Name,Distance,Rating,Votes,Address
Sapan Papadwala General Stores Opposite to Adarsh Baug Hotel Kalbadevi,0.46 KM,4.3,192 Votes,"88 Manohar Bhavan, Shop No 3, Dr A M Road, Bhuleshwar Road, Kalbadevi, Mumbai - 400002, Opposite to Adarsh Baug Hotel"
Deval General Store Near Central Bank Bhuleshwar,,,0 Votes,"23, Dauji Building, Dr A M Road, Bhuleshwar, Mumbai - 400002, Near Central Bank"
Mahamdi Store Bhuleshwar,0.1 KM,5.0,4 Votes,"Ali Umar St, Marine Lines East, Gulal Wadi, Bhuleshwar, Mumbai - 400002"
We Care Medical General Stores Near Gulalwadi Circle Gulal Wadi Bhuleshwar,0.14 KM,4.5,4 Votes,"192, Hasham Mansion Brigadier Usman Marg, Null Bazar,, Gulal Wadi-Bhuleshwar, Mumbai - 400002, Near Gulalwadi Circle"
Afzal Store Bhuleshwar,0.17 KM,1.0,2 Votes,"149, Gulal Wadi, Erskline Road, Bhuleshwar, Mumbai - 400002"
Agrawal Dryfruit General Stores Opp 2nd Bhoiwada Bhuleshwar Kalbadevi,0.3 KM,,0 Votes,"41/A Balaji Ramji Bldg, Kalbadevi, Mumbai - 400002, Opp 2nd Bhoiwada Bhuleshwar"
Shree Giriraj Stores Near Kaburtarkhana Kalbadevi,0.77 KM,1.5,2 Votes,"142 M K N Shop No 4,5,6 Lalbaba Mandir, Bhuleshwar Road, Kalbadevi, Mumbai - 400002, Near Kaburtarkhana"
Balmukund General Stores Bhuleshwar Kalbadevi,,,0 Votes,"51/53, Dr A M Road, Kalbadevi, Mumbai - 400002, Bhuleshwar"
Shreenathji Stores Near Kabutar Khana Bhuleshwar,0.31 KM,,0 Votes,"142/B, Shop No 5/6, Lalbaba Mandir, Bhuleshwar Road, Bhuleshwar, Mumbai - 400002, Near Kabutar Khana"
Salunke Bandhu Near Vegetable Market Chira Bazar kalbadevi,0.96 KM,4.1,7 Votes,"Shop No 509, Sona Chambers, J S S Road, Chira Bazar-kalbadevi, Mumbai - 400002, Near Vegetable Market"
Gayatri Dryfruits General Stores Near Chira Bazar Kalbadevi,0.92 KM,4.5,8 Votes,"17 Jaydevi Niwas, Dr M B Velkar St, Kalbadevi, Mumbai - 400002, Near Chira Bazar"
Rolex Chemists Near Signal Opposite Geeta Bhavan Princess Street,1.11 KM,4.0,10 Votes,"Shop No 221, Anant Building, S G Road, Princess Street, Mumbai - 400002, Near Signal, Opposite Geeta Bhavan"
Parle Value Shoppe Dhobi Talao,1.19 KM,4.5,2 Votes,"Shop No 3, Pandya Mansion, 625, J S S Road, Dhobi Talao, Mumbai - 400002"
Shree Ganesh General Stores Metro Cinema Dhobi Talao,1.32 KM,4.0,3 Votes,"57/59, S S Gaikwad Road, Dhobi Talao, Mumbai - 400002, Metro Cinema"
All In One General Store Maheshwari Mata Mandir Sham Bhavan Navi Wadi Chira Bazar kalbadevi,0.76 KM,5.0,1 Votes,"Shop No 1, Building No 20, Dadi Seth Agyari Lane, Chira Bazar-kalbadevi, Mumbai - 400002, Maheshwari Mata Mandir, Sham Bhavan Navi Wadi"
Siddhi general tobacco store Opp charttered house Dhobi Talao,1.28 KM,4.0,1 Votes,"shop no 1 building no 288, dr.c.h. street, Dhobi Talao, Mumbai - 400002, opp charttered house"
Mahalaxmi General Stores Kalbadevi,0.62 KM,,0 Votes,"Kalbadevi, Mumbai - 400002"
Bharat Medical General Stores Thakurdwar Kalbadevi,0.84 KM,4.0,3 Votes,"No 312, J S S Road, Kalbadevi, Mumbai - 400002, Thakurdwar"
Shah Stores Near Balaji Temple Sitaram Poddar Marg Kalbadevi,,4.0,7 Votes,"59, 1st Fanaswadi Rele Building, Palekar Marg, Kalbadevi, Mumbai - 400002, Near Balaji Temple, Sitaram Poddar Marg"
Dhanalaxmi Kirana Store Near to Hita Bhavan Hotel Princess Street,1.12 KM,4.0,1 Votes,"Shop No -216, Sethna Building, Princess Street, Princess Street, Mumbai - 400002, Near to Hita Bhavan Hotel"
Suresh General Store Behind Round Masjid Dhobi Talao,1.38 KM,4.3,2 Votes,"Shop No.48, 2nd Marin Street, Dhobi Talao, Mumbai - 400002, Behind Round Masjid"
Sha Velji Ganpat Co,,,0 Votes,"Shop No.1, 38, Panchayatwadi Lane,, Mumbai - 400002, Kabutarkhana"
Two Cee Medical Stores Kalbadevi,0.28 KM,,0 Votes,"No 91, Kansara Chawl, Kalbadevi Road, Kalbadevi, Mumbai - 400002"
Abhishek General Store Opposite Kabutar Khana Kalbadevi,0.3 KM,4.3,4 Votes,"120, Kiran Vijay Sadan, Kalbadevi, Mumbai - 400002, Opposite Kabutar Khana"
Gandhi General Store Opposite Kapadia Chamber Chira Bazar Kalbadevi,0.36 KM,4.0,2 Votes,"Shop No.- 602, Next To Wadia Building, J S S Road, Chira Bazar-Kalbadevi, Mumbai - 400002, Opposite Kapadia Chamber"
Padmavati Kiran General Store,0.48 KM,5.0,4 Votes,"30/32, Sukhani Sadan, Thakurdwar Road, Mumbai - 400002, Opposite Siddesh Appartment"
Shree Swami Samartha General Stores,0.49 KM,,0 Votes,Mumbai - 400002
Manish kala mandir Near Balaji mandir fanas wadi Fanas Wadi Kalbadevi,0.55 KM,,0 Votes,"Shop no 2 rele building, Sitaram Poddar marg, Fanas Wadi-Kalbadevi, Mumbai - 400002, Near Balaji mandir fanas wadi"
Deepali Provision Stores Recharge Centre Opposite Balaji Mandir Fanas Wadi Kalbadevi,0.57 KM,3.5,2 Votes,"Shop 3 sadbhavna, Shitaram poddar marg, Fanas Wadi-Kalbadevi, Mumbai - 400002, Opposite Balaji Mandir"
Janta General Store Near Wenkatesh Temple Fanas Wadi Kalbadevi,0.59 KM,5.0,1 Votes,"102, Jagarnath Chawl, Kalbadevi, Mumbai - 400002, Near Wenkatesh Temple, Fanas Wadi"
Shree Stationery Near A One Mobile Shop Vitthalwadi Kalbadevi,0.59 KM,,0 Votes,"Kalbadevi, Mumbai - 400002, Near A One Mobile Shop , Vitthalwadi"
Aarnesh Dashkarma Bhandar Near A One Mobile Shop Vitthalwadi Kalbadevi,0.59 KM,,0 Votes,"Kalbadevi, Mumbai - 400002, Near A One Mobile Shop , Vitthalwadi"
S v setti S p road Fanas Wadi Kalbadevi,0.6 KM,,0 Votes,"Shop no.106, Jagannath chawl, Fanas Wadi-Kalbadevi, Mumbai - 400002, S.p road"
R M Opticals Near A One Mobile Shop Vitthalwadi Kalbadevi,0.6 KM,,0 Votes,"Kalbadevi, Mumbai - 400002, Near A One Mobile Shop , Vitthalwadi"
Bhagvandas General Store Kalbadevi,0.64 KM,,0 Votes,"38/40, Champa Galli, Zaveri Bazaar, Champa Galli Cross Lane, Kalbadevi, Mumbai - 400002"
Gupta Oil And General Stores Thakurdwar Kalbadevi,0.69 KM,,0 Votes,"Siddhesh Building Shop No 6, Dr.j B Marg, Thakurdwar-Kalbadevi, Mumbai - 400002"
Shrikant General Store Opposite Prakash Paper Mart Kalbadevi,0.69 KM,,0 Votes,"Shop no.117, Dadiseth Agiary Lane, Kalbadevi, Mumbai - 400002, Opposite.,Prakash Paper Mart"
Shreekant General Stores Kalbadevi,0.69 KM,,0 Votes,"117, Dadisheth Agyari Lane, Kalbadevi, Mumbai - 400002"
Morghar Kirana Store Mughbhat Thakurdwar Kalbadevi,0.71 KM,,0 Votes,"Chogdewala Building, Plot No.10, Mughbhat Lane, Thakurdwar-Kalbadevi, Mumbai - 400002, Mughbhat"
Maharashtra general store Near station Thakurdwar Kalbadevi,0.72 KM,,0 Votes,"Shop no 9 Mehta estate, Baba saheb marg, Thakurdwar-Kalbadevi, Mumbai - 400002, Near station"
Niyati Stores Thakurdwar Kalbadevi,,4.0,2 Votes,"305,, Jss Road, Kalbadevi, Mumbai - 400002, Thakurdwar"
Kiran General Stores Opposite Bombay Medical Kalbadevi,,,0 Votes,"Shop No 5, Dr Ch Street, Kalbadevi, Mumbai - 400002, Opposite Bombay Medical"
Khira General Store,,,0 Votes,Mumbai - 400002
A v store Kalbadevi,0.8 KM,,0 Votes,"wagh wadi, Kalbadevi Road, Kalbadevi, Mumbai - 400002"
Eklingji General Stores Thakurli Murlidhar Temple Trust Chira Bazar Kalbadevi,0.81 KM,,0 Votes,"350/B, Shop No. 3, Ground Floor, Thakurli Muralidhar temple trust, JSS Road, Chira Bazar-Kalbadevi, Mumbai - 400002, Thakurli Murlidhar Temple Trust"
Milan General store Near Chira Bazar Kalbadevi,0.82 KM,4.3,10 Votes,"197 Bhatiya Nivas, Dr Vigas Street, Kalbadevi, Mumbai - 400002, Near Chira Bazar"
Lokamanya Bidi shop Thakurdwar Naka Thakurdwar Kalbadevi,0.82 KM,,0 Votes,"Shop 301, Jagarnath Shankar Sheth Road, Thakurdwar-Kalbadevi, Mumbai - 400002, Thakurdwar Naka"
Niyati Store Opp Hotel Sunshine Kalbadevi,0.83 KM,5.0,1 Votes,"Shop No.-305, JSS Road,, Thakurdwar Road, Kalbadevi, Mumbai - 400002, Opp Hotel Sunshine"
Lokmanya bidi shop Near Thakurdwar signal Kalbadevi,0.83 KM,,0 Votes,"Shop No.6, Thakurdwar Road, Kalbadevi, Mumbai - 400002, Near Thakurdwar signal"
SM GENERAL Store Opp school Chira Bazar Kalbadevi,0.84 KM,,0 Votes,"Shop no 346, JSSRoad, Chira Bazar-Kalbadevi, Mumbai - 400002, Opp school"
Hari Store JSS road Chira Bazar Kalbadevi,0.84 KM,3.5,1 Votes,"388 Krishna Nivas, Shankar wadi road, Chira Bazar-Kalbadevi, Mumbai - 400002, JSS road"
Laxmi narayan pan bandar Opposite shivam bank Kalbadevi,0.85 KM,,0 Votes,"shop no 9, shri ganesh road, Kalbadevi, Mumbai - 400002, opposite shivam bank"
Bang Data Forms Pvt Ltd Dhobi Talao,0.85 KM,,0 Votes,"1st Floor, Mistry Building 635, J.S.S. Road,, Dhobi Talao, Mumbai - 400002"
Monalisa Provisional Near Gazdar Street Opp Perfect Card Chira Bazar Kalbadevi,0.85 KM,,0 Votes,"Shop No 396, J S S Road, Chira Bazar-Kalbadevi, Mumbai - 400002, Near Gazdar Street, Opp. Perfect Card,"
Matru Ashish Hardware General Stores Chira Bazar Kalbadevi,,,0 Votes,"207-211 Shop No 5, DSA Lane, Chira Bazar-Kalbadevi, Mumbai - 400002"
Priya Medical And General Stores Thakurdwar kalbadevi,,,0 Votes,"Thakurdwar-kalbadevi, Mumbai - 400002"
Sachin Sweet N Salty Near rajdhani hotel Dhobi Talao,0.86 KM,4.5,4 Votes,"351/353,New Market, Sheikh Memon Street, Dhobi Talao, Mumbai - 400002, Near rajdhani hotel"
Shree Ganesh General Store Near Kotak ATM Kalbadevi,,,0 Votes,"Shop No.11, J.S.S Street, Kalbadevi, Mumbai - 400002, Near Kotak ATM,"
Jaiswal Supermarket Near Chira Bazar Kalbadevi,0.86 KM,,0 Votes,"Shop No.45&46, Kalbadevi Road, Kalbadevi, Mumbai - 400002, Near Chira Bazar,"
Munna General Store,,,0 Votes,"Bhagavad, Chapra , Bihar, Mumbai - 400002, Near By Central Bank"
Sherawat General Store Near Icici Atm Princess Street,,,0 Votes,"Shop No.21, Princess Street, Mumbai - 400002, Near Icici Atm"
Ashok General Store Kalbadevi,0.87 KM,,0 Votes,"278-B, Surya Mahal, J.S.S. Rd., Girgaum, Kalbadevi, Mumbai - 400002"
Misra pan bhandar Sonapur galli Chira Bazar Kalbadevi,0.88 KM,,0 Votes,"shop no 1, j s s road, Chira Bazar-Kalbadevi, Mumbai - 400002, sonapur galli"
Modern Chemists Opposite Dr Vighas Street Chira Bazar kalbadevi,0.9 KM,4.6,5 Votes,"Shop No 50, Jkb Co-Operative Housing Society, 460, J S S Road, Chira Bazar-kalbadevi, Mumbai - 400002, Opposite Dr Vighas Street"
Modern Store New Bhatia Bhajanwadi Kalbadevi,0.9 KM,3.5,1 Votes,"Shop No 3, 9/15 Moraji Veiji Bldg, Dr M.B Velkar Street, Kalbadevi, Mumbai - 400002, New Bhatia Bhajanwadi"
Shree Baleshwar Medical General Stores Thakurdwar Kalbadevi,,,0 Votes,"Thakurdwar-Kalbadevi, Mumbai - 400002"
Matrukripa Hardware General Store Near Computer House Chira Bazar Kalbadevi,0.91 KM,3.0,1 Votes,"485, J S S Road, Chirabazaar, Chira Bazar-Kalbadevi, Mumbai - 400002, Near Computer House"
Waman kedar shetave aani sons Kalbadevi,0.92 KM,5.0,1 Votes,"modi building, Kolbaht Lane, Kalbadevi, Mumbai - 400002"
Lucky General Stores Near Lotlikar Jewellers Chira Bazar Kalbadevi,0.93 KM,4.0,5 Votes,"503/505,J S S Road, Lotlikar Mansion, Chira Bazar-Kalbadevi, Mumbai - 400002, Near Lotlikar Jewellers"
Durga Medical General Stores Kalbadevi,0.94 KM,3.5,2 Votes,"565 Chira Bazar, J S S Rd, Kalbadevi, Mumbai - 400002"
Mishra general store Beside Loltekar jewllers Chira Bazar Kalbadevi,0.94 KM,,0 Votes,"Bharat building, Shree kanth pale kar marg, Chira Bazar-Kalbadevi, Mumbai - 400002, Beside Loltekar jewllers"
Samarth Medical And General Stores Near Chira Bazar Kalbadevi,0.95 KM,4.6,5 Votes,"Shop No 2 56/60, Kolbhat Marg, Kalbadevi, Mumbai - 400002, Near Chira Bazar"
Siddhivinayak Stores In Front Of City Kitchen Kalbadevi,0.95 KM,,0 Votes,"Lakhpati Building, Shrink ant Palekar Marg, Kalbadevi, Mumbai - 400002, In Front Of City Kitchen"
Alif Hardware General Stores Chira Bazar Kalbadevi,0.96 KM,,0 Votes,"533 Chira Bazar, J S S Rd, Chira Bazar-Kalbadevi, Mumbai - 400002"
Ashok General Store Chira Bazar kalbadevi,0.97 KM,3.5,2 Votes,"543/B, Girgaum Road, J S S Road, Chira Bazar-kalbadevi, Mumbai - 400002"
Arshi bidi stall Chira Bazar Kalbadevi,0.98 KM,,0 Votes,"shop no 34, Chira Bazar-Kalbadevi, Mumbai - 400002"
Mishra General Store,1 KM,4.3,3 Votes,"Kamathi Wada, Sonapur, Mumbai - 400002, Marine Lines"
Dhanlaxmi Kirana Store Near Parsi Dairy Signal Kalbadevi,1.08 KM,,0 Votes,"Setna Shop No. 216, Jess Marg, Kalbadevi, Mumbai - 400002, Near Parsi Dairy Signal"
Vinayak General Stores Near Hiti Perfumers Kalbadevi,1.09 KM,,0 Votes,"Shop No. 83, Princess Street,, Kalbadevi, Mumbai - 400002, Near Hiti Perfumers,"
Laxmichand Hansraj 45 Chandanwadi Opposite Nipra House Chira Bazar kalbadevi,1.1 KM,3.5,1 Votes,"Shop No 1&2,B I T Chawl 1, Chira Bazar-kalbadevi, Mumbai - 400002, 45 Chandanwadi, Opposite Nipra House"
Af Stores Chandanwadi Chira Bazar Kalbadevi,1.12 KM,,0 Votes,"VIP Building No 1, Chira Bazar-Kalbadevi, Mumbai - 400002, Chandanwadi"
Sai General Stores Princess road Kalbadevi,1.12 KM,,0 Votes,"Shop no.614, Setana bldg, Kalbadevi, Mumbai - 400002, Princess road"
Manish pco Navjeevan Wadi Dhobi Talao,1.15 KM,,0 Votes,"shop no.-5,Shri ram bld., Navjeevan Wadi-Dhobi Talao, Mumbai - 400002"
Metro stores Kalbadevi,1.16 KM,3.0,1 Votes,"cawas ji mohamedi house, Kalbadevi, Mumbai - 400002"
Pratham General Store Near Megha Bar Dhobi Talao,1.19 KM,,0 Votes,"Shop No 23, C.H. Street,, Dhobi Talao, Mumbai - 400002, Near Megha Bar,"
Bhagabati General Store Dhobi Talao,1.2 KM,,0 Votes,"Shop No 2,Parda House, Dhobi Talao, Mumbai - 400002"
Sagar General Store Near By Metro Cinema Dhobi Talao,1.22 KM,,0 Votes,"240/1, Shah House, Dr Ch Street,, Dhobi Talao, Mumbai - 400002, Near By Metro Cinema,"
Raju patra Dhobi Talao,1.24 KM,,0 Votes,"Shop no.57, Bhiwandiwala s.s gaikwala road, Dhobi Talao, Mumbai - 400002"
Picnic bar pan shop Near marine lines opp parsi dairy Dhobi Talao,,4.0,1 Votes,"shop no 11, dr c s street, Dhobi Talao, Mumbai - 400002, near marine lines, opp parsi dairy"
Silsila E Husaina General Store Near Marine Line Station Kalbadevi,1.25 KM,,0 Votes,"Shop No. 76, Station Road, Kalbadevi, Mumbai - 400002, Near Marine Line Station"
Kamal General Store Opposite Cross Road Restaurant Lohar Chawl,1.25 KM,3.5,2 Votes,"Shop No. 2, Ground Floor, 23 25, Hamal Wadi, Navajeevan Wadi, Sonapur, Dr Cawasji Hormusji Road, Lohar Chawl, Mumbai - 400002, Opposite Cross Road Restaurant"
Maharashtra oil depot Dhobi talo Kalbadevi,1.27 KM,,0 Votes,"Shop no 24, S s street, Kalbadevi, Mumbai - 400002, Dhobi talo"
Galaxy General Stores A P Market Dhobi Talao,1.29 KM,,0 Votes,"Shop No 1, S S Gaikwad Road, Dhobi Talao, Mumbai - 400002, A P Market"
Priya Stationery Metro cinema Kalbadevi,1.31 KM,,0 Votes,"shop no. 7, Kalbadevi, Mumbai - 400002, Metro cinema"
Shree Swami Samarth General Stores Opposite MetroBoc Cinema Dhobi Talao,1.33 KM,3.5,1 Votes,"70 Mahavir Mansion, Gaikwad Marg, Dhobi Talao, Mumbai - 400002, Opposite MetroBoc Cinema"
Mahadev Medical General Stores SECOND MARINE STREET Dhobi Talao,1.36 KM,5.0,2 Votes,"Surya Kalayani Mansion, Building No 36/44, Wellington Street, Dhobi Talao, Mumbai - 400002, SECOND MARINE STREET"
Gulshan Provision Stores Gaikwala Marg Dhobi Talao,1.36 KM,,0 Votes,"Shop No 82, Dhobi Talao, Mumbai - 400002, Gaikwala Marg"
Vallabhji Vershi Nr Metro Dhobi Talao,1.39 KM,,0 Votes,"Wellington Terrace Bldg Gr Flr Shop No 8, Wellington Street, Dhobi Talao, Mumbai - 400002, Nr Metro"
Suresh General Stores Behind delhi darbar restaurent Dhobi Talao,1.39 KM,4.0,1 Votes,"48/52, 2nd Marine Street, Ground Floor, Dhobi Talao, Mumbai - 400002, behind delhi darbar restaurent"
Ajay bidi shop Dhobi Talao,1.4 KM,,0 Votes,"shop no. 92, J S S road, Dhobi Talao, Mumbai - 400002"
