Name,Distance,Rating,Votes,Address
Asha Oil Depot Near Station Lal Bahadur Shastri Market Matunga East,0.11 KM,4.3,51 Votes,"Shop No 9 & 10, L N Road, Matunga East, Mumbai - 400019, Near Station, Lal Bahadur Shastri Market"
Lucky General Stores Matunga East,0.16 KM,4.1,19 Votes,"264-A/5, Leela Niwas, L N Road, Matunga East, Mumbai - 400019"
Annapoorneswari Stores Near Post Office Matunga East,0.12 KM,4.1,26 Votes,"20/D Mahavir Building, Bhandarkar Road, Matunga East, Mumbai - 400019, Near Post Office"
Gala Stationeries General Stores Next to Welingkar Institute Of Managemnt Studies Matunga East,0.21 KM,4.1,66 Votes,"Shop No 10, Balkrishna Niwas, Matunga East, Mumbai - 400019, Next to Welingkar Institute Of Managemnt Studies"
Mahavir Stores Opposite to Muncipal School Matunga East,0.28 KM,4.3,14 Votes,"Shop No.13 / 3, Liladhar Ratanshi Building, Laxmi Narayan Lane, Matunga East, Mumbai - 400019, Opposite to Muncipal School"
Shri Nityanand General Stores Opposite Ruia College Matunga East,0.51 KM,4.6,7 Votes,"Shop No 4, 153 B, Dongre Buliding, Lady Jahangir Road, Matunga East, Mumbai - 400019, Opposite Ruia College"
Laxmi Store Near Ruia College Matunga East,0.6 KM,5.0,1 Votes,"153 Nandadeep, Lj Road, Matunga East, Mumbai - 400019, Near Ruia College"
Ramlingam Agro Product Pvt Ltd Near Matunga Station Road Matunga East,0.31 KM,3.4,8 Votes,"Shop No 1&2,Natraj Building, L N Lane, Matunga East, Mumbai - 400019, Near Matunga Station Road"
R S General Stores Matunga Labour Camp Matunga East,100 mts.,,0 Votes,"Shop No. 3, Yankappa Chawl, Andra Valley Road, Anand Nagar, Matunga East, Mumbai - 400019, Matunga Labour Camp"
Matunga Sahakari Bhandar Ltd Matunga East,0.09 KM,3.7,6 Votes,"Matunga, Mumbai, Bhandarkar Road, Matunga East, Mumbai - 400019"
Heena General Stores kuverji Opposite Tatapower House Matunga East,,,0 Votes,"Shop No 23, Muncipal Chawl A/2, Andhra Valley Road, Matunga Labour Camp, Matunga East, Mumbai - 400019, Opposite Tatapower House"
Shree Jagdish Medical General Stores Near Bridge Matunga East,0.17 KM,4.2,5 Votes,"Shop No 3, Kacchi House Building, Bhandarkar Road, Matunga East, Mumbai - 400019, Near Bridge"
Ganesh Grain Store Near State Bank Of Mysore Matunga East,0.84 KM,4.0,8 Votes,"Plot No 31, Shop No 2/3, Timber Terrace Building, Bhaudaji Road, Matunga East, Mumbai - 400019, Near State Bank Of Mysore"
Sunil General Store Matunga East,,,0 Votes,"Matunga East, Mumbai - 400019"
Heema General Stores Matunga East,,,0 Votes,"Shop No 23 Municipal Chew No 2 M L Camp, 60 Ft Rd, Matunga East, Mumbai - 400019"
Guide Store Opposite Traffic Poice Station King Circle Maheshwari Udyan Matunga East,,,0 Votes,"Matunga East, Mumbai - 400019, Opposite Traffic Poice Station, King Circle Maheshwari Udyan"
Indrabai Koregaonkar Pan Bidi Shop And General Store Matunga East,,,0 Votes,"Lady Jamshedji Road, Matunga East, Mumbai - 400019"
Sana General Store Near Eligant School Matunga East,,,0 Votes,"Matunga East, Mumbai - 400019, Near Eligant School,"
Chintamani STORE Matunga East,,,0 Votes,"Matunga East, Mumbai - 400019"
Ambika General Stores Opposite Gitanjali Nagar Matunga East,,,0 Votes,"Shop No 1, Anariya Building No 47, Jasmine Mill Road, Matunga East, Mumbai - 400019, Opposite Gitanjali Nagar"
Jaiswal Stores Opposite Mini Sion Hospital Matunga East,,,0 Votes,"Shop No 1, R P Nagar Compound Chawl No G-9, 60 Feet Road, Matunga Labour Camp, Matunga East, Mumbai - 400019, Opposite Mini Sion Hospital"
New Arjun General Stores Near Hanuman Mandir Matunga East,,,0 Votes,"Shop No 13, Muncipal Chawl No G-19, Jasmine Mill Road, Matunga Labour Camp, Matunga East, Mumbai - 400019, Near Hanuman Mandir"
Selvi Stores Opposite Matunga Labour Camp Building No 5 Matunga East,,,0 Votes,"Shop No 655, Labour Camp, Dr Babasaheb Ambedkar Road, Matunga East, Mumbai - 400019, Opposite Matunga Labour Camp Building No 5"
Sudhir General Store Near Extrella Battery Matunga East,,,0 Votes,"Shop No 110, BMC Chawl, Andhra Valley Road, M L Camp, Matunga East, Mumbai - 400019, Near Extrella Battery"
Om Sai General Store Near Central Railway Workshop Matunga East,,,0 Votes,"Shop No 1, New Ganesh Nagar Chawl, T H Kataria Marg, Matunga East, Mumbai - 400019, Near Central Railway Workshop"
Om Shanthi General Stores Labour Camp Matunga East,,,0 Votes,"D - 15, Room No 8, Matunga East, Mumbai - 400019, Labour Camp"
Anisa Bakery Kirana Store Ambedkar Nagar Labour Camp Matunga East,,,0 Votes,"Ratna Mahal Tower, Matunga East, Mumbai - 400019, Ambedkar Nagar, Labour Camp"
Popular Provision General Stores Matunga East,,3.0,1 Votes,"75 T H Kataria Marg, Matunga East, Mumbai - 400019"
Citilight General Stores Matunga East,,4.0,3 Votes,"Dinanath Terrace, L J Road, Matunga East, Mumbai - 400019"
New Roop Sangam Book House General Stores Opposite Geetanjali Sahu Nagar Matunga East,,2.0,1 Votes,"Shop No 5, Anariya Co Operative Housing Society, Jasmil Road, Matunga East, Mumbai - 400019, Opposite Geetanjali Sahu Nagar"
Bharat General Stores Near axis Bank atm Gm Chowk Matunga East,,,0 Votes,"lavender Apts, TH Kataria Marg, Gm Chowk-Matunga East, Mumbai - 400019, near axis Bank atm"
Roop Sangam Stationery General Stores Near Shahu Nagar Post Office Matunga East,,,0 Votes,"Shop No 7, Anariya Building, Jasmine Mill Road, Matunga Labour Camp, Matunga East, Mumbai - 400019, Near Shahu Nagar Post Office"
Mahadev Kirana Stores Opposite Panchsheel Building No 3 Matunga East,,,0 Votes,"Shop No 1-2, Muncipal Chawl No D-11, Jasmine Mill Road, Matunga Labour Camp, Matunga East, Mumbai - 400019, Opposite Panchsheel Building No 3"
Sunil General Stores Matunga East,0.12 KM,1.0,1 Votes,"126/F, Mahavir Building, Bhandarkar Road, Matunga East, Mumbai - 400019"
The Lalwani Store Opposite Kabutar Khana Matunga East,0.12 KM,,0 Votes,"Maya IT Building, Bhandarkar Road, Matunga East, Mumbai - 400019, Opposite Kabutar Khana"
Jagdish Medical General Stores Near Sunder Bhavan Hotel Matunga East,0.17 KM,5.0,5 Votes,"Shop No 4, Kachi House, Bhandakar Road, Matunga East, Mumbai - 400019, Near Sunder Bhavan Hotel"
Shree Jagdish Medical General Store Beside railway station Matunga East,0.18 KM,3.8,4 Votes,"Bhivandiwala Bldg ., Matunga, Mumbai, L N Road, Matunga East, Mumbai - 400019, Beside railway station"
Sunil General Stroes Matunga East,0.18 KM,,0 Votes,"Bhandarkar Road, Matunga East, Mumbai - 400019"
Suyog medical general stores Opp HDFC Bank Matunga East,0.18 KM,4.0,2 Votes,"Plot No 370, Gangar Nivas, Bhandakar Road, Matunga East, Mumbai - 400019, Opp. HDFC Bank"
Malik Kirana General Store Near Central Railway Workshop Matunga East,0.18 KM,,0 Votes,"Central Railway Colony, T H Kataria Marg, Matunga East, Mumbai - 400019, Near Central Railway Workshop"
Chintamani Enterprises Near Central Railway Colony Matunga East,0.18 KM,,0 Votes,"Shop No 200, Mali Chawl, T H Kataria Marg, Matunga East, Mumbai - 400019, Near Central Railway Colony"
Shree Arihant Ayurvedic General Stores Near Z Bridge Matunga East,0.19 KM,1.0,2 Votes,"Shop No 4, Nagardas Chawl, Bhandarkar Road, Matunga East, Mumbai - 400019, Near Z Bridge"
Matunga Paraspar Sahakari Mandal Ltd Near Mantunga Gym Khana Poddar College and Welcomes Optics Matunga East,0.2 KM,,0 Votes,"265 Balkrishna Niwas, Devdhar Road Corner, Matunga East, Mumbai - 400019, Near Mantunga Gym Khana & Poddar College and Welcomes Optics"
Vijay Fruit Shop Opp Ram Mandir Matunga East,0.21 KM,,0 Votes,"Shop No 3 Plot No 387, Dadbhawala Sadan Road, Matunga East, Mumbai - 400019, Opp. Ram Mandir"
Muthu stores Opp Nallis Silk Center Matunga East,0.23 KM,,0 Votes,"384 Dadabhawla Sadan, Telang Road, Matunga East, Mumbai - 400019, Opp Nallis Silk Center"
Tej Leela Opp Rambag Holl Matunga East,0.33 KM,3.7,7 Votes,"404 Laxmi Narayanwadi, Laxminarayan Lane, Matunga East, Mumbai - 400019, Opp Rambag Holl"
Koolar Co Stores Kings Circle Matunga East,0.34 KM,4.0,1 Votes,"Plot No 541 Noor Mahal, Dr Ambedkar Road, Adenwala Road, Matunga East, Mumbai - 400019, Kings Circle"
Poonam Provision Stores Near Maheshwari Garden Matunga East,0.35 KM,4.0,4 Votes,"541, Noor Mahal, Adenwala Road, Matunga East, Mumbai - 400019, Near Maheshwari Garden"
Monarch Medico Opp Maheshwari Udhyan Matunga East,0.35 KM,4.1,55 Votes,"Circle House, Dr. B A Road, Matunga East, Mumbai - 400019, Opp Maheshwari Udhyan"
Badriya Kirana Stores Opposite Ashrafiya Masjid Matunga East,0.36 KM,,0 Votes,"Shop No 2-3, Anand Society, Dr Ambedkar Road, Matunga Labour Camp, Matunga East, Mumbai - 400019, Opposite Ashrafiya Masjid"
Nikhil Store Opposite To Maheshwari Garden Next To Cafe Mysore Matunga East,0.37 KM,4.5,1 Votes,"Shop No.1, 461-A, Ramnivas Building, Dr B A Road, Matunga East, Mumbai - 400019, Opposite To Maheshwari Garden, Next To Cafe Mysore"
S V Berde Bidi Shop Near Maheshwari Udhyan Matunga East,0.47 KM,,0 Votes,"462/3 Shri rambhuvan, Dr Ambedkar Road, Matunga East, Mumbai - 400019, Near Maheshwari Udhyan"
Anna General Store Arora cinima Matunga East,0.5 KM,,0 Votes,"shop no 16, dr.ambedkar road, Matunga East, Mumbai - 400019, arora cinima"
Rakesh Medical General Stores Near Sies High School Matunga East,0.73 KM,4.0,17 Votes,"Shop No 7, Modi Minar, Kas Road, Matunga East, Mumbai - 400019, Near Sies High School"
Maharashtra Enterprises Opp Tata Power House Matunga East,0.91 KM,,0 Votes,"Shop no.11, Shoppe Chawl, Kataria Road, Matunga East, Mumbai - 400019, Opp Tata Power House"
Shree Gajanan Kirana General Stores Matunga Labour Camp Matunga East,1.06 KM,,0 Votes,"Shop No 1, E-Ward Chawl No 1, Dr Ambedkar Road, Matunga East, Mumbai - 400019, Matunga Labour Camp"
Gurudev Stores Matunga Labour Camp Matunga East,1.11 KM,,0 Votes,"Shop No 5, Anand Nagar Colony, Dr Babasaheb Ambedkar Road, Matunga East, Mumbai - 400019, Matunga Labour Camp"
Ahamed General Store Opposite Punchsheel Building No 3 Matunga East,1.15 KM,,0 Votes,"Room No 5, Muncipal Chawl No D-14, Jasmine Mill Road, Matunga Labour Camp, Matunga East, Mumbai - 400019, Opposite Punchsheel Building No 3"
Deva General Stores Opposite Panchsheel Building No 3 Matunga East,1.16 KM,5.0,2 Votes,"Shop No 3, Muncipal Chawl No D-11, Jasmine Mill Road, Matunga Labour Camp, Matunga East, Mumbai - 400019, Opposite Panchsheel Building No 3"
Amma General Store Near Pravin General Station Matunga East,1.21 KM,1.8,5 Votes,"Matunga Labour Camp, Matunga East, Mumbai - 400019, Near Pravin General Station"
New Maharashtra Kirana Store Opposite Rajeshri Shahu Nagar Municipality School Matunga East,1.25 KM,,0 Votes,"Chawl No G 6, Shop No 5, Labour Camp, Jasinmill Road, Matunga East, Mumbai - 400019, Opposite Rajeshri Shahu Nagar Municipality School"
Mahadev Medical General Stores Near R P Nagar Near Axis Bank Matunga East,1.4 KM,5.0,1 Votes,"Shop No 13, JAI Ganesh Society, 60 Feet Road, Matunga East, Mumbai - 400019, Near R P Nagar, Near Axis Bank"
Welcome General Stores Opposite Laxmi Building Matunga East,,,0 Votes,"Shop No 6, Muncipal Chawl, R P Nagar, V K Gokhale Road, Matunga Labour Camp, Matunga East, Mumbai - 400019, Opposite Laxmi Building"
Tirupati Plastic General Stores Opposite Panchsheel Building No 3 Matunga East,,,0 Votes,"Shop No 5, Muncipal Chawl No D-11, Jasmine Mill Road, Matunga Labour Camp, Matunga East, Mumbai - 400019, Opposite Panchsheel Building No 3"
Shree ganesh stores Opp karnantak hall Matunga East,0.88 KM,,0 Votes,"shop.-2 anand bldg, T H Katariya marg, Matunga East, Mumbai - 400019, opp karnantak hall"
S A Kirana General Stores Near Makdumiya Masjid Matunga East,1.07 KM,,0 Votes,"Shop No 2, Milind Nagar Compound, Dr Ambedkar Road, Matunga Labour Camp, Matunga East, Mumbai - 400019, Near Makdumiya Masjid"
Saeed Brothers Kirana General Store,,,0 Votes,"Patel House, Number 3, King Circle, Matunga, Shankar Mutt Road, Shankar Mutt Roadtelang Cross Road, Mumbai - 400019"
Mahalaxi Stores,0.13 KM,3.0,2 Votes,"Shop No. 19, Lbs Market, Matunga, L.M. Road, Mumbai - 400019"
Dungarshi Virji Company,0.19 KM,4.0,3 Votes,"Nagardas Biulding, Matunga, Bhandarkar Road, Mumbai - 400019"
Shiva Sai General Store,0.37 KM,,0 Votes,"No. 467/B, Vasanth Breezy Chembers, Maheshwari Udyan, Matunga, Dr. Ambedkar Road, Mumbai - 400019"
Central Medical And General Stores,0.48 KM,3.3,4 Votes,"Matunga, Mumbai - 400019"
Modern General Store,0.73 KM,2.5,4 Votes,"Matunga, Bhaudaji Road, Mumbai - 400019"
Selvam Store,0.82 KM,4.7,3 Votes,"R 107,Bharat Seva Mandal, Matunga,King's Circle, Mumbai - 400019, Near Shanmukhananda Hall"
Kirti Kumar Mohanlal Sheth,0.88 KM,5.0,2 Votes,"Shop No. 186, Cward, Azad Nagar, Matunga, T. H. Katariya Marg, Mumbai - 400019"
Jai Bhavani Stores,0.9 KM,5.0,4 Votes,"Shop No. 179/180, C Ward, Azad Nagar, Matunga, Mumbai - 400019"
Santosh General Store,1.08 KM,5.0,1 Votes,"Sundar Kamla Nagar, Western Railway Colony, Hanuman Nagar, Matunga, Mumbai - 400019"
Janta Supreme Punjabi Atta Samaj Mandir Hall Sion Koliwada,1.36 KM,4.3,15 Votes,"Sardar Nagar No 3,, Hemant Manjrekar Marg, Sion Koliwada, Mumbai - 400022, Samaj Mandir Hall"
Shriram Variety Stores Opposite Manjrekar Market Sion Koliwada,1.74 KM,4.4,6 Votes,"Shop No.D-2, Building No.1, Jaishankar Yagnik Road, Sion Koliwada, Mumbai - 400022, Opposite Manjrekar Market"
Asian Stores Near Dadar T T Circle Dadar East,1.16 KM,4.2,128 Votes,"807, Imperial Mahal, Khodadad Circle, Dr Ambedkar Road,, Dadar East, Mumbai - 400014, Near Dadar T T Circle"
Modern Distributor Medical General Store Near Dominoz Pizza Sion,1.54 KM,4.2,53 Votes,"56/3 Shop No:3, Jain Indralaya Near Sabri Hotel, Sion, Mumbai - 400022, Near Dominoz Pizza"
Rachana Dry Fruits Opposite Karnataka Sangh Hall Mahim,0.96 KM,4.3,22 Votes,"Shop No 2, Ajay Shopping Centre, T H Kataria Marg, Mahim, Mumbai - 400016, Opposite Karnataka Sangh Hall"
Laxmi Medical General Store Opposite Gandhi Market Near King Circle Station Sion,0.9 KM,4.3,18 Votes,"Shop No.4 Plot No 262, Dr Ambedkar Road, Sion, Mumbai - 400022, Opposite Gandhi Market, Near King Circle Station"
Satnam Atta Stores Near Gtb Nagar Sion Koliwada,1.44 KM,4.5,37 Votes,"Shop No 6 & 7, Guru Arjun Niwas, Sion Koliwada, Mumbai - 400022, Near Gtb Nagar"
Amit Medical General Stores Near Raja Rani Travels and Ashray Hotel Mahim,1.13 KM,4.9,5 Votes,"Shop No 4, Plot No 211 C, Keshav Bhawan, L J Road, Mahim, Mumbai - 400016, Near Raja Rani Travels and Ashray Hotel"
Khosla Stores Near Hazara Hotel Sion Koliwada,1.42 KM,3.6,6 Votes,"Bldg No 1, Shop No 27, Sion Koliwada, Mumbai - 400022, Near Hazara Hotel"
Jain General Stores Near Wadala Telephone Exchange Dadar East,1.62 KM,4.3,34 Votes,"Plot No- 234/235, Naigaon Cross Road, Dadar East, Mumbai - 400014, Near Wadala Telephone Exchange"
Nilkanth Super Market Near Mahim Bus Depot Mahim,1.74 KM,4.4,8 Votes,"Shop No.12, Mori Road, Mahim, Mumbai - 400016, Near Mahim Bus Depot"
Meghdoot General Stores Opposite Shanmukhanand Hall Sion East Sion,1.76 KM,3.7,8 Votes,"Shop No. 2 & 3 Plot No. 283 Meghdoot Building, Sion, Mumbai - 400022, Opposite Shanmukhanand Hall Sion (East)"
National Medical Surgical And General Store Near Triwari Sweets Sion,1.16 KM,4.5,10 Votes,"Shop No: 5, New Nand Deep CHS Ltd., Sulochana Shetty Road, Sion, Mumbai - 400022, Near Triwari Sweets"
Stop N Shop Boutique Near Victoria Church Mahim,1.32 KM,4.0,71 Votes,"4, Dimple Building, 133, L J Road, Mahim, Mumbai - 400016, Near Victoria Church"
J P Stores Kumbharwada Dharavi,1.38 KM,4.3,5 Votes,"Shop No 129, 90 Feet Road, Dharavi, Mumbai - 400017, Kumbharwada"
Mangalore General Stores Opposite Paradise Cinema 76 Alj Road Mahim,1.61 KM,3.9,48 Votes,"Shop No 8, Mohhamad Edu Manzil, Lady Jamshedji Road, Mahim, Mumbai - 400016, Opposite Paradise Cinema ,76 Alj Road"
Milan Variety Store Near SIES College Sion,1.69 KM,3.9,9 Votes,"Plot No 112, Shop No 4, Shanti Sadan, Vallabdas Marg, Sion, Mumbai - 400022, Near SIES College"
Bharat Medico Star Mall Opposite Plaza Cinema Dadar West,1.14 KM,3.9,35 Votes,"Shop No 2 Star Mall, N C Kelkar Road, Dadar West, Mumbai - 400028, Opposite Plaza Cinema"
Sagar Toys Shop OPP CANOSSA HIGH SCHOOL Mahim,1.66 KM,4.0,2 Votes,"SHOP NO.4 ROSARY BUILDING, Mia Mohd Chhotani Road, Mahim, Mumbai - 400016, OPP CANOSSA HIGH SCHOOL"
Ikon Bio Pharma Medical General Store Opposite Portuguese Church Dadar West,1.81 KM,4.5,49 Votes,"Shop No 11, Ground Floor, Jilani Manzil Building, S K Bole Road Junction, Dadar West, Mumbai - 400028, Opposite Portuguese Church"
Vipul Chemist Near Mahim Station Mahim,0.81 KM,4.5,6 Votes,"Shop No 4, Qureshi Mahal, Mia Mohd Chhotani Road, Mahim, Mumbai - 400016, Near Mahim Station"
Shree Swami Samartha Medical General Stores Near Hindu Colony Lane No 1 Dadar East,1.07 KM,4.2,30 Votes,"Shop No -05 Ground Floor Plot No 61 Shrikant Lodging, Sir Bhalchandra Road, Dadar East, Mumbai - 400014, Near Hindu Colony Lane No 1"
Ashish Medical General Stores Shivaji Park Dadar West,1.16 KM,3.7,8 Votes,"Shop No 3/4, 54/64 Upasana Building, L J Road, Dadar West, Mumbai - 400028, Shivaji Park"
Sukhsagar Bazar Near Hari Mandir GTB Nagar,1.45 KM,3.4,11 Votes,"Shop No. 27/1, J K Bhasin Marg, GTB Nagar, Mumbai - 400022, Near Hari Mandir"
