Name,Distance,Rating,Votes,Address
Mayur Traders Opp Kamakshi Building Mulund West,0.39 KM,3.5,2 Votes,"Shop No 58, Goshala Road-Mulund West, Mulund West, Mumbai - 400080, Opp Kamakshi Building"
Nagrik Stores Opposite Railway Station Mulund West,0.68 KM,4.2,132 Votes,"Shop No 10, Sai Leela Building, Station Road, Mulund West, Mumbai - 400080, Opposite Railway Station"
Aadhiganesh Stores Vijay Nagar Mulund West,0.56 KM,4.4,120 Votes,"J N Road, Mulund West, Mumbai - 400080, Vijay Nagar"
Rashmi Traders Near Ambaji Dham Temple Mulund West,0.62 KM,4.3,90 Votes,"Shop No 1/2, Vasant Niwas, M G Road, Mulund West, Mumbai - 400080, Near Ambaji Dham Temple"
Metro Medical General Store Opposite Jain Mandir Sarvodaya Nagar Mulund West,1.02 KM,4.1,46 Votes,"Shop No 1, Suparshav Building, Nahur Road, Mulund West, Mumbai - 400080, Opposite Jain Mandir, Sarvodaya Nagar"
Arihant General Provision Stores Below Ashwini Hospital Mulund West,,5.0,3 Votes,"Lalan NX Building, P. K. Road, Mulund West, Mumbai - 400080, Below Ashwini Hospital"
Sargam Grainl Stores Opp Andhra Bank Mulund West,0.56 KM,4.2,28 Votes,"1, Matru Krupa, M G Rd, Mulund West, Mumbai - 400080, Opp Andhra Bank"
Low Price Department Near Jai Ganesh Talkies Mulund East,0.85 KM,4.2,58 Votes,"Shop No.4 & 5, Kishor Building, Gokhle Road, Mulund East, Mumbai - 400081, Near Jai Ganesh Talkies"
Dilip General Stores Near Mehul Cinema Gala Nagar Mulund West,0.69 KM,4.6,41 Votes,"Shop No - 14, Gala Nagar, Pandit Jawaharlal Nehru Road, Mulund West, Mumbai - 400080, Near Mehul Cinema, Gala Nagar"
Jeevandeep Medical General Stores Tambe Ngr Mulund West,0.86 KM,3.9,8 Votes,"Shop No 1, Sushila Apt, S N Rd, Mulund West, Mumbai - 400080, Tambe Ngr"
Shenoys Mangalore Stores Nr Paanch Rasta Mulund West,0.41 KM,4.2,35 Votes,"Anex Lalan Bldg, P K Road, Mulund West, Mumbai - 400080, Nr Paanch Rasta"
Sai Krishna Medical General Stores Near Sai Baba Temple Mulund West,0.79 KM,3.4,16 Votes,"F 25 Sai Dham, Opposite Tulsi Building, P K Road, Mulund West, Mumbai - 400080, Near Sai Baba Temple"
Mahavir Medical General Stores Near to Marathi Vidyalaya Mulund East,1.42 KM,4.4,10 Votes,"Shop no.1,Nilesh Bldg, Vidyalala Marg, Mulund East, Mumbai - 400081, Near to Marathi Vidyalaya"
Pawan tobacco Near metro medical near mulund check naka Mulund West,1.5 KM,,0 Votes,"Shop no 1,hiramoti shopping center, Shivaji nagar, Mulund West, Mumbai - 400080, Near metro medical,near mulund check naka"
Nidhi Medical General Stores Near State Bank Of India Mulund West,1.59 KM,4.3,22 Votes,"Shop No 7, Manisha Heights, Mulund West, Mumbai - 400080, Near State Bank Of India"
Oskar Super Market Bhaji Market Mulund West,0.46 KM,4.2,92 Votes,"Gaurav Plaza, Shop Number 3,4,5, R R T Road, Mulund West, Mumbai - 400080, Bhaji Market"
Vardhaman Medical General Stores Opposite Dena Bank Mulund West,0.53 KM,4.6,5 Votes,"Shop No 11, Shankar Smruti Building, Mahatma Gandhi Road, Mulund West, Mumbai - 400080, Opposite Dena Bank"
Bhavesh General Stores Opposite Upasani Hospital Mulund West,0.58 KM,4.0,4 Votes,"15, Shivaji Shopping Centre, S L Road, Mulund West, Mumbai - 400080, Opposite Upasani Hospital"
Murugan Stores Opposite Rajyog Residency Mulund West,0.72 KM,2.0,2 Votes,"Shop No 1 Kadam Pada, Dr Rajendra Prasad Road, Mulund West, Mumbai - 400080, Opposite Rajyog Residency"
Arihant Foods Sarvodaya Nagar Opposite Jain Mandir Mulund West,0.96 KM,4.2,37 Votes,"Sambhav Apartments, Shop No 2, Jain Mandir Road, Mulund West, Mumbai - 400080, Sarvodaya Nagar, Opposite Jain Mandir"
Ayushi Provision Stores Gavanpada Mulund East,,,0 Votes,"Mahatma Phule Road,, Mulund East, Mumbai - 400081, Gavanpada,"
Parshva Foods Sarvodaya Nagar Near Jain Mandir Mulund West,1 KM,3.9,24 Votes,"Shop No.F/4,mitradham Chs., Servoday Nagar,near Car ACCESSARIES Shop,before I.c.i.c.i.bank Mulund We, Jain Mandir Marg, Near Car Accessaries Shop., Mulund West, Mumbai - 400080, Sarvodaya Nagar, Near Jain Mandir"
Sarvodaya Foods Opp Jain Temple Mulund West,1.03 KM,3.8,9 Votes,"Shop No-8,Suparshav Aptm, Sarvodaya Nagar, Mulund West, Mumbai - 400080, Opp Jain Temple"
Shree Ashapura General Store Mulund Colony Mulund West,1.23 KM,5.0,1 Votes,"67/5, Hindustan Chowk, Near Police Chowky, Guru Govind Singh Marg,, Mulund West, Mumbai - 400082, Mulund Colony"
Gala Stores Mulund East,1.28 KM,4.6,9 Votes,"Shop No 7, Shanti Sadan Wing C, 90 Feet Road, Mulund East, Mumbai - 400081"
Vora Medical Vasant Garden Sapana Nagari Mulund West,1.33 KM,4.1,39 Votes,"Shop No 10, Silver Oaks Building, L.b.s road, Mulund West, Mumbai - 400080, Vasant Garden, Sapana Nagari"
Tip Top Dry Fruits General Store Mulund West,1.39 KM,4.5,2 Votes,"Shantaram Chavan Road, Kamgar Colony, Mulund West, Mumbai - 400080"
Mahalaxmi General Store Near to Station Mulund East,1.6 KM,4.5,4 Votes,"Shop No.3,Sotta Bhavan, LT Road, Mulund East, Mumbai - 400081, Near to Station"
The Q Shop M005 Sahara Q Shop Shop No 11 Dreamland Chs Shastri Nagar Mulund Colony Mulund Colony Mulund West,1.78 KM,3.8,2 Votes,"Sahara Q Shop, Mulund Colony-Mulund West, Mumbai - 400082, Shop No :- 11, Dreamland Chs,Shastri Nagar,Mulund Colony"
Madhu Medicine Shoppy Chemist And General Store Near Hanuman Chowk and Bank Of India Mulund East,1.12 KM,3.9,32 Votes,"Shop No 1, Samadhan Co Operative Housing Society, L T Extention Road, Mulund East, Mumbai - 400081, Near Hanuman Chowk and Bank Of India"
Hunani Aurved N General Store Nr Sunny Nurani Masjid Nr Cement Company Road Mulund West,,5.0,1 Votes,"Shop No. 5 Shayadri Bilding, Mulund West, Mumbai - 400080, Nr Sunny Nurani Masjid Nr,Cement Company Road"
Sonal General Store Opposite Building No 4 Shreeram Nagar Mulund West,0.32 KM,,0 Votes,"Shop No. 1, PK Road, Mulund West, Mumbai - 400080, Opposite Building No 4, Shreeram Nagar"
Hiral Stores Opposite Zenith Tower Mulund West,0.48 KM,4.8,2 Votes,"Shop No 7, Sammishra, Jawaharlal Nehru Road, Mulund West, Mumbai - 400080, Opposite Zenith Tower"
Siddhivinayak Super Market Geeta Collection Mulund West,0.52 KM,3.7,15 Votes,"Shop No 13 Koteshwar Ashish, Jain Mandir Marg, Mulund West, Mumbai - 400080, Geeta Collection"
Vasant Oil Depot Mehul Talkies Gala Nagar Mulund West,0.69 KM,,0 Votes,"Shop No 6, J N Road, Mulund West, Mumbai - 400080, Mehul Talkies, Gala Nagar"
Shiv Shakti Medical General Store Opp Municipal Hospital Mulund West,0.73 KM,4.0,11 Votes,"119-A, Kadam Pada, Dr R P Road, Mulund West, Mumbai - 400080, Opp Municipal Hospital"
Mahakali Traders Mulund West,0.73 KM,2.0,1 Votes,"Shop No 4/5, Jayanti Apartment, J S D Road, Mulund West, Mumbai - 400080"
Mahadev Medicad General Store Near Mulund Junction Mulund West,0.78 KM,4.8,2 Votes,"Shop No. 11, Ambe Maiya Society, Bhakti Marg, Mulund West, Mumbai - 400080, Near Mulund Junction"
Mahalaxmi General Stores LIC Colony Mulund East,0.96 KM,,0 Votes,"Shop No.4, Mhatre Nagar, Mithaghar Road, Mulund East, Mumbai - 400081, LIC Colony"
All In One Behind Jain Mandir Mulund West,0.98 KM,3.9,7 Votes,"Shop No S5/a,roop Pooja Apartment, Jain Mandir Marg,sarvodaya Nagar, Mulund West, Mumbai - 400080, Behind Jain Mandir"
Raymond General Stores Near Mulund Baji Market Ghatipada mulund West,0.98 KM,,0 Votes,"1 Gopal House, NS Road, Ghatipada-mulund West, Mumbai - 400080, Near Mulund Baji Market"
Kirtida Book Centre General Stores Near Deshmukh Garden Mulund East,1.01 KM,4.3,35 Votes,"Shop No 12/A, Ashoka Apartment, Mahatma Phule Marg, Mulund East, Mumbai - 400081, Near Deshmukh Garden"
Kamdhenu Super Shoppy Near Station Mulund East,1.02 KM,4.1,19 Votes,"Shop No-10, Satnam Apartment, L T Road, Mulund East, Mumbai - 400081, Near Station"
Swastik Medical General Stores Opposite to Hanunam Temple Mulund East,1.12 KM,4.2,16 Votes,"Shop No 5, MAA Durga CHS, Navghar Road, Mulund East, Mumbai - 400081, Opposite to Hanunam Temple"
Shenoy Book Depot General Stores Near Allahabad Bank Mulund East,1.2 KM,4.2,32 Votes,"Shop No 4 Prne Kutter Building, Navghar Road, Mulund East, Mumbai - 400081, Near Allahabad Bank"
Paras General Store Near Hira Nagar Mulund West,1.27 KM,4.5,12 Votes,"Shop No 3, Gurukrupa Nagar, Hira Nagar, Goregaon Mulund Link Road, Mulund West, Mumbai - 400080, Near Hira Nagar"
Shah Mithalal Opposite Nirmal Life Style Mulund West,1.32 KM,3.9,8 Votes,"Aziz Compound, LBS Road, Mulund West, Mumbai - 400080, Opposite Nirmal Life Style"
Shree Sai Medical General Stores Near Saidham Hospital Mulund East,1.33 KM,3.9,9 Votes,"Shop No 1, Ambika Plaza, 90 Feet Road, Mulund East, Mumbai - 400081, Near Saidham Hospital"
Variya Super Shopee Opposite Fish Market Mulund East,1.37 KM,4.8,2 Votes,"Shop No 2 Jigna Apartment, M.P Road Gavanpada, Mulund East, Mumbai - 400081, Opposite Fish Market"
Savala Medical General Store Opposite Vishvabharti Hotel Mulund West,1.55 KM,3.7,5 Votes,"Shop no 31 Bodke Bldg, M G Road, Mulund West, Mumbai - 400080, Opposite Vishvabharti Hotel"
Ashirwad General Store Near to Saibaba Temple Mulund East,1.6 KM,,0 Votes,"Shop No.12,plot No.36, Mhada Colony Road, Mulund East, Mumbai - 400081, Near to Saibaba Temple"
Medimart Chemist And Druggist Near Ashirvad Hospital Mulund Colony mulund West,1.8 KM,3.9,5 Votes,"Shop No 17 E/5, Highland Park, Gurugobind Singh Road, Mulund Colony-mulund West, Mumbai - 400082, Near Ashirvad Hospital"
Mahavir Society Store Indira Nagar Mulund West,1.95 KM,3.0,1 Votes,"Shop no.1, S V Road, Mulund West, Mumbai - 400080, Indira Nagar"
Dilip General Stores Mulund West,,,0 Votes,"B 6, Samrat Vp Road, Mulund West, Mumbai - 400080"
Vijay General Store Mulund West,,4.0,1 Votes,"S L Road, Mulund West, Mumbai - 400080"
Gala General Stores Mulund West,,3.7,3 Votes,"Devadayal Road, Mulund West, Mumbai - 400080"
Bhagavan General Store Mulund West,,,0 Votes,"D P Rd, Mulund West, Mumbai - 400080"
Swastik General Stores Mulund West,,,0 Votes,"Mulund West, Mumbai - 400080"
Gala General Store Opp ESIC Hosp Mulund West,,4.0,1 Votes,"Kadampada,, Mulund West, Mumbai - 400080, Opp ESIC Hosp,"
Sanjay Medical And General Stores Mulund West,,4.0,1 Votes,"Mulund West, Mumbai - 400080"
B9 General Stores Mulund West,,4.5,1 Votes,"Chapsi Bimsi Road, Mulund West, Mumbai - 400080"
Ridhi Siddhi General Store Mulund West,,,0 Votes,"Mulund West, Mumbai - 400080"
Kalyan Ji Ranchoddas General Store Mulund West,0.09 KM,,0 Votes,"Dr Ambedkar Road, Vidya Vihar, Mulund West, Mumbai - 400080"
Parass General Stores Opposite Shraddha Hospital Mulund West,0.12 KM,3.9,18 Votes,"Shop No-A-10, Mirani Nagar, Opposite Urban Supermarket, Ganesh Gavde Road, Mulund West, Mumbai - 400080, Opposite Shraddha Hospital"
Ankit General Store G n Rd Mulund West,0.14 KM,5.0,4 Votes,"Shop No.7, Near Mehul Circal, Shankardam Plaz, Mulund West, MUMBAI - 400080, G.n. Rd"
Deepak General Stores Mulund West,0.14 KM,,0 Votes,"Shop No 2 Sonapur Single Road, Mulund West, mumbai - 400080"
Meena General Stores Mulund West,0.15 KM,5.0,2 Votes,"Shop No 1, N S Road, Mulund West, Mumbai - 400080"
New Bharat Medical General Stores Opposite Keshav Pada Mulund West,0.19 KM,3.9,6 Votes,"Shop No. 2, Ashirwad Building, Near Dr. Yogesh Shah, P K Road, Mulund West, Mumbai - 400080, Opposite Keshav Pada"
Jay Chana Bhandar Mulund West,0.24 KM,,0 Votes,"Purushottam Kheraj Road, Keshav Pada, Mulund West, Mumbai - 400080"
Sunanda Store Mulund West,0.24 KM,,0 Votes,"07/B, Samishra Cooperative Housing Society, Keshav Pada, Purushottam Kheraj Road, Mulund West, Mumbai - 400080"
Gupta Kirana Near Kalidas Natyamandir Mulund West,0.25 KM,,0 Votes,"Shop2, Pk Road, Mulund West, Mumbai - 400080, Near Kalidas Natyamandir"
Jaiswal food fruits centre Mulund West,0.25 KM,4.2,5 Votes,"Shop No.17 Koteshwar Plaza, India Nivas Jn Road, Mulund West, Mumbai - 400080"
Vijay Store Mulund West,0.25 KM,3.6,3 Votes,"Keshav Pada, Pandit Dindayal Upadhyay Marg, Mulund West, Mumbai - 400080"
Kailesh General Store Mulund West Mulund West,0.27 KM,,0 Votes,"Shop-3,, Santhoshi Mata Mandir,, Mulund West, Mumbai - 400080, Mulund West,"
Tiwari General Store Mulund West,,,0 Votes,"S N Road, Mulund West, Mumbai - 400080"
Anand Store Mulund West,,,0 Votes,"S N Road, Mulund West, Mumbai - 400080"
Maharashtra General Stores LBS Marg Mulund West,,,0 Votes,"Shope:12, Ali Bhadure Chale,, ACC Road, Mulund West, Mumbai - 400080, LBS Marg"
Kamaths Mangalore Stores Opposite Antarishk Tower Mulund West,0.33 KM,4.6,86 Votes,"Shree Rameshwar Apartment, Murar Road, Mulund West, Mumbai - 400080, Opposite Antarishk Tower"
Mahendra Stores Behind Shreeram Nagar Co Op Hou Society Mulund West,0.37 KM,2.7,12 Votes,"Keshav Pada Pk Road, Mulund West, Mumbai - 400080, Behind Shreeram Nagar Co. Op. Hou Society"
Ankita Stores Mulund West,0.37 KM,,0 Votes,"Shop No.B/C4, Jalaram Ashish, West, Devidayal Road, Devidayal Roadb Parduman Singh Road, Mulund West, Mumbai - 400080"
Maharashtra Bakery General Store Ramnagar Mulund West,0.38 KM,4.0,7 Votes,"Shop No 1, Goshala Road, Mulund West, Mumbai - 400080, Ramnagar"
Shree Medical General Stores Near Vijay Nagar Mulund West,0.38 KM,4.0,6 Votes,"Shop No.4, Mahadeo Niwas, Junction Of SL Road & Rhb Road, Mulund West, Mumbai - 400080, Near Vijay Nagar"
Bharat General Stores Near Kuttchi Dairy Mulund West,0.38 KM,,0 Votes,"Shop No 10, Mahadev Nivas, Rhb Road, Mulund West, Mumbai - 400080, Near Kuttchi Dairy"
Niraj Kirana General Store Mulund West,0.39 KM,,0 Votes,"Goshala Road, Mulund West, Mumbai - 400080"
Bhavesh General grain stores Mulund Opp Pushpanjali Apartment Mulund West,0.39 KM,,0 Votes,"Shop No.48/20,Ramgad Nagar ,, Goshala Road,, Mulund West, mumbai - 400080, Opp. Pushpanjali Apartment,"
Sagar Provision General Store Near Ramgad Mulund West,0.43 KM,3.8,13 Votes,"Shop No.107, Goshala Road, Goshala Roadpurushottam Kheraj Road, Mulund West, Mumbai - 400080, Near Ramgad"
Janta Grain Stores Opposite Javerat Jewellers Mulund West,0.45 KM,3.8,13 Votes,"12, Damji Kheraj Biulding, Ganesh Gawade Road, Mulund West, Mumbai - 400080, Opposite Javerat Jewellers"
Hirji Umarshi Co Near Bharat Bank Mulund West,0.46 KM,5.0,5 Votes,"Gala No. 1, Padam Bhavan, J N Road, Mulund West, Mumbai - 400080, Near Bharat Bank"
Hiralal Dwarkadas Company General Store Mulund West,0.49 KM,5.0,8 Votes,"Vidya Vihar, Mulund, Marg, Margroad, Mulund West, Mumbai - 400080"
Shree Ram Stores Opposite Ratanbai Marathi School Mulund West,0.49 KM,,0 Votes,"B2, Gaurav Plaza, R.R.T. Road, Mulund West, Mumbai - 400080, Opposite Ratanbai Marathi School"
Shree AAI Mata Green General Store Near Neelkanth Nagar Mulund West,0.5 KM,,0 Votes,"Shop No.3, Neelkanth Nagar Society,, B.p.s Road Near Neelkant Tower,, Mulund West, Mumbai - 400080, Near Neelkanth Nagar"
Rinku Medical And General Store Near Bus Depot Mulund West,0.51 KM,4.0,18 Votes,"Shop No 10, Bps Plaza, Devi Dayal Road, Mulund West, Mumbai - 400080, Near Bus Depot"
JAI Jalaram General Stores Mulund West,0.51 KM,4.0,1 Votes,"Shop No 11 Bps Plaza, D D Rd, Mulund West, Mumbai - 400080"
New Mayur General Stores Opposite Vbs Plaza Mulund West,0.52 KM,3.8,11 Votes,"Shop No.6, Ambe Smruti Building, Devi Dayal Road, Mulund West, Mumbai - 400080, Opposite Vbs Plaza"
Nakoda Stores Near Kachhi Dairy Mulund West,0.52 KM,,0 Votes,"Shop No. 6/7, Navmangal Society, R H Bhojraj Road, Mulund West, Mumbai - 400080, Near Kachhi Dairy"
Oswal General Stores Mulund West,0.55 KM,4.6,6 Votes,"Oswal House, Mulund, . S. L. Road, Mulund West, Mumbai - 400080"
Naimbhai Mulund West,0.57 KM,,0 Votes,"Mulund West, Mumbai, M G Road, Mulund West, Mumbai - 400080"
Swaminaryan General and Tobacco Store Mulund West,0.57 KM,,0 Votes,"J.N. Road , Pandit Jawaharlal Nehru Road, Indira Nagar, Mulund West, Mumbai - 400080"
Lal Chand Gupta General Store Mulund West,0.58 KM,5.0,7 Votes,"Shanti Nagar, Goshala Road, Mulund West, Mumbai - 400080"
Kapil General Store Near to HDFC Bank Mehul Talkies Mulund West,0.6 KM,4.2,6 Votes,"Shop No 3 Meera Shyam Building, Gaushala Road, Mulund West, Mumbai - 400080, Near to HDFC Bank & Mehul Talkies"
