Name,Distance,Rating,Votes,Address
Savla Dry Fruits Near Vishnunagar Ghantali Chowk Naupada Thane West,0.75 KM,3.6,5 Votes,"Shradha Bhavan, Station Road, Thane West, Thane - 400601, Near Vishnunagar Ghantali Chowk Naupada"
Ashish Bharatiya Bazaar Apna Near Shimla Bar Thane West,1.42 KM,4.0,3 Votes,"Shop 2,Shreejidham Building, Edulji Road, Thane West, thane - 400601, Near Shimla Bar"
Ratan Supermarket Near Gaondevi Mandir Kopri Colony Thane East,0.33 KM,4.1,26 Votes,"Shop No 52, C, Sant Tukaram Road, Kopri Colony-Thane East, Thane - 400603, Near Gaondevi Mandir"
Deepak Stores Near Jambhali Naka Thane West,1.05 KM,4.3,3 Votes,"Station Rd, Thane West, Thane - 400601, Near Jambhali Naka"
Vishal Super Market Opposite Sant Tukaram Ground Kopri Thane East,0.26 KM,3.7,15 Votes,"Shop No-02, Gautam Aracade, Raut Road, Kopri-Thane East, Thane - 400603, Opposite Sant Tukaram Ground"
Khushalani Stores Opposite Building No 22 Kopri Thane East,0.6 KM,4.0,20 Votes,"Sarvanand Appartment , Plot No 10, Kopri, Thane East, Thane - 400603, Opposite Building No 22 ,Kopri"
New Thana Traders Near Thane Market Jambli Naka Thane West,,3.9,5 Votes,"Shop No 1, Bohri Building, Devidas Road, Thane West, Thane - 400601, Near Thane Market,Jambli Naka"
Niti General Store Near Thane Bharat Sahakari Bank Thane West,0.87 KM,3.7,11 Votes,"Kaustubh Chs, Baji Prabhu Deshpande Road, Thane West, Thane - 400601, Near Thane Bharat Sahakari Bank"
Raju Cold Drinks And Gen Store Near Block No 4 Kopri Colony thane East,0.94 KM,4.0,1 Votes,"Kopari Colony, Thane West, Mumbai, Kopri Road, Kopri Colony-thane East, Thane - 400603, Near Block No 4"
Krishna Medical General Store Near Bhanushali Hospital Shivaji Path Thane West,0.37 KM,4.0,27 Votes,"Shop No 3, Solanki Sadan, Station Road, Thane West, Thane - 400601, Near Bhanushali Hospital, Shivaji Path"
Sharda Medical General Store Opposite Thane Janta Sahakari Bank Singh Nagar Thane West,2 KM,4.1,14 Votes,"Shop No.01 Singh Nagar, Kopat Road, Thane West, Thane - 400601, Opposite Thane Janta Sahakari Bank, Singh Nagar"
Hari Om Crockery Kirana Store,,2.0,1 Votes,"Section 29, Bhaji Market, Thane - 400603, Near Unr- 4"
Jainam General Store Opp Sadguru Garden Kopri Thane East,0.28 KM,,0 Votes,"Shop no-1 Gurudev Nagar, R. M. Road, Kopri-Thane East, Thane - 400603, Opp. Sadguru Garden"
Shri Krishna General Store Thane West,0.29 KM,,0 Votes,"Vartak Nagar, Thane West, Thane - 400601"
Food Trip Next to Monginis Cake Shop Near Railway Station Thane West,0.31 KM,4.7,3 Votes,"Shop No 6 & 7, Yashodhan Biulding, Station Road, Thane West, Thane - 400601, Next to Monginis Cake Shop, Near Railway Station"
Patel Medical Thane Thane West,,5.0,1 Votes,"Shop No 2,Trishul Sadan, Kisan Nagar,, Thane West, Thane - 400601, Thane"
Bharat Soap General Store Kopri Colony thane East,0.34 KM,,0 Votes,"1 Kopri Colony, Sant Tukaram Road, Kopri Colony-thane East, Thane - 400603"
Vimal Medical General Stores Opposite American Watch Company Thane West,0.5 KM,,0 Votes,"Dandekar Bhavan shop-1, Station Road, Thane West, Thane - 400601, Opposite American Watch Company"
Patidar Tobaco General Store Manpada Naka Thane West,,,0 Votes,"4 Chitalsar, Thane West, Thane - 400601, Manpada Naka"
Laxmi Super Market Opposite Suraj Water Park Thane West,,4.0,1 Votes,"Shop No 4 Kanchan Pushpa, Ghodbunder Road, Thane West, Thane - 400601, Opposite Suraj Water Park"
Vijay Medical General Stores Lokmanya Ngr Thane West,,3.8,10 Votes,"Shop No 1 Prabhat Soc, Thane West, Thane - 400601, Lokmanya Ngr"
Kailash Dry Fruits Thane West,,3.0,1 Votes,"Vartak Nagar, Thane West, Thane - 400601"
Karia Tobacco And Tea Centre Near Fire Brigade Thane West,1.01 KM,4.5,1 Votes,"Shop No 2, Karsan Virji Chawl, Mahatma Phule Marg, Thane West, Thane - 400601, Near Fire Brigade"
Patel General Stores Mahagir Market Thane West,1.08 KM,,0 Votes,"Shop No 3, Manilal Narsi Bhavan, Mahatma Phule Road, Thane West, Thane - 400601, Mahagir Market"
Kanchan Medical General Stores Near Peda Maruti Mandir Thane West,1.1 KM,3.6,8 Votes,"Shop No.1, Tijadeep Apartment., T.M. ROAD, KHARKAR ALI, Thane West, Thane - 400601, Near Peda Maruti Mandir"
Bhawani Stores Opposite Blue Star Mobile Shop Thane West,1.11 KM,4.8,4 Votes,"Indira Sadan, Kharkar Alley Road, Thane West, Thane - 400601, Opposite Blue Star Mobile Shop"
Vipul Dryfruit Opp St John School Thane West,1.2 KM,5.0,2 Votes,"Bhagirat Building, Shop No 1, Old Mumbai Road, Thane West, Thane - 400601, Opp. St. John School"
New Kishor Electrical General Stores Bhawani Chowk Thane West,1.34 KM,4.5,2 Votes,"Shop No. 2, Devi Darshan Building, Tembhi Naka, Thane West, Thane - 400601, Bhawani Chowk"
Kirti Shop Near Tembi Naka Charai Thane West,1.35 KM,3.0,2 Votes,"Bidvai House Shop No 3, Edulji Road, Charai-Thane West, Thane - 400601, Near Tembi Naka"
Mukesh Medical And General Stores Wagle Estate Kisan Nagar 2 Thane West,1.41 KM,5.0,2 Votes,"Shop No 1, Rajmahal Building, Thane West, Thane - 400601, Wagle Estate, Kisan Nagar 2"
Mahavir Grain And General Stores Near Civil Hospital Tembhi Naka Thane West,1.68 KM,5.0,2 Votes,"Mahavir House, Shop On.1, Tembi Naka, Dr Ambedkar Road, Tembhi Naka-Thane West, Thane - 400601, Near Civil Hospital"
Bajrang Kirana Stores,1.8 KM,,0 Votes,"Shop No 1&2,Pitrijchaya Appartment, Pandurang Thakar Chowk, Kalwa West, Mumbai, Bp Road, Thane - 400601"
Deepak Oil Centre General Stores Near Maybar Hotel Utharsan Naka Thane West,1.96 KM,3.0,2 Votes,"Shop No 1,2 and 3, Madvi House, Utharsan Road, Thane West, Thane - 400601, Near Maybar Hotel, Utharsan Naka"
Sri Laxmi Mangalore General Store Thane East,0.03 KM,,0 Votes,"Kopri Colony, Thane, Raut Road, Thane East, Thane - 400603"
Shree Laxmi General Stores Opposite ICICI Bank Kopri Thane East,0.03 KM,,0 Votes,"Shop No-08, Kapri Road, Kopri-Thane East, Thane - 400603, Opposite ICICI Bank"
Jodhpur Sweet And Snacks Opp Railway Station Kopri Thane East,0.03 KM,,0 Votes,"Shop No.8,Jyostna Chs, Station Road, Kopri-Thane East, Thane - 400603, Opp,Railway Station"
Bhavani Dryfruit General Store Opposite Railway Station Kopri Thane East,0.04 KM,5.0,1 Votes,"Shop No 07 Gr. Floor Jyostna Apartment, Station Road, Kopri-Thane East, Thane - 400603, Opposite Railway Station"
Rampuri Communication And General Store Opp Bus Stop Kopri Thane East,0.05 KM,,0 Votes,"Kopri Colony, Thane, Thane Station Road, Kopri-Thane East, Thane - 400603, Opp. Bus Stop"
Bhavani Medical And General Store Opposite Railway Station Kopri Colony thane East,0.11 KM,,0 Votes,"Shop No.07 Jyostna Apartment, Station Road, Kopri Colony-thane East, Thane - 400603, Opposite Railway Station"
Om Traders General Store Wagle Estate Thane Thane West,0.13 KM,,0 Votes,"Section No - 1, Shree Nagar, Thane West, Thane - 400601, Wagle Estate,Thane"
Sai Krupa General Store Near Mangla School Thane East,0.13 KM,,0 Votes,"Shop No. 5, L T Road, Thane East, Thane - 400603, Near Mangla School"
Rajesh Stationery General Store Opp Canara Bank Thane East,0.16 KM,4.5,2 Votes,"Draupati Amrut, Shop No 8, Station Road, Thane East, Thane - 400603, Opp Canara Bank"
New Rajesh Stationers General Store Near Hotel Twins Thane East,0.18 KM,5.0,1 Votes,"Shop No.8, Ranewadi (Ranebhavan Biulding), Kopri Colony, Thane East, Thane - 400603, Near Hotel Twins"
Jai Ganesh Novelty And General Store Thane East,0.21 KM,,0 Votes,"Rambhau Mhalgi Road, Sudarshan Colony, Daulat Nagar, Thane East, Thane - 400603"
S T General Store Near Thane Station Thane West,0.22 KM,,0 Votes,"Shop No1, Station Road, Thane West, Thane - 400601, Near Thane Station"
Matvi General Stores,,,0 Votes,Thane - 400601
Mahaveer General Stores Thane West,0.26 KM,4.5,2 Votes,"Thane West, Thane - 400601"
Veera General Stores Opposite Railway Station Thane West,0.26 KM,,0 Votes,"3, Samadhan Building, Thane West, Thane - 400601, Opposite Railway Station"
Hindustan Kirana Stores Kopri Thane West,0.27 KM,,0 Votes,"Shop No. 7, Gautam Arcade, Raut Road, Thane West, Thane - 400601, Kopri"
Tanmai Provision General Store Mehata Pharmaceutical Company Kopri Colony thane East,0.28 KM,,0 Votes,"0/2 R K Jivdani Niwas, Chandarkar Road, Kopri Colony-thane East, Thane - 400603, Mehata Pharmaceutical Company"
Kavita Dry Fruits Nr Rajshree medical shop Kopri Thane East,0.28 KM,3.5,2 Votes,"Shop No B3 Gurunanak Co HSG Society, Fire brigade, Kopri-Thane East, Thane - 400603, Nr Rajshree medical shop"
SAI Shradha Pan General Stores Kopri thane East,0.28 KM,,0 Votes,"Prem Nagar Society, Kopri-thane East, Thane - 400603"
Vikram Traders Near Mirani Nagar Kopri Thane East,0.29 KM,4.0,3 Votes,"Shop No 4, Seema Society, Kopri Colony, Kopri-Thane East, Thane - 400603, Near Mirani Nagar"
Dinesh Dry Fruits And General Stores Near Gurudwara Thane East,0.29 KM,4.0,1 Votes,"A1/3 , Shiv CHS, Sadhu Vasmani Marg Kopri Colony, Thane East, Thane - 400603, Near Gurudwara"
Vijay General Stores Thane West,0.31 KM,4.0,1 Votes,"Yashodhan,Chhatrapati Shivaji Path, Ambedkar Chowk, Thane West, Thane - 400601"
Vinod General Store Kisan Nagar 2 Thane West,0.31 KM,,0 Votes,"Gupta Niwas, Road No 16, Thane West, Thane - 400601, Kisan Nagar 2"
Harish General Stores Opp Sarvodaya Society Kopri Colony Thane East,0.32 KM,3.7,3 Votes,"Shop No 31 & 35 Kopri Colony, Kopri Colony, Kopri Colony-Thane East, Thane - 400603, Opp Sarvodaya Society"
Shree Ganesh General Store Opposite Mangala Hindu High School Thane East,0.32 KM,,0 Votes,"Shop 8 Godavari Appartment, Tilak Road, Thane East, Thane - 400603, Opposite Mangala Hindu High School"
Muhavelly Kirana Store Maveli Thane West,,,0 Votes,"Shop No2,Sanlep Niwas,, Kisan Nagar -3,, Thane West, Thane - 400601, Maveli"
Yogita General Store Thane Thane West,,,0 Votes,"Shop No 7,Snatoshi Bhavan,, Bhatwadi, Kisan Nagar - 3,, Thane West, Thane - 400601, Thane"
Jagannath General Store Shri Complex Kisan Nagar 3 Thane West,,,0 Votes,"Shop No 3,B/Wing ,, Ground Floor,, Thane West, Thane - 400601, Shri Complex,Kisan Nagar -3."
Barnwal General Stores Thane West,,,0 Votes,"Vadhaman Bus Stop, Old Agra Rd,, Old Agra Rd, Thane West, Thane - 400601"
Jailaxmi Pro Store Sathe Nagar Wagle Estate Thane West,,,0 Votes,"Shop No.- 606, Road No -22,, Thane West, Thane - 400601, Sathe Nagar,Wagle Estate,"
Laxmi Novelty Telecom Wagle Estate Thane West,,,0 Votes,"Shop No -3,, Indra Nagar,, Thane West, Thane - 400601, Wagle Estate,"
Vinod Kirana Stores Opp Sundaram Bldg Thane West,,,0 Votes,"Panchpakhdi, Kashinath, Tandel Chawl, Naupada,Kashinath,, Thane West, Thane - 400601, Opp Sundaram Bldg"
Sai Prasad General Store Kisan Nagar No 2 Thane West,,,0 Votes,"Shop No 5, Road No 16, Thane West, Thane - 400601, Kisan Nagar No 2"
Sailesh General Store Padwal Nagar Thane West,,,0 Votes,"Shop No - 2,, Purnima Dharshan,, Thane West, Thane - 400601, Padwal Nagar,"
Sandeep General Store Kisan Nagar 3 Thane West,,,0 Votes,"Shop No -3,Kusumnagraj Bldg., Bhattwadi, Thane West, Thane - 400601, Kisan Nagar - 3"
Sneha Kirana General Store Wagle Estate Thane West,,,0 Votes,"Nehru Nagar No-1,, Rd No-16,, Thane West, Thane - 400601, Wagle Estate,"
Tiwari General Store Kisan Nagar 3 Thane W Thane West,,,0 Votes,"Shop No-1,, Panchpandu Bld,, Thane West, Thane - 400601, Kisan Nagar-3,Thane W."
Rajnarayan General Store Thane West Thane West,,,0 Votes,"Shop No- 1/2, Ameena Bai Chawl,, Sawarkar Nagar,, Thane West, Thane - 400601, Thane West."
Maharashtra Store Thane West Thane West,,5.0,3 Votes,"Opp Anand Kripa Tower,, Huzoori Darga,, Thane West, Thane - 400601, Thane West."
Jalaram Gen Store Thane West Thane West,,,0 Votes,"Shop-2,Gagan Giri Apt,, Sawarkar Nagar,, Thane West, Thane - 400601, Thane West."
Satguru Medical And General Store Near Prem Nagar Thane East,0.32 KM,4.3,14 Votes,"Shop No 02, Sainath Darshan, Kopri Colony Road, Thane East, Thane - 400603, Near Prem Nagar"
Tejal General Kirana Store Mith Bandar road Thane East,0.32 KM,,0 Votes,"Shop No-45, Sai Sadan Chawl, Chendani Koliwada Chawl, Thane East, Thane - 400603, Mith Bandar road"
Shakuntala Kirana Stores Thane West,,4.0,1 Votes,"Shop No.21093, Chandanwadinoori Baba Dargah Road, Chandanwadinoori Baba Dargah Road, Thane West, Thane - 400601"
Krishna General Stores Opposite Kishore Nagar Society Sarvodaya Society Kopri Colony thane East,0.33 KM,4.3,3 Votes,"Shop No 30, Kopri Colony, Kopri Colony-thane East, Thane - 400603, Opposite Kishore Nagar Society & Sarvodaya Society"
Jhulelal General Stores Near Union Bank Thane East,0.33 KM,,0 Votes,"Shop-10 Main Bazar, Kopri Colony Sant Tuka Ram Road, Thane East, Thane - 400603, Near Union Bank"
Jai Santoshi Maa General Store Thane West,0.34 KM,,0 Votes,"Shop No 2, Sainath Society, Huzoori Darga, Thane West, Thane - 400601"
New Thana Supari General Store Opp Axis Bank Thane West,0.34 KM,,0 Votes,"Shop No.02, Agra Road, Thane West, Thane - 400601, Opp Axis Bank"
Sai Medical General Stores Opposite Rajvi Plaza Chendani Koliwada Thane East,0.34 KM,,0 Votes,"Laxmi Wadi, Mith Bunder Road, Thane East, Thane - 400603, Opposite Rajvi Plaza, Chendani Koliwada"
Kinjal General Stores Opposite Rajiv Plaza Thane East,0.35 KM,5.0,2 Votes,"Lakshmiwadi, Chandeni Koliwada, Gajanan Koli Marg, Thane East, Thane - 400603, Opposite Rajiv Plaza"
Gurudatt Milk General Stores Thane East,0.35 KM,3.0,2 Votes,"Chandeni Koliwada, Mithbunder Road, Mithbunder Roadgajanan Koli Marg, Thane East, Thane - 400603"
R D Kirana Store Opposite Saibaba Mandir Thane West,0.36 KM,4.5,2 Votes,"No 39, Kopri Colony, Station Road, Thane West, Thane - 400601, Opposite Saibaba Mandir"
Janata General Store Opp Gaodevi Maidan Thane West,0.37 KM,,0 Votes,"Amardeep Bldg, Gokhle Road, Thane West, Thane - 400601, Opp Gaodevi Maidan"
Ladharam Narayandas Kirana General Store Kopri Colony Thane East,0.38 KM,4.0,1 Votes,"Shop No 7-8, Main Bazaar, Thane East, Thane - 400603, Kopri Colony"
Maharashtra Stationery General Store Near Punjab National Bank Thane East,0.38 KM,,0 Votes,"Shop No. 1 ,Bharat English School, Kopri Colony, Thane East, Thane - 400603, Near Punjab National Bank"
Janata General Stores Near Jain Traders Thane West,0.39 KM,4.5,24 Votes,"Gala No4, Suryadarshan Building, Ram Maruti Nagar Road, Thane West, Thane - 400601, Near Jain Traders"
Nikita Dry Fruits Gerenal Store Near Maa Sherawali Temple Thane East,0.39 KM,3.0,2 Votes,"Kopri Colony, Daulat Nagar, St Tukaram Maharaj Path, Thane East, Thane - 400603, Near Maa Sherawali Temple"
Ambika Provision Dry Fruit Store Opposite United Sports Club Koli Wada Kopri Colony Thane East,0.41 KM,5.0,1 Votes,"Anand Bharti Road, Kopri Colony-Thane East, Thane - 400603, Opposite United Sports Club Koli Wada"
Siddhivinayak Store Kopri Colony Near Punjab National Bank Thane East,0.41 KM,5.0,1 Votes,"Shop No 5, Thane East, Thane - 400603, Kopri Colony, Near Punjab National Bank"
Shree Ramnath Stores Near Bank Of India Thane East,0.41 KM,5.0,1 Votes,"Shop No-20, Gautam Centre, L.T Marg, Thane East, Thane - 400603, Near Bank Of India"
Sona Dry Fruits And General Stores Near Satguru Garden Thane East,0.41 KM,,0 Votes,"Shop No-03,Keerti Society, Jijamata Marg, Thane East, Thane - 400603, Near Satguru Garden"
Suvidha Stores Kopri Colony Thane East,0.42 KM,2.0,1 Votes,"Kirti Society, Jijamata Marg, Kopri Colony-Thane East, Thane - 400603"
Aashapura General Store Bhattwadi Kisan Nagar 3 Thane West,0.42 KM,5.0,1 Votes,"Shop No-6,, Santoshi Bhavan,, Thane West, Thane - 400601, Bhattwadi,Kisan Nagar-3,"
Shree Guru Kripa General Store Wagle Estate Thane East,0.42 KM,,0 Votes,"Shop No-16, Kisan Nagar No-2, Thane East, Thane - 400603, Wagle Estate"
Bhoomika General Store Vita Suriya Nagar Gate No 8 Thane East,0.42 KM,,0 Votes,"Kapila building shop no. 2, Ganesh mandir road, Thane East, Thane - 400603, Vita Suriya Nagar, Gate No 8"
Balaji general store Near bhaji market Thane East,0.42 KM,,0 Votes,"shop no 2, kopari, Thane East, Thane - 400603, near bhaji market"
Niranjan Kirana General Store Near Ganesh Mandir Chendani Koliwada Thane East,0.43 KM,,0 Votes,"Janardan Nakhda Chawl, Mith Bunder Road, Thane East, Thane - 400603, Near Ganesh Mandir, Chendani Koliwada"
Khamkar General Stores Near Narayan Koli Chowk Kopri Kopri Thane East,0.43 KM,,0 Votes,"Shop No 5, Rajiv Gandhi Shopping Centre, Mith Bunder Road, Kopri-Thane East, Thane - 400603, Near Narayan Koli Chowk, Kopri"
