Name,Distance,Rating,Votes,Address,OriginFileNavin Super Market Near Vasinaka Opposite Agarwal Nagar Chembur East,1.81 KM,3.8,40 Votes,"Shop No 4, Mahul Road, Chembur East, Mumbai - 400074, Near Vasinaka, Opposite Agarwal Nagar",Chembur
Vijay Medical Store Near BMC School Chembur East,1.8 KM,4.7,12 Votes,"5, Maruti Sadan , Ghatla Village, N B Road, Chembur East, Mumbai - 400071, Near BMC School",Chembur
Karthik General Store Easten Express Higway Chembur East,0.56 KM,4.2,5 Votes,"Nandanvan, Chembur East, Mumbai - 400088, Easten Express Higway",Chembur
Shree Mahaveer Karishma Kirana And General Stores Chembur East,1.11 KM,3.8,24 Votes,"Hp Nagar, Bharat Nagar, Chembur East, Mumbai - 400074",Chembur
Ganesh Medical General Store Bharat Nagar Near H P Colony Vashi Naka Chembur Colony Chembur East,1.13 KM,4.0,6 Votes,"102/47,, Chembur Colony-Chembur East, Mumbai - 400074, Bharat Nagar, Near H P Colony, Vashi Naka",Chembur
Sidhhivinayak Masala And General Stores Chembur East,1.15 KM,4.8,5 Votes,"Hpcl Colony Private Road, Vashi Naka, Bharat Nagar, Chembur East, Mumbai - 400074",Chembur
Shree Sadguru Medical General Stores Kashinath Patil Wadi Mukti Nagar Chembur East,1.22 KM,4.3,8 Votes,"F/A, 13, N G Acharya Marg, Chembur East, Mumbai - 400071, Kashinath Patil Wadi, Mukti Nagar",Chembur
Jasraj Supermarket Opposite Borla Housing Society Chembur East,1.45 KM,3.8,68 Votes,"Vani Apartment A Wing Shop No 12, Dr Choitram Gidwani Marg, Chembur East, Mumbai - 400071, Opposite Borla Housing Society",Chembur
Mahalaxmi Pan Shop General Store Chembur East,1.62 KM,5.0,6 Votes,"Jari Mandir Road, Wadhavli Village, Chembur East, Mumbai - 400074",Chembur
Hari Om General Stores Vasinaka Opposite The Chembur Nagarik Sakari Bank Chembur East,1.8 KM,4.7,10 Votes,"Shop 9, R C Marg, Chembur East, Mumbai - 400074, Vasinaka, Opposite The Chembur Nagarik Sakari Bank",Chembur
Shree Ganesh Farsan Mart General Stores Mukti Nagar Ghatla Chembur East,1.8 KM,4.2,9 Votes,"Shop No.314,, Chembur East, Mumbai - 400071, Mukti Nagar, Ghatla",Chembur
Anil Stores Chembur East,1.81 KM,4.0,8 Votes,"Vasi Naka, Gurudwara, Sharad Nagar, Ramakrishna Chemburkar Marg, Chembur East, Mumbai - 400074",Chembur
Mahadev Traders Antophil Chembur East,1.97 KM,4.4,8 Votes,"A132 Antopil Warehousing Society, Wadala Stn East, Chembur East, Mumbai - 400071, Antophil",Chembur
Yayati General Stores Beside Police Chowky Khardev Nagar Chembur East,1.99 KM,4.0,10 Votes,"Khardev NAgar, Arvind Patil Wadi, Market Road End, Chembur East, Mumbai - 400071, Beside Police Chowky, Khardev Nagar",Chembur
Tulsi Medical General Stores Near Tiss Deonar,0.83 KM,4.0,95 Votes,"7, Daffodil Apartment, Sion Trombay Road, Deonar, Mumbai - 400088, Near Tiss",Chembur
Sagar Medical General Stores Opposite Usv Ltd Banganga Society Govandi East,1.41 KM,4.5,33 Votes,"Shop No A 5, Indira Apartment, Govandi East, Mumbai - 400088, Opposite Usv Ltd, Banganga Society",Chembur
Nagrik Chemist Near Govandi Station Govandi East,1.88 KM,4.6,9 Votes,"Shop No 2, Govandi East, Mumbai - 400088, Near Govandi Station",Chembur
Deonar Pharmacy General Stores Opposite Lakme Deonar,1.16 KM,3.9,32 Votes,"Shop No 1m Aastha II, Govandi Station Road, Deonar, Mumbai - 400088, Opposite Lakme",Chembur
Chetan Stores Near Krishna Hotel Deonar,1.62 KM,4.0,28 Votes,"Shop No B/12, Hill View Building, Deonar Village, Deonar, Mumbai - 400088, Near Krishna Hotel",Chembur
Star Market A TATA And Tesco Enterprise Near Churchgate Railway Station Beside KC and HR Churchgate,0.51 KM,4.2,1734 Votes,"123, Mistry Bhavan, Dinshaw Vacha Road, Churchgate, Mumbai - 400020, Near Churchgate Railway Station, Beside KC and HR",Churchgate
Fair Price Shop Opposite Samrat Hotel Churchgate,0.4 KM,4.0,71 Votes,"Shop No 4, 195, Moti Mahal, J T Road, Churchgate, Mumbai - 400020, Opposite Samrat Hotel",Churchgate
Jyoti Grain Stores Bhd Satyam Collection Churchgate,0.38 KM,3.9,22 Votes,"Shop No 4 Chheda Sadan Grd Flr, J Tata Road, Churchgate, Mumbai - 400020, Bhd Satyam Collection",Churchgate
Patel Brothers Near yes ub academy school Marine Drive,0.86 KM,3.8,37 Votes,"Shop No 3, Badrikeshwar Building No 82, Marine Drive, Mumbai - 400020, near yes ub academy school",Churchgate
K J Mart Opposite Adamji Peerbhai Market Marine Lines,1.05 KM,3.7,6 Votes,"Shop No 21, Bhiwandiwala Terrace, 2nd Dhobhighat Lane, Marine Lines, Mumbai - 400020, Opposite Adamji Peerbhai Market",Churchgate
Sarvodaya Stores Marine Drive,0.9 KM,3.9,61 Votes,"Shop No 1, Building No 81, Swashray, Hvb Road, Marine Drive, Mumbai - 400020",Churchgate
Manish Market Near Chhatrapati Shivaji Terminus Area Fort,1.7 KM,3.9,7677 Votes,"Unit No 2, Ramabai Ambedkar Marg, Fort, Mumbai - 400001, Near Chhatrapati Shivaji Terminus Area",Churchgate
Lobo Stores Opposite Bombay Police Head Quater Crawford Market,1.7 KM,4.1,206 Votes,"Shop No 295-296, M J Phule Market, Crawford Market, Mumbai - 400001, Opposite Bombay Police Head Quater",Churchgate
Hakimi Stores Crawford Market,1.69 KM,4.4,132 Votes,"301/302 Crawford Hair Tage Market, 3rd Lane, Crawford Market, Mumbai - 400001",Churchgate
Janta Super Market Colaba Market Colaba,1.94 KM,4.8,9 Votes,"Shop No 03, Colaba Mansion, Lala Nigam Road, Colaba, Mumbai - 400005, Colaba Market",Churchgate
V K Stores Opp crime branch Crawford Market,1.65 KM,4.3,12 Votes,"Shop No 467-468, second galli second shop, Crawford Market, Mumbai - 400001, opp crime branch",Churchgate
Maratha Stores Near Dena Bank Colaba,1.86 KM,3.7,110 Votes,"40/A, Dena Bank Building, Shahid Bhagat Singh Marg, 3rd Pasta Lane, Colaba, Mumbai - 400005, Near Dena Bank",Churchgate
Shah Vasanji Damji Opposite Badshah Cold Drink House Opposite CID Office Crawford Market,1.14 KM,4.0,18 Votes,"Shop No 376/377/378, D N Road, Crawford Market, Mumbai - 400001, Opposite Badshah Cold Drink House, Opposite CID Office",Churchgate
New Colaba Super Market Opposite Dena Bank Colaba,1.89 KM,4.1,29 Votes,"Shop No 1, Ruby Terrace, Lala Nigam Road, Colaba, Mumbai - 400005, Opposite Dena Bank",Churchgate
Hiralal Shival Super Market Near Goldeval Temple Gol Deval Cawasji Patel Tank,2 KM,4.5,11 Votes,"209/211, Laxmi Building, Sant Sena Maharaj Marg, Gol Deval-Cawasji Patel Tank, Mumbai - 400004, Near Goldeval Temple",Churchgate
Joseph Company Opp Naval Public School Colaba,1.94 KM,4.3,7 Votes,"Shop No 4, Pipewala Bldg, 4th Pasta Lane, Colaba, Mumbai - 400005, Opp Naval Public School",Churchgate
Alpha General Store Opp Stationary Zone Fort,1.08 KM,4.3,6 Votes,"95 Sai Bihar, Modi Street, Fort, Mumbai - 400001, Opp. Stationary Zone",Churchgate
Sangam Stores Colaba Market Colaba,1.93 KM,3.7,8 Votes,"Shop No 2, Building No 24, Indumati Sakarikar Marg, Colaba, Mumbai - 400005, Colaba Market",Churchgate
Welcome General Stores Colaba Market Colaba,1.95 KM,3.8,5 Votes,"Shop No 5, Plumber House, Lala Nigam Road, Colaba, Mumbai - 400005, Colaba Market",Churchgate
Gupta Provision Store Masoob Shopping Centre Near Janmabhoomi Marg Fort,0.7 KM,4.6,9 Votes,"14 Bagh, Wakriwala Building, Shop A/ 1, Pitha Street, Fort, Mumbai - 400001, Masoob Shopping Centre, Near Janmabhoomi Marg",Churchgate
Bansi Studio Fort,0.79 KM,4.8,13 Votes,"Dhun Biulding, Jyoti Studio Compound, Veer Nariman Road, Kala Ghoda, Fort, Mumbai - 400001",Churchgate
Magna Nutrition Centre Kala Ghoda Fort,0.87 KM,3.5,12 Votes,"143, Sassoon Building, M G Road, Fort, Mumbai - 400001, Kala Ghoda",Churchgate
Gourmet West Opposite Jehangir Art Gallery Kala Ghoda Fort,0.87 KM,4.0,6 Votes,"C/O Westside Store, Ground Floor, Army & Navy Building, 148 M G Road, Fort, Mumbai - 400001, Opposite Jehangir Art Gallery, Kala Ghoda",Churchgate
Shreeji Foods Nx Fort,1.03 KM,4.4,89 Votes,"Shop No 1/2, Walchand Hirachand Marg, Fort, Mumbai - 400001",Churchgate
Grocesory Shop,,4.4,8 Votes,Mumbai - 400001,Churchgate
Students General Stores Cuffe Parade colaba,1.28 KM,4.2,155 Votes,"625, G D Somani Memorial School, Cuffe Parade-colaba, Mumbai - 400005",Colaba
Patel General Stores Near Colaba Post Office Colaba,1.4 KM,3.5,15 Votes,"Shop No 20, Hampton Court, Shahid Bhagat Singh Road, Colaba, Mumbai - 400005, Near Colaba Post Office",Colaba
New Variety General Stores Near Colaba Post Office Colaba,0.83 KM,3.6,8 Votes,"Shop No 22, Hampton Court, Shahid Bhagat Singh Road, Colaba, Mumbai - 400005, Near Colaba Post Office",Colaba
Kohinoor General Stores Behind Strand Cinema Colaba,1.66 KM,4.1,35 Votes,"Grants Building, Arthur Bunder Road, Colaba, Mumbai - 400005, Behind Strand Cinema",Colaba
Shakti General Stores Near Colaba Post Officie Colaba,1.54 KM,4.6,8 Votes,"Usha Sadan, Shop No 9, Block A, Shahid Bhagat Singh Road,Colaba, Colaba, Mumbai - 400005, Near Colaba Post Officie",Colaba
Garden General Store Colaba,0.25 KM,5.0,6 Votes,"Malabar Mansion, 37, Colaba Causeway, Gundecha Garden, Colaba, Mumbai - 400005",Colaba
Javed General Stores Opposite Telephone Bhavan Colaba,0.44 KM,4.2,11 Votes,"Shop No 6 Mistry Chamber Building, Colaba, Mumbai - 400005, Opposite Telephone Bhavan",Colaba
Karishma General Provision Store Colaba,1.86 KM,4.9,14 Votes,"Cen508, Doctor B.A Nagar Punarvasab, Settlement, Babasaheb Ambedkar Nagar, Captain Prakash Pethe Marg, Colaba, Mumbai - 400005",Colaba
Balge Colaba,1.91 KM,4.0,8 Votes,"Settlement, Ganesh Murti Nagar, Captain Prakash Pethe Marg, Colaba, Mumbai - 400005",Colaba
K G N Near Suladh Sochalya Colaba,2 KM,4.3,35 Votes,"Ganesh Muti Nagar 3, Ganesh Murti Nagar, Captain Prakash Pethe Marg, Colaba, Mumbai - 400005, Near Suladh Sochalya",Colaba
Bombay Crafts Pharmacy General Store Opposite Oval Ground Churchgate,1.16 KM,4.1,41 Votes,"124/I, Eros Cinema Building, M K Road, Churchgate, Mumbai - 400020, Opposite Oval Ground",Colaba
Neelam Medical Street Bazaar Gate Opposite V T Station Fort,1.88 KM,4.4,41 Votes,"53, Perin Nariman Street, Fort, Mumbai - 400001, Bazaar Gate, Opposite V T Station",Colaba
Ravi General Stores Opp Nirmala Niketan College Near Churchgate Station Churchgate,1.6 KM,4.1,25 Votes,"Shop No 1, Jolly Bhavan No 2, 7 New Marine Lines, Churchgate, Mumbai - 400020, Opp Nirmala Niketan College, Near Churchgate Station",Colaba
The Lucky General Stores Near Rbi Bank Fort,1.56 KM,4.0,24 Votes,"Office No 221, Bora Bazar Street, Fort, Mumbai - 400001, Near Rbi Bank",Colaba
Kirloskar Electric Company Limited In Mumbai Gpo Fort,,4.3,7 Votes,"9, State Bank Officers 1st Colony, SS Colony, Sv Nagar, Fort, Mumbai - 400001, In Mumbai Gpo",Colaba
Rajat General Stores Near Reserve Bank Of India Opp Horniman Circle Fort,1.45 KM,3.8,6 Votes,"Shop No 2, Gool Mansion, 6,Homji Street, Fort, Mumbai - 400001, Near Reserve Bank Of India,Opp Horniman Circle",Colaba
Dhedia Store,,3.9,7 Votes,Mumbai - 400001,Colaba
Oxford Books General Store,,3.8,13 Votes,Mumbai - 400001,Colaba
White Magic Near Sewri Bus Depot Sewri,1.34 KM,4.1,654 Votes,"BPT Plot No 2, Acharya Donde Marg, Sewri, Mumbai - 400015, Near Sewri Bus Depot",CottonGreen
Jai Maharashtra Super Market Near Abhudiya Coprative Bank Parel,1.34 KM,3.8,12 Votes,"Patel Wadi Shope No.15/16, Parel Village, Parel, Mumbai - 400012, Near Abhudiya Coprative Bank",CottonGreen
National Medical General Stores Near Sewri Station Sewri,1.71 KM,4.0,9 Votes,"Shop No 3Transit D, Sewri Cross Road, Sewri, Mumbai - 400015, Near Sewri Station",CottonGreen
Atharva Medical And General Stores Near Bavla Masjid Lower Parel,1.65 KM,4.4,5 Votes,"Shop No 4, Bavla Masjid Building, N M Joshi Marg, Lower Parel, Mumbai - 400013, Near Bavla Masjid",CottonGreen
Shraddha Medical General Store Behind Kem Hospital Gate No 07 Opposite Guru Rani Chowk Parel,1.43 KM,4.3,16 Votes,"649, S P Compound, Dr S S Rao Road, Parel, Mumbai - 400012, Behind Kem Hospital Gate No 07, Opposite Guru Rani Chowk",CottonGreen
Sirocco Opposite Hindi Vidhay Bhavan Marine Lines,3.16 KM,4.4,45 Votes,"Shop No 9, Building No 82, Badrikehswar, F Road, Marine Lines, Mumbai - 400020, Opposite Hindi Vidhay Bhavan",CuffeParade
Lucky Provision Stores Crawford Market,3.88 KM,4.2,10 Votes,"Shop 21, Inside Crawford Market, Opp. Sitaram Building, Anna Saheb Daundkar Marg, Lucky Provision St, Crawford Market, Mumbai - 400001",CuffeParade
Asian Stores Near Dadar T T Circle Dadar East,0.57 KM,4.2,128 Votes,"807, Imperial Mahal, Khodadad Circle, Dr Ambedkar Road,, Dadar East, Mumbai - 400014, Near Dadar T T Circle",Dadar
Manoj Medical General Stores Dadar West,0.94 KM,4.4,22 Votes,"13,Raghuraj Bhavan, Gokhale Road South, Dadar West, Mumbai - 400028",Dadar
Jain General Stores Near Wadala Telephone Exchange Dadar East,0.97 KM,4.3,34 Votes,"Plot No- 234/235, Naigaon Cross Road, Dadar East, Mumbai - 400014, Near Wadala Telephone Exchange",Dadar
Bharat Medico Star Mall Opposite Plaza Cinema Dadar West,0.39 KM,3.9,35 Votes,"Shop No 2 Star Mall, N C Kelkar Road, Dadar West, Mumbai - 400028, Opposite Plaza Cinema",Dadar
Swami Samarth General Store Near Ashish Industry Dadar West,1.19 KM,4.8,5 Votes,"11, Ganesh Bhuvan, Gokhale Road South, Dadar West, Mumbai - 400028, Near Ashish Industry",Dadar
Ikon Bio Pharma Medical General Store Opposite Portuguese Church Dadar West,0.6 KM,4.5,49 Votes,"Shop No 11, Ground Floor, Jilani Manzil Building, S K Bole Road Junction, Dadar West, Mumbai - 400028, Opposite Portuguese Church",Dadar
Shree Swami Samartha Medical General Stores Near Hindu Colony Lane No 1 Dadar East,0.42 KM,4.2,30 Votes,"Shop No -05 Ground Floor Plot No 61 Shrikant Lodging, Sir Bhalchandra Road, Dadar East, Mumbai - 400014, Near Hindu Colony Lane No 1",Dadar
Arun Provision Stores Near Axis Bank Dadar West,0.51 KM,4.2,6 Votes,"Shop No.2, Popatlal Chawl, Ranade Road, Dadar West, Mumbai - 400028, Near Axis Bank",Dadar
Wellcare Medical And General Stores Near Ajanta Plywood Dadar West,0.52 KM,4.3,5 Votes,"Shop No 72,Kawali Wadi, Rao Bahadur S K Bole Marg, Dadar West, Mumbai - 400028, Near Ajanta Plywood",Dadar
Shushrusha Medical And General Store Opposite HP Petrol Pump Dadar West,0.64 KM,3.9,37 Votes,"Shop No 784/785, Hendre Castle, Gokhale Road North, Dadar West, Mumbai - 400028, Opposite HP Petrol Pump",Dadar
Ashish Medical General Stores Shivaji Park Dadar West,0.77 KM,3.7,8 Votes,"Shop No 3/4, 54/64 Upasana Building, L J Road, Dadar West, Mumbai - 400028, Shivaji Park",Dadar
Rambhia Cash N Carry Super Market Front State Bank Of India Near Railway Station Dadar West,0.72 KM,4.2,17 Votes,"Shop No 4/68, Kiran Building, Ranade Road, Dadar West, Mumbai - 400028, Front State Bank Of India, Near Railway Station",Dadar
Khimji Palan Co Opp portugese Church Dadar West,0.69 KM,4.0,25 Votes,"110 Ravji Sojpal Building, S K Bole Road, Dadar West, Mumbai - 400028, Opp.portugese Church",Dadar
Health Care Medical And General Store Near Portuguese Church Dadar West,0.7 KM,4.3,28 Votes,"Shop No.14, Raoji Sojpal Building, Gokhale Road North, Dadar West, Mumbai - 400028, Near Portuguese Church",Dadar
Adarsh Medical General Store Opposite Spring Mail Dadar East,1.32 KM,4.0,12 Votes,"Shop No 50, G Chawl No 5, Laxmi Co Operative Housing Society, G D Ambekar Road, Naigaon, Dadar East, Mumbai - 400014, Opposite Spring Mail",Dadar
Patel Stores Opposite Kabutar Khana Dadar West,0.22 KM,4.4,5 Votes,"Shop No.53/92, Kirtikar Market, 1st Lane, Dr Dsilva Road, Dadar West, Mumbai - 400028, Opposite Kabutar Khana",Dadar
Sadguru Medical General Store Near Dadar Railway Station Dadar East,0.29 KM,4.3,6 Votes,"Shop No-10 Gafoor Bldg, L N Road, Dadar East, Mumbai - 400014, Near Dadar Railway Station",Dadar
Kalpesh Stores Near Plaza Cinema Dadar West,0.46 KM,3.8,6 Votes,"Shop No 1, Khandeko Building No 11, J K Sawant Marg, Dadar West, Mumbai - 400028, Near Plaza Cinema",Dadar
Lee Medical General Store Opposite Shindewadi Dadar East,0.84 KM,4.1,14 Votes,"Shop No. 09, Mahavir Sukh Building, Dr Ambedkar Road, Dadar East, Mumbai - 400014, Opposite Shindewadi",Dadar
Smokers Corner Near Saraswat Bank Dadar West,0.17 KM,3.6,20 Votes,"Suryaji Niwas, Senapati Bapat Marg, Dadar West, Mumbai - 400028, Near Saraswat Bank",Dadar
Pravin Stores Dadar West,0.23 KM,3.6,14 Votes,"32 Kirtikar Market, M C Jawle Marg, Dadar West, Mumbai - 400028",Dadar
A K Nagina General Store Dadar West,0.44 KM,4.0,6 Votes,"Kasaravadi, Tulsi Pipe Road, Dadar West, Mumbai - 400028",Dadar
Sardarjees Stop And Shop Khodad Circle Dadar East,,4.1,16 Votes,"In Front Of 805 Tehm Terracce, Dr Ambedkar Rd, Dadar East, Mumbai - 400014, Khodad Circle",Dadar
Gulshan Stores Near Dadar T T Dadar East,0.56 KM,4.3,20 Votes,"807 Imperial Mahal B Block, Dr Ambedkar Road, Dadar East, Mumbai - 400014, Near Dadar T T",Dadar
Gogari Anna Bhandar Opposite Bhatladevi Temple Dahisar,0.38 KM,4.0,98 Votes,"Shop No-9/10, Mani Ben Chawl, Station Road, Dahisar, Mumbai - 400068, Opposite Bhatladevi Temple",Dahisar
Bhavani Medical General Stores Maruti Nagar Ashokvan Near Gokul Anand Hotel Dahisar,1.33 KM,4.2,19 Votes,"Shop No 7 Kesari Nandan BBuilding, Shiv Vallabh Road, Dahisar, Mumbai - 400068, Maruti Nagar, Ashokvan, Near Gokul Anand Hotel",Dahisar
Jyoti Medico Opp BMC Market Dahisar,0.8 KM,3.9,12 Votes,"Shop No-13 A-2 Anand Nagar, CST Road, Dahisar, Mumbai - 400068, Opp BMC Market",Dahisar
Krishna Medical General Stores Kandar Pada Dahisar,0.93 KM,3.7,28 Votes,"Shop No 7, Radha Raman Apartment, Waman Rao Bhoir Road, Dahisar, Mumbai - 400068, Kandar Pada",Dahisar
Shri Purnima Super Market Near 298 Last Bus Stop Rawalpada Dahisar East,1.3 KM,4.0,90 Votes,"Shop No 1 & 2, Mandakini Building, Shiv Vallabh Cross Road, Rawalpada-Dahisar East, Mumbai - 400068, Near 298 Last Bus Stop",Dahisar
Ankur Stores Opposite Vithal Temple Dahisar,0.44 KM,3.9,7 Votes,"Shop No. 01, Mantri Tower Bldg., L T Road, Dahisar, Mumbai - 400068, Opposite Vithal Temple",Dahisar
Real Chemist Medical General Store Near JBCN International School Dahisar,0.47 KM,3.9,20 Votes,"Shop No 1, Shree Blue Diamond Co-op.Hsg.socity Ltd., L M Road, Dahisar, Mumbai - 400068, Near JBCN International School",Dahisar
Shree Krishna Super Market Near Raj Medical Dahisar,0.69 KM,4.0,69 Votes,"Shop No 125,M.H.B Colony, Society No 22, S.N Dubey Road, Chunabhatti, Dahisar, Mumbai - 400068, Near Raj Medical",Dahisar
Yash Supermarket Opposite Garden Dahisar,1.22 KM,4.0,10 Votes,"Anand Nagar Complex Building Udhish Thir Shop 11/10, 1750 Shivaji Road, Dahisar, Mumbai - 400068, Opposite Garden",Dahisar
SAI Medical General Stores Near Ravindra Hotel Dahisar,0.42 KM,4.3,23 Votes,"Shop No:- 1, SAI Mandir Co Op HSG Soc Ltd, S V Rd, Dahisar, Mumbai - 400068, Near Ravindra Hotel",Dahisar
Gajanand Medical General Stores Near Sagun Hotel Navagaon Dahisar West,0.56 KM,4.5,6 Votes,"Shop No.4, Yellow Ribbon Chs Ltd, L M Road, Navagaon-Dahisar West, Mumbai - 400068, Near Sagun Hotel",Dahisar
Momai Maa Super Market Near Rustamji Business School Mhatre Wadi Dahisar West,1.19 KM,3.7,9 Votes,"Shop No 4. SAI Amrut, J. Sawant Road, Mhatre Wadi-Dahisar West, Mumbai - 400068, Near Rustamji Business School",Dahisar
Shiv Medical General Store Bus Stpo Of 297 Dahisar,1.25 KM,4.6,5 Votes,"Shop No 2,Kumar Chawl,Rawal Pada, S N Dubey Road, Dahisar, Mumbai - 400068, Bus Stpo Of 297",Dahisar
Hari Om Super Market Near Om Yogeshwar Apartment Kandar Pada Dahisar,1.09 KM,3.9,11 Votes,"Shop No 5, Ekta Vivek Building, Linking Road, Dahisar, Mumbai - 400068, Near Om Yogeshwar Apartment, Kandar Pada",Dahisar
Ramkrishna Medical General Store Opposite Siddhi Hospital Near Nancy Colony Veer Savarkar Nagar Dahisar,1.27 KM,4.5,26 Votes,"Shop No 8, Datta Dham Building, Veer Savarkar Nagar, Dahisar, Mumbai - 400068, Opposite Siddhi Hospital, Near Nancy Colony, Veer Savarkar Nagar",Dahisar
Mangalore General Stores Opposite Muncipal School Dahisar,0.15 KM,3.9,23 Votes,"Shop No-5 Sangeeta Niwas, Hari Shankar Joshi Road, Dahisar, Mumbai - 400068, Opposite Muncipal School",Dahisar
Prasad Super Market Opposite Oriental Bank Of Commerce Masquita Nagar Dahisar East,0.25 KM,3.8,9 Votes,"Shop No 4 Ketaki CHS Misquitta Nagar, Vidya Mandir Road, Masquita Nagar-Dahisar East, Mumbai - 400068, Opposite Oriental Bank Of Commerce",Dahisar
Liberty Medical General Stores Opposite Canara Bank Dahisar,0.42 KM,4.1,6 Votes,"Shop No:- 1, N K Chawl, S V Rd, Dahisar, Mumbai - 400068, Opposite Canara Bank",Dahisar
Shakti Aanna Bhandar Near Dahisar Police Station Dahisar,0.67 KM,3.6,5 Votes,"C/10, Shiv Shakti Complex, S V Road, Dahisar, Mumbai - 400068, Near Dahisar Police Station",Dahisar
Shiv Shakti Opp Krishna Tower Dahisar,0.84 KM,4.1,15 Votes,"Shop No 2-3, Ashapura Shopping Centre, Near Matru Chhaya School, Dahisar, Mumbai - 400068, Opp. Krishna Tower",Dahisar
Raj Kirana Store Opposite to Garden Dahisar,1.24 KM,3.5,6 Votes,"Shop No. 8, Sindhu Bhuvan Apartment, Rawalpada, Dahisar, Mumbai - 400068, Opposite to Garden",Dahisar
Janata Market Ashokvan Dahisar,1.31 KM,3.8,6 Votes,"Shop No 8, Kesari Nandan Building, Shiv Vallabh Road, Dahisar, Mumbai - 400068, Ashokvan",Dahisar
Brijesh Medical General Stores Opp Fish Market Dahisar,1.7 KM,4.0,7 Votes,"Sakharam Khandekar Chawl, Ketkipada, Dahisar, Mumbai - 400068, Opp Fish Market",Dahisar
New Sancheti Chemist Opposite Railway Station Dahisar,0.11 KM,4.2,5 Votes,"Shop No,5, Nikita Building, Harishankar Joshi Marg, Dahisar, Mumbai - 400068, Opposite Railway Station",Dahisar
Anantrai Harilal co Opposite Anant Wadi Bhuleshwar,0.82 KM,4.9,9 Votes,"8991, Fanas Wadi, A Merchant Road, Bhuleshwar, Mumbai - 400002, Opposite Anant Wadi",Dhobi_talao
Rahul Store Kalbadevi,0.84 KM,5.0,11 Votes,"91/Hh Koliwadi, Kalbadevi, Mumbai - 400002",Dhobi_talao
Khimji Anand Company Opposite Chaniya House Gulal Wadi bhuleshwar,,4.2,5 Votes,"139 Kika Street, Gulal Wadi-bhuleshwar, Mumbai - 400002, Opposite Chaniya House",Dhobi_talao
Satyam Enterprises Opposite Patwa Chambers Near Masjid Station East Dana Bandar,1.47 KM,4.3,59 Votes,"110 & 111, Clive Road,, Dana Bandar, Mumbai - 400009, Opposite Patwa Chambers, Near Masjid Station East",Dhobi_talao
Naeem Masala Near Gol Deval Temple Null Bazar,1.48 KM,3.6,15 Votes,"Shop No 23 and 24, Mirza Ghalib Market, Matka Gali, Null Bazar, Mumbai - 400003, Near Gol Deval Temple",Dhobi_talao
Kuvarji Khimraj Company Gol Dev Mandir Shiv Mandir Null Bazar,1.55 KM,4.2,44 Votes,"Shop No 132 134, S V P Road, Null Bazar, Mumbai - 400003, Gol Dev Mandir (Shiv Mandir)",Dhobi_talao
Sha Raga Ladha Company Near Madhavbaug Temple Cawasji Patel Tank,1.35 KM,4.2,98 Votes,"33, Sindhi Lane, Cawasji Patel Tank, Mumbai - 400004, Near Madhavbaug Temple",Dhobi_talao
Satyam Enterprise Masjid Bunder,,3.8,6 Votes,"Masjid Bunder, Mumbai - 400003",Dhobi_talao
Parshuram Traders Virmani Market Bhat Bazar Masjid Bunder,1.4 KM,4.1,20 Votes,"267/71, G-15, Narshi Nath Street, Masjid Bunder, Mumbai - 400003, Virmani Market, Bhat Bazar",Dhobi_talao
E H Kathawala Company Bhat Bazar Masjid Bunder,1.39 KM,4.6,27 Votes,"262/70, Anant Niwas, Narshi Natha Street, Masjid Bunder, Mumbai - 400003, Bhat Bazar",Dhobi_talao
Virchand Khimji Co Opposite Two Tank Grant Road,1.95 KM,4.0,35 Votes,"144, Grant Road, Mumbai - 400007, Opposite Two Tank",Dhobi_talao
Bhat Bazar,1.49 KM,3.8,155 Votes,"New Chinchbunder, Chinchbunder, Mandvi, Keshavji Naik Road, Mumbai - 400003",Dhobi_talao
Rahat Medical General Stores Next to Metro Opticians Dongri,0.58 KM,4.3,6 Votes,"Shop No 17, Haroon Manzil, 155 Imamwada Road, Dongri, Mumbai - 400009, Next to Metro Opticians",Dongri
Shree Datta General Store Near Sandhurst Road Railway Station Sandhurst Road,0.11 KM,3.7,413 Votes,"Shop No 6 , Dongri Muncipal Market, Nowroji Hill Road No4, Sandhurst Road, Mumbai - 400009, Near Sandhurst Road Railway Station",Dongri
Nazir Medico Near Sandhurst Road Dongri Muncipal Fish Market Dongri,0.12 KM,4.6,7 Votes,"Shop No 13, Nowroji Hill Road No 4, Dongri, Mumbai - 400009, Near Sandhurst Road, Dongri Muncipal Fish Market",Dongri
Shree Datta General Store Dongri,0.13 KM,3.7,413 Votes,"Shop No 6,Dongi Municipal Market, Nauroji Hill Road No 4, Dongri, Mumbai - 400009",Dongri
Prince Medical General Stores Opp Dongri BMC Market Dongri,0.16 KM,4.7,10 Votes,"Shop No.3, 73/75 Nawab Mansion Bldg., Dr Meisheri Road, Dongri, Mumbai - 400009, Opp Dongri BMC Market",Dongri
Getwell Soon Chemist General Stores Near Noor Baug Circle Sandhurst Road,0.25 KM,4.1,7 Votes,"Shop No 2, Amir Building, Jail Road, Sandhurst Road, Mumbai - 400009, Near Noor Baug Circle",Dongri
New Plaza Medical General Stores Opp Dena bank Noor Baug Umerkhadi,0.33 KM,5.0,6 Votes,"Shop No 1, Pragati Building, S.C. Marg, Noor Baug-Umerkhadi, Mumbai - 400009, opp. Dena bank",Dongri
Food Spot Bussines Park Ghatkopar East,0.19 KM,4.1,75 Votes,"Shop No 18, Kamdar Shopping Apartment, Tilak Road, Ghatkopar East, Mumbai - 400077, Bussines Park",Ghatkopar
Shah Arjan Virji Company Jalaram Nagar Opp Gandhi Market Ghatkopar East,0.19 KM,4.1,59 Votes,"1/4 Jalaram Nagar, M G Road, Ghatkopar East, Mumbai - 400077, Jalaram Nagar Opp. Gandhi Market",Ghatkopar
Pramanik General Store Near Indian Overseas Bank Ghatkopar East,0.33 KM,4.2,379 Votes,"Shop No. 7 & 8, Golwala Banglow, M G Road, Hingwala Lane, Ghatkopar East, Mumbai - 400077, Near Indian Overseas Bank",Ghatkopar
Shah Ramji Bachubhai Kirana Store Opposite Balaji Mandir Ghatkopar East,0.28 KM,3.8,80 Votes,"Shop No 7 & 8, Mahesh Kunj, Tilak Road, Ghatkopar East, Mumbai - 400077, Opposite Balaji Mandir",Ghatkopar
Janta Masala Next Tiptop Ghatkopar East,0.24 KM,4.2,17 Votes,"Shree Sadan, Vallabh Baug Lane, Ghatkopar East, Mumbai - 400077, Next Tiptop",Ghatkopar
Mansi Medical General Stores Near Garodia Nagar Opp Union Bank Of India Ghatkopar East,0.75 KM,4.2,61 Votes,"157, Shop No 8, Neelkanth Bldg, Vallabh Baug Lane, Ghatkopar East, Mumbai - 400077, Near Garodia Nagar, Opp Union Bank Of India",Ghatkopar
