Name,Distance,Rating,Votes,Address,OriginFile
Kohinoor Masala Kirana Store Near Jhoola Maidan Agripada,0.16 KM,4.6,13 Votes,"Shop No 25 Fancy Market, Morland Road, Agripada, Mumbai - 400011, Near Jhoola Maidan",Agripada
Shree Ganesh Medical General Stores Near Jaccob Circle Mahalaxmi,0.69 KM,3.7,8 Votes,"Shop No 11, Masjid Chawl, Dr E Moses Road, Mahalaxmi, Mumbai - 400011, Near Jaccob Circle",Agripada
Laxmi General Stores Opp Masjid Mahalaxmi,0.72 KM,3.5,7 Votes,"Shop No 7, Dr E Moses Road, Mahalaxmi, Mumbai - 400011, Opp Masjid",Agripada
Swati Grain Stores Mahalaxmi,1.17 KM,4.8,6 Votes,"Shop No.2, Laxmi Pooja Appartment, D Wing, Saatrasta, J. R. Boricha Marg, Mahalaxmi, Mumbai - 400011",Agripada
Kalpana Grain Stores,1.32 KM,5.0,5 Votes,"43/44, Ananad Estate, 452, 454, Jacob Circle, Nm Joshi Marg, Mumbai - 400011",Agripada
Nutan Medical General Stores Near Apollo Mills Mark Classes Chinchpokli,1.48 KM,4.3,14 Votes,"390-A, Shop No 2, Laxmi Niwas, N M Joshi Marg, Chinchpokli, Mumbai - 400011, Near Apollo Mills & Mark Classes",Agripada
Global Enterprises Opp Voltas Chinchpokli,1.62 KM,5.0,6 Votes,"5, Dattakrupa HSG Society, Dr Babasaheb Ambedkar Road, Chinchpokli, Mumbai - 400011, Opp Voltas",Agripada
Sahakari Bhandar Next to Amarsons Opposite Breach Candy Hospital Breach Candy,0.77 KM,3.9,253 Votes,"Shop No 63, Bhulabhai Desai Road, Breach Candy, Mumbai - 400026, Next to Amarsons, Opposite Breach Candy Hospital",Altamound Road
Diamond Stores Opp ACI Cumballa Hospital Kemps Corner,0.17 KM,3.8,22 Votes,"Shop No 96, Bhiwandiwala Building, August Kranti Marg, Kemps Corner, Mumbai - 400026, Opp ACI Cumballa Hospital",Altamound Road
Bhimshi Vershi Company Opp Nalanda Building Pedder Road,0.26 KM,4.2,20 Votes,"63, Mani Mansion, Pedder Road, Mumbai - 400026, Opp Nalanda Building",Altamound Road
Nutan Stores Near Jaslok Hospital Breach Candy,0.68 KM,3.9,9 Votes,"Purnima Apartment, Pedder Road, Breach Candy, Mumbai - 400026, Near Jaslok Hospital",Altamound Road
Bharat Stores Next to Jaslok Hospital Pedder Road,0.68 KM,4.3,20 Votes,"19, Shanti Building No 2, Pedder Road, Mumbai - 400026, Next to Jaslok Hospital",Altamound Road
Amit Stores Mahalaxmi Breach Candy,1.3 KM,4.1,8 Votes,"28/A,Bachubhai Niwas, Bhulabhai Desai Road, Breach Candy, Mumbai - 400026, Mahalaxmi",Altamound Road
Raveesons Breach Candy,1.2 KM,3.6,19 Votes,"42 A, Bhulabhai Desai Road, Breach Candy, Mumbai - 400026",Altamound Road
Kenorita Supermarket Opposite Dariya Mahal Near Priya Darshni Nepean Sea Road,1.67 KM,4.1,471 Votes,"75, Sagar Tarang Building, Nepean Sea Road, Mumbai - 400006, Opposite Dariya Mahal, Near Priya Darshni",Altamound Road
Sahakari Bhandar Opposite Priyadarshini Park Nepean Sea Road,1.25 KM,4.0,214 Votes,"Hyderabad Estate, B Block, Ground Floor, Nepean Sea Road, Mumbai - 400006, Opposite Priyadarshini Park",Altamound Road
Manilal Provision Store Near Wiaa Club Malabar Hill,1.29 KM,4.1,65 Votes,"Shop No 23, David Sasson Chawl, 10 Ridge Road, Malabar Hill, Mumbai - 400006, Near Wiaa Club",Altamound Road
Apna bazar Opposite Phadkewadi Ganpati Mandir Girgaon,1.8 KM,3.8,179 Votes,"Shop No 136, Tulsi Mansion Building, V P Road, Girgaon, Mumbai - 400004, Opposite Phadkewadi Ganpati Mandir",Altamound Road
Welcome General Store Near Shayadri Guest House Malabar Hill,1.4 KM,4.3,99 Votes,"Shop No 1-1A, Mini Sudarshan Building, 22, LD Ruparel Marg, Malabar Hill, Mumbai - 400006, Near Shayadri Guest House",Altamound Road
Apna Bazar Opposite Fire Brigade Nana Chowk Grant Road,0.57 KM,3.9,10 Votes,"Ness Baug Building, Grant Road, Mumbai - 400007, Opposite Fire Brigade, Nana Chowk",Altamound Road
Kamdhenu Gowalia Tank Kemps Corner,0.2 KM,4.2,55 Votes,"Shop No. 20, Warden Court Building, Gowalia Tank Road, Kemps Corner, Mumbai - 400006, Gowalia Tank",Altamound Road
Devshi Nathubhai Co Near Grant Road Railway Station Grant Road,0.73 KM,4.1,19 Votes,"Shop No 6, 36 D, Avishkar Building, Sleater Road, Grant Road, Mumbai - 400007, Near Grant Road Railway Station",Altamound Road
Geetanjali Super Market Opposite Brahman Sabha R R M Roy Marg Charni Road,1.44 KM,4.0,108 Votes,"3/4, Suratwala Building,211, Raja Ram Mohan Roy Marg, Charni Road, Mumbai - 400004, Opposite Brahman Sabha, R R M Roy Marg",Altamound Road
Vishal Super Market Opposite J K Building No 5 Gamdevi,0.78 KM,4.0,47 Votes,"2/3 Royal Chambers, H G Road, Gamdevi, Mumbai - 400007, Opposite J K Building No 5",Altamound Road
Matru Krupa Opposite No 10th Khetwadi Khetwadi girgaon,1.54 KM,4.0,17 Votes,"Shop No. 5, Ground Floor, Siddhesh Darshan, 199/201, Khetwadi Main Road, Khetwadi-girgaon, Mumbai - 400004, Opposite No. 10th, Khetwadi",Altamound Road
Kumkum Provision Stores Opposite Film Centre Tardeo,1.23 KM,4.0,12 Votes,"Shop No 5, Raheja Excellisor, 57 Tardeo Road, Tardeo, Mumbai - 400034, Opposite Film Centre",Altamound Road
Chedda Chemist General Store Next Garant Road Post Office Grant Road,0.87 KM,4.3,43 Votes,"13 jyoti mahal, Sleater road, Grant Road, Mumbai - 400007, Next Garant Road Post Office",Altamound Road
Soni Moni Provision Stores Tardeo,1.2 KM,4.3,6 Votes,"Shop No 18 Sahakar Niwas, 20 Tardeo Road, Tardeo, Mumbai - 400034",Altamound Road
Pramanik Provision Stores Opposite Bhatia Hospital Kailash Nagar Tardeo,1.2 KM,4.4,12 Votes,"658, Tardeo Road, Tardeo, Mumbai - 400007, Opposite Bhatia Hospital, Kailash Nagar",Altamound Road
Prabhat Stores Malabar Hill,1.5 KM,4.1,58 Votes,"66, Petit Hall, Nepean Sea Road, Navshanti Nagar, Malabar Hill, Mumbai - 400006",Altamound Road
Shah Bhimshi Naiya Opp dariya mall bus stop Walkeshwar,1.71 KM,3.9,20 Votes,"Star Dust Building,shop no 1/a,, 80 Napean Sea Road, Walkeshwar, Mumbai - 400006, opp.dariya mall bus stop",Altamound Road
Gala Provision Stores Opposite Sikka Nagar Charni Road,1.81 KM,4.8,5 Votes,"Shop No 6,18/23,Mehta Heights, Sadashiv Lane, Charni Road, Mumbai - 400004, Opposite Sikka Nagar",Altamound Road
Goyam Organic Khotachi Wadi Corner Prarthana Samaj,0.05 KM,4.0,8 Votes,"Shop No. 10, Shri Mahila Samaj Gruh Udyog, Krishvi Heights, V.P.Road , Sikkanagar, Prarthana Samaj, Mumbai - 400004, Khotachi Wadi Corner",Altamound Road
Amrut Stores Opposite JK Towers Gamdevi,0.83 KM,3.5,5 Votes,"39-47, Goravakar Wadi, H g Road, Gamdevi, Mumbai - 400007, Opposite JK Towers",Altamound Road
Devji Dhanji Grant Road,0.92 KM,3.7,10 Votes,"Shop No 85, Lokmanya Tilak Market, Grant Road, Mumbai - 400007",Altamound Road
Krupa Stores,1.08 KM,5.0,7 Votes,"Navyug Nivas, Ground Floor, A/6, Society, Mumbai - 400007, Lamington Road",Altamound Road
Lucky Stores Opposite Sevenhills Hospital Near Agrwal Sweets Andheri East,1.23 KM,4.1,197 Votes,"Shop No 17, Premavati Anand Compound, Military Road, Andheri East, Mumbai - 400059, Opposite Sevenhills Hospital Near Agrwal Sweets",AndheriEast
Real Super Market Near Vijay Nagar Opposite Vicent Pollotty Church Andheri East,1.53 KM,4.1,47 Votes,"Shop No 5, Vijay Tower, Marol Marosi Road, Andheri East, Mumbai - 400059, Near Vijay Nagar, Opposite Vicent Pollotty Church",AndheriEast
Colony Stores J B Nagar Andheri East,0.49 KM,4.0,21 Votes,"Shop No 4, 80 Bagadka Chawl, Andheri East, Mumbai - 400069, J B Nagar",AndheriEast
Rajwadi Super Stores Near Bagarka College Jb Nagar andheri East,0.42 KM,3.8,62 Votes,"Shop No 1, Narayani Bhavan, Swami Bagarka Road, Jb Nagar-andheri East, Mumbai - 400059, Near Bagarka College",AndheriEast
Shashi Medical Seepz MIDC Next to Aakruti Center Point Andheri East,1.02 KM,4.3,45 Votes,"Shop No D-14, Central Road , MIDC, Andheri East, Mumbai - 400093, Seepz, MIDC, Next to Aakruti Center Point",AndheriEast
A Mart Super Market Near Canossa Convent School Shere Punjab Mahakali Andheri East,1.79 KM,3.9,448 Votes,"Shop No 3,4,5 Sapher Building, Mahakali Cross Road, Mahakali-Andheri East, Mumbai - 400093, Near Canossa Convent School & Shere Punjab",AndheriEast
Shanti General Store Near By Jain Mandir Andheri East,0.34 KM,4.2,5 Votes,"Mehul Apartment, Bhagwan Mahaveer Marg, Andheri East, Mumbai - 400059, Near By Jain Mandir",AndheriEast
Savla General Store Near Off marol Maroshi Road Near Bus Stop Marol Village Andheri East,0.83 KM,4.2,34 Votes,"Shop No -1, Marol Village Road, Andheri East, Mumbai - 400059, Near Off.marol Maroshi Road, Near Bus Stop, Marol Village",AndheriEast
Ganesh General Stores Near seven hill hospital Marol Pipeline Andheri East,1.04 KM,4.4,34 Votes,"Shop no 1 and 2, Marol Maroshi Road, Marol Pipeline-Andheri East, Mumbai - 400059, Near seven hill hospital",AndheriEast
Super Janta Stores Near Holy Family Church Andheri East,1.34 KM,3.6,14 Votes,"Shop No 4 Grace Chamber, Sir M. V Road, Andheri East, Mumbai - 400093, Near Holy Family Church",AndheriEast
Patel Bakery And General Store Bombay Cambridge School Andheri East,1.09 KM,4.4,12 Votes,"2/cicila Cottage Dewalwadi Chakala, Bombay Cambridge Road, Andheri East, Mumbai - 400099, Bombay Cambridge School",AndheriEast
Diamond Medical General Store Near Vijay Nagar Bus Stop Andheri East,1.49 KM,4.5,14 Votes,"Building No E-4, Shop No 5, Naina Vijay Co-Operative Housing Society Limited, Marol Maroshi Road, Andheri East, Mumbai - 400059, Near Vijay Nagar Bus Stop",AndheriEast
Farm House Super Market Near St John School Andheri East,0.48 KM,4.2,8 Votes,"Shop No 3 and 4, Vicmom Co Operative Society, Marol Church Road, Andheri East, Mumbai - 400059, Near St John School",AndheriEast
Kinjal Medical General Stores Oriental Aster Andheri East,0.95 KM,4.2,41 Votes,"1 Nanda Deep Tarun Bharat Society, Tarun Bharat Road, Andheri East, Mumbai - 400099, Oriental Aster",AndheriEast
Maru Store Off Apple Heritage Andheri East,0.95 KM,4.2,65 Votes,"101, Dr Charat Singh Colony, Andheri East, Mumbai - 400093, Off Apple Heritage",AndheriEast
Sangam Medical General Stores Near Cigarette Factory Andheri East,1.22 KM,4.3,30 Votes,"Shop No-2, Royal Accord Cigarette Factory, Tati Baharat Road, Andheri East, Mumbai - 400099, Near Cigarette Factory",AndheriEast
Honesty General Stores Opposite Cigarette Factory Chakala Andheri East,1.24 KM,3.9,8 Votes,"Shop No 2 Kurban Husain Chawl, Sahar Road, Andheri East, Mumbai - 400099, Opposite Cigarette Factory, Chakala",AndheriEast
Chheda Grain Store Near Samraj Hotel Andheri East,1.3 KM,4.6,12 Votes,"Shop No 2, Vishwananak Apartment, Chakala Street, Andheri East, Mumbai - 400099, Near Samraj Hotel",AndheriEast
Shree Mahavir Medical General Store Anand Nagar Nr Sanjeevani Hospital Andheri East,1.45 KM,3.5,6 Votes,"Shop No 2, 3 Parimal Bldg, S N Marg, Andheri East, Mumbai - 400059, Anand Nagar, Nr Sanjeevani Hospital",AndheriEast
Pramanik Super Stores Near Airport Colony Sahar Andheri East,1.45 KM,4.6,9 Votes,"Sent Anthony Cottage, Baman Wada, M C Chagla Marg, Sahar-Andheri East, Mumbai - 400099, Near Airport Colony",AndheriEast
Bhagwanta Kirana Merchants Near Mahakali Circle Andheri East,1.73 KM,4.5,8 Votes,"Shop No -27,HEK Compound, Mahakali Caves Road, Andheri East, Mumbai - 400093, Near Mahakali Circle",AndheriEast
Apna Super Market Opposite Mvm High School Andheri West,0.87 KM,3.9,14 Votes,"Shop No 1, Sai Avenue, Veera Desai Road, Andheri West, Mumbai - 400058, Opposite Mvm High School",AndheriWest
Chheda Dal Mill Near Navrang Cinema Andheri West,1.38 KM,4.1,20 Votes,"Plot No.123, Shop No.6, Khandwani Mansion, J.P.Road, Andheri West, Mumbai - 400058, Near-Navrang Cinema",AndheriWest
Sky Home Super Market Near Corporation Bank Andheri West,0.61 KM,4.2,85 Votes,"Shop No 4, B Wing, Dev Prestige, Veera Desai Road, Andheri West, Mumbai - 400058, Near Corporation Bank",AndheriWest
Star Bazaar Near Indian Oil Junction and Tata Power House Jeevan Nagar Off New Link Road Dn Nagar andheri West,0.2 KM,4.1,5335 Votes,"Ground Floor, Crystal Point, SV Road, Dn Nagar-andheri West, Mumbai - 400053, Near Indian Oil Junction and Tata Power House, Jeevan Nagar, Off New Link Road",AndheriWest
Goodluck General Store Opposite Masjid Gilbert Hill Andheri West,1.38 KM,4.1,48 Votes,"Shop No 18, J P Road, Andheri West, Mumbai - 400058, Opposite Masjid, Gilbert Hill",AndheriWest
New Grand Stores Opposite J P Road Bon Bon Seven Bunglows Versova Andheri West,1.07 KM,4.0,221 Votes,"Shop No 21/22, Evershine Apartment No 2, J P Road, Andheri West, Mumbai - 400053, Opposite J P Road, Bon Bon, Seven Bunglows, Versova",AndheriWest
Varsha Medical General Store Opposite Andheri Railway Station Andheri West,1.72 KM,4.3,150 Votes,"Shop No 205, Harish Shopping Center, S V Road, Andheri West, Mumbai - 400058, Opposite Andheri Railway Station",AndheriWest
Diamond Soap Centre Near Sai Baba Mandir Ratan Nagar Andheri West,0.79 KM,4.0,34 Votes,"Shop No.1, Nanadkripa Shopping Center, Ratan Nagar, 4 Bunglow, Andheri West, Mumbai - 400053, Near Sai Baba Mandir, Ratan Nagar",AndheriWest
Good Luck General Store Opposite Wadia School Andheri West,0.29 KM,4.0,359 Votes,"Shop No 1 & 2 Dhake Colony, J P Road, Andheri West, Mumbai - 400053, Opposite Wadia School",AndheriWest
Deepak General Store Opposite Uco Bank Four Bunglow Guru Nagar Andheri West,0.69 KM,4.4,34 Votes,"Shop No 10,Building No 1, Gurunagar Building, J P Road, Four Bungalows, Andheri West, Mumbai - 400053, Opposite Uco Bank,Four Bunglow,Guru Nagar",AndheriWest
Mahavir Food Mart Near Good Sheperd Church Four Bunglows andheri West,0.88 KM,4.1,98 Votes,"Shop No A1/A2 Vibhavari Housing Society, N Datta Marg, Four Bunglows-andheri West, Mumbai - 400053, Near Good Sheperd Church",AndheriWest
Variety Provision Stores Opp Ashoka Academy School Lokhandwala Complex Andheri West,1.4 KM,3.5,33 Votes,"Shop No-3,Clan Field Bldg, Off New Link Road, Lokhandwala Complex-Andheri West, Mumbai - 400053, Opp-Ashoka Academy School,",AndheriWest
Amardeep Super Market Near Lokhandwala Circle Shastri Nagar Andheri West,1.19 KM,4.1,41 Votes,"Shop No 3, 7 Skyway Building, Shastri Nagar, Andheri West, Andheri West, Mumbai - 400053, Near Lokhandwala Circle, Shastri Nagar",AndheriWest
Savla Store Opposite BMC Market Andheri West,1.64 KM,4.2,36 Votes,"Shop No.343, S V Road, Andheri West, Mumbai - 400058, Opposite BMC Market",AndheriWest
New Roman Stores Opposite Bank Of Maharashtra 7 Bungalow Andheri West,1.46 KM,4.0,110 Votes,"Shop No-4,Janakdeep Apartment, J.P Road, Andheri West, Mumbai - 400061, Opposite Bank Of Maharashtra, 7 Bungalow",AndheriWest
Shri Ram Medical General Stores Near Seven Bungalow Axis Bank Off JP Road Andheri West,1.5 KM,4.1,47 Votes,"Shop 4, Tulsi Building No 1, Jp Road, Andheri West, Mumbai - 400053, Near Seven Bungalow & Axis Bank, Off JP Road",AndheriWest
Twinkle General Store Off Linking Road Oshiwara Lokhandwala Complex Andheri West,1.55 KM,3.9,95 Votes,"Twinkle Apartment, Shop No 12, Lokhandwala Complex-Andheri West, Mumbai - 400053, Off Linking Road, Oshiwara",AndheriWest
Tashkent Medical And General Store Near BMW Showroom and Tashkent Bakery Andheri West,1.6 KM,4.3,29 Votes,"Shop No 600/C, KWG Juhu Lane, Andheri West, Mumbai - 400058, Near BMW Showroom and Tashkent Bakery",AndheriWest
Evershine Chemist Medical General Store Near Country Club Prathmesh Complex Andheri West,1.17 KM,4.1,27 Votes,"Shop No.1, The Panorama Towers Chs Ltd,, Veera Desai Road, Andheri West, Mumbai - 400053, Near Country Club ,Prathmesh Complex",AndheriWest
Laxmi Medical General Store Near Suresh Nagar Andheri West,0.86 KM,4.3,28 Votes,"Shop No-2/3,Mohid Height, Lokhandwala Road, Andheri West, Mumbai - 400053, Near Suresh Nagar",AndheriWest
Lucky Super Market Opposite Mala Tower Lokhandwala Complex Andheri West,0.94 KM,3.8,101 Votes,"Legend, Shop No 12, Plot 95, Lokhandwala Complex-Andheri West, Mumbai - 400053, Opposite Mala Tower",AndheriWest
Satyam Stores Near Lokhandwala Market Andheri West,1.52 KM,4.2,68 Votes,"Shop No-8,Shiv Shadan, Samarth Nagar, Andheri West, Mumbai - 400053, Near-Lokhandwala Market",AndheriWest
Ramdev Super Market Opposite HDFC Bank 7 Bunglows Andheri West,1.75 KM,4.0,78 Votes,"Shop No 4, Atlanttis Building, J P Road, Andheri West, Mumbai - 400061, Opposite HDFC Bank, 7 Bunglows",AndheriWest
Sheetal General Stores Near Four Bunglow Navjit Nagar Andheri West,1.02 KM,4.0,24 Votes,"Shop No 11, Church Road, Andheri West, Mumbai - 400053, Near Four Bunglow, Navjit Nagar",AndheriWest
Arif General Stores Near O N G C Building kapaswadi Andheri West,1.04 KM,3.7,16 Votes,"Shop No-1, Ganesh nagar, Opp-juhu versova link road, Andheri West, Mumbai - 400053, Near O.N.G.C. Building, kapaswadi",AndheriWest
Lucky Medical General Stores Near Four Bunglow Market Andheri West,0.78 KM,3.9,80 Votes,"Building No 27 Shop No 2, Manish Nagar, Andheri West, Mumbai - 400053, Near Four Bunglow Market",AndheriWest
Vijay General Stores Near Lokhandwala Complex Andheri West,1.18 KM,4.1,15 Votes,"Building No X-17, Uttara Building,Shop No 2, Shastri Nagar, Andheri West, Mumbai - 400053, Near Lokhandwala Complex",AndheriWest
Kohinoor Stores Near Vegetable Market Andheri West,1.66 KM,4.4,8 Votes,"Shop No.16, S V Road, Andheri West, Mumbai - 400058, Near. Vegetable Market",AndheriWest
Apple Medical General Store Opposite to Indian Oil Petrol Pump Andheri West,0.45 KM,3.8,16 Votes,"Shop No 2 Shitladevi Devi Co Operative Society, New Link Road, Andheri West, Mumbai - 400053, Opposite to Indian Oil Petrol Pump",AndheriWest
Liberty General Store Four bungalow Andheri West,0.52 KM,3.8,15 Votes,"Shop no-5/a,manish shopping centre, J.p.road,andheri west, Andheri West, Mumbai - 400053, Four bungalow",AndheriWest
Mumbai Masala Shop Near Jansahkari Bank Four Bunglows Andheri West,0.79 KM,3.8,25 Votes,"Shop No.05, Nandkripa Annex Shopping Centre, Ratan Nagar, Four Bunglows-Andheri West, Mumbai - 400053, Near Jansahkari Bank",AndheriWest
Modern Stores Near Lokhandwala Andheri West,1.12 KM,3.6,84 Votes,"Shop 8, B-23 Wembley CHS, Shastri Nagar, Andheri West, Mumbai - 400053, Near Lokhandwala",AndheriWest
Jinal Craft Near Bus Depot Andheri West,1.85 KM,3.7,11 Votes,"46, Nadco Super Shopping Centre, S V Road, Andheri West, Mumbai - 400058, Near Bus Depot",AndheriWest
Amber Stores Sweet Opp St Louis Convent School Andheri West,0.71 KM,4.0,11 Votes,"Shop No-4,25/26, Manish Sun Flower, 4 Bunglows Road, Andheri West, Mumbai - 400053, Opp- St. Louis Convent School",AndheriWest
Shree Balaji Medical General Store Near Aadarsh Nagar Next to Lotus Petrol Pump Andheri West,1.52 KM,3.9,51 Votes,"Shop No 2, Plot No 971, New Link Road, Andheri West, Mumbai - 400053, Near Aadarsh Nagar, Next to Lotus Petrol Pump",AndheriWest
Rex General Stores Andheri West,1.12 KM,4.1,408 Votes,"144, Gharkul Society, Mudran Press Colony, Model Town Road, Andheri West, Mumbai - 400061",AndheriWest
Anand Stores Near Lokhandwala Complex Andheri West,1.2 KM,4.2,24 Votes,"Shop No-0 5 Skyway Building, Shastri Nagar, Andheri West, Mumbai - 400053, Near Lokhandwala Complex",AndheriWest
Purnima Medical General Stores Opposite Shoppers Stop Andheri West,1.98 KM,4.4,8 Votes,"Shop No. 35, Viral Shopping Center, S V Road, Andheri West, Mumbai - 400058, Opposite Shoppers Stop",AndheriWest
Mahaveer Medical General Store Opp bombay Bazar Andheri West,1.13 KM,4.0,45 Votes,"Shop No 3, 139 Vasant Niwas, J P Road, Andheri West, Mumbai - 400058, Opp.bombay Bazar",AndheriWest
Gupta tobacco general store Near Gurudwara Manish Nagar Andheri West,0.46 KM,3.5,6 Votes,"9/10, Kanchan Ganga shop no.10, JP road, Manish Nagar-Andheri West, Mumbai - 400053, Near Gurudwara",AndheriWest
Dhanlaxmi General Stores Opposite D N Nagar Police Station D N Nagar Andheri West,0.73 KM,3.9,23 Votes,"Shop No 1, Building No 43, Shramik Society, Link Road, Andheri West, Mumbai - 400058, Opposite D N Nagar Police Station, D N Nagar",AndheriWest
Rishikesh Stores Opposite Bus Depot Seven Bunglow Andheri West,1.39 KM,4.1,22 Votes,"Shop No 2, Avinash Building, J P Road, Andheri West, Mumbai - 400053, Opposite Bus Depot Seven Bunglow",AndheriWest
Ambe Chemist Opposite Sanbless Church Amboli Naka Andheri West,1.53 KM,4.4,86 Votes,"Shop No 5 Suvidha Milind Business Venture, S V Road Corner Ceasar Road, Andheri West, Mumbai - 400058, Opposite Sanbless Church Amboli Naka",AndheriWest
Metro Chemist And Druggist Opp Jivan Jyot Madicel Center Near Mahavir Jain Tempale Andheri West,1.59 KM,4.2,21 Votes,"Shop No.03 Juhu Aradhana Building, Juhu Lane, Andheri West, Mumbai - 400058, Opp.Jivan Jyot Madicel Center Near Mahavir Jain Tempale",AndheriWest
Universal Stores Bakery Opposite New India Stock Colony Andheri West,1.85 KM,4.1,33 Votes,"Himachal Building, Shop No 11, Juhu Lane, Andheri West, Mumbai - 400058, Opposite New India Stock Colony",AndheriWest
My Choice Near Lokhandwala Complex Andheri West,1.87 KM,4.0,23 Votes,"Shop No 8, Accropolist, Road No 3, Andheri West, Mumbai - 400053, Near Lokhandwala Complex",AndheriWest
Get Well Medical General Store Near ZAF Fitness Club Andheri West,1.1 KM,4.3,15 Votes,"1 B Abhishek Apartment, Juhu Versova Link Road, Andheri West, Mumbai - 400053, Near ZAF Fitness Club",AndheriWest
Kishor Supermarket Lokhandwala Complex Andheri West,1.98 KM,3.7,48 Votes,"Shop No B5, Rna Shopping Centre, 4th Cross Lane, Lokhandwala Complex-Andheri West, Mumbai - 400053",AndheriWest
Alfa General Store Andheri West,1.47 KM,4.4,5 Votes,"Shop No 18, Juhu Lane, Andheri West, Mumbai - 400058",AndheriWest
Valaji General Stores Near Infinity Mall Lokhandwala Complex Andheri West,1.53 KM,4.0,13 Votes,"Shop No.7-B, Twinkle Apartment, Lokhandwala Complex, Lokhandwala Complex-Andheri West, Mumbai - 400053, Near Infinity Mall",AndheriWest
Alfa Medical And General Stores Near Tashkant Bakery Andheri West,1.55 KM,4.2,24 Votes,"Akwg 345, Wireless Road, Juhu Galli, Andheri West, Mumbai - 400058, Near Tashkant Bakery",AndheriWest
Shivtirth Medical General Store Opposite ICICI Bank Andheri West,0.59 KM,3.9,31 Votes,"Shop No 10, Flowerqueen Building, Veera Desai Road, Andheri West, Mumbai - 400053, Opposite ICICI Bank",AndheriWest
Liberty General Stores Near DN Nagar Metro Station Andheri West,0.45 KM,3.6,12 Votes,"Shop No 2, Kanchanganga , Manish Nagar, 4 Bunglows, Andheri West, Mumbai - 400053, Near DN Nagar Metro Station",AndheriWest
Satyam Store Near Court Yard Resturant Andheri West,0.47 KM,4.2,24 Votes,"Shop No.10, Parul Apartment, Veera Desai Road, Andheri West, Mumbai - 400053, Near Court Yard Resturant",AndheriWest
Care N Cure Medical General Stores Andheri West,0.54 KM,3.5,6 Votes,"Manish Shpng Centre,J P Road, Andheri West, Mumbai - 400053",AndheriWest
Colony Medical General Store D N Ngr Office Bldg 8 1 Andheri West,0.6 KM,4.3,19 Votes,"Shop No 8/1, Ganesh Chowk, Andheri West, Mumbai - 400053, D N Ngr, Office Bldg 8/1",AndheriWest
Ashtavinayak Provision General Stores Near Laxminarayan Temple Andheri West,0.62 KM,3.6,5 Votes,"Shop No 12,Sainath Shopping Centre, Veera Desai Road, Andheri West, Mumbai - 400053, Near Laxminarayan Temple",AndheriWest
Prasad General Store Opposite Mvm School Andheri West,0.85 KM,3.5,9 Votes,"Shop No 3, Sai Shraddha Society, Veera Desai Road, Andheri West, Mumbai - 400058, Opposite Mvm School",AndheriWest
Jagdish Store Navalkar Compound Andheri West,0.96 KM,4.6,47 Votes,"Siddhkuttir Bangla, N Datta Marg, Andheri West, Mumbai - 400053, Navalkar Compound",AndheriWest
Sheetal General Store 4 Bunglow Andheri West,1.02 KM,3.9,7 Votes,"Shop No 11, Navjit Nagar, Juhu Versova Link Road, Andheri West, Mumbai - 400053, 4 Bunglow",AndheriWest
Central Society Medical General Stores Near Joe Helan Ground Andheri West,1.09 KM,4.3,20 Votes,"Shop No 1, Desai Villa, Jay Bhavani Mata Road, Andheri West, Mumbai - 400058, Near Joe Helan Ground",AndheriWest
Shiv Medical General Stores 4 Bungalows Svp Nagar Nr Telephone Exchange Andheri West,1.09 KM,3.6,7 Votes,"57/D-3,Mahada, Andheri West, Mumbai - 400053, 4 Bungalows,Svp Nagar,Nr Telephone Exchange",AndheriWest
Patel General Stores Ramesh Nagar Near 248 Last Bus Stop Amboli Andheri West,1.15 KM,4.4,7 Votes,"Shop No 8, Unique Apartment, Jai Bhavani Mata Road, Amboli-Andheri West, Mumbai - 400058, Ramesh Nagar, Near 248 Last Bus Stop",AndheriWest
Amogh Sai Medical General Store Opposite Navnit Society 32 Bharda Wadi Andheri West,1.16 KM,4.1,10 Votes,"Shop No 1, New Ankur Chs, Bharda Wadi Road, Andheri West, Mumbai - 400058, Opposite Navnit Society, 32 Bharda Wadi",AndheriWest
Micky General Store Opposite Hdfc Bank Shastri Nagar Lokhandwala Complex Andheri West,1.24 KM,4.0,14 Votes,"Shop No 1, Y-4, Marble Arch Society, Lokhandwala Complex-Andheri West, Mumbai - 400053, Opposite Hdfc Bank, Shastri Nagar",AndheriWest
Imax Medical And General Store Near Sai Baba Mandir Antop Hill,0.52 KM,3.7,11 Votes,"Shop No 351 2/2, Sangam Nagar, Antop Hill, Mumbai - 400037, Near Sai Baba Mandir",Antop Hill
Kukus Mart HDFC Bank Antop Hill,0.11 KM,4.1,65 Votes,"Shop No 21, Dosti Shopping Center, S M D Road, Antop Hill, Mumbai - 400037, HDFC Bank",Antop Hill
Kohinoor Medical General Stores Near Vidyalankar College Antop Hill,0.46 KM,4.2,6 Votes,"Shop No.2/3, Plot No.186, Sangam Nagar, Antop Hill, Mumbai - 400037, Near Vidyalankar College",Antop Hill
Mohan Store S M Road Antop Hill,0.43 KM,4.3,14 Votes,"Shop No 7, Bhatkuli Shaha Baba Compound, Antop Hill, Mumbai - 400037, S M Road",Antop Hill
Metro Chemist General Stores Near Antop Hill Post Office Antop Hill,0.44 KM,3.7,14 Votes,"Shop No.6, B-Wing, Mistry Park, S.M.Road, Antop Hill, Mumbai - 400037, Near.Antop Hill Post Office",Antop Hill
Apple Chemist General Stores Opp Hanuman Mandir Antop Hill,0.47 KM,4.2,5 Votes,"Shop No.FNG-1,2/2, Bharatiya Kamala Nagar, S.P. Road, Antop Hill, Mumbai - 400037, Opp. Hanuman Mandir",Antop Hill
Rajesh General Stores Near Sm Dargah Antop Hill,0.49 KM,4.3,11 Votes,"175 Antophill, SMD Road, Antop Hill, Mumbai - 400037, Near Sm Dargah",Antop Hill
Saravana Stores Antop Hill,0.59 KM,4.5,6 Votes,"100 S M Road, Antop Hill, Mumbai - 400037",Antop Hill
