Name,Distance,Rating,Votes,Address,Website
Imax Medical And General Store Near Sai Baba Mandir Antop Hill,0.52 KM,3.7,11 Votes,"Shop No 351 2/2, Sangam Nagar, Antop Hill, Mumbai - 400037, Near Sai Baba Mandir",https://www.justdial.com/Mumbai/Imax-Medical-And-General-Store-Near-Sai-Baba-Mandir-Antop-Hill/022PXX22-XX22-130218125528-B7S6_BZDET?xid=TXVtYmFpIEdlbmVyYWwgU3RvcmVzIEFudG9wIEhpbGw=
Ambika Stores Sion Koliwada Antop Hill,,2.0,1 Votes,"Shop No C-3, Bldg No 1, Indira Nagar HSG Soc, Antop Hill, Mumbai - 400037, Sion Koliwada",https://www.justdial.com/Mumbai/Ambika-Stores-Sion-Koliwada-Antop-Hill/022P1236268040X5A7H6_BZDET?xid=TXVtYmFpIEdlbmVyYWwgU3RvcmVzIEFudG9wIEhpbGw=
Kukus Mart HDFC Bank Antop Hill,0.11 KM,4.1,65 Votes,"Shop No 21, Dosti Shopping Center, S M D Road, Antop Hill, Mumbai - 400037, HDFC Bank",https://www.justdial.com/Mumbai/Kukus-Mart-HDFC-Bank-Antop-Hill/022PXX22-XX22-160108130932-Z3G5_BZDET?xid=TXVtYmFpIEdlbmVyYWwgU3RvcmVzIEFudG9wIEhpbGw=
Madheshiya Kirana General Stores SMD road wadala east Antop Hill,0.43 KM,,0 Votes,"Shop no 55 jaikar wadi opp margate house, Barkat Ali Dargah Road, Antop Hill, Mumbai - 400037, SMD road wadala east",https://www.justdial.com/Mumbai/Madheshiya-Kirana-General-Stores-SMD-road-wadala-east-Antop-Hill/022PXX22-XX22-160906135700-C3E9_BZDET?xid=TXVtYmFpIEdlbmVyYWwgU3RvcmVzIEFudG9wIEhpbGw=
Kohinoor Medical General Stores Near Vidyalankar College Antop Hill,0.46 KM,4.2,6 Votes,"Shop No.2/3, Plot No.186, Sangam Nagar, Antop Hill, Mumbai - 400037, Near Vidyalankar College",https://www.justdial.com/Mumbai/Kohinoor-Medical-General-Stores-Near-Vidyalankar-College-Antop-Hill/022PXX22-XX22-121218145237-C6C7_BZDET?xid=TXVtYmFpIEdlbmVyYWwgU3RvcmVzIEFudG9wIEhpbGw=
Aradhana Dryfruit Store Near S M Dargah Opposite Antop Hill Bus Depot Antop Hill,0.5 KM,4.4,17 Votes,"Shop No 175 2, S M Road, Antop Hill, Mumbai - 400037, Near S M Dargah, Opposite Antop Hill Bus Depot",https://www.justdial.com/Mumbai/Aradhana-Dryfruit-Store-Near-S-M-Dargah-Opposite-Antop-Hill-Bus-Depot-Antop-Hill/022PF009132_BZDET?xid=TXVtYmFpIEdlbmVyYWwgU3RvcmVzIEFudG9wIEhpbGw=
Metro Medical Provision Store Bhaji Market Sangam Nagar Antop Hill,0.58 KM,4.1,4 Votes,"Fng 84-2/3, Lahan Paigambari Chawl, Salt Pan Road, Antop Hill, Mumbai - 400037, Bhaji Market, Sangam Nagar",https://www.justdial.com/Mumbai/Metro-Medical-Provision-Store-Bhaji-Market-Sangam-Nagar-Antop-Hill/022PXX22-XX22-121217144810-F6D7_BZDET?xid=TXVtYmFpIEdlbmVyYWwgU3RvcmVzIEFudG9wIEhpbGw=
Deepak General Store Near Sagar Restaurant Motilal Nehru Nagar Antop Hill,1.16 KM,3.5,1 Votes,"Shop No 4, S M Road, Antop Hill, Mumbai - 400037, Near Sagar Restaurant , Motilal Nehru Nagar",https://www.justdial.com/Mumbai/Deepak-General-Store-Near-Sagar-Restaurant-Motilal-Nehru-Nagar-Antop-Hill/022P1226388784C3D8V1_BZDET?xid=TXVtYmFpIEdlbmVyYWwgU3RvcmVzIEFudG9wIEhpbGw=
New Hariram Store Near Police Chowki Antop Hill,1.22 KM,,0 Votes,"Kokri Agar, Antop Hill Church, Sion Koliwada, S M Road, Antop Hill, Mumbai - 400037, Near Police Chowki",https://www.justdial.com/Mumbai/New-Hariram-Store-Near-Police-Chowki-Antop-Hill/022PXX22-XX22-130305150012-X7V5_BZDET?xid=TXVtYmFpIEdlbmVyYWwgU3RvcmVzIEFudG9wIEhpbGw=
New Durga General Stores Opposite Mini Punjab Hotel Gtb Nagar Sion Koliwada Antop Hill,1.41 KM,,0 Votes,"Punjabi Colony, Antop Hill, Mumbai - 400037, Opposite Mini Punjab Hotel, Gtb Nagar, Sion Koliwada",https://www.justdial.com/Mumbai/New-Durga-General-Stores-Opposite-Mini-Punjab-Hotel-Gtb-Nagar-Sion-Koliwada-Antop-Hill/022PXX22-XX22-150102192728-D9Y4_BZDET?xid=TXVtYmFpIEdlbmVyYWwgU3RvcmVzIEFudG9wIEhpbGw=
S M General Stores Near S M Dargah Antop Hill,,,0 Votes,"174 1/2, Antop Hill, Mumbai - 400037, Near S M Dargah",https://www.justdial.com/Mumbai/S-M-General-Stores-Near-S-M-Dargah-Antop-Hill/022P1235144742S2E9F9_BZDET?xid=TXVtYmFpIEdlbmVyYWwgU3RvcmVzIEFudG9wIEhpbGw=
Krishna Medical Store Rama Natha Wadi Antop Hill,,5.0,1 Votes,"Korba Metha Ghar, Antop Hill, Mumbai - 400037, Rama Natha Wadi",https://www.justdial.com/Mumbai/Krishna-Medical-Store-Rama-Natha-Wadi-Antop-Hill/022PK040342_BZDET?xid=TXVtYmFpIEdlbmVyYWwgU3RvcmVzIEFudG9wIEhpbGw=
Ansar General Stores Near New Transis Camp Antop Hill,,4.0,1 Votes,"873, Rajiv Gandhi Nagar, Antop Hill, Antop Hill, Mumbai - 400037, Near New Transis Camp",https://www.justdial.com/Mumbai/Ansar-General-Stores-Near-New-Transis-Camp-Antop-Hill/022PXX22-XX22-100331154812-C1T4_BZDET?xid=TXVtYmFpIEdlbmVyYWwgU3RvcmVzIEFudG9wIEhpbGw=
Bharti Kirana Stores Sector 7 Near Buiding No 143 Cgs Colony Antop Hill,,,0 Votes,"Shop No 2, Antop Hill, Mumbai - 400037, Sector 7, Near Buiding No 143, Cgs Colony",https://www.justdial.com/Mumbai/Bharti-Kirana-Stores-Sector-7-Near-Buiding-No-143-Cgs-Colony-Antop-Hill/022PXX22-XX22-101102173333-E8Z4_BZDET?xid=TXVtYmFpIEdlbmVyYWwgU3RvcmVzIEFudG9wIEhpbGw=
Maharashtra General Stores Antop Hill Bus Stop Antop Hill,,5.0,1 Votes,"Shop No.172, Shaikh Mistry Dargha, Antop Hill, Mumbai - 400037, Antop Hill Bus Stop",https://www.justdial.com/Mumbai/Maharashtra-General-Stores-Antop-Hill-Bus-Stop-Antop-Hill/022PXX22-XX22-120220235553-P6G4_BZDET?xid=TXVtYmFpIEdlbmVyYWwgU3RvcmVzIEFudG9wIEhpbGw=
Ayesha General Stores Garib Nawaz Nagar Kokri Agar Antop Hill,,,0 Votes,"Room No 305, S M Road, Antop Hill, Mumbai - 400037, Garib Nawaz Nagar, Kokri Agar",https://www.justdial.com/Mumbai/Ayesha-General-Stores-Garib-Nawaz-Nagar-Kokri-Agar-Antop-Hill/022PXX22-XX22-120828012615-E8B4_BZDET?xid=TXVtYmFpIEdlbmVyYWwgU3RvcmVzIEFudG9wIEhpbGw=
Ajit Kumar Kirana Store Near Antophill Church Near Saibaba Mandir Antop Hill,,,0 Votes,"Jai Maharshtra Nagar, Antop Hill, Mumbai - 400037, Near Antophill Church & Near Saibaba Mandir",https://www.justdial.com/Mumbai/Ajit-Kumar-Kirana-Store-Near-Antophill-Church-Near-Saibaba-Mandir-Antop-Hill/022PXX22-XX22-170926125416-N8N3_BZDET?xid=TXVtYmFpIEdlbmVyYWwgU3RvcmVzIEFudG9wIEhpbGw=
Divya General Stores Kokari Agar Vardraj Nagar Antop Hill,,,0 Votes,"F/N/G/A, 10, 2/3, Antop Hill, Mumbai - 400037, Kokari Agar, Vardraj Nagar",https://www.justdial.com/Mumbai/Divya-General-Stores-Kokari-Agar-Vardraj-Nagar-Antop-Hill/022PXX22-XX22-180417191945-K2T6_BZDET?xid=TXVtYmFpIEdlbmVyYWwgU3RvcmVzIEFudG9wIEhpbGw=
Nitin General Stores Near Building No 58 CGS Colony Sector 07 Antop Hill,,,0 Votes,"Shop No 14, Antop Hill, Mumbai - 400037, Near Building No 58, CGS Colony, Sector 07",https://www.justdial.com/Mumbai/Nitin-General-Stores-Near-Building-No-58-CGS-Colony-Sector-07-Antop-Hill/022PXX22-XX22-180627033745-P2T4_BZDET?xid=TXVtYmFpIEdlbmVyYWwgU3RvcmVzIEFudG9wIEhpbGw=
Aiman Gandhi Harbal Kirana Merchant Chandani Agar Antop Hill Wadala East,0.31 KM,,0 Votes,"Shop No 165, S P Road, Wadala East, Mumbai - 400037, Chandani Agar, Antop Hill",https://www.justdial.com/Mumbai/Aiman-Gandhi-Harbal-Kirana-Merchant-Chandani-Agar-Antop-Hill-Wadala-East/022PXX22-XX22-180426181014-S8X9_BZDET?xid=TXVtYmFpIEdlbmVyYWwgU3RvcmVzIEFudG9wIEhpbGw=
Chourasiya General Stores Near Sangam Nagar Police Chowki Chandni Agar Antop Hill Wadala East,0.31 KM,,0 Votes,"S P Road, Wadala East, Mumbai - 400037, Near Sangam Nagar Police Chowki, Chandni Agar, Antop Hill",https://www.justdial.com/Mumbai/Chourasiya-General-Stores-Near-Sangam-Nagar-Police-Chowki-Chandni-Agar-Antop-Hill-Wadala-East/022PXX22-XX22-180426202017-E3K7_BZDET?xid=TXVtYmFpIEdlbmVyYWwgU3RvcmVzIEFudG9wIEhpbGw=
Mohit General Stores Near antophill post office Antop Hill,0.32 KM,,0 Votes,"Acharya attrya Nagar shop no 1, Barkat Ali Dargah Road, Antop Hill, Mumbai - 400037, Near antophill post office",https://www.justdial.com/Mumbai/Mohit-General-Stores-Near-antophill-post-office-Antop-Hill/022PXX22-XX22-160906115808-F2F1_BZDET?xid=TXVtYmFpIEdlbmVyYWwgU3RvcmVzIEFudG9wIEhpbGw=
Jhanvi Kirana General Stores Bhartiya Kamla Nagar Antop Hill Wadala East,0.33 KM,,0 Votes,"S P Road, Wadala East, Mumbai - 400037, Bhartiya Kamla Nagar, Antop Hill",https://www.justdial.com/Mumbai/Jhanvi-Kirana-General-Stores-Bhartiya-Kamla-Nagar-Antop-Hill-Wadala-East/022PXX22-XX22-180430160019-A6I7_BZDET?xid=TXVtYmFpIEdlbmVyYWwgU3RvcmVzIEFudG9wIEhpbGw=
Diamond Supari General Store Shanti Nagar Antop Hill Wadala East,0.37 KM,,0 Votes,"Shop No 77, S P Road, Wadala East, Mumbai - 400037, Shanti Nagar, Antop Hill",https://www.justdial.com/Mumbai/Diamond-Supari-General-Store-Shanti-Nagar-Antop-Hill-Wadala-East/022PXX22-XX22-180425162009-W8Z9_BZDET?xid=TXVtYmFpIEdlbmVyYWwgU3RvcmVzIEFudG9wIEhpbGw=
A R Kirana General Stores Shanti Nagar Antop Hill Wadala East,0.37 KM,,0 Votes,"S P Road, Wadala East, Mumbai - 400037, Shanti Nagar, Antop Hill",https://www.justdial.com/Mumbai/A-R-Kirana-General-Stores-Shanti-Nagar-Antop-Hill-Wadala-East/022PXX22-XX22-180425170017-J9I3_BZDET?xid=TXVtYmFpIEdlbmVyYWwgU3RvcmVzIEFudG9wIEhpbGw=
Sushil Kirana Stores Sangam Nagar Antop Hill Wadala East,0.37 KM,,0 Votes,"Shop No 07, S P Road, Wadala East, Mumbai - 400037, Sangam Nagar, Antop Hill",https://www.justdial.com/Mumbai/Sushil-Kirana-Stores-Sangam-Nagar-Antop-Hill-Wadala-East/022PXX22-XX22-180425175039-B2H5_BZDET?xid=TXVtYmFpIEdlbmVyYWwgU3RvcmVzIEFudG9wIEhpbGw=
Kamani Soap Centre Sangam Nagar Antop Hill Wadala East,0.37 KM,,0 Votes,"S P Road, Wadala East, Mumbai - 400037, Sangam Nagar, Antop Hill",https://www.justdial.com/Mumbai/Kamani-Soap-Centre-Sangam-Nagar-Antop-Hill-Wadala-East/022PXX22-XX22-180427175010-I7T2_BZDET?xid=TXVtYmFpIEdlbmVyYWwgU3RvcmVzIEFudG9wIEhpbGw=
Kamal Kirana General Stores Near Hanuman Mandir Bhartiya Kamla Nagar Antop Hill Wadala East,0.37 KM,,0 Votes,"Shop No 2/2, S P Road, Wadala East, Mumbai - 400037, Near Hanuman Mandir, Bhartiya Kamla Nagar, Antop Hill",https://www.justdial.com/Mumbai/Kamal-Kirana-General-Stores-Near-Hanuman-Mandir-Bhartiya-Kamla-Nagar-Antop-Hill-Wadala-East/022PXX22-XX22-180427180007-C1B1_BZDET?xid=TXVtYmFpIEdlbmVyYWwgU3RvcmVzIEFudG9wIEhpbGw=
Hetal General Store Near Adarsh School Bhartiya Kamla Nagar Antop Hill Wadala East,0.37 KM,,0 Votes,"S P Road, Wadala East, Mumbai - 400037, Near Adarsh School, Bhartiya Kamla Nagar, Antop Hill",https://www.justdial.com/Mumbai/Hetal-General-Store-Near-Adarsh-School-Bhartiya-Kamla-Nagar-Antop-Hill-Wadala-East/022PXX22-XX22-180427191005-M2N4_BZDET?xid=TXVtYmFpIEdlbmVyYWwgU3RvcmVzIEFudG9wIEhpbGw=
Mahavir Oil Depot Kirana General Stores Vijay Nagar Antop Hill Wadala East,0.37 KM,,0 Votes,"S P Road, Wadala East, Mumbai - 400037, Vijay Nagar, Antop Hill",https://www.justdial.com/Mumbai/Mahavir-Oil-Depot-Kirana-General-Stores-Vijay-Nagar-Antop-Hill-Wadala-East/022PXX22-XX22-180430164011-S1K6_BZDET?xid=TXVtYmFpIEdlbmVyYWwgU3RvcmVzIEFudG9wIEhpbGw=
Shifa Gandhi Unani Ayurvedic General Stores Near Ahle Hadish Masjid Bhartiya Kamla Nagar Antop Hill Wadala East,0.37 KM,,0 Votes,"Shop No 912, S P Road, Wadala East, Mumbai - 400037, Near Ahle Hadish Masjid, Bhartiya Kamla Nagar, Antop Hill",https://www.justdial.com/Mumbai/Shifa-Gandhi-Unani-Ayurvedic-General-Stores-Near-Ahle-Hadish-Masjid-Bhartiya-Kamla-Nagar-Antop-Hill-Wadala-East/022PXX22-XX22-180430165051-J9G9_BZDET?xid=TXVtYmFpIEdlbmVyYWwgU3RvcmVzIEFudG9wIEhpbGw=
Himalaya Dairy General Store Near Jama Masjid Sangam Nagar Antop Hill Wadala East,0.37 KM,,0 Votes,"Shop No 414, S P Road, Wadala East, Mumbai - 400037, Near Jama Masjid, Sangam Nagar, Antop Hill",https://www.justdial.com/Mumbai/Himalaya-Dairy-General-Store-Near-Jama-Masjid-Sangam-Nagar-Antop-Hill-Wadala-East/022PXX22-XX22-180502165115-A4E9_BZDET?xid=TXVtYmFpIEdlbmVyYWwgU3RvcmVzIEFudG9wIEhpbGw=
Awadh Kirana General Stores Near Bhaji Market Sangam Nagar Antop Hill Wadala East,0.37 KM,,0 Votes,"S P Road, Wadala East, Mumbai - 400037, Near Bhaji Market, Sangam Nagar, Antop Hill",https://www.justdial.com/Mumbai/Awadh-Kirana-General-Stores-Near-Bhaji-Market-Sangam-Nagar-Antop-Hill-Wadala-East/022PXX22-XX22-180502182012-T3M8_BZDET?xid=TXVtYmFpIEdlbmVyYWwgU3RvcmVzIEFudG9wIEhpbGw=
Ashish General Stores Kokari Agar Siddharth Nagar Antop Hill,0.37 KM,,0 Votes,"S M Road, Antop Hill, Mumbai - 400037, Kokari Agar, Siddharth Nagar",https://www.justdial.com/Mumbai/Ashish-General-Stores-Kokari-Agar-Siddharth-Nagar-Antop-Hill/022PXX22-XX22-180504200004-F4Z3_BZDET?xid=TXVtYmFpIEdlbmVyYWwgU3RvcmVzIEFudG9wIEhpbGw=
Rohit Masala Kirana Stores Kokari Agar Naik Nagar Antop Hill,0.37 KM,,0 Votes,"S M Road, Antop Hill, Mumbai - 400037, Kokari Agar, Naik Nagar",https://www.justdial.com/Mumbai/Rohit-Masala-Kirana-Stores-Kokari-Agar-Naik-Nagar-Antop-Hill/022PXX22-XX22-180504202029-V3T4_BZDET?xid=TXVtYmFpIEdlbmVyYWwgU3RvcmVzIEFudG9wIEhpbGw=
Neha General Store Near VID collage Antop Hill,0.39 KM,,0 Votes,"Shop No 51/14/18 Sangam nagar, Salt Pan Road, Antop Hill, Mumbai - 400037, Near VID collage",https://www.justdial.com/Mumbai/Neha-General-Store-Near-VID-collage-Antop-Hill/022PXX22-XX22-130226113811-X7F5_BZDET?xid=TXVtYmFpIEdlbmVyYWwgU3RvcmVzIEFudG9wIEhpbGw=
Khoraram Antop Hill,0.39 KM,5.0,1 Votes,"Mumbai, Barkat Ali Nagar, Antop Hill, Mumbai - 400037",https://www.justdial.com/Mumbai/Khoraram-Antop-Hill/022PXX22-XX22-180626220932-E7G6_BZDET?xid=TXVtYmFpIEdlbmVyYWwgU3RvcmVzIEFudG9wIEhpbGw=
Maruti Medical General Stores Near Antop Hill Ware House Antop Hill,0.42 KM,,0 Votes,"145, Grd. panchasil Nagar, Salt Pan Road, Antop Hill, Mumbai - 400037, Near Antop Hill Ware House",https://www.justdial.com/Mumbai/Maruti-Medical-General-Stores-Near-Antop-Hill-Ware-House-Antop-Hill/022PXX22-XX22-121124115821-C6P5_BZDET?xid=TXVtYmFpIEdlbmVyYWwgU3RvcmVzIEFudG9wIEhpbGw=
R M Traders SMD ROAD Antop Hill,0.42 KM,,0 Votes,"shop no 2 khati jabai chawal, Barkat Ali Dargah Road, Antop Hill, Mumbai - 400037, SMD ROAD",https://www.justdial.com/Mumbai/R-M-Traders-SMD-ROAD-Antop-Hill/022PXX22-XX22-160903134422-G1K3_BZDET?xid=TXVtYmFpIEdlbmVyYWwgU3RvcmVzIEFudG9wIEhpbGw=
Gupta General Stores Sangam Nagar Antop Hill Wadala East,0.42 KM,,0 Votes,"Shop No 180 4/4, S P Road, Wadala East, Mumbai - 400037, Sangam Nagar, Antop Hill",https://www.justdial.com/Mumbai/Gupta-General-Stores-Sangam-Nagar-Antop-Hill-Wadala-East/022PXX22-XX22-180424184020-B6J6_BZDET?xid=TXVtYmFpIEdlbmVyYWwgU3RvcmVzIEFudG9wIEhpbGw=
Keshavan General Stores Near Rawani Camp Hospital Antop Hill,,,0 Votes,"Fn 1/009288 Kamraj Nagar Kokri Agar, Sion Koliwada, Antop Hill, Mumbai - 400037, Near Rawani Camp Hospital",https://www.justdial.com/Mumbai/Keshavan-General-Stores-Near-Rawani-Camp-Hospital-Antop-Hill/022PXX22-XX22-110127152849-A3F7_BZDET?xid=TXVtYmFpIEdlbmVyYWwgU3RvcmVzIEFudG9wIEhpbGw=
Mohan Store S M Road Antop Hill,0.43 KM,4.3,14 Votes,"Shop No 7, Bhatkuli Shaha Baba Compound, Antop Hill, Mumbai - 400037, S M Road",https://www.justdial.com/Mumbai/Mohan-Store-S-M-Road-Antop-Hill/022PXX22-XX22-120308210652-S7Z1_BZDET?xid=TXVtYmFpIEdlbmVyYWwgU3RvcmVzIEFudG9wIEhpbGw=
Narottamdas Hathidas Opposite Dargaah Antop Hill,0.43 KM,4.5,1 Votes,"Shop No-5, Vishwasrao Chawl, S M D Road, Antop Hill, Mumbai - 400037, Opposite Dargaah",https://www.justdial.com/Mumbai/Narottamdas-Hathidas-Opposite-Dargaah-Antop-Hill/022PXX22-XX22-130307143607-B5W1_BZDET?xid=TXVtYmFpIEdlbmVyYWwgU3RvcmVzIEFudG9wIEhpbGw=
Jalaram Stores Antop Hill,0.43 KM,3.0,2 Votes,"Shaikh Misree Marg, Dosti Acres, Antop Hill, Mumbai - 400037",https://www.justdial.com/Mumbai/Jalaram-Stores-Antop-Hill/022PXX22-XX22-180327191805-S1V8_BZDET?xid=TXVtYmFpIEdlbmVyYWwgU3RvcmVzIEFudG9wIEhpbGw=
Metro Chemist General Stores Near Antop Hill Post Office Antop Hill,0.44 KM,3.7,14 Votes,"Shop No.6, B-Wing, Mistry Park, S.M.Road, Antop Hill, Mumbai - 400037, Near.Antop Hill Post Office",https://www.justdial.com/Mumbai/Metro-Chemist-General-Stores-Near-Antop-Hill-Post-Office-Antop-Hill/022PXX22-XX22-121123160833-X2E7_BZDET?xid=TXVtYmFpIEdlbmVyYWwgU3RvcmVzIEFudG9wIEhpbGw=
S M Patel Kirana Stores Antop Hill,0.45 KM,,0 Votes,"Kp Munot Nagar, Shaikh Misree Marg Maharastra Office, Antop Hill, Mumbai - 400037",https://www.justdial.com/Mumbai/S-M-Patel-Kirana-Stores-Antop-Hill/022PXX22-XX22-180411205455-L7H7_BZDET?xid=TXVtYmFpIEdlbmVyYWwgU3RvcmVzIEFudG9wIEhpbGw=
Sai General Store Near Shiv Markandaya Mandir Antop Hill,0.46 KM,,0 Votes,"43/9/11, Antop Hill, Mumbai - 400037, Near Shiv Markandaya Mandir",https://www.justdial.com/Mumbai/Sai-General-Store-Near-Shiv-Markandaya-Mandir-Antop-Hill/022PK029688_BZDET?xid=TXVtYmFpIEdlbmVyYWwgU3RvcmVzIEFudG9wIEhpbGw=
K r Nisha Mobile General Store B B C Gate No 5 Antop Hill,0.46 KM,5.0,2 Votes,"Mt Villa Shop No 49, Rao Nagar Marg, Nandkarni Park, Antop Hill, Mumbai - 400037, B B C Gate No 5",https://www.justdial.com/Mumbai/K-r-Nisha-Mobile-General-Store-B-B-C-Gate-No-5-Antop-Hill/022PXX22-XX22-170919143441-C9J1_BZDET?xid=TXVtYmFpIEdlbmVyYWwgU3RvcmVzIEFudG9wIEhpbGw=
Shivam Kirana General Stores Antop Hill,0.46 KM,2.5,2 Votes,"Mt Villa, Nandkarni Park, Rao Nagar Marg, Antop Hill, Mumbai - 400037",https://www.justdial.com/Mumbai/Shivam-Kirana-General-Stores-Antop-Hill/022PXX22-XX22-180411213838-Y9I1_BZDET?xid=TXVtYmFpIEdlbmVyYWwgU3RvcmVzIEFudG9wIEhpbGw=
S S Masala General Store Azad Mohalla Sangam Nagar Antop Hill Wadala East,0.46 KM,,0 Votes,"S P Road, Wadala East, Mumbai - 400037, Azad Mohalla, Sangam Nagar, Antop Hill",https://www.justdial.com/Mumbai/S-S-Masala-General-Store-Azad-Mohalla-Sangam-Nagar-Antop-Hill-Wadala-East/022PXX22-XX22-180427160109-J2S4_BZDET?xid=TXVtYmFpIEdlbmVyYWwgU3RvcmVzIEFudG9wIEhpbGw=
Apple Chemist General Stores Opp Hanuman Mandir Antop Hill,0.47 KM,4.2,5 Votes,"Shop No.FNG-1,2/2, Bharatiya Kamala Nagar, S.P. Road, Antop Hill, Mumbai - 400037, Opp. Hanuman Mandir",https://www.justdial.com/Mumbai/Apple-Chemist-General-Stores-Opp-Hanuman-Mandir-Antop-Hill/022PXX22-XX22-121217140317-U3W7_BZDET?xid=TXVtYmFpIEdlbmVyYWwgU3RvcmVzIEFudG9wIEhpbGw=
Taiyeb Gandhi Near Sai Baba Mandir Antop Hill,0.47 KM,5.0,1 Votes,"Hikmat Nagar, Salt Pant Road, Antop Hill, Mumbai - 400037, Near Sai Baba Mandir",https://www.justdial.com/Mumbai/Taiyeb-Gandhi-Near-Sai-Baba-Mandir-Antop-Hill/022PXX22-XX22-130223130629-K1C9_BZDET?xid=TXVtYmFpIEdlbmVyYWwgU3RvcmVzIEFudG9wIEhpbGw=
Rajesh General Store Next To Antophill Darga Antop Hill,0.48 KM,,0 Votes,"Shop No.175/1/2, S M D Road, Antop Hill, Mumbai - 400037, Next To Antophill Darga",https://www.justdial.com/Mumbai/Rajesh-General-Store-Next-To-Antophill-Darga-Antop-Hill/022PXX22-XX22-141206155628-N6K5_BZDET?xid=TXVtYmFpIEdlbmVyYWwgU3RvcmVzIEFudG9wIEhpbGw=
Rajeshwari Enterprises Antop Hill,0.48 KM,4.0,2 Votes,"Indra Nagar, Barkat Ali Nagar, Sewri Chembur Road, Antop Hill, Mumbai - 400037",https://www.justdial.com/Mumbai/Rajeshwari-Enterprises-Antop-Hill/022PXX22-XX22-180627022651-I4T2_BZDET?xid=TXVtYmFpIEdlbmVyYWwgU3RvcmVzIEFudG9wIEhpbGw=
Rajesh General Stores Near Sm Dargah Antop Hill,0.49 KM,4.3,11 Votes,"175 Antophill, SMD Road, Antop Hill, Mumbai - 400037, Near Sm Dargah",https://www.justdial.com/Mumbai/Rajesh-General-Stores-Near-Sm-Dargah-Antop-Hill/022P1235076429Z4D7W1_BZDET?xid=TXVtYmFpIEdlbmVyYWwgU3RvcmVzIEFudG9wIEhpbGw=
Arvind General Store Near Shiv Sean Office Antop Hill,0.51 KM,,0 Votes,"Shop No .380, Rajiv Gandhi Nagar, Antop Hill, Mumbai - 400037, Near Shiv Sean Office",https://www.justdial.com/Mumbai/Arvind-General-Store-Near-Shiv-Sean-Office-Antop-Hill/022PXX22-XX22-160709130615-Z8Y6_BZDET?xid=TXVtYmFpIEdlbmVyYWwgU3RvcmVzIEFudG9wIEhpbGw=
Neel Kamal Medical General Stores Opp Nirankari Hall Antop Hill,0.52 KM,5.0,1 Votes,"Shop No.156, Sangam Nagar, Salt Pan Road, Antop Hill, Mumbai - 400037, Opp. Nirankari Hall",https://www.justdial.com/Mumbai/Neel-Kamal-Medical-General-Stores-Opp-Nirankari-Hall-Antop-Hill/022PXX22-XX22-121217152418-I1U3_BZDET?xid=TXVtYmFpIEdlbmVyYWwgU3RvcmVzIEFudG9wIEhpbGw=
Akhtar General Store Sangam Nagar antop Hill,,,0 Votes,"Fnd/34, Sangam Nagar-antop Hill, Mumbai - 400037",https://www.justdial.com/Mumbai/Akhtar-General-Store-Sangam-Nagar-antop-Hill/022P1233299767I8F2B7_BZDET?xid=TXVtYmFpIEdlbmVyYWwgU3RvcmVzIEFudG9wIEhpbGw=
Faiz General Store New Transist Camp Opposite Chawl No 89 Antop Hill,,,0 Votes,"Shop No. 748, Mira Datar Dargah Gali, Antop Hill, Mumbai - 400037, New Transist Camp, Opposite Chawl No. 89",https://www.justdial.com/Mumbai/Faiz-General-Store-New-Transist-Camp-Opposite-Chawl-No-89-Antop-Hill/022PXX22-XX22-160623155431-G3H5_BZDET?xid=TXVtYmFpIEdlbmVyYWwgU3RvcmVzIEFudG9wIEhpbGw=
Shree General Store Near by wadala monorail station Antop Hill,,,0 Votes,"block no-a/62,shop no-8,sion koliwada, kokri agar wadala east, Antop Hill, Mumbai - 400037, near by wadala monorail station",https://www.justdial.com/Mumbai/Shree-General-Store-Near-by-wadala-monorail-station-Antop-Hill/022PXX22-XX22-160824233841-X7S7_BZDET?xid=TXVtYmFpIEdlbmVyYWwgU3RvcmVzIEFudG9wIEhpbGw=
Anwaar General Store Bsc Powehouse Sangam Nagar Antop Hill,,,0 Votes,"Sangam Nagar-Antop Hill, Mumbai - 400037, Bsc Powehouse",https://www.justdial.com/Mumbai/Anwaar-General-Store-Bsc-Powehouse-Sangam-Nagar-Antop-Hill/022PXX22-XX22-180313173250-M1T9_BZDET?xid=TXVtYmFpIEdlbmVyYWwgU3RvcmVzIEFudG9wIEhpbGw=
Deepak Kirana Stores Antop Hill,0.53 KM,3.0,2 Votes,"Mt Villa, G.T.B. Railway Gate No. 5, Shaheed Bhagat Singh Nagar, Nandkarni Park, Antop Hill, Rao Nagar Marg, Antop Hill, Mumbai - 400037",https://www.justdial.com/Mumbai/Deepak-Kirana-Stores-Antop-Hill/022PXX22-XX22-180411162354-C2F5_BZDET?xid=TXVtYmFpIEdlbmVyYWwgU3RvcmVzIEFudG9wIEhpbGw=
Amol Ratan General Store Chikkalwadi Sangam Nagar Antop Hill Wadala East,0.53 KM,,0 Votes,"Shop No 340, S P Road, Wadala East, Mumbai - 400037, Chikkalwadi , Sangam Nagar, Antop Hill",https://www.justdial.com/Mumbai/Amol-Ratan-General-Store-Chikkalwadi-Sangam-Nagar-Antop-Hill-Wadala-East/022PXX22-XX22-180426174010-A3V2_BZDET?xid=TXVtYmFpIEdlbmVyYWwgU3RvcmVzIEFudG9wIEhpbGw=
Rafiq Store Wadala East,,,0 Votes,"Antop Hill, Wadala East, Mumbai - 400037",https://www.justdial.com/Mumbai/Rafiq-Store-Wadala-East/022PXX22-XX22-180519165433-B8R1_BZDET?xid=TXVtYmFpIEdlbmVyYWwgU3RvcmVzIEFudG9wIEhpbGw=
S M Kirana Stores Wadala East,,,0 Votes,"Shop No 1, Smd Road, Antop Hill, Wadala East, Mumbai - 400037",https://www.justdial.com/Mumbai/S-M-Kirana-Stores-Wadala-East/022PXX22-XX22-180627033735-K8Z4_BZDET?xid=TXVtYmFpIEdlbmVyYWwgU3RvcmVzIEFudG9wIEhpbGw=
Classic General Store Near Sagar Bar Antop Hill,0.55 KM,,0 Votes,"Shop Png 74-3/4, Barkat Ali Dargah Road, Antop Hill, Mumbai - 400037, Near Sagar Bar",https://www.justdial.com/Mumbai/Classic-General-Store-Near-Sagar-Bar-Antop-Hill/022PXX22-XX22-170617113252-B5N5_BZDET?xid=TXVtYmFpIEdlbmVyYWwgU3RvcmVzIEFudG9wIEhpbGw=
Saravana Stores Antop Hill,0.59 KM,4.5,6 Votes,"100 S M Road, Antop Hill, Mumbai - 400037",https://www.justdial.com/Mumbai/Saravana-Stores-Antop-Hill/022PXX22-XX22-140510144336-G7Y9_BZDET?xid=TXVtYmFpIEdlbmVyYWwgU3RvcmVzIEFudG9wIEhpbGw=
Shree Krupa Masala Antop Hill,0.61 KM,3.0,3 Votes,"Shop Number.296, Chikkalwadi, Sangam Nagar, Antop Hill, Mumbai - 400037",https://www.justdial.com/Mumbai/Shree-Krupa-Masala-Antop-Hill/022PXX22-XX22-181220222802-K7Z3_BZDET?xid=TXVtYmFpIEdlbmVyYWwgU3RvcmVzIEFudG9wIEhpbGw=
Bhavesh General Stores Opposite V I T College Shanti Nagar Antop Hill Wadala East,0.62 KM,,0 Votes,"Shop No 1, S P Road, Wadala East, Mumbai - 400037, Opposite V I T College, Shanti Nagar, Antop Hill",https://www.justdial.com/Mumbai/Bhavesh-General-Stores-Opposite-V-I-T-College-Shanti-Nagar-Antop-Hill-Wadala-East/022PXX22-XX22-180425123006-J9H5_BZDET?xid=TXVtYmFpIEdlbmVyYWwgU3RvcmVzIEFudG9wIEhpbGw=
New Mahavir Chemist General Stores Opposite Jyoti Building Near Wadala Bridge Antop Hill,0.63 KM,3.5,1 Votes,"Shop No.1&2, Tixeria Chawl, Barkat Ali Dargah Road, Antop Hill, Mumbai - 400037, Opposite Jyoti Building, Near Wadala Bridge",https://www.justdial.com/Mumbai/New-Mahavir-Chemist-General-Stores-Opposite-Jyoti-Building-Near-Wadala-Bridge-Antop-Hill/022PXX22-XX22-121203153643-C9I4_BZDET?xid=TXVtYmFpIEdlbmVyYWwgU3RvcmVzIEFudG9wIEhpbGw=
Varsha Medical General Stores Near VIT College Sangam Nagar Shanti Nagar Antop Hill,0.63 KM,,0 Votes,"Salt Pan Road, Antop Hill, Mumbai - 400037, Near VIT College, Sangam Nagar, Shanti Nagar",https://www.justdial.com/Mumbai/Varsha-Medical-General-Stores-Near-VIT-College-Sangam-Nagar-Shanti-Nagar-Antop-Hill/022PXX22-XX22-121217155727-Q8B7_BZDET?xid=TXVtYmFpIEdlbmVyYWwgU3RvcmVzIEFudG9wIEhpbGw=
Shimla Medical General Stores Behind Vidyalankar College Back Side Gate Antop Hill,0.63 KM,,0 Votes,"Shop No.06, Shanti Nagar, Sangam Rahivashi Sangh, Salt Pan Road, Antop Hill, Mumbai - 400037, Behind Vidyalankar College Back Side Gate",https://www.justdial.com/Mumbai/Shimla-Medical-General-Stores-Behind-Vidyalankar-College-Back-Side-Gate-Antop-Hill/022PXX22-XX22-121217161238-A5L1_BZDET?xid=TXVtYmFpIEdlbmVyYWwgU3RvcmVzIEFudG9wIEhpbGw=
Shiv Shakti Medical General Stores Beside Vidyalankar College Antop Hill,0.64 KM,,0 Votes,"F.N.G.4, Sangam Nagar, Salt Pan Road, Antop Hill, Mumbai - 400037, Beside Vidyalankar College",https://www.justdial.com/Mumbai/Shiv-Shakti-Medical-General-Stores-Beside-Vidyalankar-College-Antop-Hill/022PXX22-XX22-121217154325-G3B2_BZDET?xid=TXVtYmFpIEdlbmVyYWwgU3RvcmVzIEFudG9wIEhpbGw=
Lucky General Store Near Amar Restaurant Sangam Nagar Antop Hill,0.65 KM,,0 Votes,"Shop No.391, Antop Hill, Mumbai - 400037, Near Amar Restaurant Sangam Nagar",https://www.justdial.com/Mumbai/Lucky-General-Store-Near-Amar-Restaurant-Sangam-Nagar-Antop-Hill/022PXX22-XX22-130218115211-A9Y1_BZDET?xid=TXVtYmFpIEdlbmVyYWwgU3RvcmVzIEFudG9wIEhpbGw=
Rashmi Kirana Stores Dinbandhu Nagar Jay Maharashtra Nagar Antop Hill Wadala East,0.65 KM,,0 Votes,"Shop No 4 Area, S P Road, Wadala East, Mumbai - 400037, Dinbandhu Nagar, Jay Maharashtra Nagar, Antop Hill",https://www.justdial.com/Mumbai/Rashmi-Kirana-Stores-Dinbandhu-Nagar-Jay-Maharashtra-Nagar-Antop-Hill-Wadala-East/022PXX22-XX22-180425120006-D1S3_BZDET?xid=TXVtYmFpIEdlbmVyYWwgU3RvcmVzIEFudG9wIEhpbGw=
