Name,Distance,Rating,Votes,Address,WebsiteShanti Enterprises Kirana General Stores Shanti Nagar Antop Hill Wadala East,0.65 KM,,0 Votes,"Shop No 85 Behind Vidyalanmkar College, S P Road, Wadala East, Mumbai - 400037, Shanti Nagar, Antop Hill",https://www.justdial.com/Mumbai/Shanti-Enterprises-Kirana-General-Stores-Shanti-Nagar-Antop-Hill-Wadala-East/022PXX22-XX22-180425120047-N8N8_BZDET?xid=TXVtYmFpIEdlbmVyYWwgU3RvcmVzIEFudG9wIEhpbGw=
Sawariya General Stores Sangam Nagar Antop Hill Wadala East,0.65 KM,,0 Votes,"Shop No 6,, S P Road, Wadala East, Mumbai - 400037, Sangam Nagar, Antop Hill",https://www.justdial.com/Mumbai/Sawariya-General-Stores-Sangam-Nagar-Antop-Hill-Wadala-East/022PXX22-XX22-180425142005-P1P8_BZDET?xid=TXVtYmFpIEdlbmVyYWwgU3RvcmVzIEFudG9wIEhpbGw=
Ramdev Store Near Best Cabin Sangam Nagar Antop Hill,0.66 KM,,0 Votes,"Salt Pant Road, Antop Hill, Mumbai - 400037, Near Best Cabin, Sangam Nagar",https://www.justdial.com/Mumbai/Ramdev-Store-Near-Best-Cabin-Sangam-Nagar-Antop-Hill/022PXX22-XX22-130228154445-V6J9_BZDET?xid=TXVtYmFpIEdlbmVyYWwgU3RvcmVzIEFudG9wIEhpbGw=
Mahadev Medical General Stores Chikkal Wadi Antop Hill,0.67 KM,,0 Votes,"FNG 249, Sangam Nagar, Chikkal Wadi, S.M.D.Road, Antop Hill, Mumbai - 400037, Chikkal Wadi",https://www.justdial.com/Mumbai/Mahadev-Medical-General-Stores-Chikkal-Wadi-Antop-Hill/022PXX22-XX22-121217124241-Y2X6_BZDET?xid=TXVtYmFpIEdlbmVyYWwgU3RvcmVzIEFudG9wIEhpbGw=
Ashutosh Kirana General Stores Near Bharni Naka Wadala East,0.67 KM,,0 Votes,"Shop No 129/31 Chandni Nagar, Salt Pan Road Antop Hill, Wadala East, Mumbai - 400037, Near Bharni Naka",https://www.justdial.com/Mumbai/Ashutosh-Kirana-General-Stores-Near-Bharni-Naka-Wadala-East/022PXX22-XX22-140607133402-S4T2_BZDET?xid=TXVtYmFpIEdlbmVyYWwgU3RvcmVzIEFudG9wIEhpbGw=
Pankaj Stores Wadala East,0.67 KM,3.0,6 Votes,"Antop Hill, Sangam Nagar, Salt Pan Road, Wadala East, Mumbai - 400037",https://www.justdial.com/Mumbai/Pankaj-Stores-Wadala-East/022PXX22-XX22-181220222747-M5Z4_BZDET?xid=TXVtYmFpIEdlbmVyYWwgU3RvcmVzIEFudG9wIEhpbGw=
Paradise Medical General Stores Near Bharani Naka Antop Hill,0.68 KM,5.0,1 Votes,"Sangam Nagar, S.M.D.Road, Antop Hill, Mumbai - 400037, Near Bharani Naka",https://www.justdial.com/Mumbai/Paradise-Medical-General-Stores-Near-Bharani-Naka-Antop-Hill/022PXX22-XX22-121217125228-Q2U4_BZDET?xid=TXVtYmFpIEdlbmVyYWwgU3RvcmVzIEFudG9wIEhpbGw=
Devi Medical General Stores Behind VIT College Back Side Gate Antop Hill,0.69 KM,,0 Votes,"14/69, Shanti Nagar, Salt Pan Road, Antop Hill, Mumbai - 400037, Behind VIT College Back Side Gate",https://www.justdial.com/Mumbai/Devi-Medical-General-Stores-Behind-VIT-College-Back-Side-Gate-Antop-Hill/022PXX22-XX22-121217162744-M7E2_BZDET?xid=TXVtYmFpIEdlbmVyYWwgU3RvcmVzIEFudG9wIEhpbGw=
Hariom Medical General Stores Behind VIT College Back Side Gate Antop Hill,0.7 KM,,0 Votes,"Shop No.13/68, Shanti Nagar, Salt Pan Road, Antop Hill, Mumbai - 400037, Behind VIT College Back Side Gate",https://www.justdial.com/Mumbai/Hariom-Medical-General-Stores-Behind-VIT-College-Back-Side-Gate-Antop-Hill/022PXX22-XX22-121217171610-S7E9_BZDET?xid=TXVtYmFpIEdlbmVyYWwgU3RvcmVzIEFudG9wIEhpbGw=
Green Medical General Stores Koyala Galli Corner Antop Hill,0.72 KM,4.0,1 Votes,"Shop No.183-1/2, Chandani Aagar, S.P.Road, Antop Hill, Mumbai - 400037, Koyala Galli Corner",https://www.justdial.com/Mumbai/Green-Medical-General-Stores-Koyala-Galli-Corner-Antop-Hill/022PXX22-XX22-121217130946-K8D6_BZDET?xid=TXVtYmFpIEdlbmVyYWwgU3RvcmVzIEFudG9wIEhpbGw=
Navyansh Baranwal Antop Hill,0.72 KM,4.0,1 Votes,"Chandani Nagar, Bharatiya Kamala Nagar, Wadala East, Salt Pan Road, Antop Hill, Mumbai - 400037",https://www.justdial.com/Mumbai/Navyansh-Baranwal-Antop-Hill/022PXX22-XX22-181222181445-N7N2_BZDET?xid=TXVtYmFpIEdlbmVyYWwgU3RvcmVzIEFudG9wIEhpbGw=
Paras Medical General Stores Near Jama Masjid Antop Hill,0.73 KM,,0 Votes,"Shop No.399, Sangam Nagar, Salt Pan Road, Antop Hill, Mumbai - 400037, Near Jama Masjid",https://www.justdial.com/Mumbai/Paras-Medical-General-Stores-Near-Jama-Masjid-Antop-Hill/022PXX22-XX22-121217143224-K2L2_BZDET?xid=TXVtYmFpIEdlbmVyYWwgU3RvcmVzIEFudG9wIEhpbGw=
Rehaan Medical General Stores Behind VIT College Back Side Gate Antop Hill,0.79 KM,,0 Votes,"Shop No.85, Shanti Nagar, Salt Pan Road, Antop Hill, Mumbai - 400037, Behind VIT College Back Side Gate",https://www.justdial.com/Mumbai/Rehaan-Medical-General-Stores-Behind-VIT-College-Back-Side-Gate-Antop-Hill/022PXX22-XX22-121217165823-Q6F5_BZDET?xid=TXVtYmFpIEdlbmVyYWwgU3RvcmVzIEFudG9wIEhpbGw=
K G N General Store Near antop hill Vijay Nagar Antop Hill,0.79 KM,,0 Votes,"shop no 22, satallpan road, Vijay Nagar-Antop Hill, Mumbai - 400037, near antop hill",https://www.justdial.com/Mumbai/K-G-N-General-Store-Near-antop-hill-Vijay-Nagar-Antop-Hill/022PXX22-XX22-161114161018-P6B3_BZDET?xid=TXVtYmFpIEdlbmVyYWwgU3RvcmVzIEFudG9wIEhpbGw=
Subhaniya Medical General Stores Near Karbala Masjid Bharatiya Kamala Nagar Antop Hill,0.92 KM,,0 Votes,"Shop No 105, Raza Galli, Antop Hill, Mumbai - 400037, Near Karbala Masjid, Bharatiya Kamala Nagar",https://www.justdial.com/Mumbai/Subhaniya-Medical-General-Stores-Near-Karbala-Masjid-Bharatiya-Kamala-Nagar-Antop-Hill/022PXX22-XX22-121217132724-J2C4_BZDET?xid=TXVtYmFpIEdlbmVyYWwgU3RvcmVzIEFudG9wIEhpbGw=
J S Chaudhary Kirana General Store Near Hanuman Mandir Bhartiya Kamla Nagar Antop Hill Wadala East,0.96 KM,4.4,5 Votes,"Shop No 205, S P Road, Wadala East, Mumbai - 400037, Near Hanuman Mandir, Bhartiya Kamla Nagar Antop Hill",https://www.justdial.com/Mumbai/J-S-Chaudhary-Kirana-General-Store-Near-Hanuman-Mandir-Bhartiya-Kamla-Nagar-Antop-Hill-Wadala-East/022PXX22-XX22-180427185010-S5C6_BZDET?xid=TXVtYmFpIEdlbmVyYWwgU3RvcmVzIEFudG9wIEhpbGw=
National Medical General Stores Opp Gulshan A Bagdad Madarsha Antop Hill,0.98 KM,4.0,3 Votes,"Sangan Nagar, Bharatiya Kamala Nagar, Antop Hill, Mumbai - 400037, Opp Gulshan A Bagdad Madarsha",https://www.justdial.com/Mumbai/National-Medical-General-Stores-Opp-Gulshan-A-Bagdad-Madarsha-Antop-Hill/022PXX22-XX22-110112172018-P6F1_BZDET?xid=TXVtYmFpIEdlbmVyYWwgU3RvcmVzIEFudG9wIEhpbGw=
Ashtavinayak Celluers Near Dr Prasun Clinc Antop Hill,0.99 KM,3.5,1 Votes,"B/24,Kalpak Estate Building, Shaikh Mistry Road, Antop Hill, Mumbai - 400037, Near Dr Prasun Clinc",https://www.justdial.com/Mumbai/Ashtavinayak-Celluers-Near-Dr-Prasun-Clinc-Antop-Hill/022PXX22-XX22-130118123835-R7B1_BZDET?xid=TXVtYmFpIEdlbmVyYWwgU3RvcmVzIEFudG9wIEhpbGw=
Khan Traders Kirana Stores Bhartiya Kamla Nagar Antop Hill Wadala East,1 KM,5.0,1 Votes,"S P Road, Wadala East, Mumbai - 400037, Bhartiya Kamla Nagar, Antop Hill",https://www.justdial.com/Mumbai/Khan-Traders-Kirana-Stores-Bhartiya-Kamla-Nagar-Antop-Hill-Wadala-East/022PXX22-XX22-180430155018-I7E6_BZDET?xid=TXVtYmFpIEdlbmVyYWwgU3RvcmVzIEFudG9wIEhpbGw=
Momin Medical General Stores Opposite Ahlehadies Masjid Antop Hill,1.01 KM,4.8,11 Votes,"R-630, Bharatiya Kamala Nagar, S.P.Road, Antop Hill, Mumbai - 400037, Opposite Ahlehadies Masjid",https://www.justdial.com/Mumbai/Momin-Medical-General-Stores-Opposite-Ahlehadies-Masjid-Antop-Hill/022PXX22-XX22-121217134611-T6I2_BZDET?xid=TXVtYmFpIEdlbmVyYWwgU3RvcmVzIEFudG9wIEhpbGw=
Kwality General Store Opposite Building No 48 Motilal Nagar Antop Hill,1.01 KM,,0 Votes,"Shop No.A/115, S M Road, Antop Hill, Mumbai - 400037, Opposite Building No.48,Motilal Nagar",https://www.justdial.com/Mumbai/Kwality-General-Store-Opposite-Building-No-48-Motilal-Nagar-Antop-Hill/022PXX22-XX22-150105163109-B4F9_BZDET?xid=TXVtYmFpIEdlbmVyYWwgU3RvcmVzIEFudG9wIEhpbGw=
Jeevitha General Store Near Police Station Bus Stop Antop Hill,1.06 KM,4.5,1 Votes,"Shop No 29 CGS Colony Sector 4, L M Nandkarni Road, Antop Hill, Mumbai - 400037, Near Police Station Bus Stop",https://www.justdial.com/Mumbai/Jeevitha-General-Store-Near-Police-Station-Bus-Stop-Antop-Hill/022PXX22-XX22-160902163253-C8J6_BZDET?xid=TXVtYmFpIEdlbmVyYWwgU3RvcmVzIEFudG9wIEhpbGw=
Sulochana General Stores S M D Road Antop Hill,1.11 KM,5.0,4 Votes,"Vishwasrao Chawl,Shop No.2, Antop Hill, Mumbai - 400037, S M D Road",https://www.justdial.com/Mumbai/Sulochana-General-Stores-S-M-D-Road-Antop-Hill/022PXX22-XX22-120308223040-T2V4_BZDET?xid=TXVtYmFpIEdlbmVyYWwgU3RvcmVzIEFudG9wIEhpbGw=
Balaji Super Market Near Antophill Church Antop Hill,1.11 KM,,0 Votes,"Shop no.7, S. M Road, Antop Hill, Mumbai - 400037, Near Antophill Church",https://www.justdial.com/Mumbai/Balaji-Super-Market-Near-Antophill-Church-Antop-Hill/022PXX22-XX22-150202170937-G5W4_BZDET?xid=TXVtYmFpIEdlbmVyYWwgU3RvcmVzIEFudG9wIEhpbGw=
R R Store Antop Hill,1.13 KM,2.3,3 Votes,"Shaikh Misree Marg, Kokri Agar, Antop Hill, Mumbai - 400037",https://www.justdial.com/Mumbai/R-R-Store-Antop-Hill/022PXX22-XX22-170913155318-M5P4_BZDET?xid=TXVtYmFpIEdlbmVyYWwgU3RvcmVzIEFudG9wIEhpbGw=
