Name,Distance,Rating,Votes,Address,WebsiteSagar Stores Near Police Station Gamdevi,,,0 Votes,"Shop No.6,36 Sohrab Blg, H.g.road, Gamdevi, Mumbai - 400007, Near Police Station",https://www.justdial.com/Mumbai/Sagar-Stores-Near-Police-Station-Gamdevi/022PXX22-XX22-161226153701-D6X2_BZDET?xid=TXVtYmFpIEdyb2NlcnkgU3RvcmVzIEN1bWJhbGxhIEhpbGw=
Gupta provision store Tardeo,1.09 KM,,0 Votes,"9, dawoodbhai fazalbhai blg, Tardeo, Mumbai - 400034",https://www.justdial.com/Mumbai/Gupta-provision-store-Tardeo/022PXX22-XX22-151130144250-A8L8_BZDET?xid=TXVtYmFpIEdyb2NlcnkgU3RvcmVzIEN1bWJhbGxhIEhpbGw=
Bhulabhai Velji Co Opp Hindmata Hotel Tardeo,1.1 KM,5.0,1 Votes,"352/A, Bellasis Bridge, Mumbai Central Station, Tardeo, Mumbai - 400034, Opp. Hindmata Hotel",https://www.justdial.com/Mumbai/Bhulabhai-Velji-Co-Opp-Hindmata-Hotel-Tardeo/022PXX22-XX22-151222093704-B5V4_BZDET?xid=TXVtYmFpIEdyb2NlcnkgU3RvcmVzIEN1bWJhbGxhIEhpbGw=
Soni Moni Provision Store Haji Ali,1.1 KM,,0 Votes,"Shop no.15 sahakar niwas, Haji Ali, Mumbai - 400034",https://www.justdial.com/Mumbai/Soni-Moni-Provision-Store-Haji-Ali/022PXX22-XX22-161004140623-S5A7_BZDET?xid=TXVtYmFpIEdyb2NlcnkgU3RvcmVzIEN1bWJhbGxhIEhpbGw=
SAVMORE Supermarket Haji Ali Circle Tardeo,1.12 KM,,0 Votes,"Shop No 1, Heera Panna Shopping Arcade, Tulsiwadi RTO Road, Tardeo, Mumbai - 400034, Haji Ali Circle",https://www.justdial.com/Mumbai/SAVMORE-Supermarket-Haji-Ali-Circle-Tardeo/022PXX22-XX22-151211155031-V3U7_BZDET?xid=TXVtYmFpIEdyb2NlcnkgU3RvcmVzIEN1bWJhbGxhIEhpbGw=
Shamji Khyshi Co Tardeo,1.14 KM,3.0,1 Votes,"505/8 Hira Kunj Gora Gandi Bldg, Sane Guruji Marg, Tardeo, Mumbai - 400034",https://www.justdial.com/Mumbai/Shamji-Khyshi-Co-Tardeo/022P1226506699H4D2U7_BZDET?xid=TXVtYmFpIEdyb2NlcnkgU3RvcmVzIEN1bWJhbGxhIEhpbGw=
Fab Inn Super Market Near Haji Ali Dargah Haji Ali,1.14 KM,3.9,55 Votes,"Shop No 3, Heera Panna Shopping Centre, Haji Ali, Haji Ali, Mumbai - 400034, Near Haji Ali Dargah",https://www.justdial.com/Mumbai/Fab-Inn-Super-Market-Near-Haji-Ali-Dargah-Haji-Ali/022P1965174_BZDET?xid=TXVtYmFpIEdyb2NlcnkgU3RvcmVzIEN1bWJhbGxhIEhpbGw=
Shah Devshi Nadadh Company Tulsiwadi,1.15 KM,,0 Votes,"Gashwala Building 876,A, Sane Guruji Marg, Tulsiwadi, Mumbai - 400034",https://www.justdial.com/Mumbai/Shah-Devshi-Nadadh-Company-Tulsiwadi/022PXX22-XX22-140726105251-Q1Y7_BZDET?xid=TXVtYmFpIEdyb2NlcnkgU3RvcmVzIEN1bWJhbGxhIEhpbGw=
Diet Tamasha Opposite Oside Heera Haji Ali,1.17 KM,3.0,1 Votes,"Shop No. 5 & 6, Rewa Appartment B, Panna, Bhula Bhai Desai Road, Haji Ali, Mumbai - 400034, Opposite Oside Heera",https://www.justdial.com/Mumbai/Diet-Tamasha-Opposite-Oside-Heera-Haji-Ali/022PXX22-XX22-171223190353-Z9S6_BZDET?xid=TXVtYmFpIEdyb2NlcnkgU3RvcmVzIEN1bWJhbGxhIEhpbGw=
Malwa Traders Near Railway Station Grant Road,,,0 Votes,"Ground Floor,Shop No 1e,A Wing, M K Ansari Marg,Aara Plan, Grant Road, Mumbai - 400007, Near Railway Station",https://www.justdial.com/Mumbai/Malwa-Traders-Near-Railway-Station-Grant-Road/022PXX22-XX22-090702213808-IAPP_BZDET?xid=TXVtYmFpIEdyb2NlcnkgU3RvcmVzIEN1bWJhbGxhIEhpbGw=
Shah Lalji Kachara Co Tulsiwadi,1.18 KM,,0 Votes,"Jariwala Bldg,9, Sane Guruji Marg, Tulsiwadi, Mumbai - 400034",https://www.justdial.com/Mumbai/Shah-Lalji-Kachara-Co-Tulsiwadi/022PXX22-XX22-140802131126-J2Z8_BZDET?xid=TXVtYmFpIEdyb2NlcnkgU3RvcmVzIEN1bWJhbGxhIEhpbGw=
Shah Devji Hemraj Company Opposite Wagul Nath Chopati Market Grant Road,1.19 KM,5.0,2 Votes,"Building No 4 Krishna Kunj Building, Dadi Seeth Road, Grant Road, Mumbai - 400007, Opposite Wagul Nath Chopati Market",https://www.justdial.com/Mumbai/Shah-Devji-Hemraj-Company-Opposite-Wagul-Nath-Chopati-Market-Grant-Road/022PAPP20081231IROK4054848_BZDET?xid=TXVtYmFpIEdyb2NlcnkgU3RvcmVzIEN1bWJhbGxhIEhpbGw=
Babulnath General Store Opposite Babulnath Temple Grant Road,1.19 KM,5.0,1 Votes,"Ratan Lal, Babulnath Road, Grant Road, Mumbai - 400007, Opposite Babulnath Temple",https://www.justdial.com/Mumbai/Babulnath-General-Store-Opposite-Babulnath-Temple-Grant-Road/022PXX22-XX22-131230183145-C2D4_BZDET?xid=TXVtYmFpIEdyb2NlcnkgU3RvcmVzIEN1bWJhbGxhIEhpbGw=
Joshi Stores Opposite J K Building No 4 Gamdevi,1.21 KM,,0 Votes,"Akhalwaya Building, H G Road, Gamdevi, Mumbai - 400007, Opposite J K Building No 4",https://www.justdial.com/Mumbai/Joshi-Stores-Opposite-J-K-Building-No-4-Gamdevi/022PXX22-XX22-131015002502-L9L4_BZDET?xid=TXVtYmFpIEdyb2NlcnkgU3RvcmVzIEN1bWJhbGxhIEhpbGw=
Shah Ratilal Ramji Company Gamdevi,1.24 KM,,0 Votes,"J K Building No 3, Gamdevi, Mumbai - 400007",https://www.justdial.com/Mumbai/Shah-Ratilal-Ramji-Company-Gamdevi/022PXX22-XX22-131017002903-V8N4_BZDET?xid=TXVtYmFpIEdyb2NlcnkgU3RvcmVzIEN1bWJhbGxhIEhpbGw=
Sai Sagar Dry Fruits General Store Opp Gamdevi Temple Gamdevi,1.25 KM,3.3,3 Votes,"Shop No ,6,36, H.G .road, Gamdevi, Mumbai - 400007, Opp Gamdevi Temple",https://www.justdial.com/Mumbai/Sai-Sagar-Dry-Fruits-General-Store-Opp-Gamdevi-Temple-Gamdevi/022PXX22-XX22-131224162932-R2U7_BZDET?xid=TXVtYmFpIEdyb2NlcnkgU3RvcmVzIEN1bWJhbGxhIEhpbGw=
Shaikh bhajiwala Tardeo,1.25 KM,4.0,2 Votes,"Dadal Estate, Bane Compound, Tardeo, Mumbai - 400034",https://www.justdial.com/Mumbai/Shaikh-bhajiwala-Tardeo/022PXX22-XX22-200627113226-U4K4_BZDET?xid=TXVtYmFpIEdyb2NlcnkgU3RvcmVzIEN1bWJhbGxhIEhpbGw=
Amrut Stores Opposite JK Towers Gamdevi,1.26 KM,3.5,5 Votes,"39-47, Goravakar Wadi, H g Road, Gamdevi, Mumbai - 400007, Opposite JK Towers",https://www.justdial.com/Mumbai/Amrut-Stores-Opposite-JK-Towers-Gamdevi/022PXX22-XX22-000988397138-W1V8_BZDET?xid=TXVtYmFpIEdyb2NlcnkgU3RvcmVzIEN1bWJhbGxhIEhpbGw=
Devji Dhanji Grant Road,1.28 KM,3.7,10 Votes,"Shop No 85, Lokmanya Tilak Market, Grant Road, Mumbai - 400007",https://www.justdial.com/Mumbai/Devji-Dhanji-Grant-Road/022PXX22-XX22-181127123444-A9D4_BZDET?xid=TXVtYmFpIEdyb2NlcnkgU3RvcmVzIEN1bWJhbGxhIEhpbGw=
Jinaam Stores Opp Chheda Medical Stores Tardeo,1.31 KM,,0 Votes,"Shop No.6, Yasho Mandir Building, Sane Guruji Road,, Tardeo, Mumbai - 400034, Opp. Chheda Medical Stores",https://www.justdial.com/Mumbai/Jinaam-Stores-Opp-Chheda-Medical-Stores-Tardeo/022PXX22-XX22-140801130637-Q8W6_BZDET?xid=TXVtYmFpIEdyb2NlcnkgU3RvcmVzIEN1bWJhbGxhIEhpbGw=
Britannia Store Near Menara Cenima Mumbai Central,1.31 KM,0.5,1 Votes,"Shop No. 8, Dr. D B Marg, Mumbai Central, Mumbai - 400008, Near Menara Cenima",https://www.justdial.com/Mumbai/Britannia-Store-Near-Menara-Cenima-Mumbai-Central/022PXX22-XX22-161223102422-F5T3_BZDET?xid=TXVtYmFpIEdyb2NlcnkgU3RvcmVzIEN1bWJhbGxhIEhpbGw=
Om Sai Prasad Stores Near Congress House Charni Road,1.37 KM,,0 Votes,"Below Kennedy Bridge, Opera House, Charni Road, Mumbai - 400004, Near Congress House",https://www.justdial.com/Mumbai/Om-Sai-Prasad-Stores-Near-Congress-House-Charni-Road/022PXX22-XX22-140128163236-N1Q6_BZDET?xid=TXVtYmFpIEdyb2NlcnkgU3RvcmVzIEN1bWJhbGxhIEhpbGw=
Krupa Stores,1.37 KM,5.0,7 Votes,"Navyug Nivas, Ground Floor, A/6, Society, Mumbai - 400007, Lamington Road",https://www.justdial.com/Mumbai/Krupa-Stores/022PXX22-XX22-191116092555-J2U9_BZDET?xid=TXVtYmFpIEdyb2NlcnkgU3RvcmVzIEN1bWJhbGxhIEhpbGw=
