Name,Distance,Rating,Votes,Address,Website
Jai Jagdish General Stores Opposite St Xavier Collage Fish Market Mahim Koliwada,,,0 Votes,"Shop No 15, Janseva Society, Causeway Road,, Mahim Koliwada, Mumbai - 400016, Opposite St Xavier Collage, Fish Market",https://www.justdial.com/Mumbai/Jai-Jagdish-General-Stores-Opposite-St-Xavier-Collage-Fish-Market-Mahim-Koliwada/022PXX22-XX22-170821124507-J2Y9_BZDET?xid=TXVtYmFpIEdlbmVyYWwgU3RvcmVzIE1haGltIEtvbGl3YWRh
Naresh Milk Dairy General Stores Opposite Shiv Sena Shakha Mahim Koliwada,0.04 KM,,0 Votes,"Shop No 7, Fishermen Colony, Causeway Road, Mahim Koliwada, Mumbai - 400016, Opposite Shiv Sena Shakha",https://www.justdial.com/Mumbai/Naresh-Milk-Dairy-General-Stores-Opposite-Shiv-Sena-Shakha-Mahim-Koliwada/022PXX22-XX22-170819163503-F4L7_BZDET?xid=TXVtYmFpIEdlbmVyYWwgU3RvcmVzIE1haGltIEtvbGl3YWRh
Rachana Dry Fruits Opposite Karnataka Sangh Hall Mahim,1.75 KM,4.3,22 Votes,"Shop No 2, Ajay Shopping Centre, T H Kataria Marg, Mahim, Mumbai - 400016, Opposite Karnataka Sangh Hall",https://www.justdial.com/Mumbai/Rachana-Dry-Fruits-Opposite-Karnataka-Sangh-Hall-Mahim/022P1933134_BZDET?xid=TXVtYmFpIEdlbmVyYWwgU3RvcmVzIE1haGltIEtvbGl3YWRh
Nilkanth Super Market Near Mahim Bus Depot Mahim,1.13 KM,4.4,8 Votes,"Shop No.12, Mori Road, Mahim, Mumbai - 400016, Near Mahim Bus Depot",https://www.justdial.com/Mumbai/Nilkanth-Super-Market-Near-Mahim-Bus-Depot-Mahim/022PXX22-XX22-131026144449-E1P4_BZDET?xid=TXVtYmFpIEdlbmVyYWwgU3RvcmVzIE1haGltIEtvbGl3YWRh
Amit Medical General Stores Near Raja Rani Travels and Ashray Hotel Mahim,1.96 KM,4.9,5 Votes,"Shop No 4, Plot No 211 C, Keshav Bhawan, L J Road, Mahim, Mumbai - 400016, Near Raja Rani Travels and Ashray Hotel",https://www.justdial.com/Mumbai/Amit-Medical-General-Stores-Near-Raja-Rani-Travels-and-Ashray-Hotel-Mahim/022P1980537_BZDET?xid=TXVtYmFpIEdlbmVyYWwgU3RvcmVzIE1haGltIEtvbGl3YWRh
Mangalore General Stores Opposite Paradise Cinema 76 Alj Road Mahim,0.95 KM,3.9,48 Votes,"Shop No 8, Mohhamad Edu Manzil, Lady Jamshedji Road, Mahim, Mumbai - 400016, Opposite Paradise Cinema ,76 Alj Road",https://www.justdial.com/Mumbai/Mangalore-General-Stores-Opposite-Paradise-Cinema-76-Alj-Road-Mahim/022P1980607_BZDET?xid=TXVtYmFpIEdlbmVyYWwgU3RvcmVzIE1haGltIEtvbGl3YWRh
Stop N Shop Boutique Near Victoria Church Mahim,1.31 KM,4.0,71 Votes,"4, Dimple Building, 133, L J Road, Mahim, Mumbai - 400016, Near Victoria Church",https://www.justdial.com/Mumbai/Stop-N-Shop-Boutique-Near-Victoria-Church-Mahim/022P1303708_BZDET?xid=TXVtYmFpIEdlbmVyYWwgU3RvcmVzIE1haGltIEtvbGl3YWRh
Sagar Toys Shop OPP CANOSSA HIGH SCHOOL Mahim,0.88 KM,4.0,2 Votes,"SHOP NO.4 ROSARY BUILDING, Mia Mohd Chhotani Road, Mahim, Mumbai - 400016, OPP CANOSSA HIGH SCHOOL",https://www.justdial.com/Mumbai/Sagar-Toys-Shop-OPP-CANOSSA-HIGH-SCHOOL-Mahim/022P1980576_BZDET?xid=TXVtYmFpIEdlbmVyYWwgU3RvcmVzIE1haGltIEtvbGl3YWRh
Jwell Chemist Next to Mahim Bus Depot Mahim,0.46 KM,4.2,15 Votes,"Shop No 1, Mohini Mansion, Mori Road, Mahim, Mumbai - 400016, Next to Mahim Bus Depot",https://www.justdial.com/Mumbai/Jwell-Chemist-Next-to-Mahim-Bus-Depot-Mahim/022PXX22-XX22-000197936106-S1F8_BZDET?xid=TXVtYmFpIEdlbmVyYWwgU3RvcmVzIE1haGltIEtvbGl3YWRh
Mahim Super Masala Near Police Chowky Mahim,0.96 KM,5.0,2 Votes,"Shop No. 3, Kapad Bazar Road, Mahim, Mumbai - 400016, Near Police Chowky",https://www.justdial.com/Mumbai/Mahim-Super-Masala-Near-Police-Chowky-Mahim/022PXX22-XX22-130223135315-R8Y8_BZDET?xid=TXVtYmFpIEdlbmVyYWwgU3RvcmVzIE1haGltIEtvbGl3YWRh
Vipul Chemist Near Mahim Station Mahim,1.85 KM,4.5,6 Votes,"Shop No 4, Qureshi Mahal, Mia Mohd Chhotani Road, Mahim, Mumbai - 400016, Near Mahim Station",https://www.justdial.com/Mumbai/Vipul-Chemist-Near-Mahim-Station-Mahim/022PXX22-XX22-121108170924-Q2F4_BZDET?xid=TXVtYmFpIEdlbmVyYWwgU3RvcmVzIE1haGltIEtvbGl3YWRh
Bismillah Medical General Stores Near Mahim Dargah Mahim,0.7 KM,,0 Votes,"Shop No. 1, Madina Manzil, Cadel Road, Mahim, Mumbai - 400016, Near Mahim Dargah",https://www.justdial.com/Mumbai/Bismillah-Medical-General-Stores-Near-Mahim-Dargah-Mahim/022P1236183718U7T9T7_BZDET?xid=TXVtYmFpIEdlbmVyYWwgU3RvcmVzIE1haGltIEtvbGl3YWRh
Apna Stores Near Kottak Mahindra ATM Mahim,0.72 KM,4.2,16 Votes,"Navjivan Colony.shop No-14, Mori Road, Mahim, Mumbai - 400016, Near- Kottak Mahindra ATM",https://www.justdial.com/Mumbai/Apna-Stores-Near-Kottak-Mahindra-ATM-Mahim/022PXX22-XX22-131023115055-L5E1_BZDET?xid=TXVtYmFpIEdlbmVyYWwgU3RvcmVzIE1haGltIEtvbGl3YWRh
Hemant General Stores Mahim,0.91 KM,4.0,3 Votes,"8 Garden View Building, MMC Road, Mahim, Mumbai - 400016",https://www.justdial.com/Mumbai/Hemant-General-Stores-Mahim/022P1980777_BZDET?xid=TXVtYmFpIEdlbmVyYWwgU3RvcmVzIE1haGltIEtvbGl3YWRh
Poorna Bramha Near Shobha Hotel Mahim,0.92 KM,,0 Votes,"L J Road, Mahim, Mumbai - 400016, Near Shobha Hotel",https://www.justdial.com/Mumbai/Poorna-Bramha-Near-Shobha-Hotel-Mahim/022PK023335_BZDET?xid=TXVtYmFpIEdlbmVyYWwgU3RvcmVzIE1haGltIEtvbGl3YWRh
Snow Magic Ice Cream Parlour Near Canosa Convent Mahim,0.97 KM,4.0,47 Votes,"Shop No- 2/5, Garden View Co-Operative Housing Society, MMC Road, Mahim, Mumbai - 400016, Near Canosa Convent",https://www.justdial.com/Mumbai/Snow-Magic-Ice-Cream-Parlour-Near-Canosa-Convent-Mahim/022PXX22-XX22-120629012215-Y9W9_BZDET?xid=TXVtYmFpIEdlbmVyYWwgU3RvcmVzIE1haGltIEtvbGl3YWRh
Metro Biscuit Stores Near indian Bank Mahim,1.03 KM,3.0,1 Votes,"Rajmahal Building,Shop No .9, M M C Road, Mahim, Mumbai - 400016, Near.indian Bank",https://www.justdial.com/Mumbai/Metro-Biscuit-Stores-Near-indian-Bank-Mahim/022PXX22-XX22-140517162733-F9B3_BZDET?xid=TXVtYmFpIEdlbmVyYWwgU3RvcmVzIE1haGltIEtvbGl3YWRh
Divya Pharma Medical General Store Nr Hinduja Hospital Mahim,1.48 KM,4.3,22 Votes,"9-B,Gannsiddhinayk Socity, Dilipgupte Marag, Mahim, Mumbai - 400016, Nr Hinduja Hospital",https://www.justdial.com/Mumbai/Divya-Pharma-Medical-General-Store-Nr-Hinduja-Hospital-Mahim/022P1217665148R4Z8G7_BZDET?xid=TXVtYmFpIEdlbmVyYWwgU3RvcmVzIE1haGltIEtvbGl3YWRh
Nandu General Stores Opp Ajay Shopping Centre Mahim,1.71 KM,4.0,1 Votes,"Shop No.5, Shree Krishna Niwas, T H Kataria Marg, Mahim, Mumbai - 400016, Opp Ajay Shopping Centre",https://www.justdial.com/Mumbai/Nandu-General-Stores-Opp-Ajay-Shopping-Centre-Mahim/022P1005547_BZDET?xid=TXVtYmFpIEdlbmVyYWwgU3RvcmVzIE1haGltIEtvbGl3YWRh
Apna Bhandar Matunga West,1.73 KM,,0 Votes,"Shop No 120/3, Shri Krishna, Takandas Kataria Marg, Matunga West, Mumbai - 400016",https://www.justdial.com/Mumbai/Apna-Bhandar-Matunga-West/022PXX22-XX22-181225204149-U8G6_BZDET?xid=TXVtYmFpIEdlbmVyYWwgU3RvcmVzIE1haGltIEtvbGl3YWRh
Kanti general store Opp natural ice creem Mahim,1.75 KM,,0 Votes,"T h katariya marg, Mahim, Mumbai - 400016, Opp natural ice creem",https://www.justdial.com/Mumbai/Kanti-general-store-Opp-natural-ice-creem-Mahim/022PXX22-XX22-140301143930-F2U3_BZDET?xid=TXVtYmFpIEdlbmVyYWwgU3RvcmVzIE1haGltIEtvbGl3YWRh
Sunder Milan Mahim,0.69 KM,,0 Votes,"Shop No 16,, Mori Road, Mahim, Mumbai - 400016",https://www.justdial.com/Mumbai/Sunder-Milan-Mahim/022PXX22-XX22-200304112858-D7T6_BZDET?xid=TXVtYmFpIEdlbmVyYWwgU3RvcmVzIE1haGltIEtvbGl3YWRh
Shalimar Bakery General Stores Mahim,1.01 KM,3.0,1 Votes,"Sant Rohidas Marg, Mahim, Mumbai - 400016",https://www.justdial.com/Mumbai/Shalimar-Bakery-General-Stores-Mahim/022PXX22-XX22-161118150537-L5J2_BZDET?xid=TXVtYmFpIEdlbmVyYWwgU3RvcmVzIE1haGltIEtvbGl3YWRh
Satgurus Medical General Stores Oppoasite Saint Xaviers Technical Institute Mahim,0.31 KM,4.5,8 Votes,"Shop No 3 & 4, Fisherman Colony, Mahim, Mumbai - 400016, Oppoasite Saint Xaviers Technical Institute",https://www.justdial.com/Mumbai/Satgurus-Medical-General-Stores-Oppoasite-Saint-Xaviers-Technical-Institute-Mahim/022P1229721459V7W2T8_BZDET?xid=TXVtYmFpIEdlbmVyYWwgU3RvcmVzIE1haGltIEtvbGl3YWRh
Kerala General Stores Near Mahim Dargah Mahim,0.64 KM,,0 Votes,"Makhdoomiya Apartment, Shop No 8, Dargah Street, Mahim, Mumbai - 400016, Near Mahim Dargah",https://www.justdial.com/Mumbai/Kerala-General-Stores-Near-Mahim-Dargah-Mahim/022PXX22-XX22-190729110213-D8N3_BZDET?xid=TXVtYmFpIEdlbmVyYWwgU3RvcmVzIE1haGltIEtvbGl3YWRh
VINAY General Stores K G Khilnani School Mahim,0.66 KM,4.0,2 Votes,"Kunwar Cottage,Shop No-1,34-B, Mori street, Mahim, Mumbai - 400016, K.G Khilnani School",https://www.justdial.com/Mumbai/VINAY-General-Stores-K-G-Khilnani-School-Mahim/022PXX22-XX22-131023131653-G8B5_BZDET?xid=TXVtYmFpIEdlbmVyYWwgU3RvcmVzIE1haGltIEtvbGl3YWRh
Bk Stores Opposite Chhoti Dargah Mahim,0.84 KM,4.0,2 Votes,"Rehmat Manzil, Lady Jamshedji Road, Mahim, Mumbai - 400016, Opposite Chhoti Dargah",https://www.justdial.com/Mumbai/Bk-Stores-Opposite-Chhoti-Dargah-Mahim/022PXX22-XX22-181221032031-R7A8_BZDET?xid=TXVtYmFpIEdlbmVyYWwgU3RvcmVzIE1haGltIEtvbGl3YWRh
Laxmi Medico And General Stores Opposite Bank Of Maharashtra Mahim,0.94 KM,5.0,6 Votes,"Shop No 2, 72/74,Laxmi Building, Lady Jamshedji Road, Mahim, Mumbai - 400016, Opposite Bank Of Maharashtra",https://www.justdial.com/Mumbai/Laxmi-Medico-And-General-Stores-Opposite-Bank-Of-Maharashtra-Mahim/022PXX22-XX22-121212150905-Y8B9_BZDET?xid=TXVtYmFpIEdlbmVyYWwgU3RvcmVzIE1haGltIEtvbGl3YWRh
Metro biskut store Near Indian bank Mahim,1.05 KM,,0 Votes,"Raj mahal bldg shop no 9, M.m.c road, Mahim, Mumbai - 400016, Near Indian bank",https://www.justdial.com/Mumbai/Metro-biskut-store-Near-Indian-bank-Mahim/022PXX22-XX22-140530133404-G2T5_BZDET?xid=TXVtYmFpIEdlbmVyYWwgU3RvcmVzIE1haGltIEtvbGl3YWRh
Vinod General Stores Opp M M C Garden Mahim,1.1 KM,4.5,4 Votes,"5-A, Garden View, M M C Road, Mahim, Mumbai - 400016, Opp M M C Garden",https://www.justdial.com/Mumbai/Vinod-General-Stores-Opp-M-M-C-Garden-Mahim/022PXX22-XX22-130301003758-A5I7_BZDET?xid=TXVtYmFpIEdlbmVyYWwgU3RvcmVzIE1haGltIEtvbGl3YWRh
Jai Ganesh Medical General Stores Near R P Nagar M L Camp Mahim,1.53 KM,3.7,5 Votes,"D/3, JAI Ganesh Chs, 60 Feet Road 9, Mahim, Mumbai - 400016, Near R P Nagar, M L Camp",https://www.justdial.com/Mumbai/Jai-Ganesh-Medical-General-Stores-Near-R-P-Nagar-M-L-Camp-Mahim/022P1236291459D1B1M2_BZDET?xid=TXVtYmFpIEdlbmVyYWwgU3RvcmVzIE1haGltIEtvbGl3YWRh
Jagdish General Store,1.69 KM,4.0,1 Votes,"Shop No 126, , Damodar Haridas Biulding, Bhatwadi, Vsnl Colony, Matunga, Takandas Kataria Marg, Mumbai - 400016",https://www.justdial.com/Mumbai/Jagdish-General-Store/022PXX22-XX22-190323070322-C3A6_BZDET?xid=TXVtYmFpIEdlbmVyYWwgU3RvcmVzIE1haGltIEtvbGl3YWRh
Shah Kunwarji Hansraj Opp Magnet Mall Mahim,1.71 KM,4.5,2 Votes,"Shop No5om Sai Co Op Soc., Mogul Lane, Mahim, Mumbai - 400016, Opp Magnet Mall",https://www.justdial.com/Mumbai/Shah-Kunwarji-Hansraj-Opp-Magnet-Mall-Mahim/022PXX22-XX22-140521143155-T9A9_BZDET?xid=TXVtYmFpIEdlbmVyYWwgU3RvcmVzIE1haGltIEtvbGl3YWRh
Jai Ambe Sweets Farsan Near Raja Rani Travels Mahim,1.8 KM,4.5,1 Votes,"Shop No 4, Rajnath Sadan, 9082763988 Chetan, Mahim, Mumbai - 400016, Near Raja Rani Travels",https://www.justdial.com/Mumbai/Jai-Ambe-Sweets-Farsan-Near-Raja-Rani-Travels-Mahim/022PXX22-XX22-170816192724-H6H9_BZDET?xid=TXVtYmFpIEdlbmVyYWwgU3RvcmVzIE1haGltIEtvbGl3YWRh
City Light General Store Opp HDFC Bank Mahim,1.81 KM,,0 Votes,"Dinath Terrace, Shop No 2, L J Road, Mahim, Mumbai - 400016, Opp.HDFC Bank",https://www.justdial.com/Mumbai/City-Light-General-Store-Opp-HDFC-Bank-Mahim/022PXX22-XX22-171229124522-X7N1_BZDET?xid=TXVtYmFpIEdlbmVyYWwgU3RvcmVzIE1haGltIEtvbGl3YWRh
Arrey Sarita Store Mahim,1.83 KM,,0 Votes,"Shop No - 175,Raja Mall, P N Road, Mahim, Mumbai - 400016",https://www.justdial.com/Mumbai/Arrey-Sarita-Store-Mahim/022PXX22-XX22-150813161240-I8A9_BZDET?xid=TXVtYmFpIEdlbmVyYWwgU3RvcmVzIE1haGltIEtvbGl3YWRh
Sai Krupa Kaddhanya General Store Opposite Datta Mandir Mahim,0.3 KM,,0 Votes,"Shop No 10, Adivasi Koli Rahivashi Sangh, S L Raheja Road, Mahim Fish Market, Mahim, Mumbai - 400016, Opposite Datta Mandir",https://www.justdial.com/Mumbai/Sai-Krupa-Kaddhanya-General-Store-Opposite-Datta-Mandir-Mahim/022PXX22-XX22-170819140213-Z4X6_BZDET?xid=TXVtYmFpIEdlbmVyYWwgU3RvcmVzIE1haGltIEtvbGl3YWRh
Jivdani Stores Near Building No 13 14 Mahim,0.33 KM,,0 Votes,"Shop No 1, Fishermen Colony, S L Raheja Road, Swami Samarth Nagar, Mahim, Mumbai - 400016, Near Building No 13 & 14",https://www.justdial.com/Mumbai/Jivdani-Stores-Near-Building-No-13-14-Mahim/022PXX22-XX22-170818151018-K3Z5_BZDET?xid=TXVtYmFpIEdlbmVyYWwgU3RvcmVzIE1haGltIEtvbGl3YWRh
Sai Oil Depot Opposite Ram Mandir Ground Mahim,0.33 KM,,0 Votes,"Shop No 1, Fishermen Colony Building No 10, S L Raheja Road, Mahim, Mumbai - 400016, Opposite Ram Mandir Ground",https://www.justdial.com/Mumbai/Sai-Oil-Depot-Opposite-Ram-Mandir-Ground-Mahim/022PXX22-XX22-170818165508-J8Y2_BZDET?xid=TXVtYmFpIEdlbmVyYWwgU3RvcmVzIE1haGltIEtvbGl3YWRh
Colony Medical General Store Mahim,0.34 KM,4.0,4 Votes,"Shop No 961, Building No 20 Fisherman Colony, SL Raheja Marg, Mahim, Mumbai - 400016",https://www.justdial.com/Mumbai/Colony-Medical-General-Store-Mahim/022PXX22-XX22-121119230856-G4A4_BZDET?xid=TXVtYmFpIEdlbmVyYWwgU3RvcmVzIE1haGltIEtvbGl3YWRh
Ekveera General Store Behind Mahim Bus Depot Mahim,0.39 KM,,0 Votes,"Shop No.317, Mori Road, Mahim, Mumbai - 400016, Behind Mahim Bus Depot",https://www.justdial.com/Mumbai/Ekveera-General-Store-Behind-Mahim-Bus-Depot-Mahim/022PXX22-XX22-181221215044-X2K3_BZDET?xid=TXVtYmFpIEdlbmVyYWwgU3RvcmVzIE1haGltIEtvbGl3YWRh
Emperor Snacks Bar Near Axix Bank Mahim,0.49 KM,,0 Votes,"Shop No 57 Saifi Mansion, L j Road, Mahim, Mumbai - 400016, Near Axix Bank",https://www.justdial.com/Mumbai/Emperor-Snacks-Bar-Near-Axix-Bank-Mahim/022PXX22-XX22-160712115615-L7L4_BZDET?xid=TXVtYmFpIEdlbmVyYWwgU3RvcmVzIE1haGltIEtvbGl3YWRh
Iqbal General Stores Near Shakoor Bakery Mahim,0.54 KM,,0 Votes,"Shop No 16, Next to Shakoor Bakery, Cadel Road, Mahim, Mumbai - 400016, Near Shakoor Bakery",https://www.justdial.com/Mumbai/Iqbal-General-Stores-Near-Shakoor-Bakery-Mahim/022PXX22-XX22-190720120509-T2U6_BZDET?xid=TXVtYmFpIEdlbmVyYWwgU3RvcmVzIE1haGltIEtvbGl3YWRh
Cadel General Stores Near Afzal Sweet Mahim,0.54 KM,,0 Votes,"Shop No 2, Next to Nasir Hotel,Azim Building, Cadel Road, Mahim, Mumbai - 400016, Near Afzal Sweet",https://www.justdial.com/Mumbai/Cadel-General-Stores-Near-Afzal-Sweet-Mahim/022PXX22-XX22-190911101209-M9X1_BZDET?xid=TXVtYmFpIEdlbmVyYWwgU3RvcmVzIE1haGltIEtvbGl3YWRh
Garr Soda Pub General Store Next to Andhra Bank Mahim,0.56 KM,3.7,3 Votes,"Shop No. 85/Gn/Sg/1/10, Mori Road, Mahim, Mumbai - 400016, Next to Andhra Bank",https://www.justdial.com/Mumbai/Garr-Soda-Pub-General-Store-Next-to-Andhra-Bank-Mahim/022PXX22-XX22-131023135430-K2N7_BZDET?xid=TXVtYmFpIEdlbmVyYWwgU3RvcmVzIE1haGltIEtvbGl3YWRh
Nidhi General Stores Near Building No 11 Mahim,0.57 KM,4.5,1 Votes,"Fisherman Colony, Mahim, Mumbai - 400016, Near Building No 11",https://www.justdial.com/Mumbai/Nidhi-General-Stores-Near-Building-No-11-Mahim/022PXX22-XX22-121119230530-L9Q8_BZDET?xid=TXVtYmFpIEdlbmVyYWwgU3RvcmVzIE1haGltIEtvbGl3YWRh
Al Firdous Confectionery Stores Near Mahim Dargah Mahim,0.59 KM,,0 Votes,"Moin Manzil, Shop No 3, Dargah Street, Mahim, Mumbai - 400016, Near Mahim Dargah",https://www.justdial.com/Mumbai/Al-Firdous-Confectionery-Stores-Near-Mahim-Dargah-Mahim/022PXX22-XX22-160917160103-T4P6_BZDET?xid=TXVtYmFpIEdlbmVyYWwgU3RvcmVzIE1haGltIEtvbGl3YWRh
Pooja Stores Mahim,0.59 KM,,0 Votes,"Naya Nagar, Baba Saheb Ambedkar Nagar, Sion Link Road, Mahim, Mumbai - 400016",https://www.justdial.com/Mumbai/Pooja-Stores-Mahim/022PXX22-XX22-181221231835-T6Q8_BZDET?xid=TXVtYmFpIEdlbmVyYWwgU3RvcmVzIE1haGltIEtvbGl3YWRh
Lalan General Stores St Michael Church And Living Room Mahim,0.6 KM,4.0,4 Votes,"Shop No 1, Lalan Bhavan, 26, Lady Jamshedji Road, Mahim, Mumbai - 400016, St Michael Church, And Living Room",https://www.justdial.com/Mumbai/Lalan-General-Stores-St-Michael-Church-And-Living-Room-Mahim/022PXX22-XX22-120301041919-D6C3_BZDET?xid=TXVtYmFpIEdlbmVyYWwgU3RvcmVzIE1haGltIEtvbGl3YWRh
Star Kerala Shop Near Mahim Dargah Mahim,0.64 KM,,0 Votes,"Makhdoomiya Building, Dargah Steeet, Mahim, Mumbai - 400016, Near Mahim Dargah",https://www.justdial.com/Mumbai/Star-Kerala-Shop-Near-Mahim-Dargah-Mahim/022PXX22-XX22-190717165728-T1W6_BZDET?xid=TXVtYmFpIEdlbmVyYWwgU3RvcmVzIE1haGltIEtvbGl3YWRh
Nawaz General Stores Near Pakeza Bakery Mahim,0.64 KM,,0 Votes,"Sagar Darshan, Apt Shop No 12, Opp Pakiza Bakery, Cadel Road, Mahim, Mumbai - 400016, Near Pakeza Bakery",https://www.justdial.com/Mumbai/Nawaz-General-Stores-Near-Pakeza-Bakery-Mahim/022PXX22-XX22-190909112208-R5K3_BZDET?xid=TXVtYmFpIEdlbmVyYWwgU3RvcmVzIE1haGltIEtvbGl3YWRh
S K Reshu General store Near raheja hospital Mahim,0.65 KM,,0 Votes,"Naya nagar mahim west, Sion mahim Link Road, Mahim, Mumbai - 400016, Near- raheja hospital",https://www.justdial.com/Mumbai/S-K-Reshu-General-store-Near-raheja-hospital-Mahim/022PXX22-XX22-131111153014-Y1U3_BZDET?xid=TXVtYmFpIEdlbmVyYWwgU3RvcmVzIE1haGltIEtvbGl3YWRh
Afzal General Stores Near Mahim Railway Station Mahim,0.65 KM,,0 Votes,"Shop No 3, Mahim Mension, M.M.C Road, Mahim, mumbai - 400016, Near Mahim Railway Station",https://www.justdial.com/Mumbai/Afzal-General-Stores-Near-Mahim-Railway-Station-Mahim/022PXX22-XX22-190803112533-E3Q7_BZDET?xid=TXVtYmFpIEdlbmVyYWwgU3RvcmVzIE1haGltIEtvbGl3YWRh
A F General Stores Near Mahim Dargah Mahim,0.66 KM,,0 Votes,"Makhdoomia Manzil Shop No 4, Dargah Street, Mahim, Mumbai - 400016, Near Mahim Dargah",https://www.justdial.com/Mumbai/A-F-General-Stores-Near-Mahim-Dargah-Mahim/022PXX22-XX22-190717195504-N9S6_BZDET?xid=TXVtYmFpIEdlbmVyYWwgU3RvcmVzIE1haGltIEtvbGl3YWRh
Marvel General Stores Near Shobha Refreshments Mahim,0.66 KM,,0 Votes,"Shop No 12, Sainath Building, Opp Shobha Resturant, L.J Road, Mahim, Mumbai - 400016, Near Shobha Refreshments",https://www.justdial.com/Mumbai/Marvel-General-Stores-Near-Shobha-Refreshments-Mahim/022PXX22-XX22-190914101006-D2N1_BZDET?xid=TXVtYmFpIEdlbmVyYWwgU3RvcmVzIE1haGltIEtvbGl3YWRh
Ansari kirana store Mahim,0.67 KM,,0 Votes,"shop no. 4 crystal colony, Senapati Bapat Marg, Mahim, Mumbai - 400016",https://www.justdial.com/Mumbai/Ansari-kirana-store-Mahim/022PXX22-XX22-150813115107-U3J5_BZDET?xid=TXVtYmFpIEdlbmVyYWwgU3RvcmVzIE1haGltIEtvbGl3YWRh
National General Stores Near Billabong School Mahim,0.67 KM,,0 Votes,"Shop No 2, Ata Mention,Opp Billabong International School, L.J Road, Mahim, Mumbai - 400016, Near Billabong School",https://www.justdial.com/Mumbai/National-General-Stores-Near-Billabong-School-Mahim/022PXX22-XX22-190813113038-U1P4_BZDET?xid=TXVtYmFpIEdlbmVyYWwgU3RvcmVzIE1haGltIEtvbGl3YWRh
Guru stores Tea Mart Near Shobha Veg Resturant Matunga West,0.67 KM,,0 Votes,"Sainath Building,Shop No 21, Opp Shobha Resturant, L.J Road, Matunga West, Mumbai - 400016, Near Shobha Veg Resturant",https://www.justdial.com/Mumbai/Guru-stores-Tea-Mart-Near-Shobha-Veg-Resturant-Matunga-West/022PXX22-XX22-190817112334-G1Z9_BZDET?xid=TXVtYmFpIEdlbmVyYWwgU3RvcmVzIE1haGltIEtvbGl3YWRh
Mansoor General Stores Near Parsi Ground Mahim,0.67 KM,,0 Votes,"Inyaat Building, Shop No 18 Near Parsi Ground, M.M.C Road, Mahim, Mumbai - 400016, Near Parsi Ground",https://www.justdial.com/Mumbai/Mansoor-General-Stores-Near-Parsi-Ground-Mahim/022PXX22-XX22-190819113359-D8Y9_BZDET?xid=TXVtYmFpIEdlbmVyYWwgU3RvcmVzIE1haGltIEtvbGl3YWRh
City Light General Stores Mahim,0.67 KM,,0 Votes,"Crystal Building, Shop No 4, Next to Fatima Auto, Soonawala Agiary Lane, Mahim, mumbai - 400016",https://www.justdial.com/Mumbai/City-Light-General-Stores-Mahim/022PXX22-XX22-190916204503-W7V3_BZDET?xid=TXVtYmFpIEdlbmVyYWwgU3RvcmVzIE1haGltIEtvbGl3YWRh
Ansari Kirana And General Stores Near Chamunda Medical and General Store Mahim,0.67 KM,3.0,1 Votes,"Naya Nagar, Baba Saheb Ambedkar Nagar, Sion Link Road, Mahim, Mumbai - 400016, Near Chamunda Medical and General Store",https://www.justdial.com/Mumbai/Ansari-Kirana-And-General-Stores-Near-Chamunda-Medical-and-General-Store-Mahim/022PXX22-XX22-200629140721-B5P1_BZDET?xid=TXVtYmFpIEdlbmVyYWwgU3RvcmVzIE1haGltIEtvbGl3YWRh
Khan Shoping Mart Near Mahim Dargah Mahim,0.68 KM,,0 Votes,"Khatija Bai Metha Building, Shop No 12, Dargah Street ,Mahim, Mumbai, Mahim, Mumbai - 400016, Near Mahim Dargah",https://www.justdial.com/Mumbai/Khan-Shoping-Mart-Near-Mahim-Dargah-Mahim/022PXX22-XX22-190729161952-J5K2_BZDET?xid=TXVtYmFpIEdlbmVyYWwgU3RvcmVzIE1haGltIEtvbGl3YWRh
Janta General Stores Near Mahim Railway Station Mahim,0.68 KM,,0 Votes,"Subhani Building,Shop No 12 Opp Tarzan Bar Restro, M.M.C Road, Mahim, mumbai - 400016, Near Mahim Railway Station",https://www.justdial.com/Mumbai/Janta-General-Stores-Near-Mahim-Railway-Station-Mahim/022PXX22-XX22-190810165636-T8E1_BZDET?xid=TXVtYmFpIEdlbmVyYWwgU3RvcmVzIE1haGltIEtvbGl3YWRh
Salim General Stores Near Canossa High School Mahim,0.69 KM,,0 Votes,"Mahim Mension,Shop No 12,Near Canossa High School, M.M.C Roaf, Mahim, Mumbai - 400016, Near Canossa High School",https://www.justdial.com/Mumbai/Salim-General-Stores-Near-Canossa-High-School-Mahim/022PXX22-XX22-190814112457-W6L1_BZDET?xid=TXVtYmFpIEdlbmVyYWwgU3RvcmVzIE1haGltIEtvbGl3YWRh
Sunder Cafe Near KG Khilnani School Mahim,0.7 KM,4.0,5 Votes,"Navjivan Colony, Mori Road, Mahim, Mumbai - 400016, Near KG Khilnani School",https://www.justdial.com/Mumbai/Sunder-Cafe-Near-KG-Khilnani-School-Mahim/022PXX22-XX22-120320172229-L8Q1_BZDET?xid=TXVtYmFpIEdlbmVyYWwgU3RvcmVzIE1haGltIEtvbGl3YWRh
Jishan Kirana Stores Near Welcome Wafers Mahim,0.71 KM,,0 Votes,"Shop No 1, Attarwali Chawl, Mori Road, Mahim, Mumbai - 400016, Near Welcome Wafers",https://www.justdial.com/Mumbai/Jishan-Kirana-Stores-Near-Welcome-Wafers-Mahim/022PXX22-XX22-170817171054-Q4G8_BZDET?xid=TXVtYmFpIEdlbmVyYWwgU3RvcmVzIE1haGltIEtvbGl3YWRh
Ajwah General Stores Near BMC Building Mahim,0.71 KM,,0 Votes,"Shop No 72 Lohar Chawal, Mahim Dargah Road, Mahim, Mumbai - 400016, Near BMC Building",https://www.justdial.com/Mumbai/Ajwah-General-Stores-Near-BMC-Building-Mahim/022PXX22-XX22-190718200405-H2P9_BZDET?xid=TXVtYmFpIEdlbmVyYWwgU3RvcmVzIE1haGltIEtvbGl3YWRh
Ajwa General Store Opp bmc colony Mahim,0.73 KM,,0 Votes,"shop no, kapad bazar road, Mahim, Mumbai - 400016, opp.bmc colony",https://www.justdial.com/Mumbai/Ajwa-General-Store-Opp-bmc-colony-Mahim/022PXX22-XX22-131220114206-B9S8_BZDET?xid=TXVtYmFpIEdlbmVyYWwgU3RvcmVzIE1haGltIEtvbGl3YWRh
Akbari Bidi Shop Near Mahim Darga Mahim,0.76 KM,,0 Votes,"Shop no. 92, Cadell Road, Mahim, Mumbai - 400016, Near Mahim Darga",https://www.justdial.com/Mumbai/Akbari-Bidi-Shop-Near-Mahim-Darga-Mahim/022PXX22-XX22-130305125008-L6X1_BZDET?xid=TXVtYmFpIEdlbmVyYWwgU3RvcmVzIE1haGltIEtvbGl3YWRh
Bharat General Stores Mahim,0.81 KM,3.0,1 Votes,"Crystal Colony, Sonawala Agiyari Marg, Mahim, Mumbai - 400016",https://www.justdial.com/Mumbai/Bharat-General-Stores-Mahim/022PXX22-XX22-110912001104-V1I6_BZDET?xid=TXVtYmFpIEdlbmVyYWwgU3RvcmVzIE1haGltIEtvbGl3YWRh
Babu Stores Near Datta Mandir Mahim,,5.0,1 Votes,"Shop No 51, Adivasi Rahivashi Sangh, S L Raheja Road, Fishermen Colony, Mahim, Mumbai - 400016, Near Datta Mandir",https://www.justdial.com/Mumbai/Babu-Stores-Near-Datta-Mandir-Mahim/022PXX22-XX22-170819150511-V3Y2_BZDET?xid=TXVtYmFpIEdlbmVyYWwgU3RvcmVzIE1haGltIEtvbGl3YWRh
Savers Choice Near Mahim Police Station Mahim,,5.0,1 Votes,"Al Hussain Co Op Ho Soc,Shop No 5/24, Mahim, Mumbai - 400016, Near Mahim Police Station",https://www.justdial.com/Mumbai/Savers-Choice-Near-Mahim-Police-Station-Mahim/022PXX22-XX22-170910123721-H5M2_BZDET?xid=TXVtYmFpIEdlbmVyYWwgU3RvcmVzIE1haGltIEtvbGl3YWRh
Mary Stores Near Dena Bank Mahim,,,0 Votes,"Pitamber Lane,Shop No 7, Next to Dena Bank, Pitembar Lane, Mahim, Mumbai - 400016, Near Dena Bank",https://www.justdial.com/Mumbai/Mary-Stores-Near-Dena-Bank-Mahim/022PXX22-XX22-190905132638-T4H6_BZDET?xid=TXVtYmFpIEdlbmVyYWwgU3RvcmVzIE1haGltIEtvbGl3YWRh
Gupta General Store Near Railway Station Mahim,,,0 Votes,"Sanaullah Compound, Mahim, Mumbai - 400016, Near Railway Station",https://www.justdial.com/Mumbai/Gupta-General-Store-Near-Railway-Station-Mahim/022PXX22-XX22-191001125231-K1X1_BZDET?xid=TXVtYmFpIEdlbmVyYWwgU3RvcmVzIE1haGltIEtvbGl3YWRh
Emperor Snack Bar Near Axis Bank Mahim,0.84 KM,3.9,14 Votes,"Shop No 3, Shaffi Mansion, Lady Jamshedji Road, Mahim, Mumbai - 400016, Near Axis Bank",https://www.justdial.com/Mumbai/Emperor-Snack-Bar-Near-Axis-Bank-Mahim/022P209496_BZDET?xid=TXVtYmFpIEdlbmVyYWwgU3RvcmVzIE1haGltIEtvbGl3YWRh
Asha General Store Lohar Chawl Mahim,0.85 KM,4.5,2 Votes,"Shop No. 3, Kapad Bazar Road, Mahim, Mumbai - 400016, Lohar Chawl",https://www.justdial.com/Mumbai/Asha-General-Store-Lohar-Chawl-Mahim/022PXX22-XX22-130302120451-B5Q6_BZDET?xid=TXVtYmFpIEdlbmVyYWwgU3RvcmVzIE1haGltIEtvbGl3YWRh
Asif General Store Dargah Mahim,0.85 KM,,0 Votes,"Shop No 01, Lungiwala Building No 25, Mahim, Mumbai - 400016, Dargah",https://www.justdial.com/Mumbai/Asif-General-Store-Dargah-Mahim/022PXX22-XX22-170602174634-E7L7_BZDET?xid=TXVtYmFpIEdlbmVyYWwgU3RvcmVzIE1haGltIEtvbGl3YWRh
Ansari General Stores Mahim,0.86 KM,,0 Votes,"Wanjiwadi West, Mahim, Mumbai - 400016",https://www.justdial.com/Mumbai/Ansari-General-Stores-Mahim/022PXX22-XX22-181225201945-L6V9_BZDET?xid=TXVtYmFpIEdlbmVyYWwgU3RvcmVzIE1haGltIEtvbGl3YWRh
Ivaan General Stores Near Paradise Cinema Mahim,0.86 KM,,0 Votes,"Vaibhav Building, Shop No 9, Next to Paradise Cinema, L.J Road, Mahim, Mumbai - 400016, Near Paradise Cinema",https://www.justdial.com/Mumbai/Ivaan-General-Stores-Near-Paradise-Cinema-Mahim/022PXX22-XX22-190912104102-Y7Z5_BZDET?xid=TXVtYmFpIEdlbmVyYWwgU3RvcmVzIE1haGltIEtvbGl3YWRh
Laxmi Store Janta Sevak Society Mahim,,,0 Votes,"Shop No. 135, Mahim, Mumbai - 400016, Janta Sevak Society",https://www.justdial.com/Mumbai/Laxmi-Store-Janta-Sevak-Society-Mahim/022PXX22-XX22-110112200651-W3H9_BZDET?xid=TXVtYmFpIEdlbmVyYWwgU3RvcmVzIE1haGltIEtvbGl3YWRh
