Name,Distance,Rating,Votes,Address,WebsiteKurla General Stores Near Dipak Cinema Lower Parel,0.93 KM,,0 Votes,"Shop No.6,, N M Joshi Marg, Lower Parel, Mumbai - 400013, Near Dipak Cinema",https://www.justdial.com/Mumbai/Kurla-General-Stores-Near-Dipak-Cinema-Lower-Parel/022PXX22-XX22-151118115225-F6T1_BZDET?xid=TXVtYmFpIEdlbmVyYWwgU3RvcmVzIExvd2VyIFBhcmVs
United General Store Lower Parel,0.96 KM,4.5,25 Votes,"Bdd Chawl, 110, Shivram Seth Amritwar Marg, Hanuman Gali, Lower Parel, Mumbai - 400013",https://www.justdial.com/Mumbai/United-General-Store-Lower-Parel/022PXX22-XX22-180328102047-C2W5_BZDET?xid=TXVtYmFpIEdlbmVyYWwgU3RvcmVzIExvd2VyIFBhcmVs
Sreyhans kirana store Lower Parel,1 KM,,0 Votes,"shop no 6 padmavati building, n.m.joshi marg, Lower Parel, Mumbai - 400013",https://www.justdial.com/Mumbai/Sreyhans-kirana-store-Lower-Parel/022PXX22-XX22-140729131353-J6L3_BZDET?xid=TXVtYmFpIEdlbmVyYWwgU3RvcmVzIExvd2VyIFBhcmVs
Welcome General Stores Lower Parel,1.02 KM,3.3,3 Votes,"Shop No 3, 9C, Kabir Ashram, Pandurang Budhkar Marg, Lower Parel, Mumbai - 400013",https://www.justdial.com/Mumbai/Welcome-General-Stores-Lower-Parel/022PXX22-XX22-120306032526-C5N4_BZDET?xid=TXVtYmFpIEdlbmVyYWwgU3RvcmVzIExvd2VyIFBhcmVs
Shree Swami Samarth Stores Next Deepak Cinema Lower Parel,1.02 KM,4.5,1 Votes,"Shop No.4, N.M. Joshi Marg, Lower Parel, Mumbai - 400013, Next Deepak Cinema",https://www.justdial.com/Mumbai/Shree-Swami-Samarth-Stores-Next-Deepak-Cinema-Lower-Parel/022PXX22-XX22-151105104046-S6F8_BZDET?xid=TXVtYmFpIEdlbmVyYWwgU3RvcmVzIExvd2VyIFBhcmVs
Harikrishna Electric Hardware Store Opposite Deepak Cinema Lower Parel,1.05 KM,4.0,1 Votes,"Shop No.7/8, 33/35 Ziya Masum Chawl, NM Joshi Marg, Lower Parel, Mumbai - 400013, Opposite Deepak Cinema",https://www.justdial.com/Mumbai/Harikrishna-Electric-Hardware-Store-Opposite-Deepak-Cinema-Lower-Parel/022PXX22-XX22-120307215458-J8M7_BZDET?xid=TXVtYmFpIEdlbmVyYWwgU3RvcmVzIExvd2VyIFBhcmVs
Shree Sai Provisional Store Lower Parel,1.05 KM,,0 Votes,"Shop No 1.unity Tower, PB Marg, Lower Parel, Mumbai - 400013",https://www.justdial.com/Mumbai/Shree-Sai-Provisional-Store-Lower-Parel/022PXX22-XX22-190716111926-Z4Z5_BZDET?xid=TXVtYmFpIEdlbmVyYWwgU3RvcmVzIExvd2VyIFBhcmVs
Bhagyalaxmi Provision General Stores NEAR SUMER KENDRA Lower Parel,1.06 KM,,0 Votes,"SHIVSAI BLDG, S S AMRUTWAR MARG, Lower Parel, Mumbai - 400013, NEAR SUMER KENDRA",https://www.justdial.com/Mumbai/Bhagyalaxmi-Provision-General-Stores-NEAR-SUMER-KENDRA-Lower-Parel/022PXX22-XX22-140322104704-C3J2_BZDET?xid=TXVtYmFpIEdlbmVyYWwgU3RvcmVzIExvd2VyIFBhcmVs
Sai General Stores Near India Bull Lower Parel,1.19 KM,3.0,1 Votes,"Shop No:1 Khimji Chawl, Senapati Bapat Marg, Lower Parel, Mumbai - 400013, Near India Bull",https://www.justdial.com/Mumbai/Sai-General-Stores-Near-India-Bull-Lower-Parel/022PXX22-XX22-151107121603-K8M8_BZDET?xid=TXVtYmFpIEdlbmVyYWwgU3RvcmVzIExvd2VyIFBhcmVs
Maharashtra General Stores Near Deepak Cinema Lower Parel,1.19 KM,,0 Votes,"Shop No 2, Bmc Stall, N M Joshi Marg, Lower Parel, Mumbai - 400013, Near Deepak Cinema",https://www.justdial.com/Mumbai/Maharashtra-General-Stores-Near-Deepak-Cinema-Lower-Parel/022PXX22-XX22-160125172709-G6C3_BZDET?xid=TXVtYmFpIEdlbmVyYWwgU3RvcmVzIExvd2VyIFBhcmVs
G L Kirana Store Mahalaxmi SRA Society Lower Parel,1.2 KM,,0 Votes,"Shop No:2,Gopal Chawl, P.B Marg, Lower Parel, Mumbai - 400013, Mahalaxmi SRA Society",https://www.justdial.com/Mumbai/G-L-Kirana-Store-Mahalaxmi-SRA-Society-Lower-Parel/022PXX22-XX22-150914122232-T7P9_BZDET?xid=TXVtYmFpIEdlbmVyYWwgU3RvcmVzIExvd2VyIFBhcmVs
Laxmi General Stores Lower Parel,1.2 KM,,0 Votes,"shop no.5 BDD Chawl, Ganpatrao Kadam Marg, Lower Parel, Mumbai - 400013",https://www.justdial.com/Mumbai/Laxmi-General-Stores-Lower-Parel/022PXX22-XX22-160114184834-C8S7_BZDET?xid=TXVtYmFpIEdlbmVyYWwgU3RvcmVzIExvd2VyIFBhcmVs
Laxmi General Stores PB Marg Worli BDD Chawl Lower Parel,1.22 KM,,0 Votes,"6/AO, Gopal Chawl, BDD Chawl-Lower Parel, Mumbai - 400013, PB Marg, Worli",https://www.justdial.com/Mumbai/Laxmi-General-Stores-PB-Marg-Worli-BDD-Chawl-Lower-Parel/022PXX22-XX22-151114110001-F4V9_BZDET?xid=TXVtYmFpIEdlbmVyYWwgU3RvcmVzIExvd2VyIFBhcmVs
Maharashtra Biscuit Shop Near Worli Lower Parel Lower Parel,1.27 KM,,0 Votes,"Shop No 15 Nahir Mahindra Tower Pb Marg, P.B. Marg, Worli, Ne, PB Marg, Lower Parel, Mumbai - 400013, Near Worli-Lower Parel",https://www.justdial.com/Mumbai/Maharashtra-Biscuit-Shop-Near-Worli-Lower-Parel-Lower-Parel/022PXX22-XX22-151010144654-D5Q3_BZDET?xid=TXVtYmFpIEdlbmVyYWwgU3RvcmVzIExvd2VyIFBhcmVs
Ketan General Stores Near BDD Chawl Lower Parel,1.27 KM,4.5,1 Votes,"Shop No.2, Khimji Chawl, Ganpatrao Kadam Marg, Lower Parel, Mumbai - 400013, Near BDD Chawl",https://www.justdial.com/Mumbai/Ketan-General-Stores-Near-BDD-Chawl-Lower-Parel/022PXX22-XX22-160118100430-E5G2_BZDET?xid=TXVtYmFpIEdlbmVyYWwgU3RvcmVzIExvd2VyIFBhcmVs
LAXMI STORES Opp G South BMC OFFICE Lower Parel,1.28 KM,4.7,4 Votes,"Shop No A-10, Orbit Grand Building, N.M.Joshi Marg, Lower Parel, Mumbai - 400013, Opp G-South BMC OFFICE",https://www.justdial.com/Mumbai/LAXMI-STORES-Opp-G-South-BMC-OFFICE-Lower-Parel/022PCLR20090214IROL943501757_BZDET?xid=TXVtYmFpIEdlbmVyYWwgU3RvcmVzIExvd2VyIFBhcmVs
Krishna General Store Lower Parel,1.88 KM,,0 Votes,"BMC Stall, Shop No.2, Ganpatrao Kadam Marg, Lower Parel, Mumbai - 400013",https://www.justdial.com/Mumbai/Krishna-General-Store-Lower-Parel/022PXX22-XX22-160114101048-D6D7_BZDET?xid=TXVtYmFpIEdlbmVyYWwgU3RvcmVzIExvd2VyIFBhcmVs
Santosh General Stores Lower Parel,,,0 Votes,"Hari Bldg, Dr Batliwala Rd, Lower Parel, Mumbai - 400013",https://www.justdial.com/Mumbai/Santosh-General-Stores-Lower-Parel/022P209574_BZDET?xid=TXVtYmFpIEdlbmVyYWwgU3RvcmVzIExvd2VyIFBhcmVs
Mumbai Oil Depo Opposite Peninsula Business Park Lower Parel,0.14 KM,,0 Votes,"Shop No. 1, Munshi Party Chawl, Ganpatrao Kadam Marg, Lower Parel, Mumbai - 400013, Opposite Peninsula Business Park",https://www.justdial.com/Mumbai/Mumbai-Oil-Depo-Opposite-Peninsula-Business-Park-Lower-Parel/022PXX22-XX22-141115190329-K2M6_BZDET?xid=TXVtYmFpIEdlbmVyYWwgU3RvcmVzIExvd2VyIFBhcmVs
Variety Foods Lower Parel Lower Parel,0.59 KM,,0 Votes,"Shop No.1 Sagar Darshan Building, Senapati Bapat Marg, Lower Parel, Mumbai - 400013, Lower Parel",https://www.justdial.com/Mumbai/Variety-Foods-Lower-Parel-Lower-Parel/022PXX22-XX22-151119163419-Y6I9_BZDET?xid=TXVtYmFpIEdlbmVyYWwgU3RvcmVzIExvd2VyIFBhcmVs
Om General Stores Opp Peninsula Lower Parel,0.63 KM,,0 Votes,"C V Chawl, S N Path, Lower Parel, Mumbai - 400013, Opp Peninsula",https://www.justdial.com/Mumbai/Om-General-Stores-Opp-Peninsula-Lower-Parel/022PXX22-XX22-140319165850-N2S2_BZDET?xid=TXVtYmFpIEdlbmVyYWwgU3RvcmVzIExvd2VyIFBhcmVs
