Name,Distance,Rating,Votes,Address,Website
Reliance Fresh Opposite Shagun Hotel Navjeevan Society Mumbai Central,0.32 KM,3.8,924 Votes,"Central City Mall, Santoshi Mata Durga Co Operative Housing Society, Parekh Holding, Lamington Road, Mumbai Central, Mumbai - 400008, Opposite Shagun Hotel & Navjeevan Society",https://www.justdial.com/Mumbai/Reliance-Fresh-Opposite-Shagun-Hotel-Navjeevan-Society-Mumbai-Central/022P1233741292B2T9P4_BZDET?xid=TXVtYmFpIEdyb2NlcnkgU3RvcmVzIE11bWJhaSBDZW50cmFs
Alka General Stores Mumbai Central,,3.0,1 Votes,"JAI Bhagwan, Walkeshwar Road,, Mumbai Central, Mumbai - 400008",https://www.justdial.com/Mumbai/Alka-General-Stores-Mumbai-Central/022PXX22-XX22-140221102058-B6D1_BZDET?xid=TXVtYmFpIEdyb2NlcnkgU3RvcmVzIE11bWJhaSBDZW50cmFs
Anmol Grain Store Madanpura Mumbai Central,0.18 KM,4.0,1 Votes,"Shop No 7, Mansoor Building, Mohammed Umer Rajjab Road, Mumbai Central, Mumbai - 400008, Madanpura",https://www.justdial.com/Mumbai/Anmol-Grain-Store-Madanpura-Mumbai-Central/022PXX22-XX22-180130165052-D2C1_BZDET?xid=TXVtYmFpIEdyb2NlcnkgU3RvcmVzIE11bWJhaSBDZW50cmFs
Nandu Super Bazaar Near Navjivan Society Opposite Reliance Mall Mumbai Central,0.43 KM,3.9,94 Votes,"Gala No 3/4, Shiv Smruti Building, K K Marg, Mumbai Central, Mumbai - 400008, Near Navjivan Society, Opposite Reliance Mall",https://www.justdial.com/Mumbai/Nandu-Super-Bazaar-Near-Navjivan-Society-Opposite-Reliance-Mall-Mumbai-Central/022PXX22-XX22-110321205355-Q5W2_BZDET?xid=TXVtYmFpIEdyb2NlcnkgU3RvcmVzIE11bWJhaSBDZW50cmFs
Apna Bazar Kamat Market Mumbai Central,,4.0,1 Votes,"Mumbai Central, Mumbai - 400008, Kamat Market",https://www.justdial.com/Mumbai/Apna-Bazar-Kamat-Market-Mumbai-Central/022PXX22-XX22-140530112531-V9N1_BZDET?xid=TXVtYmFpIEdyb2NlcnkgU3RvcmVzIE11bWJhaSBDZW50cmFs
King Of Rice Near Bhavna Baug Kamathipura Mumbai Central,0.85 KM,2.7,2 Votes,"101-A, Shop No. 2, S P Road, 6th, Kamathipura-Mumbai Central, Mumbai - 400008, Near Bhavna Baug",https://www.justdial.com/Mumbai/King-Of-Rice-Near-Bhavna-Baug-Kamathipura-Mumbai-Central/022PCLR20081108IROM712599188_BZDET?xid=TXVtYmFpIEdyb2NlcnkgU3RvcmVzIE11bWJhaSBDZW50cmFs
Apna Bazar Ambekar Nagar Mumbai Central,1.82 KM,3.8,2 Votes,"G Building, Golandaji Hill Road, Mumbai Central, Mumbai - 400008, , Ambekar Nagar",https://www.justdial.com/Mumbai/Apna-Bazar-Ambekar-Nagar-Mumbai-Central/022PXX22-XX22-140530114117-R8B7_BZDET?xid=TXVtYmFpIEdyb2NlcnkgU3RvcmVzIE11bWJhaSBDZW50cmFs
Amrit Medical And General Stores Shambang Mumbai Central,,0.5,1 Votes,"36, N M Joshi Marg, Mumbai Central, Mumbai - 400008, Shambang",https://www.justdial.com/Mumbai/Amrit-Medical-And-General-Stores-Shambang-Mumbai-Central/022PXX22-XX22-140221102340-A3X9_BZDET?xid=TXVtYmFpIEdyb2NlcnkgU3RvcmVzIE11bWJhaSBDZW50cmFs
K Aboobakar Baputty General Store Mumbai Central,,,0 Votes,"Chowty Chamber,, Anandarshram Bhagat Singh Patel Road,, Mumbai Central, Mumbai - 400008",https://www.justdial.com/Mumbai/K-Aboobakar-Baputty-General-Store-Mumbai-Central/022PXX22-XX22-140221104034-B5E2_BZDET?xid=TXVtYmFpIEdyb2NlcnkgU3RvcmVzIE11bWJhaSBDZW50cmFs
Lalji Meghji Mumbai Central,,,0 Votes,"24, Ghas Galli,, Mumbai Central, Mumbai - 400008",https://www.justdial.com/Mumbai/Lalji-Meghji-Mumbai-Central/022PXX22-XX22-140221104757-R2Y5_BZDET?xid=TXVtYmFpIEdyb2NlcnkgU3RvcmVzIE11bWJhaSBDZW50cmFs
Madhuri General Stores Mumbai Central,,,0 Votes,"50, G D Ambekar Road, Laxmi Chambers, Raikar Chawl,, Mumbai Central, Mumbai - 400008",https://www.justdial.com/Mumbai/Madhuri-General-Stores-Mumbai-Central/022PXX22-XX22-140221105117-X1Q4_BZDET?xid=TXVtYmFpIEdyb2NlcnkgU3RvcmVzIE11bWJhaSBDZW50cmFs
Neo Canara General Stores Mumbai Central,,,0 Votes,"Ram Niwas Gupta Chawl, Mohilli Village,, Mumbai Central, Mumbai - 400008",https://www.justdial.com/Mumbai/Neo-Canara-General-Stores-Mumbai-Central/022PXX22-XX22-140221105747-T5F9_BZDET?xid=TXVtYmFpIEdyb2NlcnkgU3RvcmVzIE11bWJhaSBDZW50cmFs
Apna Bazar Mumbai Central,,3.0,1 Votes,"27 Deepanjali Co-Operative Housing Society,, Marve Road,, Mumbai Central, Mumbai - 400008",https://www.justdial.com/Mumbai/Apna-Bazar-Mumbai-Central/022PXX22-XX22-140530113037-E1Z9_BZDET?xid=TXVtYmFpIEdyb2NlcnkgU3RvcmVzIE11bWJhaSBDZW50cmFs
Bedekar Sales Shop Mumbai Central,,,0 Votes,"Bora Bazar,Narayan DAS Wadi Road,Mumbai G.P.O, Mumbai Central, Mumbai - 400008",https://www.justdial.com/Mumbai/Bedekar-Sales-Shop-Mumbai-Central/022PXX22-XX22-140608215607-L2Z8_BZDET?xid=TXVtYmFpIEdyb2NlcnkgU3RvcmVzIE11bWJhaSBDZW50cmFs
Kanti Grain Stores Mumbai Central,,,0 Votes,"Bail Bazar Sandesh Nagar Kurla Andhhri Rd Opp All India Glass Works Andheri(E) Mumbai, Mumbai Central, Mumbai - 400008",https://www.justdial.com/Mumbai/Kanti-Grain-Stores-Mumbai-Central/022PXX22-XX22-140610174705-S8F1_BZDET?xid=TXVtYmFpIEdyb2NlcnkgU3RvcmVzIE11bWJhaSBDZW50cmFs
Chandu Grain Stores Mumbai Central,,5.0,1 Votes,"Murli Upadhyay Chawl Off Aarey Road, Vishweshwar Nagar Mumbai, Mumbai Central, Mumbai - 400008",https://www.justdial.com/Mumbai/Chandu-Grain-Stores-Mumbai-Central/022PXX22-XX22-140611120103-S2U4_BZDET?xid=TXVtYmFpIEdyb2NlcnkgU3RvcmVzIE11bWJhaSBDZW50cmFs
Shivam Grain Stores Mumbai Central,,,0 Votes,"8 Panch Kutir Adi Shankaracharya Marg, I I T Mumbai, Mumbai Central, Mumbai - 400008",https://www.justdial.com/Mumbai/Shivam-Grain-Stores-Mumbai-Central/022PXX22-XX22-140611134332-D9W8_BZDET?xid=TXVtYmFpIEdyb2NlcnkgU3RvcmVzIE11bWJhaSBDZW50cmFs
Hansraj Hemraj General Stores Near Kamathipura Mumbai Central,0.19 KM,3.5,1 Votes,"Shop-10, Murgiwala Chawl, M.R.Marg, Mumbai Central, Mumbai - 400008, Near Kamathipura",https://www.justdial.com/Mumbai/Hansraj-Hemraj-General-Stores-Near-Kamathipura-Mumbai-Central/022PXX22-XX22-130117141704-M6M9_BZDET?xid=TXVtYmFpIEdyb2NlcnkgU3RvcmVzIE11bWJhaSBDZW50cmFs
Meena General Store City Center Mall Mumbai Central,0.21 KM,,0 Votes,"Shop No.5 Taj Manjil, Belasis Road, Mumbai Central, Mumbai - 400008, City Center Mall",https://www.justdial.com/Mumbai/Meena-General-Store-City-Center-Mall-Mumbai-Central/022PXX22-XX22-140705115056-K4L5_BZDET?xid=TXVtYmFpIEdyb2NlcnkgU3RvcmVzIE11bWJhaSBDZW50cmFs
L R General Store Dr Anandrao Nair Road Mumbai Central,0.26 KM,5.0,2 Votes,"Shop No 01, Near Nair Hospital, Mumbai Central, Mumbai - 400008, Dr Anandrao Nair Road",https://www.justdial.com/Mumbai/L-R-General-Store-Dr-Anandrao-Nair-Road-Mumbai-Central/022PXX22-XX22-140714124211-B7Z1_BZDET?xid=TXVtYmFpIEdyb2NlcnkgU3RvcmVzIE11bWJhaSBDZW50cmFs
Central Chana Bhandar Mumbai Central Railway Station Mumbai Central,0.28 KM,3.7,2 Votes,"Shop No.C-32, Central Avenue, Dr. D.B. Marg, Mumbai Central, Mumbai - 400008, Mumbai Central Railway Station",https://www.justdial.com/Mumbai/Central-Chana-Bhandar-Mumbai-Central-Railway-Station-Mumbai-Central/022PXX22-XX22-140131153909-M4K6_BZDET?xid=TXVtYmFpIEdyb2NlcnkgU3RvcmVzIE11bWJhaSBDZW50cmFs
Central Chana Bazar Near Reliance Super Mumbai Central,0.29 KM,4.0,1 Votes,"Shop no C -33, Belasis Road, Mumbai Central, Mumbai - 400008, Near Reliance Super",https://www.justdial.com/Mumbai/Central-Chana-Bazar-Near-Reliance-Super-Mumbai-Central/022PXX22-XX22-140708123540-U2Y5_BZDET?xid=TXVtYmFpIEdyb2NlcnkgU3RvcmVzIE11bWJhaSBDZW50cmFs
Anand Bazar Grain General Stores Belasis Road Mumbai Central,0.3 KM,4.0,1 Votes,"Shop No 6/7/8, Kunj Co-Operative Society, Mohammad Ali Mansion, Mumbai Central, Mumbai - 400008, Belasis Road",https://www.justdial.com/Mumbai/Anand-Bazar-Grain-General-Stores-Belasis-Road-Mumbai-Central/022PXX22-XX22-140721184935-J4G1_BZDET?xid=TXVtYmFpIEdyb2NlcnkgU3RvcmVzIE11bWJhaSBDZW50cmFs
A to Z cake shop Opp Rilayance Mart Mumbai Central,0.32 KM,,0 Votes,"Geetanjali bldg Ground floo, Belasis Road, Mumbai Central, Mumbai - 400008, Opp Rilayance Mart",https://www.justdial.com/Mumbai/A-to-Z-cake-shop-Opp-Rilayance-Mart-Mumbai-Central/022PXX22-XX22-161008151832-T5K1_BZDET?xid=TXVtYmFpIEdyb2NlcnkgU3RvcmVzIE11bWJhaSBDZW50cmFs
Prince Super Market Opp Reliance Super Market Mumbai Central,0.34 KM,,0 Votes,"Shop No.6, Ground Floor, 79/81Jariwala Chawl, Dr. D. B. Marg, Mumbai Central East, Mumbai Central, Mumbai - 400008, Opp. Reliance Super Market",https://www.justdial.com/Mumbai/Prince-Super-Market-Opp-Reliance-Super-Market-Mumbai-Central/022PXX22-XX22-160728113217-G3D3_BZDET?xid=TXVtYmFpIEdyb2NlcnkgU3RvcmVzIE11bWJhaSBDZW50cmFs
Lr Store Near Nair Hospital Mumbai Central,0.35 KM,,0 Votes,"Anad Rao Nair Road,Gate No.1,Shop No.1, Agli Pada Near Railway Statn, Mumbai Central, Mumbai - 400008, Near Nair Hospital",https://www.justdial.com/Mumbai/Lr-Store-Near-Nair-Hospital-Mumbai-Central/022PXX22-XX22-160218203237-V8Y7_BZDET?xid=TXVtYmFpIEdyb2NlcnkgU3RvcmVzIE11bWJhaSBDZW50cmFs
Jalaram Trading Opp Reliance Super Mumbai Central,0.37 KM,,0 Votes,"Shop No 5, Zariwala Bldng, Dr. DB Marg, Mumbai Central, Mumbai - 400008, Opp Reliance Super",https://www.justdial.com/Mumbai/Jalaram-Trading-Opp-Reliance-Super-Mumbai-Central/022PXX22-XX22-140707151502-F2J3_BZDET?xid=TXVtYmFpIEdyb2NlcnkgU3RvcmVzIE11bWJhaSBDZW50cmFs
RCM Bazar Near Reliance Mall Mumbai Central,0.38 KM,4.0,4 Votes,"Shop No 13, Santoshi Mata Society, D B Marg, Mumbai Central, Mumbai - 400008, Near Reliance Mall",https://www.justdial.com/Mumbai/RCM-Bazar-Near-Reliance-Mall-Mumbai-Central/022PXX22-XX22-160406171322-F7F2_BZDET?xid=TXVtYmFpIEdyb2NlcnkgU3RvcmVzIE11bWJhaSBDZW50cmFs
Shivam Traders Near navjivan socity Mumbai Central,0.44 KM,,0 Votes,"Shiv Smruti blg shop no.6, Mumbai Central, Mumbai - 400008, Near navjivan socity",https://www.justdial.com/Mumbai/Shivam-Traders-Near-navjivan-socity-Mumbai-Central/022PXX22-XX22-151224162622-K8B2_BZDET?xid=TXVtYmFpIEdyb2NlcnkgU3RvcmVzIE11bWJhaSBDZW50cmFs
Javeer Provision Mumbai Central,,,0 Votes,"#3, Ready Many Building Sankli Street Mumbai Central Mumbai -400008, Mumbai Central, Mumbai - 400008",https://www.justdial.com/Mumbai/Javeer-Provision-Mumbai-Central/022PXX22-XX22-101027094951-U3F5_BZDET?xid=TXVtYmFpIEdyb2NlcnkgU3RvcmVzIE11bWJhaSBDZW50cmFs
Aman General Store Bostan Hotel Mumbai Central,0.52 KM,,0 Votes,"Shop No 271, Mumbai Central road, Mumbai Central, Mumbai - 400008, Bostan Hotel",https://www.justdial.com/Mumbai/Aman-General-Store-Bostan-Hotel-Mumbai-Central/022PXX22-XX22-140516153401-V5D9_BZDET?xid=TXVtYmFpIEdyb2NlcnkgU3RvcmVzIE11bWJhaSBDZW50cmFs
Guru Meher Stores Mumbai Central,0.58 KM,5.0,1 Votes,"New Municipal Biulding, Shop No: 1, Navjeevan Society, Dalal Estate, K. K. Marg, Mumbai Central, Mumbai - 400008",https://www.justdial.com/Mumbai/Guru-Meher-Stores-Mumbai-Central/022PXX22-XX22-181204045610-D4P3_BZDET?xid=TXVtYmFpIEdyb2NlcnkgU3RvcmVzIE11bWJhaSBDZW50cmFs
Britannia Store Near Menara Cenima Mumbai Central,0.62 KM,0.5,1 Votes,"Shop No. 8, Dr. D B Marg, Mumbai Central, Mumbai - 400008, Near Menara Cenima",https://www.justdial.com/Mumbai/Britannia-Store-Near-Menara-Cenima-Mumbai-Central/022PXX22-XX22-161223102422-F5T3_BZDET?xid=TXVtYmFpIEdyb2NlcnkgU3RvcmVzIE11bWJhaSBDZW50cmFs
Mahakali Traders Near Station Road Mumbai Central,0.63 KM,3.0,1 Votes,"Shop-1 B, I.T.Chawl No.10, Bellasis Road, Mumbai Central, Mumbai - 400008, Near Station Road",https://www.justdial.com/Mumbai/Mahakali-Traders-Near-Station-Road-Mumbai-Central/022PXX22-XX22-130102131408-B7F8_BZDET?xid=TXVtYmFpIEdyb2NlcnkgU3RvcmVzIE11bWJhaSBDZW50cmFs
A J Stores Opp Jain Dairy Mumbai Central,0.64 KM,3.5,2 Votes,"Shop No. 3, Bori Chawl, R S Nimkar Marg, Mumbai Central, Mumbai - 400008, Opp Jain Dairy",https://www.justdial.com/Mumbai/A-J-Stores-Opp-Jain-Dairy-Mumbai-Central/022PXX22-XX22-160326115206-N6U9_BZDET?xid=TXVtYmFpIEdyb2NlcnkgU3RvcmVzIE11bWJhaSBDZW50cmFs
Hemlata Inc Mumbai Central,,4.0,1 Votes,"195,Shop No 1, Mooja Mansion, Maulana Azad Road, Duncan Road, Mumbai Central, Mumbai - 400008",https://www.justdial.com/Mumbai/Hemlata-Inc-Mumbai-Central/022PXX22-XX22-120214224814-E6D7_BZDET?xid=TXVtYmFpIEdyb2NlcnkgU3RvcmVzIE11bWJhaSBDZW50cmFs
WonderMart SuperMarket Opp Salvation Army Mumbai Central,0.7 KM,4.4,5 Votes,"Shop no.8/B Fanuswala bldg ..grd floor, Sankli Street, Mumbai Central, Mumbai - 400008, Opp.Salvation Army",https://www.justdial.com/Mumbai/WonderMart-SuperMarket-Opp-Salvation-Army-Mumbai-Central/022PXX22-XX22-160413174247-D2Y7_BZDET?xid=TXVtYmFpIEdyb2NlcnkgU3RvcmVzIE11bWJhaSBDZW50cmFs
Salim Store Mumbai Central,0.7 KM,,0 Votes,"Nagpada Mumbai, Nagpada, Madanpura, Kamatipura 13th Budh Vihar Marg, Mumbai Central, Mumbai - 400008",https://www.justdial.com/Mumbai/Salim-Store-Mumbai-Central/022PXX22-XX22-180328052541-Q3P7_BZDET?xid=TXVtYmFpIEdyb2NlcnkgU3RvcmVzIE11bWJhaSBDZW50cmFs
Jay Maharashtra general store Near agripada police station Mumbai Central,0.75 KM,,0 Votes,"shop no.24 fancy market, Morland Road, Mumbai Central, Mumbai - 400008, near agripada police station",https://www.justdial.com/Mumbai/Jay-Maharashtra-general-store-Near-agripada-police-station-Mumbai-Central/022PXX22-XX22-140712143408-U3P2_BZDET?xid=TXVtYmFpIEdyb2NlcnkgU3RvcmVzIE11bWJhaSBDZW50cmFs
General Store Hajira Big Masjid Madanpura Mumbai Central,0.76 KM,3.6,5 Votes,"Shope No 2 167 Isa, Molana Azad Road, Madanpura-Mumbai Central, Mumbai - 400008, Big Masjid",https://www.justdial.com/Mumbai/General-Store-Hajira-Big-Masjid-Madanpura-Mumbai-Central/022PXX22-XX22-170810154441-Y2G8_BZDET?xid=TXVtYmFpIEdyb2NlcnkgU3RvcmVzIE11bWJhaSBDZW50cmFs
M Store Gosht Bazar Madanpura Mumbai Central,0.76 KM,,0 Votes,"Shop No 8, Mumbai Central, Mumbai - 400008, Gosht Bazar, Madanpura",https://www.justdial.com/Mumbai/M-Store-Gosht-Bazar-Madanpura-Mumbai-Central/022PXX22-XX22-180131175027-D5Q8_BZDET?xid=TXVtYmFpIEdyb2NlcnkgU3RvcmVzIE11bWJhaSBDZW50cmFs
India Kirana Super Market Kamathipura Mumbai Central,0.76 KM,,0 Votes,"Superme Heights, 2nd Lane, Mumbai Central, Mumbai - 400008, Kamathipura",https://www.justdial.com/Mumbai/India-Kirana-Super-Market-Kamathipura-Mumbai-Central/022PXX22-XX22-180212180022-Q5E3_BZDET?xid=TXVtYmFpIEdyb2NlcnkgU3RvcmVzIE11bWJhaSBDZW50cmFs
Mannat Grain Store Mastan Tank Nagpada Mumbai Central,0.76 KM,,0 Votes,"Shop No 8, Kader Building, Tank Cross Road, Mumbai Central, Mumbai - 400008, Mastan Tank, Nagpada",https://www.justdial.com/Mumbai/Mannat-Grain-Store-Mastan-Tank-Nagpada-Mumbai-Central/022PXX22-XX22-180214154005-U2R1_BZDET?xid=TXVtYmFpIEdyb2NlcnkgU3RvcmVzIE11bWJhaSBDZW50cmFs
Raj Store Near Fauziya Hospital Kamathipura Mumbai Central,0.77 KM,,0 Votes,"Lokhand Wala Building,Shop No. A-311,, Bapti Road, Kamathipura-Mumbai Central, Mumbai - 400008, Near Fauziya Hospital",https://www.justdial.com/Mumbai/Raj-Store-Near-Fauziya-Hospital-Kamathipura-Mumbai-Central/022PXX22-XX22-160826102223-W5S6_BZDET?xid=TXVtYmFpIEdyb2NlcnkgU3RvcmVzIE11bWJhaSBDZW50cmFs
Laxmi General Stores Opposite agripadaPoliceStation Mumbai Central,0.78 KM,,0 Votes,"Shop no 18/19, prabhat Sadan Building, R. B.C marg, Mumbai Central, Mumbai - 400008, Opposite agripadaPoliceStation",https://www.justdial.com/Mumbai/Laxmi-General-Stores-Opposite-agripadaPoliceStation-Mumbai-Central/022PXX22-XX22-160722125244-D7Y2_BZDET?xid=TXVtYmFpIEdyb2NlcnkgU3RvcmVzIE11bWJhaSBDZW50cmFs
Agnes Stores Mumbai Central,0.82 KM,,0 Votes,"Pochkhanwala Road, Sadanand Khada,, Mumbai Central, Mumbai - 400008",https://www.justdial.com/Mumbai/Agnes-Stores-Mumbai-Central/022PXX22-XX22-140221101952-T1C1_BZDET?xid=TXVtYmFpIEdyb2NlcnkgU3RvcmVzIE11bWJhaSBDZW50cmFs
Alif general store Near jhoola maidan Mumbai Central,0.83 KM,,0 Votes,"Hingwala chawl, Meghraj Shetti Marg, Mumbai Central, Mumbai - 400008, Near jhoola maidan",https://www.justdial.com/Mumbai/Alif-general-store-Near-jhoola-maidan-Mumbai-Central/022PXX22-XX22-160520170204-I4F8_BZDET?xid=TXVtYmFpIEdyb2NlcnkgU3RvcmVzIE11bWJhaSBDZW50cmFs
Zainee Store Near Alfred Cinema Mumbai Central,0.86 KM,4.8,4 Votes,"Soonawala Apartment Shop No.9, 13/15 Arab Galli, Mumbai Central, Mumbai - 400008, Near Alfred Cinema",https://www.justdial.com/Mumbai/Zainee-Store-Near-Alfred-Cinema-Mumbai-Central/022PXX22-XX22-150806150905-E5S8_BZDET?xid=TXVtYmFpIEdyb2NlcnkgU3RvcmVzIE11bWJhaSBDZW50cmFs
Merchant Store Mumbai Central,0.87 KM,3.6,7 Votes,"Kamathipura, Shop No 5 Bapty Road, Shop No 5 Bapty Road1 Lane, Mumbai Central, Mumbai - 400008",https://www.justdial.com/Mumbai/Merchant-Store-Mumbai-Central/022PXX22-XX22-180327214341-I6T5_BZDET?xid=TXVtYmFpIEdyb2NlcnkgU3RvcmVzIE11bWJhaSBDZW50cmFs
Yusuf Kirana General Stores Underia Street Nagpada Mumbai Central,0.91 KM,,0 Votes,"Shop No 1, Mumbai Central, Mumbai - 400008, Underia Street, Nagpada",https://www.justdial.com/Mumbai/Yusuf-Kirana-General-Stores-Underia-Street-Nagpada-Mumbai-Central/022PXX22-XX22-180209180006-X3K7_BZDET?xid=TXVtYmFpIEdyb2NlcnkgU3RvcmVzIE11bWJhaSBDZW50cmFs
Zoya Bakery Kirana Store Opp Ksa Grande Mumbai Central,0.96 KM,,0 Votes,"Shop No.1, Sarah Palace (Qureshi Manzil), 3rd Sankli Street, Mumbai Central, Mumbai - 400008, Opp Ksa Grande",https://www.justdial.com/Mumbai/Zoya-Bakery-Kirana-Store-Opp-Ksa-Grande-Mumbai-Central/022PXX22-XX22-151209183124-S1T1_BZDET?xid=TXVtYmFpIEdyb2NlcnkgU3RvcmVzIE11bWJhaSBDZW50cmFs
Vikas Enterprises Calcuttawala East Mumbai Central,1.18 KM,,0 Votes,"Shop No 77, Dr. D B Marg, Mumbai Central, Mumbai - 400008, Calcuttawala East",https://www.justdial.com/Mumbai/Vikas-Enterprises-Calcuttawala-East-Mumbai-Central/022PXX22-XX22-140707150109-Q3N6_BZDET?xid=TXVtYmFpIEdyb2NlcnkgU3RvcmVzIE11bWJhaSBDZW50cmFs
Shanti Grain Store,0.55 KM,,0 Votes,"Dalal Estate, East, Rs Nimkar Marg , Kamathipura, Grani Road, Grani Road K.K. Marg, Mumbai - 400008, Opposite Municipal School",https://www.justdial.com/Mumbai/Shanti-Grain-Store/022PXX22-XX22-181207154011-Y7X2_BZDET?xid=TXVtYmFpIEdyb2NlcnkgU3RvcmVzIE11bWJhaSBDZW50cmFs
Shree Ganesh General Store Near Ganesh Mandir Ghat,,,0 Votes,"Seva Mandal Chawl Barve Nagar, R.B.Kadam Marg, ghat, Mumbai - 400008, Near Ganesh Mandir",https://www.justdial.com/Mumbai/Shree-Ganesh-General-Store-Near-Ganesh-Mandir-Ghat/022PXX22-XX22-140429081019-I3V5_BZDET?xid=TXVtYmFpIEdyb2NlcnkgU3RvcmVzIE11bWJhaSBDZW50cmFs
Naeem Masala Near Gol Deval Temple Null Bazar,1.76 KM,3.6,15 Votes,"Shop No 23 and 24, Mirza Ghalib Market, Matka Gali, Null Bazar, Mumbai - 400003, Near Gol Deval Temple",https://www.justdial.com/Mumbai/Naeem-Masala-Near-Gol-Deval-Temple-Null-Bazar/022PXX22-XX22-190621185122-K9T5_BZDET?xid=TXVtYmFpIEdyb2NlcnkgU3RvcmVzIE11bWJhaSBDZW50cmFs
Kuvarji Khimraj Company Gol Dev Mandir Shiv Mandir Null Bazar,1.59 KM,4.2,44 Votes,"Shop No 132 134, S V P Road, Null Bazar, Mumbai - 400003, Gol Dev Mandir (Shiv Mandir)",https://www.justdial.com/Mumbai/Kuvarji-Khimraj-Company-Gol-Dev-Mandir-Shiv-Mandir-Null-Bazar/022PXX22-XX22-140221104703-D4P5_BZDET?xid=TXVtYmFpIEdyb2NlcnkgU3RvcmVzIE11bWJhaSBDZW50cmFs
Godrej Natures Basket Opposite Mahalaxmi Temple Near Nalli Sarees Warden Road,1.48 KM,4.1,1290 Votes,"Shop No.8, Ground Floor, Tirupati Apartment, Bhulabhai Desai Road, Warden Road, Mumbai - 400026, Opposite Mahalaxmi Temple, Near Nalli Sarees",https://www.justdial.com/Mumbai/Godrej-Natures-Basket-Opposite-Mahalaxmi-Temple-Near-Nalli-Sarees-Warden-Road/022P8006103_BZDET?xid=TXVtYmFpIEdyb2NlcnkgU3RvcmVzIE11bWJhaSBDZW50cmFs
Sahakari Bhandar Next to Amarsons Opposite Breach Candy Hospital Breach Candy,1.64 KM,3.9,253 Votes,"Shop No 63, Bhulabhai Desai Road, Breach Candy, Mumbai - 400026, Next to Amarsons, Opposite Breach Candy Hospital",https://www.justdial.com/Mumbai/Sahakari-Bhandar-Next-to-Amarsons-Opposite-Breach-Candy-Hospital-Breach-Candy/022P651756_BZDET?xid=TXVtYmFpIEdyb2NlcnkgU3RvcmVzIE11bWJhaSBDZW50cmFs
Diamond Stores Opp ACI Cumballa Hospital Kemps Corner,1.29 KM,3.8,22 Votes,"Shop No 96, Bhiwandiwala Building, August Kranti Marg, Kemps Corner, Mumbai - 400026, Opp ACI Cumballa Hospital",https://www.justdial.com/Mumbai/Diamond-Stores-Opp-ACI-Cumballa-Hospital-Kemps-Corner/022PXX22-XX22-000038290740-E7G8_BZDET?xid=TXVtYmFpIEdyb2NlcnkgU3RvcmVzIE11bWJhaSBDZW50cmFs
Sha Raga Ladha Company Near Madhavbaug Temple Cawasji Patel Tank,1.71 KM,4.2,98 Votes,"33, Sindhi Lane, Cawasji Patel Tank, Mumbai - 400004, Near Madhavbaug Temple",https://www.justdial.com/Mumbai/Sha-Raga-Ladha-Company-Near-Madhavbaug-Temple-Cawasji-Patel-Tank/022P8903122_BZDET?xid=TXVtYmFpIEdyb2NlcnkgU3RvcmVzIE11bWJhaSBDZW50cmFs
Apna bazar Opposite Phadkewadi Ganpati Mandir Girgaon,1.62 KM,3.8,179 Votes,"Shop No 136, Tulsi Mansion Building, V P Road, Girgaon, Mumbai - 400004, Opposite Phadkewadi Ganpati Mandir",https://www.justdial.com/Mumbai/Apna-bazar-Opposite-Phadkewadi-Ganpati-Mandir-Girgaon/022PXX22-XX22-120731121224-X9W2_BZDET?xid=TXVtYmFpIEdyb2NlcnkgU3RvcmVzIE11bWJhaSBDZW50cmFs
New Vijay Store Behind Jas Lok Hospital Pedder Road,,4.0,2 Votes,"Shop No:01, 31D, Bhavisha Darshan Building, Altamount Road, Pedder Road, Mumbai - 400026, Behind Jas Lok Hospital",https://www.justdial.com/Mumbai/New-Vijay-Store-Behind-Jas-Lok-Hospital-Pedder-Road/022PXX22-XX22-150804133930-P7F2_BZDET?xid=TXVtYmFpIEdyb2NlcnkgU3RvcmVzIE11bWJhaSBDZW50cmFs
Apna Bazar Opposite Fire Brigade Nana Chowk Grant Road,1.29 KM,3.9,10 Votes,"Ness Baug Building, Grant Road, Mumbai - 400007, Opposite Fire Brigade, Nana Chowk",https://www.justdial.com/Mumbai/Apna-Bazar-Opposite-Fire-Brigade-Nana-Chowk-Grant-Road/022P28341_BZDET?xid=TXVtYmFpIEdyb2NlcnkgU3RvcmVzIE11bWJhaSBDZW50cmFs
Virchand Khimji Co Opposite Two Tank Grant Road,1.25 KM,4.0,35 Votes,"144, Grant Road, Mumbai - 400007, Opposite Two Tank",https://www.justdial.com/Mumbai/Virchand-Khimji-Co-Opposite-Two-Tank-Grant-Road/022P4901828_BZDET?xid=TXVtYmFpIEdyb2NlcnkgU3RvcmVzIE11bWJhaSBDZW50cmFs
Jai Bharat Store Near Bhatia Hospital Grant Road,0.82 KM,3.2,20 Votes,"1/6 Talmaki Wadi 235 F, Tardeo Road, Grant Road, Mumbai - 400007, Near Bhatia Hospital",https://www.justdial.com/Mumbai/Jai-Bharat-Store-Near-Bhatia-Hospital-Grant-Road/022PXX22-XX22-000043649896-J6B3_BZDET?xid=TXVtYmFpIEdyb2NlcnkgU3RvcmVzIE11bWJhaSBDZW50cmFs
Kamdhenu Gowalia Tank Kemps Corner,1.41 KM,4.2,55 Votes,"Shop No. 20, Warden Court Building, Gowalia Tank Road, Kemps Corner, Mumbai - 400006, Gowalia Tank",https://www.justdial.com/Mumbai/Kamdhenu-Gowalia-Tank-Kemps-Corner/022P8127623_BZDET?xid=TXVtYmFpIEdyb2NlcnkgU3RvcmVzIE11bWJhaSBDZW50cmFs
Bhimshi Vershi Company Opp Nalanda Building Pedder Road,1.43 KM,4.2,20 Votes,"63, Mani Mansion, Pedder Road, Mumbai - 400026, Opp Nalanda Building",https://www.justdial.com/Mumbai/Bhimshi-Vershi-Company-Opp-Nalanda-Building-Pedder-Road/022P1224363455R7G4G7_BZDET?xid=TXVtYmFpIEdyb2NlcnkgU3RvcmVzIE11bWJhaSBDZW50cmFs
Patel Brothers Novelty Cinema Grant Road,0.81 KM,4.2,3 Votes,"Shop No 391b, Lt Market, Grant Road, Mumbai - 400007, Novelty Cinema",https://www.justdial.com/Mumbai/Patel-Brothers-Novelty-Cinema-Grant-Road/022PXX22-XX22-150718151159-M9J3_BZDET?xid=TXVtYmFpIEdyb2NlcnkgU3RvcmVzIE11bWJhaSBDZW50cmFs
Devshi Nathubhai Co Near Grant Road Railway Station Grant Road,0.88 KM,4.1,19 Votes,"Shop No 6, 36 D, Avishkar Building, Sleater Road, Grant Road, Mumbai - 400007, Near Grant Road Railway Station",https://www.justdial.com/Mumbai/Devshi-Nathubhai-Co-Near-Grant-Road-Railway-Station-Grant-Road/022PK058514_BZDET?xid=TXVtYmFpIEdyb2NlcnkgU3RvcmVzIE11bWJhaSBDZW50cmFs
Kwik 7 Oasis Mahalaxmi,1.05 KM,4.1,287 Votes,"Suite No 4, Capricon Centre, Vivarea Complex, Sane Guruji Marg, Mahalaxmi, Mumbai - 400011",https://www.justdial.com/Mumbai/Kwik-7-Oasis-Mahalaxmi/022PXX22-XX22-160304094808-V4M3_BZDET?xid=TXVtYmFpIEdyb2NlcnkgU3RvcmVzIE11bWJhaSBDZW50cmFs
Nutan Stores Near Jaslok Hospital Breach Candy,1.11 KM,3.9,9 Votes,"Purnima Apartment, Pedder Road, Breach Candy, Mumbai - 400026, Near Jaslok Hospital",https://www.justdial.com/Mumbai/Nutan-Stores-Near-Jaslok-Hospital-Breach-Candy/022P5648648_BZDET?xid=TXVtYmFpIEdyb2NlcnkgU3RvcmVzIE11bWJhaSBDZW50cmFs
Bharat Stores Next to Jaslok Hospital Pedder Road,1.16 KM,4.3,20 Votes,"19, Shanti Building No 2, Pedder Road, Mumbai - 400026, Next to Jaslok Hospital",https://www.justdial.com/Mumbai/Bharat-Stores-Next-to-Jaslok-Hospital-Pedder-Road/022P8904655_BZDET?xid=TXVtYmFpIEdyb2NlcnkgU3RvcmVzIE11bWJhaSBDZW50cmFs
Yadav Bandhu Jivan Vastu Store Near Station Byculla,1.4 KM,4.0,2 Votes,"Shop No 5,Sumit and Hendre Recidency, MM Joshi Marg, 1st Cross Lanenear Vittal, Byculla, Mumbai - 400027, Near Station,",https://www.justdial.com/Mumbai/Yadav-Bandhu-Jivan-Vastu-Store-Near-Station-Byculla/022PXX22-XX22-161115152106-S8K6_BZDET?xid=TXVtYmFpIEdyb2NlcnkgU3RvcmVzIE11bWJhaSBDZW50cmFs
Amit Stores Mahalaxmi Breach Candy,1.53 KM,4.1,8 Votes,"28/A,Bachubhai Niwas, Bhulabhai Desai Road, Breach Candy, Mumbai - 400026, Mahalaxmi",https://www.justdial.com/Mumbai/Amit-Stores-Mahalaxmi-Breach-Candy/022PXX22-XX22-120312225447-A7A5_BZDET?xid=TXVtYmFpIEdyb2NlcnkgU3RvcmVzIE11bWJhaSBDZW50cmFs
Geetanjali Super Market Opposite Brahman Sabha R R M Roy Marg Charni Road,1.58 KM,4.0,108 Votes,"3/4, Suratwala Building,211, Raja Ram Mohan Roy Marg, Charni Road, Mumbai - 400004, Opposite Brahman Sabha, R R M Roy Marg",https://www.justdial.com/Mumbai/Geetanjali-Super-Market-Opposite-Brahman-Sabha-R-R-M-Roy-Marg-Charni-Road/022PXX22-XX22-000811503617-U9P1_BZDET?xid=TXVtYmFpIEdyb2NlcnkgU3RvcmVzIE11bWJhaSBDZW50cmFs
Shreeji Lad Stores Near Wilson School Khetwadi girgaon,1.71 KM,4.8,4 Votes,"Shop No 112, Laxmi Building, N D Road, Khetwadi-girgaon, Mumbai - 400004, Near Wilson School",https://www.justdial.com/Mumbai/Shreeji-Lad-Stores-Near-Wilson-School-Khetwadi-girgaon/022PXX22-XX22-121231171004-J8G9_BZDET?xid=TXVtYmFpIEdyb2NlcnkgU3RvcmVzIE11bWJhaSBDZW50cmFs
Vishal Super Market Opposite J K Building No 5 Gamdevi,1.04 KM,4.0,47 Votes,"2/3 Royal Chambers, H G Road, Gamdevi, Mumbai - 400007, Opposite J K Building No 5",https://www.justdial.com/Mumbai/Vishal-Super-Market-Opposite-J-K-Building-No-5-Gamdevi/022PXX22-XX22-000981614429-W1D1_BZDET?xid=TXVtYmFpIEdyb2NlcnkgU3RvcmVzIE11bWJhaSBDZW50cmFs
