Name,Distance,Rating,Votes,Address,WebsiteApna Bazar Mumbai Central Station Tardeo,0.41 KM,4.3,4 Votes,"Ganjawala Building, Shaneguruji Marg, Tardeo, Mumbai - 400034, Mumbai Central Station",https://www.justdial.com/Mumbai/Apna-Bazar-Mumbai-Central-Station-Tardeo/022PXX22-XX22-160630104811-I2S1_BZDET?xid=TXVtYmFpIEdyb2NlcnkgU3RvcmVzIE11bWJhaSBDZW50cmFs
New Regal Stores Grant Road,1.04 KM,,0 Votes,"Shop No.5,6, Grant Road, Mumbai - 400007",https://www.justdial.com/Mumbai/New-Regal-Stores-Grant-Road/022PXX22-XX22-161004161056-S4Q4_BZDET?xid=TXVtYmFpIEdyb2NlcnkgU3RvcmVzIE11bWJhaSBDZW50cmFs
Kgn Mini Mart Opposite St Agnes High School Byculla,1.06 KM,4.4,5 Votes,"41/49 B Shop No 10 Habib Park, Mirza Galib Road, Byculla, Mumbai - 400027, Opposite St Agnes High School",https://www.justdial.com/Mumbai/Kgn-Mini-Mart-Opposite-St-Agnes-High-School-Byculla/022PXX22-XX22-181229042831-N2S5_BZDET?xid=TXVtYmFpIEdyb2NlcnkgU3RvcmVzIE11bWJhaSBDZW50cmFs
Bhaskar Store Near Jaslok Hospital Pedder Road,1.14 KM,5.0,1 Votes,"Sukh Shanti Building, Blg No. 2, Shop No. 5, Pedder Road, Mumbai - 400026, Near Jaslok Hospital",https://www.justdial.com/Mumbai/Bhaskar-Store-Near-Jaslok-Hospital-Pedder-Road/022PXX22-XX22-161128122652-N5E8_BZDET?xid=TXVtYmFpIEdyb2NlcnkgU3RvcmVzIE11bWJhaSBDZW50cmFs
Himalaya Store Haji Ali Circle Haji Ali,1.29 KM,3.3,3 Votes,"Karimbhai Manor, Haji Ali, Mumbai - 400034, Haji Ali Circle",https://www.justdial.com/Mumbai/Himalaya-Store-Haji-Ali-Circle-Haji-Ali/022PXX22-XX22-140711200134-I6Q1_BZDET?xid=TXVtYmFpIEdyb2NlcnkgU3RvcmVzIE11bWJhaSBDZW50cmFs
Matru Krupa Opposite No 10th Khetwadi Khetwadi girgaon,1.31 KM,4.0,17 Votes,"Shop No. 5, Ground Floor, Siddhesh Darshan, 199/201, Khetwadi Main Road, Khetwadi-girgaon, Mumbai - 400004, Opposite No. 10th, Khetwadi",https://www.justdial.com/Mumbai/Matru-Krupa-Opposite-No-10th-Khetwadi-Khetwadi-girgaon/022PXX22-XX22-120221193547-J8N9_BZDET?xid=TXVtYmFpIEdyb2NlcnkgU3RvcmVzIE11bWJhaSBDZW50cmFs
Shah Bhimshi Naiya Grocery Store Oppo Dariya Mahal Bus Stop Nepean Sea Road,1.47 KM,3.3,5 Votes,"Stardust Building 1-A , 80 Nepean Sea Road, Nepean Sea Road, Nepean Sea Road, Mumbai - 400006, Oppo Dariya Mahal Bus Stop",https://www.justdial.com/Mumbai/Shah-Bhimshi-Naiya-Grocery-Store-Oppo-Dariya-Mahal-Bus-Stop-Nepean-Sea-Road/022PXX22-XX22-190213175700-F9K7_BZDET?xid=TXVtYmFpIEdyb2NlcnkgU3RvcmVzIE11bWJhaSBDZW50cmFs
Vijay Stores Opposite Mukesh Chowk Nepean Sea Road,1.91 KM,3.7,3 Votes,"10/A, Taher Mansion, Nepean Sea Road, Mumbai - 400006, Opposite Mukesh Chowk",https://www.justdial.com/Mumbai/Vijay-Stores-Opposite-Mukesh-Chowk-Nepean-Sea-Road/022P1238133179M1I5S6_BZDET?xid=TXVtYmFpIEdyb2NlcnkgU3RvcmVzIE11bWJhaSBDZW50cmFs
Sonu Monu Dry Fruits Sweets Namkeen Near Jacab Circal Mahalaxmi,1.39 KM,4.0,20 Votes,"Shop No 12 ,46/A Rasul Bulding, K K Marg, Mahalaxmi, Mumbai - 400011, Near Jacab Circal",https://www.justdial.com/Mumbai/Sonu-Monu-Dry-Fruits-Sweets-Namkeen-Near-Jacab-Circal-Mahalaxmi/022PXX22-XX22-091011295448-IAPP_BZDET?xid=TXVtYmFpIEdyb2NlcnkgU3RvcmVzIE11bWJhaSBDZW50cmFs
Kumkum Provision Stores Opposite Film Centre Tardeo,0.94 KM,4.0,12 Votes,"Shop No 5, Raheja Excellisor, 57 Tardeo Road, Tardeo, Mumbai - 400034, Opposite Film Centre",https://www.justdial.com/Mumbai/Kumkum-Provision-Stores-Opposite-Film-Centre-Tardeo/022P1304704_BZDET?xid=TXVtYmFpIEdyb2NlcnkgU3RvcmVzIE11bWJhaSBDZW50cmFs
Urmila Provision Stores Jacob Circle Mahalaxmi,1.37 KM,3.6,13 Votes,"Sai krupa Shop No 5, K.K. Marg, Mahalaxmi, Mumbai - 400011, Jacob Circle",https://www.justdial.com/Mumbai/Urmila-Provision-Stores-Jacob-Circle-Mahalaxmi/022P1976156_BZDET?xid=TXVtYmFpIEdyb2NlcnkgU3RvcmVzIE11bWJhaSBDZW50cmFs
Sagarmal Mohanlal Opp Bhendi Bazar Null Bazar,1.65 KM,5.0,2 Votes,"Huseinbhai Mansion, 208, Bara Imam Road, Null Bazar, Mumbai - 400003, Opp Bhendi Bazar",https://www.justdial.com/Mumbai/Sagarmal-Mohanlal-Opp-Bhendi-Bazar-Null-Bazar/022PXX22-XX22-140526112231-N2H8_BZDET?xid=TXVtYmFpIEdyb2NlcnkgU3RvcmVzIE11bWJhaSBDZW50cmFs
Navrang Dhanya Bhandar Near Shobha Hotel Warden Road,1.73 KM,,0 Votes,"Shop No 6, K P Trust Building, B 30 Road, Bhulabhai Desai Road, Warden Road, Mumbai - 400026, Near Shobha Hotel",https://www.justdial.com/Mumbai/Navrang-Dhanya-Bhandar-Near-Shobha-Hotel-Warden-Road/022PXX22-XX22-090504143451-S1W8_BZDET?xid=TXVtYmFpIEdyb2NlcnkgU3RvcmVzIE11bWJhaSBDZW50cmFs
Nanji Ujpal And Company Opposite Som Restaurant Near Babulnath Temple Grant Road,1.91 KM,3.8,3 Votes,"Gangadas Wadi, Babulnath Road, Grant Road, Mumbai - 400007, Opposite Som Restaurant, Near Babulnath Temple",https://www.justdial.com/Mumbai/Nanji-Ujpal-And-Company-Opposite-Som-Restaurant-Near-Babulnath-Temple-Grant-Road/022PXX22-XX22-140221105635-G9B9_BZDET?xid=TXVtYmFpIEdyb2NlcnkgU3RvcmVzIE11bWJhaSBDZW50cmFs
Vijay Stores Kelewadi Corner Girgaon,1.92 KM,4.0,4 Votes,"Shop No 212-A, Bapu Balwant Building, J S S Road, Girgaon, Mumbai - 400004, Kelewadi Corner",https://www.justdial.com/Mumbai/Vijay-Stores-Kelewadi-Corner-Girgaon/022PXX22-XX22-140120110257-R7D7_BZDET?xid=TXVtYmFpIEdyb2NlcnkgU3RvcmVzIE11bWJhaSBDZW50cmFs
Kohinoor Masala Kirana Store Near Jhoola Maidan Agripada,0.79 KM,4.6,13 Votes,"Shop No 25 Fancy Market, Morland Road, Agripada, Mumbai - 400011, Near Jhoola Maidan",https://www.justdial.com/Mumbai/Kohinoor-Masala-Kirana-Store-Near-Jhoola-Maidan-Agripada/022PXX22-XX22-180201164014-E1C2_BZDET?xid=TXVtYmFpIEdyb2NlcnkgU3RvcmVzIE11bWJhaSBDZW50cmFs
Roman Dry Fruits Near Harikrishandas Hospital Opera House,1.48 KM,3.8,14 Votes,"457, Pheonix Building, S V P Road, Opera House, Mumbai - 400004, Near Harikrishandas Hospital",https://www.justdial.com/Mumbai/Roman-Dry-Fruits-Near-Harikrishandas-Hospital-Opera-House/022PXX22-XX22-000976124803-K6J6_BZDET?xid=TXVtYmFpIEdyb2NlcnkgU3RvcmVzIE11bWJhaSBDZW50cmFs
Pramanik Provision Stores Opposite Bhatia Hospital Kailash Nagar Tardeo,0.29 KM,4.4,12 Votes,"658, Tardeo Road, Tardeo, Mumbai - 400007, Opposite Bhatia Hospital, Kailash Nagar",https://www.justdial.com/Mumbai/Pramanik-Provision-Stores-Opposite-Bhatia-Hospital-Kailash-Nagar-Tardeo/022PXX22-XX22-101004134538-V9U4_BZDET?xid=TXVtYmFpIEdyb2NlcnkgU3RvcmVzIE11bWJhaSBDZW50cmFs
Chedda Chemist General Store Next Garant Road Post Office Grant Road,0.6 KM,4.3,43 Votes,"13 jyoti mahal, Sleater road, Grant Road, Mumbai - 400007, Next Garant Road Post Office",https://www.justdial.com/Mumbai/Chedda-Chemist-General-Store-Next-Garant-Road-Post-Office-Grant-Road/022PXX22-XX22-090526040847-N3N7_BZDET?xid=TXVtYmFpIEdyb2NlcnkgU3RvcmVzIE11bWJhaSBDZW50cmFs
Consumers Food Near railway station Grant Road,0.63 KM,3.0,5 Votes,"Shop no. 92 Chaman manzil, Chaman Road, Grant Road, Mumbai - 400007, near railway station",https://www.justdial.com/Mumbai/Consumers-Food-Near-railway-station-Grant-Road/022PXX22-XX22-140214112954-X7J3_BZDET?xid=TXVtYmFpIEdyb2NlcnkgU3RvcmVzIE11bWJhaSBDZW50cmFs
Ashok Stores Tardeo,0.66 KM,3.9,4 Votes,"225/227 Dun Shopping Centre Shop No 34-35, Tardeo Road, Tardeo, Mumbai - 400007",https://www.justdial.com/Mumbai/Ashok-Stores-Tardeo/022P1226416972T8J8L4_BZDET?xid=TXVtYmFpIEdyb2NlcnkgU3RvcmVzIE11bWJhaSBDZW50cmFs
Gupta General Store Agripada,0.83 KM,5.0,2 Votes,"20-22, A Prabhat Building, Agripada, Mumbai - 400011",https://www.justdial.com/Mumbai/Gupta-General-Store-Agripada/022PXX22-XX22-161018164937-J4Z3_BZDET?xid=TXVtYmFpIEdyb2NlcnkgU3RvcmVzIE11bWJhaSBDZW50cmFs
Soni Moni Provision Stores Tardeo,0.99 KM,4.3,6 Votes,"Shop No 18 Sahakar Niwas, 20 Tardeo Road, Tardeo, Mumbai - 400034",https://www.justdial.com/Mumbai/Soni-Moni-Provision-Stores-Tardeo/022PXX22-XX22-000067937551-S5I0_BZDET?xid=TXVtYmFpIEdyb2NlcnkgU3RvcmVzIE11bWJhaSBDZW50cmFs
