Name,Distance,Rating,Votes,Address,Website
Joshi Super Mart,,5.0,3 Votes,"Shop No 1,2,3, Sai Velocity Phase, 2, Pune, Paud Road, Mumbai - 400021",https://www.justdial.com/Mumbai/Joshi-Super-Mart/022PXX22-XX22-191116092255-X7G7_BZDET?xid=TXVtYmFpIEdyb2NlcnkgU3RvcmVzIE5hcmltYW4gUG9pbnQ=
Star Market A TATA And Tesco Enterprise Near Churchgate Railway Station Beside KC and HR Churchgate,0.5 KM,4.2,1734 Votes,"123, Mistry Bhavan, Dinshaw Vacha Road, Churchgate, Mumbai - 400020, Near Churchgate Railway Station, Beside KC and HR",https://www.justdial.com/Mumbai/Star-Market-A-TATA-And-Tesco-Enterprise-Near-Churchgate-Railway-Station-Beside-KC-and-HR-Churchgate/022PXX22-XX22-171211111839-F7T9_BZDET?xid=TXVtYmFpIEdyb2NlcnkgU3RvcmVzIE5hcmltYW4gUG9pbnQ=
Sahakari Bhandar Opposite to GPO Near Bus Depot Next to Sassoon Dock Colaba,1.63 KM,3.9,1532 Votes,"Shop No 21, Colaba Chamber, Shahid Bhagat Singh Marg, Colaba, Mumbai - 400005, Opposite to GPO, Near Bus Depot, Next to Sassoon Dock",https://www.justdial.com/Mumbai/Sahakari-Bhandar-Opposite-to-GPO-Near-Bus-Depot-Next-to-Sassoon-Dock-Colaba/022P4001125_BZDET?xid=TXVtYmFpIEdyb2NlcnkgU3RvcmVzIE5hcmltYW4gUG9pbnQ=
Godrej Natures Basket Near Kc College Churchgate,0.66 KM,4.1,753 Votes,"Ground Floor, Apeejay House, 3, Dinshaw Vacha Road, Churchgate, Mumbai - 400020, Near Kc College",https://www.justdial.com/Mumbai/Godrej-Natures-Basket-Near-Kc-College-Churchgate/022PXX22-XX22-101026152238-Q8X3_BZDET?xid=TXVtYmFpIEdyb2NlcnkgU3RvcmVzIE5hcmltYW4gUG9pbnQ=
Godrej Natures Basket Opposite IDBI Bank Cuffe Parade colaba,1.47 KM,4.1,715 Votes,"Plot No 30 A, Ground Floor, Shopping Arcade, World Trade Center, JD Somani Road, Cuffe Parade-colaba, Mumbai - 400005, Opposite IDBI Bank",https://www.justdial.com/Mumbai/Godrej-Natures-Basket-Opposite-IDBI-Bank-Cuffe-Parade-colaba/022P8012353_BZDET?xid=TXVtYmFpIEdyb2NlcnkgU3RvcmVzIE5hcmltYW4gUG9pbnQ=
King Plaza Supermarket Medical Near World Trade Center Cuffe Parade colaba,1.3 KM,4.0,188 Votes,"Shop No F/3, Maker Arcade Shopping Centre, Gs Somani Marg, Cuffe Parade-colaba, Mumbai - 400005, Near World Trade Center",https://www.justdial.com/Mumbai/King-Plaza-Supermarket-Medical-Near-World-Trade-Center-Cuffe-Parade-colaba/022PXX22-XX22-000848274093-B2T2_BZDET?xid=TXVtYmFpIEdyb2NlcnkgU3RvcmVzIE5hcmltYW4gUG9pbnQ=
Shiv Plaza Super Market Opposite HDFC Bank Colaba,1.31 KM,4.1,163 Votes,"Shop No 1/2 Arsiwala Building,59/61, Wode House Road, Colaba, Mumbai - 400005, Opposite HDFC Bank",https://www.justdial.com/Mumbai/Shiv-Plaza-Super-Market-Opposite-HDFC-Bank-Colaba/022PXX22-XX22-170228163739-F5K1_BZDET?xid=TXVtYmFpIEdyb2NlcnkgU3RvcmVzIE5hcmltYW4gUG9pbnQ=
Students General Stores Cuffe Parade colaba,1.28 KM,4.2,155 Votes,"625, G D Somani Memorial School, Cuffe Parade-colaba, Mumbai - 400005",https://www.justdial.com/Mumbai/Students-General-Stores-Cuffe-Parade-colaba/022P603052_BZDET?xid=TXVtYmFpIEdyb2NlcnkgU3RvcmVzIE5hcmltYW4gUG9pbnQ=
Janta Super Market Colaba Market Colaba,1.23 KM,4.8,9 Votes,"Shop No 03, Colaba Mansion, Lala Nigam Road, Colaba, Mumbai - 400005, Colaba Market",https://www.justdial.com/Mumbai/Janta-Super-Market-Colaba-Market-Colaba/022PXX22-XX22-150220181011-E9N3_BZDET?xid=TXVtYmFpIEdyb2NlcnkgU3RvcmVzIE5hcmltYW4gUG9pbnQ=
Welcome Stores Opposite Indu Clinic Colaba,1.27 KM,3.9,59 Votes,"Shop No 9, New 57/A, Arsiwala Building, Wodehouse Road, Colaba, Mumbai - 400005, Opposite Indu Clinic",https://www.justdial.com/Mumbai/Welcome-Stores-Opposite-Indu-Clinic-Colaba/022PXX22-XX22-100512172447-B1T6_BZDET?xid=TXVtYmFpIEdyb2NlcnkgU3RvcmVzIE5hcmltYW4gUG9pbnQ=
Maratha Stores Near Dena Bank Colaba,1.14 KM,3.7,110 Votes,"40/A, Dena Bank Building, Shahid Bhagat Singh Marg, 3rd Pasta Lane, Colaba, Mumbai - 400005, Near Dena Bank",https://www.justdial.com/Mumbai/Maratha-Stores-Near-Dena-Bank-Colaba/022P8402998_BZDET?xid=TXVtYmFpIEdyb2NlcnkgU3RvcmVzIE5hcmltYW4gUG9pbnQ=
Patel Brothers Near yes ub academy school Marine Drive,1.71 KM,3.8,37 Votes,"Shop No 3, Badrikeshwar Building No 82, Marine Drive, Mumbai - 400020, near yes ub academy school",https://www.justdial.com/Mumbai/Patel-Brothers-Near-yes-ub-academy-school-Marine-Drive/022P1850125_BZDET?xid=TXVtYmFpIEdyb2NlcnkgU3RvcmVzIE5hcmltYW4gUG9pbnQ=
Patel General Stores Near Colaba Post Office Colaba,1.7 KM,3.5,15 Votes,"Shop No 20, Hampton Court, Shahid Bhagat Singh Road, Colaba, Mumbai - 400005, Near Colaba Post Office",https://www.justdial.com/Mumbai/Patel-General-Stores-Near-Colaba-Post-Office-Colaba/022PXX22-XX22-120309032402-C1F2_BZDET?xid=TXVtYmFpIEdyb2NlcnkgU3RvcmVzIE5hcmltYW4gUG9pbnQ=
Ketan Store Apollo Bandar Colaba,1.19 KM,3.4,8 Votes,"Sugra Manzil, Lala Nigam Road, Colaba, Mumbai - 400005, Apollo Bandar",https://www.justdial.com/Mumbai/Ketan-Store-Apollo-Bandar-Colaba/022PXX22-XX22-000684034828-E2S8_BZDET?xid=TXVtYmFpIEdyb2NlcnkgU3RvcmVzIE5hcmltYW4gUG9pbnQ=
Shah Vasanji Damji Opposite Badshah Cold Drink House Opposite CID Office Crawford Market,1.89 KM,4.0,18 Votes,"Shop No 376/377/378, D N Road, Crawford Market, Mumbai - 400001, Opposite Badshah Cold Drink House, Opposite CID Office",https://www.justdial.com/Mumbai/Shah-Vasanji-Damji-Opposite-Badshah-Cold-Drink-House-Opposite-CID-Office-Crawford-Market/022PPE70553_BZDET?xid=TXVtYmFpIEdyb2NlcnkgU3RvcmVzIE5hcmltYW4gUG9pbnQ=
Fair Price Shop Opposite Samrat Hotel Churchgate,0.52 KM,4.0,71 Votes,"Shop No 4, 195, Moti Mahal, J T Road, Churchgate, Mumbai - 400020, Opposite Samrat Hotel",https://www.justdial.com/Mumbai/Fair-Price-Shop-Opposite-Samrat-Hotel-Churchgate/022P1850093_BZDET?xid=TXVtYmFpIEdyb2NlcnkgU3RvcmVzIE5hcmltYW4gUG9pbnQ=
Jyoti Grain Stores Bhd Satyam Collection Churchgate,0.68 KM,3.9,22 Votes,"Shop No 4 Chheda Sadan Grd Flr, J Tata Road, Churchgate, Mumbai - 400020, Bhd Satyam Collection",https://www.justdial.com/Mumbai/Jyoti-Grain-Stores-Bhd-Satyam-Collection-Churchgate/022PXX22-XX22-001078231953-O1F5_BZDET?xid=TXVtYmFpIEdyb2NlcnkgU3RvcmVzIE5hcmltYW4gUG9pbnQ=
Nagrik Stores Opp MTNL Building Cuffe Parade Colaba,,2.0,1 Votes,"G D Somani Road, Cuffe Parade-Colaba, Mumbai - 400005, opp MTNL Building",https://www.justdial.com/Mumbai/Nagrik-Stores-Opp-MTNL-Building-Cuffe-Parade-Colaba/022PXX22-XX22-110117200438-J8U5_BZDET?xid=TXVtYmFpIEdyb2NlcnkgU3RvcmVzIE5hcmltYW4gUG9pbnQ=
New Colaba Super Market Opposite Dena Bank Colaba,1.18 KM,4.1,29 Votes,"Shop No 1, Ruby Terrace, Lala Nigam Road, Colaba, Mumbai - 400005, Opposite Dena Bank",https://www.justdial.com/Mumbai/New-Colaba-Super-Market-Opposite-Dena-Bank-Colaba/022PXX22-XX22-091025205939-Q6Z3_BZDET?xid=TXVtYmFpIEdyb2NlcnkgU3RvcmVzIE5hcmltYW4gUG9pbnQ=
New Variety General Stores Near Colaba Post Office Colaba,1.31 KM,3.6,8 Votes,"Shop No 22, Hampton Court, Shahid Bhagat Singh Road, Colaba, Mumbai - 400005, Near Colaba Post Office",https://www.justdial.com/Mumbai/New-Variety-General-Stores-Near-Colaba-Post-Office-Colaba/022PXX22-XX22-000586420181-X2K3_BZDET?xid=TXVtYmFpIEdyb2NlcnkgU3RvcmVzIE5hcmltYW4gUG9pbnQ=
K J Mart Opposite Adamji Peerbhai Market Marine Lines,1.94 KM,3.7,6 Votes,"Shop No 21, Bhiwandiwala Terrace, 2nd Dhobhighat Lane, Marine Lines, Mumbai - 400020, Opposite Adamji Peerbhai Market",https://www.justdial.com/Mumbai/K-J-Mart-Opposite-Adamji-Peerbhai-Market-Marine-Lines/022PXX22-XX22-160926130947-R1R1_BZDET?xid=TXVtYmFpIEdyb2NlcnkgU3RvcmVzIE5hcmltYW4gUG9pbnQ=
Joseph Company Opp Naval Public School Colaba,1.18 KM,4.3,7 Votes,"Shop No 4, Pipewala Bldg, 4th Pasta Lane, Colaba, Mumbai - 400005, Opp Naval Public School",https://www.justdial.com/Mumbai/Joseph-Company-Opp-Naval-Public-School-Colaba/022P8903505_BZDET?xid=TXVtYmFpIEdyb2NlcnkgU3RvcmVzIE5hcmltYW4gUG9pbnQ=
Mahavir Provision Stores Colaba Market Colaba,1.33 KM,3.5,13 Votes,"Shalimar Shopping Centre, Lala Nigam Road, Colaba, Mumbai - 400005, Colaba Market",https://www.justdial.com/Mumbai/Mahavir-Provision-Stores-Colaba-Market-Colaba/022PXX22-XX22-120309195235-D5N7_BZDET?xid=TXVtYmFpIEdyb2NlcnkgU3RvcmVzIE5hcmltYW4gUG9pbnQ=
Ration Issue Centre Near Bus Depot Number 3 Navy Nagar Colaba,,4.0,1 Votes,"Colaba, Mumbai - 400005, Near Bus Depot Number 3, Navy Nagar",https://www.justdial.com/Mumbai/Ration-Issue-Centre-Near-Bus-Depot-Number-3-Navy-Nagar-Colaba/022PXX22-XX22-130719110043-B9Q8_BZDET?xid=TXVtYmFpIEdyb2NlcnkgU3RvcmVzIE5hcmltYW4gUG9pbnQ=
Janta Provision Stores Fort,1.6 KM,,0 Votes,"165, Bora Bazar Street, Fort, Mumbai - 400001",https://www.justdial.com/Mumbai/Janta-Provision-Stores-Fort/022PXX22-XX22-130216125732-B8S1_BZDET?xid=TXVtYmFpIEdyb2NlcnkgU3RvcmVzIE5hcmltYW4gUG9pbnQ=
Om Grocery Store,,,0 Votes,Mumbai - 400001,https://www.justdial.com/Mumbai/Om-Grocery-Store/022PXX22-XX22-180416190104-K7A9_BZDET?xid=TXVtYmFpIEdyb2NlcnkgU3RvcmVzIE5hcmltYW4gUG9pbnQ=
Alpha General Store Opp Stationary Zone Fort,1.75 KM,4.3,6 Votes,"95 Sai Bihar, Modi Street, Fort, Mumbai - 400001, Opp. Stationary Zone",https://www.justdial.com/Mumbai/Alpha-General-Store-Opp-Stationary-Zone-Fort/022PXX22-XX22-101022174019-Y6K2_BZDET?xid=TXVtYmFpIEdyb2NlcnkgU3RvcmVzIE5hcmltYW4gUG9pbnQ=
Britannia Grain Stores Opposite Baptist Church Near Colaba Post Office Colaba,1.84 KM,4.0,19 Votes,"Shop No 4, Daulat Building, Shahid Bhagat Singh Road,Colaba, Colaba, Mumbai - 400005, Opposite Baptist Church, Near Colaba Post Office",https://www.justdial.com/Mumbai/Britannia-Grain-Stores-Opposite-Baptist-Church-Near-Colaba-Post-Office-Colaba/022P1224354303C9R7A8_BZDET?xid=TXVtYmFpIEdyb2NlcnkgU3RvcmVzIE5hcmltYW4gUG9pbnQ=
Bhawaniprasad Ramdas Co Fort,1.84 KM,,0 Votes,"10 Smt Meena Mehta Marg, Fort, Mumbai - 400001",https://www.justdial.com/Mumbai/Bhawaniprasad-Ramdas-Co-Fort/022P1950229_BZDET?xid=TXVtYmFpIEdyb2NlcnkgU3RvcmVzIE5hcmltYW4gUG9pbnQ=
Sangam Stores Colaba Market Colaba,1.2 KM,3.7,8 Votes,"Shop No 2, Building No 24, Indumati Sakarikar Marg, Colaba, Mumbai - 400005, Colaba Market",https://www.justdial.com/Mumbai/Sangam-Stores-Colaba-Market-Colaba/022PXX22-XX22-130107152612-H2R9_BZDET?xid=TXVtYmFpIEdyb2NlcnkgU3RvcmVzIE5hcmltYW4gUG9pbnQ=
Vinayak Dry Fruits Near Antique Hotel Colaba,1.22 KM,3.0,1 Votes,"Shop 3, 15/17 Indumati Sakrikar Path, Colaba, Mumbai - 400005, Near Antique Hotel",https://www.justdial.com/Mumbai/Vinayak-Dry-Fruits-Near-Antique-Hotel-Colaba/022PXX22-XX22-140210165617-H3U4_BZDET?xid=TXVtYmFpIEdyb2NlcnkgU3RvcmVzIE5hcmltYW4gUG9pbnQ=
Janta Oil Tea Centre Near Telaphone Bhavan Colaba,1.25 KM,3.0,1 Votes,"Shop No A1, Gala House, Lala Nigam Marg, Colaba, Mumbai - 400005, Near Telaphone Bhavan",https://www.justdial.com/Mumbai/Janta-Oil-Tea-Centre-Near-Telaphone-Bhavan-Colaba/022PXX22-XX22-140203195152-Q8D8_BZDET?xid=TXVtYmFpIEdyb2NlcnkgU3RvcmVzIE5hcmltYW4gUG9pbnQ=
Welcome General Stores Colaba Market Colaba,1.26 KM,3.8,5 Votes,"Shop No 5, Plumber House, Lala Nigam Road, Colaba, Mumbai - 400005, Colaba Market",https://www.justdial.com/Mumbai/Welcome-General-Stores-Colaba-Market-Colaba/022PXX22-XX22-000759465484-K1L7_BZDET?xid=TXVtYmFpIEdyb2NlcnkgU3RvcmVzIE5hcmltYW4gUG9pbnQ=
Milan society stores Opp hanuman mandir Colaba,1.27 KM,,0 Votes,"Shop no 5, om moreshwar bldg, Rajwadkar street, Colaba, Mumbai - 400005, Opp hanuman mandir",https://www.justdial.com/Mumbai/Milan-society-stores-Opp-hanuman-mandir-Colaba/022PXX22-XX22-140212163618-S4K3_BZDET?xid=TXVtYmFpIEdyb2NlcnkgU3RvcmVzIE5hcmltYW4gUG9pbnQ=
Gala Stores Near Rex Bekari Colaba,1.29 KM,5.0,1 Votes,"Shop No 52,, Rajwadkar Street, Colaba, Mumbai - 400005, Near Rex Bekari",https://www.justdial.com/Mumbai/Gala-Stores-Near-Rex-Bekari-Colaba/022PXX22-XX22-130108134154-I5V5_BZDET?xid=TXVtYmFpIEdyb2NlcnkgU3RvcmVzIE5hcmltYW4gUG9pbnQ=
Mahavir Provision General Stores Opposite Modi Clinc Colaba,1.29 KM,3.0,1 Votes,"Shop No A/773, Nowrojee Street, Nowrojee Street, Colaba, Mumbai - 400005, Opposite Modi Clinc",https://www.justdial.com/Mumbai/Mahavir-Provision-General-Stores-Opposite-Modi-Clinc-Colaba/022PXX22-XX22-140217191655-R4E6_BZDET?xid=TXVtYmFpIEdyb2NlcnkgU3RvcmVzIE5hcmltYW4gUG9pbnQ=
Sagar Stores Opposite Bank Of India Colaba,1.55 KM,,0 Votes,"111, Almighty House, Wood House Road, Colaba, Mumbai - 400005, Opposite Bank Of India",https://www.justdial.com/Mumbai/Sagar-Stores-Opposite-Bank-Of-India-Colaba/022PXX22-XX22-140215122453-M9A7_BZDET?xid=TXVtYmFpIEdyb2NlcnkgU3RvcmVzIE5hcmltYW4gUG9pbnQ=
Jadeja Govindji Devji Company Sudama Niwas Fort,1.72 KM,4.5,4 Votes,"58/62, Bora Bazar Street, Fort, Mumbai - 400001, Sudama Niwas",https://www.justdial.com/Mumbai/Jadeja-Govindji-Devji-Company-Sudama-Niwas-Fort/022PXX22-XX22-140611123549-X3S8_BZDET?xid=TXVtYmFpIEdyb2NlcnkgU3RvcmVzIE5hcmltYW4gUG9pbnQ=
Sarvodaya Stores Marine Drive,1.74 KM,3.9,61 Votes,"Shop No 1, Building No 81, Swashray, Hvb Road, Marine Drive, Mumbai - 400020",https://www.justdial.com/Mumbai/Sarvodaya-Stores-Marine-Drive/022PXX22-XX22-110329114542-M7E4_BZDET?xid=TXVtYmFpIEdyb2NlcnkgU3RvcmVzIE5hcmltYW4gUG9pbnQ=
Shakti General Stores Near Colaba Post Officie Colaba,1.78 KM,4.6,8 Votes,"Usha Sadan, Shop No 9, Block A, Shahid Bhagat Singh Road,Colaba, Colaba, Mumbai - 400005, Near Colaba Post Officie",https://www.justdial.com/Mumbai/Shakti-General-Stores-Near-Colaba-Post-Officie-Colaba/022PXX22-XX22-111011122527-P9D8_BZDET?xid=TXVtYmFpIEdyb2NlcnkgU3RvcmVzIE5hcmltYW4gUG9pbnQ=
Pyare Mohan Store Near General Post Office Fort,1.8 KM,5.0,1 Votes,"Sanji Khetsi, 8-A,, Smt Meena Mehta Road,, Fort, Mumbai - 400001, Near General Post Office",https://www.justdial.com/Mumbai/Pyare-Mohan-Store-Near-General-Post-Office-Fort/022PK036493_BZDET?xid=TXVtYmFpIEdyb2NlcnkgU3RvcmVzIE5hcmltYW4gUG9pbnQ=
Apana General Stores Near Colaba Post Office 5 Colaba,1.86 KM,5.0,3 Votes,"Shop No 2, Shirin Building, Shahid Bhagat Singh Road, Colaba, Mumbai - 400005, Near Colaba Post Office 5",https://www.justdial.com/Mumbai/Apana-General-Stores-Near-Colaba-Post-Office-5-Colaba/022PXX22-XX22-120309002103-Q8D1_BZDET?xid=TXVtYmFpIEdyb2NlcnkgU3RvcmVzIE5hcmltYW4gUG9pbnQ=
Suresh General Store Behind Round Masjid Dhobi Talao,1.87 KM,4.3,2 Votes,"Shop No.48, 2nd Marin Street, Dhobi Talao, Mumbai - 400002, Behind Round Masjid",https://www.justdial.com/Mumbai/Suresh-General-Store-Behind-Round-Masjid-Dhobi-Talao/022PXX22-XX22-150814135237-L2X9_BZDET?xid=TXVtYmFpIEdyb2NlcnkgU3RvcmVzIE5hcmltYW4gUG9pbnQ=
Ramesh Gernal Store Near smarat hoteo Churchgate,0.56 KM,,0 Votes,"Shop no 1, J. Tata road, Churchgate, Mumbai - 400020, Near smarat hoteo",https://www.justdial.com/Mumbai/Ramesh-Gernal-Store-Near-smarat-hoteo-Churchgate/022PXX22-XX22-160420144428-G9X1_BZDET?xid=TXVtYmFpIEdyb2NlcnkgU3RvcmVzIE5hcmltYW4gUG9pbnQ=
Gourmet West Opposite Jehangir Art Gallery Kala Ghoda Fort,0.84 KM,4.0,6 Votes,"C/O Westside Store, Ground Floor, Army & Navy Building, 148 M G Road, Fort, Mumbai - 400001, Opposite Jehangir Art Gallery, Kala Ghoda",https://www.justdial.com/Mumbai/Gourmet-West-Opposite-Jehangir-Art-Gallery-Kala-Ghoda-Fort/022PXX22-XX22-130102115426-D6E2_BZDET?xid=TXVtYmFpIEdyb2NlcnkgU3RvcmVzIE5hcmltYW4gUG9pbnQ=
Treat shop Near Jai Hind College Churchgate,0.85 KM,,0 Votes,"Tushar Apt., A-Road, Churchgate, Mumbai - 400020, Near Jai Hind College",https://www.justdial.com/Mumbai/Treat-shop-Near-Jai-Hind-College-Churchgate/022PXX22-XX22-160419132424-A6I2_BZDET?xid=TXVtYmFpIEdyb2NlcnkgU3RvcmVzIE5hcmltYW4gUG9pbnQ=
Magna Nutrition Centre Kala Ghoda Fort,0.87 KM,3.5,12 Votes,"143, Sassoon Building, M G Road, Fort, Mumbai - 400001, Kala Ghoda",https://www.justdial.com/Mumbai/Magna-Nutrition-Centre-Kala-Ghoda-Fort/022PXX22-XX22-000250378383-N1V9_BZDET?xid=TXVtYmFpIEdyb2NlcnkgU3RvcmVzIE5hcmltYW4gUG9pbnQ=
Sai General Store Near Hanuman Mandir Colaba,0.95 KM,,0 Votes,"Mittal Apartment, Strand Road, Colaba, Mumbai - 400005, Near Hanuman Mandir",https://www.justdial.com/Mumbai/Sai-General-Store-Near-Hanuman-Mandir-Colaba/022PXX22-XX22-140712162000-L3K5_BZDET?xid=TXVtYmFpIEdyb2NlcnkgU3RvcmVzIE5hcmltYW4gUG9pbnQ=
Shree Bhagwati Grain Stores Opp colaba Fire Brigade Colaba,,,0 Votes,"Shop No.21, J K Mehta Block,, N A Sawant Marg (Victoria Bunder Road), Colaba, Mumbai - 400005, Opp.colaba Fire Brigade",https://www.justdial.com/Mumbai/Shree-Bhagwati-Grain-Stores-Opp-colaba-Fire-Brigade-Colaba/022PXX22-XX22-120418224847-Y6P3_BZDET?xid=TXVtYmFpIEdyb2NlcnkgU3RvcmVzIE5hcmltYW4gUG9pbnQ=
Vivek Grocery General And Cold Drinks Store Churchgate Churchgate,0.97 KM,5.0,1 Votes,"Imc Marg, Churchgate, Mumbai - 400020, Churchgate",https://www.justdial.com/Mumbai/Vivek-Grocery-General-And-Cold-Drinks-Store-Churchgate-Churchgate/022PXX22-XX22-190723192519-L9M8_BZDET?xid=TXVtYmFpIEdyb2NlcnkgU3RvcmVzIE5hcmltYW4gUG9pbnQ=
Hari Grocery Store Churchgate,1.03 KM,,0 Votes,"C Road, Churchgate, Mumbai - 400020",https://www.justdial.com/Mumbai/Hari-Grocery-Store-Churchgate/022PXX22-XX22-190312211311-G4Q4_BZDET?xid=TXVtYmFpIEdyb2NlcnkgU3RvcmVzIE5hcmltYW4gUG9pbnQ=
Remi Supermarket Near Flora Fountain Masjid Bunder,1.07 KM,1.0,1 Votes,"No 252, Narsi Natha Street, Masjid Bunder, Mumbai - 400003, Near Flora Fountain",https://www.justdial.com/Mumbai/Remi-Supermarket-Near-Flora-Fountain-Masjid-Bunder/022PXX22-XX22-131225143825-X5H2_BZDET?xid=TXVtYmFpIEdyb2NlcnkgU3RvcmVzIE5hcmltYW4gUG9pbnQ=
Amir bread shop Opp colaba sweet mart Colaba,1.11 KM,4.2,4 Votes,"Sukh niwas, 3rd pasta lane, Colaba, Mumbai - 400005, Opp colaba sweet mart",https://www.justdial.com/Mumbai/Amir-bread-shop-Opp-colaba-sweet-mart-Colaba/022PXX22-XX22-140207190808-B6R1_BZDET?xid=TXVtYmFpIEdyb2NlcnkgU3RvcmVzIE5hcmltYW4gUG9pbnQ=
Gupta Kirana Store Fort,1.13 KM,,0 Votes,"Shop-a/1 7303781032, Fort, Mumbai - 400001",https://www.justdial.com/Mumbai/Gupta-Kirana-Store-Fort/022PXX22-XX22-140718152149-K1S1_BZDET?xid=TXVtYmFpIEdyb2NlcnkgU3RvcmVzIE5hcmltYW4gUG9pbnQ=
Easyday Club Fort Fort,1.17 KM,,0 Votes,"Gymkhana Ltd, Azad Maidan, Mahatma Gandhi Road, Fort, Mumbai - 400001, Fort",https://www.justdial.com/Mumbai/Easyday-Club-Fort-Fort/022PXX22-XX22-190717125841-E5F1_BZDET?xid=TXVtYmFpIEdyb2NlcnkgU3RvcmVzIE5hcmltYW4gUG9pbnQ=
Shree Shakti General Store Near jesal park Fort,1.18 KM,,0 Votes,"Shop 11, oswal park, Fort, Mumbai - 400001, near jesal park",https://www.justdial.com/Mumbai/Shree-Shakti-General-Store-Near-jesal-park-Fort/022PXX22-XX22-140724170615-Z3R6_BZDET?xid=TXVtYmFpIEdyb2NlcnkgU3RvcmVzIE5hcmltYW4gUG9pbnQ=
Maruti Stores Near Maratha Bank Colaba,1.21 KM,4.5,2 Votes,"Mohammad Compound, Lala Nigam Road, Colaba, Mumbai - 400005, Near Maratha Bank",https://www.justdial.com/Mumbai/Maruti-Stores-Near-Maratha-Bank-Colaba/022PXX22-XX22-001190928838-W5C7_BZDET?xid=TXVtYmFpIEdyb2NlcnkgU3RvcmVzIE5hcmltYW4gUG9pbnQ=
Bombay Oil Centre Near Telephone Bhawan Colaba,1.23 KM,,0 Votes,"Shop No 5, 15, Lala Nigam Road, Colaba, Mumbai - 400005, Near Telephone Bhawan",https://www.justdial.com/Mumbai/Bombay-Oil-Centre-Near-Telephone-Bhawan-Colaba/022PXX22-XX22-130104131013-F9E5_BZDET?xid=TXVtYmFpIEdyb2NlcnkgU3RvcmVzIE5hcmltYW4gUG9pbnQ=
Krunal general store V n road Fort,1.24 KM,,0 Votes,"shop no 14, Fort, Mumbai - 400001, v n road",https://www.justdial.com/Mumbai/Krunal-general-store-V-n-road-Fort/022PXX22-XX22-140729142014-L4I3_BZDET?xid=TXVtYmFpIEdyb2NlcnkgU3RvcmVzIE5hcmltYW4gUG9pbnQ=
Shanti Super Market Colaba Market Colaba,1.26 KM,4.0,4 Votes,"Shop No 4, Rajwadkar Street, Colaba, Mumbai - 400005, Colaba Market",https://www.justdial.com/Mumbai/Shanti-Super-Market-Colaba-Market-Colaba/022PXX22-XX22-120408213423-H8H6_BZDET?xid=TXVtYmFpIEdyb2NlcnkgU3RvcmVzIE5hcmltYW4gUG9pbnQ=
Colaba Oil Tea Center Colaba Market Colaba,1.27 KM,4.0,1 Votes,"Shop No 1, Plumber House, Lala Nigam Road, Colaba, Mumbai - 400005, Colaba Market",https://www.justdial.com/Mumbai/Colaba-Oil-Tea-Center-Colaba-Market-Colaba/022PXX22-XX22-140225155210-V1P8_BZDET?xid=TXVtYmFpIEdyb2NlcnkgU3RvcmVzIE5hcmltYW4gUG9pbnQ=
Gupta Provision Store Masoob Shopping Centre Near Janmabhoomi Marg Fort,1.28 KM,4.6,9 Votes,"14 Bagh, Wakriwala Building, Shop A/ 1, Pitha Street, Fort, Mumbai - 400001, Masoob Shopping Centre, Near Janmabhoomi Marg",https://www.justdial.com/Mumbai/Gupta-Provision-Store-Masoob-Shopping-Centre-Near-Janmabhoomi-Marg-Fort/022PXX22-XX22-140326135600-U8A9_BZDET?xid=TXVtYmFpIEdyb2NlcnkgU3RvcmVzIE5hcmltYW4gUG9pbnQ=
Gala Stores Colaba,1.29 KM,4.0,3 Votes,"52, Harmos Ji St, Azad Nagar, Colaba, Mumbai - 400005",https://www.justdial.com/Mumbai/Gala-Stores-Colaba/022PXX22-XX22-180411224737-D7X2_BZDET?xid=TXVtYmFpIEdyb2NlcnkgU3RvcmVzIE5hcmltYW4gUG9pbnQ=
Ms Ashok Stores Near Modi Clinic Colaba,1.3 KM,,0 Votes,"37/3 Jaganath Shinde Building, Navroji Road, Colaba, Mumbai - 400005, Near Modi Clinic",https://www.justdial.com/Mumbai/Ms-Ashok-Stores-Near-Modi-Clinic-Colaba/022PXX22-XX22-140218193603-I1E5_BZDET?xid=TXVtYmFpIEdyb2NlcnkgU3RvcmVzIE5hcmltYW4gUG9pbnQ=
Tapan general store Near bakery Colaba,,,0 Votes,"Riya bldge, Wodehouse Road, Colaba, Mumbai - 400005, Near bakery",https://www.justdial.com/Mumbai/Tapan-general-store-Near-bakery-Colaba/022PXX22-XX22-140715133056-F4D2_BZDET?xid=TXVtYmFpIEdyb2NlcnkgU3RvcmVzIE5hcmltYW4gUG9pbnQ=
Jagdish Stores Near Modi Clinic Colaba,1.31 KM,,0 Votes,"Shop No 36/38, Somaya Bldg, Nowrojee Rd, Colaba, Mumbai - 400005, Near Modi Clinic",https://www.justdial.com/Mumbai/Jagdish-Stores-Near-Modi-Clinic-Colaba/022PXX22-XX22-140218194450-S9X6_BZDET?xid=TXVtYmFpIEdyb2NlcnkgU3RvcmVzIE5hcmltYW4gUG9pbnQ=
Irfan kirana store Near Citi Bank Wellington Fountain Fort,1.31 KM,,0 Votes,"12 A. H. D. Building, Pitha street, Wellington Fountain-Fort, Mumbai - 400001, Near Citi Bank",https://www.justdial.com/Mumbai/Irfan-kirana-store-Near-Citi-Bank-Wellington-Fountain-Fort/022PXX22-XX22-150819150802-I3I1_BZDET?xid=TXVtYmFpIEdyb2NlcnkgU3RvcmVzIE5hcmltYW4gUG9pbnQ=
Bansi Studio Fort,1.32 KM,4.8,13 Votes,"Dhun Biulding, Jyoti Studio Compound, Veer Nariman Road, Kala Ghoda, Fort, Mumbai - 400001",https://www.justdial.com/Mumbai/Bansi-Studio-Fort/022PXX22-XX22-170601200434-W7A6_BZDET?xid=TXVtYmFpIEdyb2NlcnkgU3RvcmVzIE5hcmltYW4gUG9pbnQ=
Kodiamma Store Near Fire Station Sasson Dock Colaba,1.33 KM,5.0,1 Votes,"Chottu Terrace, S B S Road, Colaba, Mumbai - 400005, Near Fire Station, Sasson Dock",https://www.justdial.com/Mumbai/Kodiamma-Store-Near-Fire-Station-Sasson-Dock-Colaba/022PXX22-XX22-130109120737-I6L1_BZDET?xid=TXVtYmFpIEdyb2NlcnkgU3RvcmVzIE5hcmltYW4gUG9pbnQ=
Shri Ambika stores Barf Wala Chawl Colaba,1.37 KM,,0 Votes,"Shop No 10, Lala Nigam Road, Colaba, Mumbai - 400005, Barf Wala Chawl",https://www.justdial.com/Mumbai/Shri-Ambika-stores-Barf-Wala-Chawl-Colaba/022PXX22-XX22-140222200626-I6L9_BZDET?xid=TXVtYmFpIEdyb2NlcnkgU3RvcmVzIE5hcmltYW4gUG9pbnQ=
Chandni General Store Fort,1.37 KM,,0 Votes,"Shop No 634, Fort, Mumbai - 400001",https://www.justdial.com/Mumbai/Chandni-General-Store-Fort/022PXX22-XX22-140719114927-W5J5_BZDET?xid=TXVtYmFpIEdyb2NlcnkgU3RvcmVzIE5hcmltYW4gUG9pbnQ=
I G Oil Center Nakwa House Colaba,1.4 KM,,0 Votes,"Shop No 25, Lala Nigam Toad, Colaba, Mumbai - 400005, Nakwa House",https://www.justdial.com/Mumbai/I-G-Oil-Center-Nakwa-House-Colaba/022PXX22-XX22-140222210656-K1L7_BZDET?xid=TXVtYmFpIEdyb2NlcnkgU3RvcmVzIE5hcmltYW4gUG9pbnQ=
Mamata Store Colaba,1.4 KM,,0 Votes,"Apollo Bandar, Lala Nigam Road, Colaba, Mumbai - 400005",https://www.justdial.com/Mumbai/Mamata-Store-Colaba/022PXX22-XX22-181011225434-D4C4_BZDET?xid=TXVtYmFpIEdyb2NlcnkgU3RvcmVzIE5hcmltYW4gUG9pbnQ=
Azad Stores Azad nagar Colaba,1.41 KM,,0 Votes,"Shop no 1, Lala Nigam road, Colaba, Mumbai - 400005, Azad nagar",https://www.justdial.com/Mumbai/Azad-Stores-Azad-nagar-Colaba/022PXX22-XX22-140222203838-Y2W7_BZDET?xid=TXVtYmFpIEdyb2NlcnkgU3RvcmVzIE5hcmltYW4gUG9pbnQ=
Anmol Kirana Store Wellington Fountain fort,1.52 KM,3.0,1 Votes,"Shop No 02, M D Road, Wellington Fountain-fort, Mumbai - 400001",https://www.justdial.com/Mumbai/Anmol-Kirana-Store-Wellington-Fountain-fort/022PXX22-XX22-140722141520-V3X9_BZDET?xid=TXVtYmFpIEdyb2NlcnkgU3RvcmVzIE5hcmltYW4gUG9pbnQ=
Raj store Fort,1.52 KM,,0 Votes,"Shop2 cst station, Fort, Mumbai - 400001",https://www.justdial.com/Mumbai/Raj-store-Fort/022PXX22-XX22-160208183413-N3J2_BZDET?xid=TXVtYmFpIEdyb2NlcnkgU3RvcmVzIE5hcmltYW4gUG9pbnQ=
Mitha Stores Near Sahakari Bhandar Colaba Post Office Colaba,1.59 KM,,0 Votes,"Shop A 6, Agmirlty House, Colaba Cross Lane, Colaba, Mumbai - 400005, Near Sahakari Bhandar, Colaba Post Office",https://www.justdial.com/Mumbai/Mitha-Stores-Near-Sahakari-Bhandar-Colaba-Post-Office-Colaba/022PXX22-XX22-140214192303-S3A5_BZDET?xid=TXVtYmFpIEdyb2NlcnkgU3RvcmVzIE5hcmltYW4gUG9pbnQ=
Adarsh Chana Mart Fort,1.59 KM,,0 Votes,"# 176, Shop No. 5, Mhada Biulding, Bora Bazar St, Borabazar Precinct, Ballard Estate, Fort, Mumbai - 400001",https://www.justdial.com/Mumbai/Adarsh-Chana-Mart-Fort/022PXX22-XX22-180308192327-B5C7_BZDET?xid=TXVtYmFpIEdyb2NlcnkgU3RvcmVzIE5hcmltYW4gUG9pbnQ=
Rajendra Kumar Store Fort,1.61 KM,,0 Votes,"Bhaji Galli, Borabazar Precinct, Ballard Estate, Greater, Fort, Mumbai - 400001",https://www.justdial.com/Mumbai/Rajendra-Kumar-Store-Fort/022PXX22-XX22-181207151218-N3J2_BZDET?xid=TXVtYmFpIEdyb2NlcnkgU3RvcmVzIE5hcmltYW4gUG9pbnQ=
Devshi Moorji Co Opposite Fort Market Fort,1.62 KM,,0 Votes,"184 Modi Street, Mody Street, Fort, Mumbai - 400001, Opposite Fort Market",https://www.justdial.com/Mumbai/Devshi-Moorji-Co-Opposite-Fort-Market-Fort/022P1224799071Z3X6A5_BZDET?xid=TXVtYmFpIEdyb2NlcnkgU3RvcmVzIE5hcmltYW4gUG9pbnQ=
Zala Stores Opp Fort Market Fort,1.64 KM,4.7,3 Votes,"Shop No 170/172 Amina Building, Modi Street, Fort, Mumbai - 400001, Opp Fort Market",https://www.justdial.com/Mumbai/Zala-Stores-Opp-Fort-Market-Fort/022PXX22-XX22-120313000610-D6G6_BZDET?xid=TXVtYmFpIEdyb2NlcnkgU3RvcmVzIE5hcmltYW4gUG9pbnQ=
Kashti Services Colaba,1.68 KM,,0 Votes,"48, Azad Nagar, Sassoon Dock Road, Colaba, Mumbai - 400005",https://www.justdial.com/Mumbai/Kashti-Services-Colaba/022PXX22-XX22-181222014433-I7C6_BZDET?xid=TXVtYmFpIEdyb2NlcnkgU3RvcmVzIE5hcmltYW4gUG9pbnQ=
