Name,Distance,Rating,Votes,Address,Website
Jai Bharat Store Near Bhatia Hospital Grant Road,0.33 KM,3.2,20 Votes,"1/6 Talmaki Wadi 235 F, Tardeo Road, Grant Road, Mumbai - 400007, Near Bhatia Hospital",https://www.justdial.com/Mumbai/Jai-Bharat-Store-Near-Bhatia-Hospital-Grant-Road/022PXX22-XX22-000043649896-J6B3_BZDET?xid=TXVtYmFpIEdyb2NlcnkgU3RvcmVzIFRhcmRlbw==
Apna Bazar Mumbai Central Station Tardeo,0.53 KM,4.3,4 Votes,"Ganjawala Building, Shaneguruji Marg, Tardeo, Mumbai - 400034, Mumbai Central Station",https://www.justdial.com/Mumbai/Apna-Bazar-Mumbai-Central-Station-Tardeo/022PXX22-XX22-160630104811-I2S1_BZDET?xid=TXVtYmFpIEdyb2NlcnkgU3RvcmVzIFRhcmRlbw==
Kumkum Provision Stores Opposite Film Centre Tardeo,1.14 KM,4.0,12 Votes,"Shop No 5, Raheja Excellisor, 57 Tardeo Road, Tardeo, Mumbai - 400034, Opposite Film Centre",https://www.justdial.com/Mumbai/Kumkum-Provision-Stores-Opposite-Film-Centre-Tardeo/022P1304704_BZDET?xid=TXVtYmFpIEdyb2NlcnkgU3RvcmVzIFRhcmRlbw==
Pramanik Provision Stores Opposite Bhatia Hospital Kailash Nagar Tardeo,0.66 KM,4.4,12 Votes,"658, Tardeo Road, Tardeo, Mumbai - 400007, Opposite Bhatia Hospital, Kailash Nagar",https://www.justdial.com/Mumbai/Pramanik-Provision-Stores-Opposite-Bhatia-Hospital-Kailash-Nagar-Tardeo/022PXX22-XX22-101004134538-V9U4_BZDET?xid=TXVtYmFpIEdyb2NlcnkgU3RvcmVzIFRhcmRlbw==
Ashok Stores Tardeo,0.79 KM,3.9,4 Votes,"225/227 Dun Shopping Centre Shop No 34-35, Tardeo Road, Tardeo, Mumbai - 400007",https://www.justdial.com/Mumbai/Ashok-Stores-Tardeo/022P1226416972T8J8L4_BZDET?xid=TXVtYmFpIEdyb2NlcnkgU3RvcmVzIFRhcmRlbw==
Soni Moni Provision Stores Tardeo,1.15 KM,4.3,6 Votes,"Shop No 18 Sahakar Niwas, 20 Tardeo Road, Tardeo, Mumbai - 400034",https://www.justdial.com/Mumbai/Soni-Moni-Provision-Stores-Tardeo/022PXX22-XX22-000067937551-S5I0_BZDET?xid=TXVtYmFpIEdyb2NlcnkgU3RvcmVzIFRhcmRlbw==
Vora Brothers Opposite Gamadia Colony Tardeo,0.33 KM,3.7,3 Votes,"225/227, Dun Shopping Centre,Lallubhai Amichand Compound, Tardeo Road, Tardeo, Mumbai - 400007, Opposite Gamadia Colony",https://www.justdial.com/Mumbai/Vora-Brothers-Opposite-Gamadia-Colony-Tardeo/022PXX22-XX22-101003151837-N2X1_BZDET?xid=TXVtYmFpIEdyb2NlcnkgU3RvcmVzIFRhcmRlbw==
Kamal General Stores Tardeo,,,0 Votes,"384, Tulsiwada Tardeo Road,, Tardeo, Mumbai - 400034",https://www.justdial.com/Mumbai/Kamal-General-Stores-Tardeo/022PXX22-XX22-140221104332-H8F2_BZDET?xid=TXVtYmFpIEdyb2NlcnkgU3RvcmVzIFRhcmRlbw==
JAI Jajau Grahak Society Opp Tardev Police Camp Tardeo,,3.5,2 Votes,"B-3 Sai Leela Co Socity Ground Floor, Tardeo, Mumbai - 400034, Opp Tardev Police Camp",https://www.justdial.com/Mumbai/JAI-Jajau-Grahak-Society-Opp-Tardev-Police-Camp-Tardeo/022PXX22-XX22-170315154127-X1H8_BZDET?xid=TXVtYmFpIEdyb2NlcnkgU3RvcmVzIFRhcmRlbw==
Pradeep General Store Tardeo,,,0 Votes,"Shop Number 4, Vrundavan Building,, M P Will Compuond,, Tardeo, Mumbai - 400034",https://www.justdial.com/Mumbai/Pradeep-General-Store-Tardeo/022PXX22-XX22-170901120950-Q8U1_BZDET?xid=TXVtYmFpIEdyb2NlcnkgU3RvcmVzIFRhcmRlbw==
Bhulabhai Velji Co Opp Hindmata Hotel Tardeo,0.47 KM,5.0,1 Votes,"352/A, Bellasis Bridge, Mumbai Central Station, Tardeo, Mumbai - 400034, Opp. Hindmata Hotel",https://www.justdial.com/Mumbai/Bhulabhai-Velji-Co-Opp-Hindmata-Hotel-Tardeo/022PXX22-XX22-151222093704-B5V4_BZDET?xid=TXVtYmFpIEdyb2NlcnkgU3RvcmVzIFRhcmRlbw==
Shamji Khyshi Co Tardeo,0.53 KM,3.0,1 Votes,"505/8 Hira Kunj Gora Gandi Bldg, Sane Guruji Marg, Tardeo, Mumbai - 400034",https://www.justdial.com/Mumbai/Shamji-Khyshi-Co-Tardeo/022P1226506699H4D2U7_BZDET?xid=TXVtYmFpIEdyb2NlcnkgU3RvcmVzIFRhcmRlbw==
Pooja Provisional Store Behind Tardeo Police Station Tardeo,0.58 KM,,0 Votes,"Shop 3, Transist Camp, M P Mills Compound,, Tardeo, Mumbai - 400034, Behind Tardeo Police Station",https://www.justdial.com/Mumbai/Pooja-Provisional-Store-Behind-Tardeo-Police-Station-Tardeo/022PXX22-XX22-160119103101-G6I3_BZDET?xid=TXVtYmFpIEdyb2NlcnkgU3RvcmVzIFRhcmRlbw==
Ganesh Corporations Opposite Axis Bank Tardeo,0.6 KM,,0 Votes,"Shop No 5, Adam Mahal, 145, Tardeo Road, Tardeo, Mumbai - 400034, Opposite Axis Bank",https://www.justdial.com/Mumbai/Ganesh-Corporations-Opposite-Axis-Bank-Tardeo/022PXX22-XX22-001187820932-B4Z6_BZDET?xid=TXVtYmFpIEdyb2NlcnkgU3RvcmVzIFRhcmRlbw==
Shaikh bhajiwala Tardeo,0.72 KM,4.0,2 Votes,"Dadal Estate, Bane Compound, Tardeo, Mumbai - 400034",https://www.justdial.com/Mumbai/Shaikh-bhajiwala-Tardeo/022PXX22-XX22-200627113226-U4K4_BZDET?xid=TXVtYmFpIEdyb2NlcnkgU3RvcmVzIFRhcmRlbw==
Jinaam Stores Opp Chheda Medical Stores Tardeo,0.73 KM,,0 Votes,"Shop No.6, Yasho Mandir Building, Sane Guruji Road,, Tardeo, Mumbai - 400034, Opp. Chheda Medical Stores",https://www.justdial.com/Mumbai/Jinaam-Stores-Opp-Chheda-Medical-Stores-Tardeo/022PXX22-XX22-140801130637-Q8W6_BZDET?xid=TXVtYmFpIEdyb2NlcnkgU3RvcmVzIFRhcmRlbw==
Shiv Krupa Store Tardeo,0.73 KM,5.0,2 Votes,"Nav Maharashtra Nagar, Janata Nagar, Road, Tardeo, Mumbai - 400034",https://www.justdial.com/Mumbai/Shiv-Krupa-Store-Tardeo/022PXX22-XX22-180901092326-V7C8_BZDET?xid=TXVtYmFpIEdyb2NlcnkgU3RvcmVzIFRhcmRlbw==
Shree Ganesh Store Opposite Rosewood hotel Tardeo,0.88 KM,,0 Votes,"shop no.9,German darshan building, Tulsiwadi RTO Road, Tardeo, Mumbai - 400034, Opposite Rosewood hotel",https://www.justdial.com/Mumbai/Shree-Ganesh-Store-Opposite-Rosewood-hotel-Tardeo/022PXX22-XX22-151202125006-M3B3_BZDET?xid=TXVtYmFpIEdyb2NlcnkgU3RvcmVzIFRhcmRlbw==
Mane brothers Tardeo,0.9 KM,,0 Votes,"Shop no gasswala building, Tardeo, Mumbai - 400034",https://www.justdial.com/Mumbai/Mane-brothers-Tardeo/022PXX22-XX22-140726104729-V9S2_BZDET?xid=TXVtYmFpIEdyb2NlcnkgU3RvcmVzIFRhcmRlbw==
Gajanan general store Near Tulsiwadi post office Tardeo,0.96 KM,,0 Votes,"Shop no-7,Arya nagar, Tardeo, Mumbai - 400034, Near Tulsiwadi post office",https://www.justdial.com/Mumbai/Gajanan-general-store-Near-Tulsiwadi-post-office-Tardeo/022PXX22-XX22-140813113725-U2Z4_BZDET?xid=TXVtYmFpIEdyb2NlcnkgU3RvcmVzIFRhcmRlbw==
Gupta Stores Near Film Centre Tardeo,1.11 KM,,0 Votes,"Shop No. 9, Khandawala Building, Tardeo Road, Tardeo, Mumbai - 400034, Near Film Centre",https://www.justdial.com/Mumbai/Gupta-Stores-Near-Film-Centre-Tardeo/022PXX22-XX22-140726183414-V8S3_BZDET?xid=TXVtYmFpIEdyb2NlcnkgU3RvcmVzIFRhcmRlbw==
Duttatray Provision Stores Tardeo,1.14 KM,,0 Votes,"Shop No 6, Raheja Excelsior, Pandit Madan Mohan Malviya Marg, Tardeo, Mumbai - 400034",https://www.justdial.com/Mumbai/Duttatray-Provision-Stores-Tardeo/022PXX22-XX22-161126061249-X7X9_BZDET?xid=TXVtYmFpIEdyb2NlcnkgU3RvcmVzIFRhcmRlbw==
Gupta provision store Tardeo,1.15 KM,,0 Votes,"9, dawoodbhai fazalbhai blg, Tardeo, Mumbai - 400034",https://www.justdial.com/Mumbai/Gupta-provision-store-Tardeo/022PXX22-XX22-151130144250-A8L8_BZDET?xid=TXVtYmFpIEdyb2NlcnkgU3RvcmVzIFRhcmRlbw==
Saroj General Stores Near Hira Pannalal Shopping Centre Tardeo,1.2 KM,,0 Votes,"Shop No.11, Goundwat Chawl, Tardeo Road, Tardeo, Mumbai - 400034, Near Hira Pannalal Shopping Centre",https://www.justdial.com/Mumbai/Saroj-General-Stores-Near-Hira-Pannalal-Shopping-Centre-Tardeo/022PXX22-XX22-160803130825-C1A7_BZDET?xid=TXVtYmFpIEdyb2NlcnkgU3RvcmVzIFRhcmRlbw==
KBs Fair Price Sobo Central Mall Near Haji Ali Tardeo,1.26 KM,3.9,5 Votes,"Ground Floor, Sobo Central Mall, Tardeo Road, Tardeo, Mumbai - 400034, Near Haji Ali",https://www.justdial.com/Mumbai/KBs-Fair-Price-Sobo-Central-Mall-Near-Haji-Ali-Tardeo/022PXX22-XX22-151130113848-Z5C9_BZDET?xid=TXVtYmFpIEdyb2NlcnkgU3RvcmVzIFRhcmRlbw==
SAVMORE Supermarket Haji Ali Circle Tardeo,1.38 KM,,0 Votes,"Shop No 1, Heera Panna Shopping Arcade, Tulsiwadi RTO Road, Tardeo, Mumbai - 400034, Haji Ali Circle",https://www.justdial.com/Mumbai/SAVMORE-Supermarket-Haji-Ali-Circle-Tardeo/022PXX22-XX22-151211155031-V3U7_BZDET?xid=TXVtYmFpIEdyb2NlcnkgU3RvcmVzIFRhcmRlbw==
Apna Bazar Opposite Fire Brigade Nana Chowk Grant Road,0.54 KM,3.9,10 Votes,"Ness Baug Building, Grant Road, Mumbai - 400007, Opposite Fire Brigade, Nana Chowk",https://www.justdial.com/Mumbai/Apna-Bazar-Opposite-Fire-Brigade-Nana-Chowk-Grant-Road/022P28341_BZDET?xid=TXVtYmFpIEdyb2NlcnkgU3RvcmVzIFRhcmRlbw==
Virchand Khimji Co Opposite Two Tank Grant Road,1.3 KM,4.0,35 Votes,"144, Grant Road, Mumbai - 400007, Opposite Two Tank",https://www.justdial.com/Mumbai/Virchand-Khimji-Co-Opposite-Two-Tank-Grant-Road/022P4901828_BZDET?xid=TXVtYmFpIEdyb2NlcnkgU3RvcmVzIFRhcmRlbw==
Devshi Nathubhai Co Near Grant Road Railway Station Grant Road,0.13 KM,4.1,19 Votes,"Shop No 6, 36 D, Avishkar Building, Sleater Road, Grant Road, Mumbai - 400007, Near Grant Road Railway Station",https://www.justdial.com/Mumbai/Devshi-Nathubhai-Co-Near-Grant-Road-Railway-Station-Grant-Road/022PK058514_BZDET?xid=TXVtYmFpIEdyb2NlcnkgU3RvcmVzIFRhcmRlbw==
Patel Brothers Novelty Cinema Grant Road,0.74 KM,4.2,3 Votes,"Shop No 391b, Lt Market, Grant Road, Mumbai - 400007, Novelty Cinema",https://www.justdial.com/Mumbai/Patel-Brothers-Novelty-Cinema-Grant-Road/022PXX22-XX22-150718151159-M9J3_BZDET?xid=TXVtYmFpIEdyb2NlcnkgU3RvcmVzIFRhcmRlbw==
Vishal Super Market Opposite J K Building No 5 Gamdevi,0.31 KM,4.0,47 Votes,"2/3 Royal Chambers, H G Road, Gamdevi, Mumbai - 400007, Opposite J K Building No 5",https://www.justdial.com/Mumbai/Vishal-Super-Market-Opposite-J-K-Building-No-5-Gamdevi/022PXX22-XX22-000981614429-W1D1_BZDET?xid=TXVtYmFpIEdyb2NlcnkgU3RvcmVzIFRhcmRlbw==
New Regal Stores Grant Road,0.47 KM,,0 Votes,"Shop No.5,6, Grant Road, Mumbai - 400007",https://www.justdial.com/Mumbai/New-Regal-Stores-Grant-Road/022PXX22-XX22-161004161056-S4Q4_BZDET?xid=TXVtYmFpIEdyb2NlcnkgU3RvcmVzIFRhcmRlbw==
Himalaya Store Haji Ali Circle Haji Ali,1.52 KM,3.3,3 Votes,"Karimbhai Manor, Haji Ali, Mumbai - 400034, Haji Ali Circle",https://www.justdial.com/Mumbai/Himalaya-Store-Haji-Ali-Circle-Haji-Ali/022PXX22-XX22-140711200134-I6Q1_BZDET?xid=TXVtYmFpIEdyb2NlcnkgU3RvcmVzIFRhcmRlbw==
Nanji Ujpal And Company Opposite Som Restaurant Near Babulnath Temple Grant Road,1.16 KM,3.8,3 Votes,"Gangadas Wadi, Babulnath Road, Grant Road, Mumbai - 400007, Opposite Som Restaurant, Near Babulnath Temple",https://www.justdial.com/Mumbai/Nanji-Ujpal-And-Company-Opposite-Som-Restaurant-Near-Babulnath-Temple-Grant-Road/022PXX22-XX22-140221105635-G9B9_BZDET?xid=TXVtYmFpIEdyb2NlcnkgU3RvcmVzIFRhcmRlbw==
Consumers Food Near railway station Grant Road,0.14 KM,3.0,5 Votes,"Shop no. 92 Chaman manzil, Chaman Road, Grant Road, Mumbai - 400007, near railway station",https://www.justdial.com/Mumbai/Consumers-Food-Near-railway-station-Grant-Road/022PXX22-XX22-140214112954-X7J3_BZDET?xid=TXVtYmFpIEdyb2NlcnkgU3RvcmVzIFRhcmRlbw==
Chedda Chemist General Store Next Garant Road Post Office Grant Road,0.17 KM,4.3,43 Votes,"13 jyoti mahal, Sleater road, Grant Road, Mumbai - 400007, Next Garant Road Post Office",https://www.justdial.com/Mumbai/Chedda-Chemist-General-Store-Next-Garant-Road-Post-Office-Grant-Road/022PXX22-XX22-090526040847-N3N7_BZDET?xid=TXVtYmFpIEdyb2NlcnkgU3RvcmVzIFRhcmRlbw==
Ranchoddas Bhaichand Sons Grant Road,,3.0,2 Votes,"Grant Road, Mumbai - 400007",https://www.justdial.com/Mumbai/Ranchoddas-Bhaichand-Sons-Grant-Road/022PXX22-XX22-090429166590-IAPP_BZDET?xid=TXVtYmFpIEdyb2NlcnkgU3RvcmVzIFRhcmRlbw==
Home Choice Opp Sbi Bank Grant Road,0.44 KM,4.8,2 Votes,"Shop No-2 Janam Bldg, Forjett Street, Grant Road, Mumbai - 400007, Opp Sbi Bank",https://www.justdial.com/Mumbai/Home-Choice-Opp-Sbi-Bank-Grant-Road/022PXX22-XX22-141120183307-G9N5_BZDET?xid=TXVtYmFpIEdyb2NlcnkgU3RvcmVzIFRhcmRlbw==
Bombay Bazaar Ltd Near Two Tanks Grant Road,1.35 KM,4.0,2 Votes,"258, Moulana Azad Road, Grant Road, Mumbai - 400007, Near Two Tanks",https://www.justdial.com/Mumbai/Bombay-Bazaar-Ltd-Near-Two-Tanks-Grant-Road/022P8402210_BZDET?xid=TXVtYmFpIEdyb2NlcnkgU3RvcmVzIFRhcmRlbw==
Easyday Club,1.69 KM,,0 Votes,"Car Care Center, 43, Simla Nagar, L Jagmohandas Marg, Mumbai - 400007, Malabar Hill",https://www.justdial.com/Mumbai/Easyday-Club/022PXX22-XX22-190814022644-A9Y6_BZDET?xid=TXVtYmFpIEdyb2NlcnkgU3RvcmVzIFRhcmRlbw==
Krupa Stores,0.27 KM,5.0,7 Votes,"Navyug Nivas, Ground Floor, A/6, Society, Mumbai - 400007, Lamington Road",https://www.justdial.com/Mumbai/Krupa-Stores/022PXX22-XX22-191116092555-J2U9_BZDET?xid=TXVtYmFpIEdyb2NlcnkgU3RvcmVzIFRhcmRlbw==
Ashish Supar Market Bhaji gali Grant Road,0.31 KM,,0 Votes,"15 Pillai lodge blg Shankar Seth lane, Grant Road, Mumbai - 400007, Bhaji gali",https://www.justdial.com/Mumbai/Ashish-Supar-Market-Bhaji-gali-Grant-Road/022PXX22-XX22-161227175624-L4C4_BZDET?xid=TXVtYmFpIEdyb2NlcnkgU3RvcmVzIFRhcmRlbw==
Ashok Provision Store Bhaji Market Grant Road,0.33 KM,4.0,2 Votes,"7, Captian House, 24, Shanker Shet Road, Grant Road, Mumbai - 400007, Bhaji Market",https://www.justdial.com/Mumbai/Ashok-Provision-Store-Bhaji-Market-Grant-Road/022PXX22-XX22-091123100957-C8N7_BZDET?xid=TXVtYmFpIEdyb2NlcnkgU3RvcmVzIFRhcmRlbw==
Devji Dhanji Grant Road,0.33 KM,3.7,10 Votes,"Shop No 85, Lokmanya Tilak Market, Grant Road, Mumbai - 400007",https://www.justdial.com/Mumbai/Devji-Dhanji-Grant-Road/022PXX22-XX22-181127123444-A9D4_BZDET?xid=TXVtYmFpIEdyb2NlcnkgU3RvcmVzIFRhcmRlbw==
Malwa Traders Near Railway Station Grant Road,,,0 Votes,"Ground Floor,Shop No 1e,A Wing, M K Ansari Marg,Aara Plan, Grant Road, Mumbai - 400007, Near Railway Station",https://www.justdial.com/Mumbai/Malwa-Traders-Near-Railway-Station-Grant-Road/022PXX22-XX22-090702213808-IAPP_BZDET?xid=TXVtYmFpIEdyb2NlcnkgU3RvcmVzIFRhcmRlbw==
Hemant Store Near Grant Road Delhi Darbar Hotel Grant Road,0.39 KM,,0 Votes,"Ground Floor, Shop No 1 Danewala Building, 5th Kolsa Lane, Pv Marg, Grant Road, Mumbai - 400007, Near Grant Road Delhi Darbar Hotel",https://www.justdial.com/Mumbai/Hemant-Store-Near-Grant-Road-Delhi-Darbar-Hotel-Grant-Road/022P1220347355P4Q4B9_BZDET?xid=TXVtYmFpIEdyb2NlcnkgU3RvcmVzIFRhcmRlbw==
Modi Arjan Lakhu Grant Road,0.42 KM,4.8,4 Votes,"Shop No 10, Siddesh Jyoti Tower, Balaram Street, Grant Road, Mumbai - 400007",https://www.justdial.com/Mumbai/Modi-Arjan-Lakhu-Grant-Road/022PXX22-XX22-111105175241-R6E1_BZDET?xid=TXVtYmFpIEdyb2NlcnkgU3RvcmVzIFRhcmRlbw==
Sansare Shop Nana Chowk Grant Road,0.45 KM,,0 Votes,"Shop No 29,Jobanputra Compound, J D Marg, Grant Road, Mumbai - 400007, Nana Chowk",https://www.justdial.com/Mumbai/Sansare-Shop-Nana-Chowk-Grant-Road/022PXX22-XX22-160716103318-R2D8_BZDET?xid=TXVtYmFpIEdyb2NlcnkgU3RvcmVzIFRhcmRlbw==
Yash General Stores Near Novelty Cinema Grant Road,0.51 KM,,0 Votes,"Shop No 79, Lt Market, Grant Road, Mumbai - 400007, Near Novelty Cinema",https://www.justdial.com/Mumbai/Yash-General-Stores-Near-Novelty-Cinema-Grant-Road/022PXX22-XX22-140827141809-D8G5_BZDET?xid=TXVtYmFpIEdyb2NlcnkgU3RvcmVzIFRhcmRlbw==
Rekha General Stores Grant Road,0.51 KM,,0 Votes,"Grant Road, Mumbai - 400007",https://www.justdial.com/Mumbai/Rekha-General-Stores-Grant-Road/022PXX22-XX22-160630152157-T2M5_BZDET?xid=TXVtYmFpIEdyb2NlcnkgU3RvcmVzIFRhcmRlbw==
Vandna Grain Stores Opposite Railway Station Grant Road,0.52 KM,,0 Votes,"Shop No 48, Union Building, Slater Road, Grant Road, Mumbai - 400007, Opposite Railway Station",https://www.justdial.com/Mumbai/Vandna-Grain-Stores-Opposite-Railway-Station-Grant-Road/022PXX22-XX22-131231102318-E9G3_BZDET?xid=TXVtYmFpIEdyb2NlcnkgU3RvcmVzIFRhcmRlbw==
Shree Krishna General Store Near minarva cinema Grant Road,,2.5,1 Votes,"shop no.4, zeenat manzil, mohammad ali road, Grant Road, Mumbai - 400007, near minarva cinema",https://www.justdial.com/Mumbai/Shree-Krishna-General-Store-Near-minarva-cinema-Grant-Road/022PXX22-XX22-150803120124-R9Y7_BZDET?xid=TXVtYmFpIEdyb2NlcnkgU3RvcmVzIFRhcmRlbw==
Ramdev kirana Near Wine Shop Grant Road,,,0 Votes,"Shop No 13, Rm Road, Grant Road, Mumbai - 400007, Near Wine Shop",https://www.justdial.com/Mumbai/Ramdev-kirana-Near-Wine-Shop-Grant-Road/022PXX22-XX22-151117215347-Y8Q8_BZDET?xid=TXVtYmFpIEdyb2NlcnkgU3RvcmVzIFRhcmRlbw==
Sagar Stores Near Police Station Gamdevi,,,0 Votes,"Shop No.6,36 Sohrab Blg, H.g.road, Gamdevi, Mumbai - 400007, Near Police Station",https://www.justdial.com/Mumbai/Sagar-Stores-Near-Police-Station-Gamdevi/022PXX22-XX22-161226153701-D6X2_BZDET?xid=TXVtYmFpIEdyb2NlcnkgU3RvcmVzIFRhcmRlbw==
Malkani Enterprise Opp Central Bank Of India Grant Road,0.54 KM,,0 Votes,"Durlabha Bhavan, Jalbhai Street, Grant Road, Mumbai - 400007, Opp Central Bank Of India",https://www.justdial.com/Mumbai/Malkani-Enterprise-Opp-Central-Bank-Of-India-Grant-Road/022PXX22-XX22-161103131937-A6U1_BZDET?xid=TXVtYmFpIEdyb2NlcnkgU3RvcmVzIFRhcmRlbw==
Shah provision stores Hotel national Grant Road,0.54 KM,,0 Votes,"Grant, Ladache Ganapathi Chowk, Grant Road, Mumbai - 400007, Hotel national",https://www.justdial.com/Mumbai/Shah-provision-stores-Hotel-national-Grant-Road/022PXX22-XX22-161105125603-A1M4_BZDET?xid=TXVtYmFpIEdyb2NlcnkgU3RvcmVzIFRhcmRlbw==
Saffron Store Near Union Bank Grant Road,0.54 KM,,0 Votes,"Shop No 7 Building No 350, Grant Road, Mumbai - 400007, Near Union Bank",https://www.justdial.com/Mumbai/Saffron-Store-Near-Union-Bank-Grant-Road/022PXX22-XX22-200929130934-F5X4_BZDET?xid=TXVtYmFpIEdyb2NlcnkgU3RvcmVzIFRhcmRlbw==
Shah Devshi Nadadh Company Tulsiwadi,0.56 KM,,0 Votes,"Gashwala Building 876,A, Sane Guruji Marg, Tulsiwadi, Mumbai - 400034",https://www.justdial.com/Mumbai/Shah-Devshi-Nadadh-Company-Tulsiwadi/022PXX22-XX22-140726105251-Q1Y7_BZDET?xid=TXVtYmFpIEdyb2NlcnkgU3RvcmVzIFRhcmRlbw==
Shah Lalji Kachara Co Tulsiwadi,0.61 KM,,0 Votes,"Jariwala Bldg,9, Sane Guruji Marg, Tulsiwadi, Mumbai - 400034",https://www.justdial.com/Mumbai/Shah-Lalji-Kachara-Co-Tulsiwadi/022PXX22-XX22-140802131126-J2Z8_BZDET?xid=TXVtYmFpIEdyb2NlcnkgU3RvcmVzIFRhcmRlbw==
Sumit General Store Near Royal chemist Grant Road,0.72 KM,,0 Votes,"Plot no. 12 data gunj, station road, Grant Road, Mumbai - 400007, Near Royal chemist",https://www.justdial.com/Mumbai/Sumit-General-Store-Near-Royal-chemist-Grant-Road/022PXX22-XX22-140723191228-M3X9_BZDET?xid=TXVtYmFpIEdyb2NlcnkgU3RvcmVzIFRhcmRlbw==
Sai Sagar Dry Fruits General Store Opp Gamdevi Temple Gamdevi,0.76 KM,3.3,3 Votes,"Shop No ,6,36, H.G .road, Gamdevi, Mumbai - 400007, Opp Gamdevi Temple",https://www.justdial.com/Mumbai/Sai-Sagar-Dry-Fruits-General-Store-Opp-Gamdevi-Temple-Gamdevi/022PXX22-XX22-131224162932-R2U7_BZDET?xid=TXVtYmFpIEdyb2NlcnkgU3RvcmVzIFRhcmRlbw==
Amrut Stores Opposite JK Towers Gamdevi,0.77 KM,3.5,5 Votes,"39-47, Goravakar Wadi, H g Road, Gamdevi, Mumbai - 400007, Opposite JK Towers",https://www.justdial.com/Mumbai/Amrut-Stores-Opposite-JK-Towers-Gamdevi/022PXX22-XX22-000988397138-W1V8_BZDET?xid=TXVtYmFpIEdyb2NlcnkgU3RvcmVzIFRhcmRlbw==
Shah Ratilal Ramji Company Gamdevi,0.78 KM,,0 Votes,"J K Building No 3, Gamdevi, Mumbai - 400007",https://www.justdial.com/Mumbai/Shah-Ratilal-Ramji-Company-Gamdevi/022PXX22-XX22-131017002903-V8N4_BZDET?xid=TXVtYmFpIEdyb2NlcnkgU3RvcmVzIFRhcmRlbw==
Joshi Stores Opposite J K Building No 4 Gamdevi,0.79 KM,,0 Votes,"Akhalwaya Building, H G Road, Gamdevi, Mumbai - 400007, Opposite J K Building No 4",https://www.justdial.com/Mumbai/Joshi-Stores-Opposite-J-K-Building-No-4-Gamdevi/022PXX22-XX22-131015002502-L9L4_BZDET?xid=TXVtYmFpIEdyb2NlcnkgU3RvcmVzIFRhcmRlbw==
Vijay grain and provision stores Riddi Siddi Apartment Grant Road,0.86 KM,4.5,2 Votes,"151-153, Khetwadi Back Road, Grant Road, Mumbai - 400007, Riddi Siddi Apartment",https://www.justdial.com/Mumbai/Vijay-grain-and-provision-stores-Riddi-Siddi-Apartment-Grant-Road/022PXX22-XX22-140205153853-C8D9_BZDET?xid=TXVtYmFpIEdyb2NlcnkgU3RvcmVzIFRhcmRlbw==
Babulnath General Store Opposite Babulnath Temple Grant Road,1.21 KM,5.0,1 Votes,"Ratan Lal, Babulnath Road, Grant Road, Mumbai - 400007, Opposite Babulnath Temple",https://www.justdial.com/Mumbai/Babulnath-General-Store-Opposite-Babulnath-Temple-Grant-Road/022PXX22-XX22-131230183145-C2D4_BZDET?xid=TXVtYmFpIEdyb2NlcnkgU3RvcmVzIFRhcmRlbw==
Soni Moni Provision Store Haji Ali,1.31 KM,,0 Votes,"Shop no.15 sahakar niwas, Haji Ali, Mumbai - 400034",https://www.justdial.com/Mumbai/Soni-Moni-Provision-Store-Haji-Ali/022PXX22-XX22-161004140623-S5A7_BZDET?xid=TXVtYmFpIEdyb2NlcnkgU3RvcmVzIFRhcmRlbw==
Shree Khodiyar Enterprises,1.44 KM,4.7,3 Votes,"Mumbai Central West, Arya Nagar, Dr Babasaheb Ambedkar Colony, Mahalakshmi, Mumbai - 400034",https://www.justdial.com/Mumbai/Shree-Khodiyar-Enterprises/022PXX22-XX22-181207154848-A1W5_BZDET?xid=TXVtYmFpIEdyb2NlcnkgU3RvcmVzIFRhcmRlbw==
Fab Inn Super Market Near Haji Ali Dargah Haji Ali,1.45 KM,3.9,55 Votes,"Shop No 3, Heera Panna Shopping Centre, Haji Ali, Haji Ali, Mumbai - 400034, Near Haji Ali Dargah",https://www.justdial.com/Mumbai/Fab-Inn-Super-Market-Near-Haji-Ali-Dargah-Haji-Ali/022P1965174_BZDET?xid=TXVtYmFpIEdyb2NlcnkgU3RvcmVzIFRhcmRlbw==
Diet Tamasha Opposite Oside Heera Haji Ali,1.55 KM,3.0,1 Votes,"Shop No. 5 & 6, Rewa Appartment B, Panna, Bhula Bhai Desai Road, Haji Ali, Mumbai - 400034, Opposite Oside Heera",https://www.justdial.com/Mumbai/Diet-Tamasha-Opposite-Oside-Heera-Haji-Ali/022PXX22-XX22-171223190353-Z9S6_BZDET?xid=TXVtYmFpIEdyb2NlcnkgU3RvcmVzIFRhcmRlbw==
Naeem Masala Near Gol Deval Temple Null Bazar,1.69 KM,3.6,15 Votes,"Shop No 23 and 24, Mirza Ghalib Market, Matka Gali, Null Bazar, Mumbai - 400003, Near Gol Deval Temple",https://www.justdial.com/Mumbai/Naeem-Masala-Near-Gol-Deval-Temple-Null-Bazar/022PXX22-XX22-190621185122-K9T5_BZDET?xid=TXVtYmFpIEdyb2NlcnkgU3RvcmVzIFRhcmRlbw==
Kuvarji Khimraj Company Gol Dev Mandir Shiv Mandir Null Bazar,1.48 KM,4.2,44 Votes,"Shop No 132 134, S V P Road, Null Bazar, Mumbai - 400003, Gol Dev Mandir (Shiv Mandir)",https://www.justdial.com/Mumbai/Kuvarji-Khimraj-Company-Gol-Dev-Mandir-Shiv-Mandir-Null-Bazar/022PXX22-XX22-140221104703-D4P5_BZDET?xid=TXVtYmFpIEdyb2NlcnkgU3RvcmVzIFRhcmRlbw==
Monarch Dry Fruit Opposite Sheetal Baug Bus Stop Walkeshwar,1.87 KM,3.8,43 Votes,"Shop No. 48-50, Surya Darshan Building, Walkeshwar Road, Walkeshwar, Mumbai - 400006, Opposite Sheetal Baug Bus Stop",https://www.justdial.com/Mumbai/Monarch-Dry-Fruit-Opposite-Sheetal-Baug-Bus-Stop-Walkeshwar/022PXX22-XX22-090603024944-G4R7_BZDET?xid=TXVtYmFpIEdyb2NlcnkgU3RvcmVzIFRhcmRlbw==
Reliance Fresh Opposite Shagun Hotel Navjeevan Society Mumbai Central,0.47 KM,3.8,924 Votes,"Central City Mall, Santoshi Mata Durga Co Operative Housing Society, Parekh Holding, Lamington Road, Mumbai Central, Mumbai - 400008, Opposite Shagun Hotel & Navjeevan Society",https://www.justdial.com/Mumbai/Reliance-Fresh-Opposite-Shagun-Hotel-Navjeevan-Society-Mumbai-Central/022P1233741292B2T9P4_BZDET?xid=TXVtYmFpIEdyb2NlcnkgU3RvcmVzIFRhcmRlbw==
Godrej Natures Basket Opposite Mahalaxmi Temple Near Nalli Sarees Warden Road,1.49 KM,4.1,1290 Votes,"Shop No.8, Ground Floor, Tirupati Apartment, Bhulabhai Desai Road, Warden Road, Mumbai - 400026, Opposite Mahalaxmi Temple, Near Nalli Sarees",https://www.justdial.com/Mumbai/Godrej-Natures-Basket-Opposite-Mahalaxmi-Temple-Near-Nalli-Sarees-Warden-Road/022P8006103_BZDET?xid=TXVtYmFpIEdyb2NlcnkgU3RvcmVzIFRhcmRlbw==
Sahakari Bhandar Next to Amarsons Opposite Breach Candy Hospital Breach Candy,1.34 KM,3.9,253 Votes,"Shop No 63, Bhulabhai Desai Road, Breach Candy, Mumbai - 400026, Next to Amarsons, Opposite Breach Candy Hospital",https://www.justdial.com/Mumbai/Sahakari-Bhandar-Next-to-Amarsons-Opposite-Breach-Candy-Hospital-Breach-Candy/022P651756_BZDET?xid=TXVtYmFpIEdyb2NlcnkgU3RvcmVzIFRhcmRlbw==
Sahakari Bhandar Opposite Priyadarshini Park Nepean Sea Road,1.93 KM,4.0,214 Votes,"Hyderabad Estate, B Block, Ground Floor, Nepean Sea Road, Mumbai - 400006, Opposite Priyadarshini Park",https://www.justdial.com/Mumbai/Sahakari-Bhandar-Opposite-Priyadarshini-Park-Nepean-Sea-Road/022PXX22-XX22-100916143840-J6F9_BZDET?xid=TXVtYmFpIEdyb2NlcnkgU3RvcmVzIFRhcmRlbw==
Manilal Provision Store Near Wiaa Club Malabar Hill,1.83 KM,4.1,65 Votes,"Shop No 23, David Sasson Chawl, 10 Ridge Road, Malabar Hill, Mumbai - 400006, Near Wiaa Club",https://www.justdial.com/Mumbai/Manilal-Provision-Store-Near-Wiaa-Club-Malabar-Hill/022P8403916_BZDET?xid=TXVtYmFpIEdyb2NlcnkgU3RvcmVzIFRhcmRlbw==
Diamond Stores Opp ACI Cumballa Hospital Kemps Corner,0.65 KM,3.8,22 Votes,"Shop No 96, Bhiwandiwala Building, August Kranti Marg, Kemps Corner, Mumbai - 400026, Opp ACI Cumballa Hospital",https://www.justdial.com/Mumbai/Diamond-Stores-Opp-ACI-Cumballa-Hospital-Kemps-Corner/022PXX22-XX22-000038290740-E7G8_BZDET?xid=TXVtYmFpIEdyb2NlcnkgU3RvcmVzIFRhcmRlbw==
Sha Raga Ladha Company Near Madhavbaug Temple Cawasji Patel Tank,1.45 KM,4.2,98 Votes,"33, Sindhi Lane, Cawasji Patel Tank, Mumbai - 400004, Near Madhavbaug Temple",https://www.justdial.com/Mumbai/Sha-Raga-Ladha-Company-Near-Madhavbaug-Temple-Cawasji-Patel-Tank/022P8903122_BZDET?xid=TXVtYmFpIEdyb2NlcnkgU3RvcmVzIFRhcmRlbw==
Apna bazar Opposite Phadkewadi Ganpati Mandir Girgaon,1.23 KM,3.8,179 Votes,"Shop No 136, Tulsi Mansion Building, V P Road, Girgaon, Mumbai - 400004, Opposite Phadkewadi Ganpati Mandir",https://www.justdial.com/Mumbai/Apna-bazar-Opposite-Phadkewadi-Ganpati-Mandir-Girgaon/022PXX22-XX22-120731121224-X9W2_BZDET?xid=TXVtYmFpIEdyb2NlcnkgU3RvcmVzIFRhcmRlbw==
Welcome General Store Near Shayadri Guest House Malabar Hill,1.97 KM,4.3,99 Votes,"Shop No 1-1A, Mini Sudarshan Building, 22, LD Ruparel Marg, Malabar Hill, Mumbai - 400006, Near Shayadri Guest House",https://www.justdial.com/Mumbai/Welcome-General-Store-Near-Shayadri-Guest-House-Malabar-Hill/022PXX22-XX22-151229153536-T9D1_BZDET?xid=TXVtYmFpIEdyb2NlcnkgU3RvcmVzIFRhcmRlbw==
New Vijay Store Behind Jas Lok Hospital Pedder Road,,4.0,2 Votes,"Shop No:01, 31D, Bhavisha Darshan Building, Altamount Road, Pedder Road, Mumbai - 400026, Behind Jas Lok Hospital",https://www.justdial.com/Mumbai/New-Vijay-Store-Behind-Jas-Lok-Hospital-Pedder-Road/022PXX22-XX22-150804133930-P7F2_BZDET?xid=TXVtYmFpIEdyb2NlcnkgU3RvcmVzIFRhcmRlbw==
