Name,Distance,Rating,Votes,Address,WebsiteKamdhenu Gowalia Tank Kemps Corner,0.73 KM,4.2,55 Votes,"Shop No. 20, Warden Court Building, Gowalia Tank Road, Kemps Corner, Mumbai - 400006, Gowalia Tank",https://www.justdial.com/Mumbai/Kamdhenu-Gowalia-Tank-Kemps-Corner/022P8127623_BZDET?xid=TXVtYmFpIEdyb2NlcnkgU3RvcmVzIFRhcmRlbw==
Bhimshi Vershi Company Opp Nalanda Building Pedder Road,0.93 KM,4.2,20 Votes,"63, Mani Mansion, Pedder Road, Mumbai - 400026, Opp Nalanda Building",https://www.justdial.com/Mumbai/Bhimshi-Vershi-Company-Opp-Nalanda-Building-Pedder-Road/022P1224363455R7G4G7_BZDET?xid=TXVtYmFpIEdyb2NlcnkgU3RvcmVzIFRhcmRlbw==
Nutan Stores Near Jaslok Hospital Breach Candy,0.89 KM,3.9,9 Votes,"Purnima Apartment, Pedder Road, Breach Candy, Mumbai - 400026, Near Jaslok Hospital",https://www.justdial.com/Mumbai/Nutan-Stores-Near-Jaslok-Hospital-Breach-Candy/022P5648648_BZDET?xid=TXVtYmFpIEdyb2NlcnkgU3RvcmVzIFRhcmRlbw==
Bharat Stores Next to Jaslok Hospital Pedder Road,0.94 KM,4.3,20 Votes,"19, Shanti Building No 2, Pedder Road, Mumbai - 400026, Next to Jaslok Hospital",https://www.justdial.com/Mumbai/Bharat-Stores-Next-to-Jaslok-Hospital-Pedder-Road/022P8904655_BZDET?xid=TXVtYmFpIEdyb2NlcnkgU3RvcmVzIFRhcmRlbw==
Geetanjali Super Market Opposite Brahman Sabha R R M Roy Marg Charni Road,1.02 KM,4.0,108 Votes,"3/4, Suratwala Building,211, Raja Ram Mohan Roy Marg, Charni Road, Mumbai - 400004, Opposite Brahman Sabha, R R M Roy Marg",https://www.justdial.com/Mumbai/Geetanjali-Super-Market-Opposite-Brahman-Sabha-R-R-M-Roy-Marg-Charni-Road/022PXX22-XX22-000811503617-U9P1_BZDET?xid=TXVtYmFpIEdyb2NlcnkgU3RvcmVzIFRhcmRlbw==
Shreeji Lad Stores Near Wilson School Khetwadi girgaon,1.46 KM,4.8,4 Votes,"Shop No 112, Laxmi Building, N D Road, Khetwadi-girgaon, Mumbai - 400004, Near Wilson School",https://www.justdial.com/Mumbai/Shreeji-Lad-Stores-Near-Wilson-School-Khetwadi-girgaon/022PXX22-XX22-121231171004-J8G9_BZDET?xid=TXVtYmFpIEdyb2NlcnkgU3RvcmVzIFRhcmRlbw==
Amit Stores Mahalaxmi Breach Candy,1.55 KM,4.1,8 Votes,"28/A,Bachubhai Niwas, Bhulabhai Desai Road, Breach Candy, Mumbai - 400026, Mahalaxmi",https://www.justdial.com/Mumbai/Amit-Stores-Mahalaxmi-Breach-Candy/022PXX22-XX22-120312225447-A7A5_BZDET?xid=TXVtYmFpIEdyb2NlcnkgU3RvcmVzIFRhcmRlbw==
Kwik 7 Oasis Mahalaxmi,1.79 KM,4.1,287 Votes,"Suite No 4, Capricon Centre, Vivarea Complex, Sane Guruji Marg, Mahalaxmi, Mumbai - 400011",https://www.justdial.com/Mumbai/Kwik-7-Oasis-Mahalaxmi/022PXX22-XX22-160304094808-V4M3_BZDET?xid=TXVtYmFpIEdyb2NlcnkgU3RvcmVzIFRhcmRlbw==
Alka General Stores Mumbai Central,,3.0,1 Votes,"JAI Bhagwan, Walkeshwar Road,, Mumbai Central, Mumbai - 400008",https://www.justdial.com/Mumbai/Alka-General-Stores-Mumbai-Central/022PXX22-XX22-140221102058-B6D1_BZDET?xid=TXVtYmFpIEdyb2NlcnkgU3RvcmVzIFRhcmRlbw==
Shah Bhimshi Naiya Grocery Store Oppo Dariya Mahal Bus Stop Nepean Sea Road,0.9 KM,3.3,5 Votes,"Stardust Building 1-A , 80 Nepean Sea Road, Nepean Sea Road, Nepean Sea Road, Mumbai - 400006, Oppo Dariya Mahal Bus Stop",https://www.justdial.com/Mumbai/Shah-Bhimshi-Naiya-Grocery-Store-Oppo-Dariya-Mahal-Bus-Stop-Nepean-Sea-Road/022PXX22-XX22-190213175700-F9K7_BZDET?xid=TXVtYmFpIEdyb2NlcnkgU3RvcmVzIFRhcmRlbw==
Matru Krupa Opposite No 10th Khetwadi Khetwadi girgaon,0.92 KM,4.0,17 Votes,"Shop No. 5, Ground Floor, Siddhesh Darshan, 199/201, Khetwadi Main Road, Khetwadi-girgaon, Mumbai - 400004, Opposite No. 10th, Khetwadi",https://www.justdial.com/Mumbai/Matru-Krupa-Opposite-No-10th-Khetwadi-Khetwadi-girgaon/022PXX22-XX22-120221193547-J8N9_BZDET?xid=TXVtYmFpIEdyb2NlcnkgU3RvcmVzIFRhcmRlbw==
Bhaskar Store Near Jaslok Hospital Pedder Road,0.93 KM,5.0,1 Votes,"Sukh Shanti Building, Blg No. 2, Shop No. 5, Pedder Road, Mumbai - 400026, Near Jaslok Hospital",https://www.justdial.com/Mumbai/Bhaskar-Store-Near-Jaslok-Hospital-Pedder-Road/022PXX22-XX22-161128122652-N5E8_BZDET?xid=TXVtYmFpIEdyb2NlcnkgU3RvcmVzIFRhcmRlbw==
Vijay Stores Opposite Mukesh Chowk Nepean Sea Road,1.33 KM,3.7,3 Votes,"10/A, Taher Mansion, Nepean Sea Road, Mumbai - 400006, Opposite Mukesh Chowk",https://www.justdial.com/Mumbai/Vijay-Stores-Opposite-Mukesh-Chowk-Nepean-Sea-Road/022P1238133179M1I5S6_BZDET?xid=TXVtYmFpIEdyb2NlcnkgU3RvcmVzIFRhcmRlbw==
Kgn Mini Mart Opposite St Agnes High School Byculla,1.61 KM,4.4,5 Votes,"41/49 B Shop No 10 Habib Park, Mirza Galib Road, Byculla, Mumbai - 400027, Opposite St Agnes High School",https://www.justdial.com/Mumbai/Kgn-Mini-Mart-Opposite-St-Agnes-High-School-Byculla/022PXX22-XX22-181229042831-N2S5_BZDET?xid=TXVtYmFpIEdyb2NlcnkgU3RvcmVzIFRhcmRlbw==
Manish Stores Walkeshwar,1.96 KM,4.5,2 Votes,"Sagar Cottage, 61/A, Walkeshwar Road, Walkeshwar, Mumbai - 400006",https://www.justdial.com/Mumbai/Manish-Stores-Walkeshwar/022PXX22-XX22-131225120208-X8L4_BZDET?xid=TXVtYmFpIEdyb2NlcnkgU3RvcmVzIFRhcmRlbw==
Nandu Super Bazaar Near Navjivan Society Opposite Reliance Mall Mumbai Central,0.44 KM,3.9,94 Votes,"Gala No 3/4, Shiv Smruti Building, K K Marg, Mumbai Central, Mumbai - 400008, Near Navjivan Society, Opposite Reliance Mall",https://www.justdial.com/Mumbai/Nandu-Super-Bazaar-Near-Navjivan-Society-Opposite-Reliance-Mall-Mumbai-Central/022PXX22-XX22-110321205355-Q5W2_BZDET?xid=TXVtYmFpIEdyb2NlcnkgU3RvcmVzIFRhcmRlbw==
Anmol Grain Store Madanpura Mumbai Central,0.6 KM,4.0,1 Votes,"Shop No 7, Mansoor Building, Mohammed Umer Rajjab Road, Mumbai Central, Mumbai - 400008, Madanpura",https://www.justdial.com/Mumbai/Anmol-Grain-Store-Madanpura-Mumbai-Central/022PXX22-XX22-180130165052-D2C1_BZDET?xid=TXVtYmFpIEdyb2NlcnkgU3RvcmVzIFRhcmRlbw==
