Name,Distance,Rating,Votes,Address,Website
Navnath Kirana Provision Stores Mukti Nagar Ghatla Chembur East,1.99 KM,,0 Votes,"Waman Tukaram Patil Marg, Chembur East, Mumbai - 400071, Mukti Nagar, Ghatla",https://www.justdial.com/Mumbai/Navnath-Kirana-Provision-Stores-Mukti-Nagar-Ghatla-Chembur-East/022PXX22-XX22-180614201004-T2M9_BZDET?xid=TXVtYmFpIEdlbmVyYWwgU3RvcmVzIFRyb21iYXk=
Tulsi Medical General Stores Near Tiss Deonar,3.17 KM,4.0,95 Votes,"7, Daffodil Apartment, Sion Trombay Road, Deonar, Mumbai - 400088, Near Tiss",https://www.justdial.com/Mumbai/Tulsi-Medical-General-Stores-Near-Tiss-Deonar/022PXX22-XX22-121211021503-X4D6_BZDET?xid=TXVtYmFpIEdlbmVyYWwgU3RvcmVzIFRyb21iYXk=
Adiyan Medical General Store Trombay,2.63 KM,3.0,1 Votes,"Shop Number.13/3 Amar Nagar Society Survey Number.115/A2 Dhobhighat, Sion Road, Trombay, Mumbai - 400088",https://www.justdial.com/Mumbai/Adiyan-Medical-General-Store-Trombay/022PXX22-XX22-200701101911-L9A2_BZDET?xid=TXVtYmFpIEdlbmVyYWwgU3RvcmVzIFRyb21iYXk=
Swami Narayan General Store Near Anand Beer Bar Trombay Post Office Trombay Koliwada Chitajain Trombay,2.77 KM,2.0,1 Votes,"Shop No 5 , Mahavir Society, Trombay Road, Trombay, Mumbai - 400088, Near Anand Beer Bar , Trombay Post Office, Trombay Koliwada Chitajain",https://www.justdial.com/Mumbai/Swami-Narayan-General-Store-Near-Anand-Beer-Bar-Trombay-Post-Office-Trombay-Koliwada-Chitajain-Trombay/022PXX22-XX22-160916182528-E5Q9_BZDET?xid=TXVtYmFpIEdlbmVyYWwgU3RvcmVzIFRyb21iYXk=
AAlam general stores Trombay,2.81 KM,,0 Votes,"H sector,A line room no 02, Cheeta camp, Trombay, Mumbai - 400088",https://www.justdial.com/Mumbai/AAlam-general-stores-Trombay/022PXX22-XX22-160725171732-T7E7_BZDET?xid=TXVtYmFpIEdlbmVyYWwgU3RvcmVzIFRyb21iYXk=
Karim Stationery General Store Cheeta Camp Trombay,2.81 KM,,0 Votes,"G - Sector, Shop No 2, Trombay, Mumbai - 400088, Cheeta Camp",https://www.justdial.com/Mumbai/Karim-Stationery-General-Store-Cheeta-Camp-Trombay/022PXX22-XX22-180721193005-B8J2_BZDET?xid=TXVtYmFpIEdlbmVyYWwgU3RvcmVzIFRyb21iYXk=
B K Kirana And General Store Cheeta Camp Trombay,2.9 KM,,0 Votes,"Kalluchacha, B K Kirana Stores, G-G1, Shop No-4, Main Road, Trombay, Mumbai - 400088, Cheeta Camp",https://www.justdial.com/Mumbai/B-K-Kirana-And-General-Store-Cheeta-Camp-Trombay/022PXX22-XX22-160728104102-C2U6_BZDET?xid=TXVtYmFpIEdlbmVyYWwgU3RvcmVzIFRyb21iYXk=
Bhavani General Stores Opp Ganesh mandir Trombay,2.92 KM,,0 Votes,"G Sector N line Shop no 17, Cheeta Camp, Trombay, Mumbai - 400088, Opp Ganesh mandir",https://www.justdial.com/Mumbai/Bhavani-General-Stores-Opp-Ganesh-mandir-Trombay/022PXX22-XX22-160721095049-L3Q3_BZDET?xid=TXVtYmFpIEdlbmVyYWwgU3RvcmVzIFRyb21iYXk=
Afzan Kirana General Store Noor Majjid Trombay,2.92 KM,4.6,7 Votes,"G Sector ,O Line, Shop No 03, Chita Camp, Trombay, Mumbai - 400088, Noor Majjid",https://www.justdial.com/Mumbai/Afzan-Kirana-General-Store-Noor-Majjid-Trombay/022PXX22-XX22-160801174211-K7F2_BZDET?xid=TXVtYmFpIEdlbmVyYWwgU3RvcmVzIFRyb21iYXk=
Swami Store Cheeta Camp Trombay,2.92 KM,,0 Votes,"G - Sector, K - 2 Line, Trombay, Mumbai - 400088, Cheeta Camp",https://www.justdial.com/Mumbai/Swami-Store-Cheeta-Camp-Trombay/022PXX22-XX22-180720163025-A4P5_BZDET?xid=TXVtYmFpIEdlbmVyYWwgU3RvcmVzIFRyb21iYXk=
Apna General Stores Cheeta Camp Trombay,2.94 KM,,0 Votes,"H - Sector, Shop No 6, A - Line, Trombay, Mumbai - 400088, Cheeta Camp",https://www.justdial.com/Mumbai/Apna-General-Stores-Cheeta-Camp-Trombay/022PXX22-XX22-180718155024-C1D6_BZDET?xid=TXVtYmFpIEdlbmVyYWwgU3RvcmVzIFRyb21iYXk=
Imo General Store Mirza Ghalib Road Trombay,2.95 KM,,0 Votes,"E Sector, Mirza Ghalib Road, Chita Camp, Trombay, Mumbai - 400088, Mirza Ghalib Road",https://www.justdial.com/Mumbai/Imo-General-Store-Mirza-Ghalib-Road-Trombay/022PXX22-XX22-160803151348-R6S7_BZDET?xid=TXVtYmFpIEdlbmVyYWwgU3RvcmVzIFRyb21iYXk=
Dadaji patang wale Custom road Market Trombay,2.98 KM,3.5,2 Votes,"D sector ,A2 line custom road, Chita camp, Trombay, Mumbai - 400088, Custom road Market",https://www.justdial.com/Mumbai/Dadaji-patang-wale-Custom-road-Market-Trombay/022PXX22-XX22-160810183240-K5R9_BZDET?xid=TXVtYmFpIEdlbmVyYWwgU3RvcmVzIFRyb21iYXk=
Tawakkal General Store Colour Xerox Opp Mallika Trombay,,,0 Votes,"Shop No- 39, Cheeta Camp, Market Road, Trombay, Mumbai - 400088, Opp Mallika",https://www.justdial.com/Mumbai/Tawakkal-General-Store-Colour-Xerox-Opp-Mallika-Trombay/022PXX22-XX22-120911181717-Z9U7_BZDET?xid=TXVtYmFpIEdlbmVyYWwgU3RvcmVzIFRyb21iYXk=
Dawood Kirana Store E Sector Chita Camp Trombay,,,0 Votes,"Shop No 1, B 119, Trombay, Mumbai - 400088, E Sector, Chita Camp",https://www.justdial.com/Mumbai/Dawood-Kirana-Store-E-Sector-Chita-Camp-Trombay/022PXX22-XX22-151219192006-T7D9_BZDET?xid=TXVtYmFpIEdlbmVyYWwgU3RvcmVzIFRyb21iYXk=
Rasib Badshah General Store Near Idial School Trombay,,,0 Votes,"Shop No D Sector Room Number 1, Dosti Hotel Road, Trombay, Mumbai - 400088, Near Idial School",https://www.justdial.com/Mumbai/Rasib-Badshah-General-Store-Near-Idial-School-Trombay/022PXX22-XX22-180205232521-H5R7_BZDET?xid=TXVtYmFpIEdlbmVyYWwgU3RvcmVzIFRyb21iYXk=
Asia Bakery General Stores Near Mehraj Masjid Cheeta Camp Trombay,,,0 Votes,"B - Sector, Shop No 4, Trombay, Mumbai - 400088, Near Mehraj Masjid, Cheeta Camp",https://www.justdial.com/Mumbai/Asia-Bakery-General-Stores-Near-Mehraj-Masjid-Cheeta-Camp-Trombay/022PXX22-XX22-180716170117-A4I6_BZDET?xid=TXVtYmFpIEdlbmVyYWwgU3RvcmVzIFRyb21iYXk=
Sumitra Stores Cheeta Camp Trombay,3.04 KM,,0 Votes,"E - Sector, Shop No 14, E - 1 Line, Trombay, Mumbai - 400088, Cheeta Camp",https://www.justdial.com/Mumbai/Sumitra-Stores-Cheeta-Camp-Trombay/022PXX22-XX22-180717170006-X8C8_BZDET?xid=TXVtYmFpIEdlbmVyYWwgU3RvcmVzIFRyb21iYXk=
Janta Kirana General Store Near Janta Hotel Chita Camp Trombay,3.06 KM,,0 Votes,"Shop No B-j-4, Trombay, Mumbai - 400088, Near Janta Hotel, Chita Camp",https://www.justdial.com/Mumbai/Janta-Kirana-General-Store-Near-Janta-Hotel-Chita-Camp-Trombay/022PXX22-XX22-160729111524-V8Y7_BZDET?xid=TXVtYmFpIEdlbmVyYWwgU3RvcmVzIFRyb21iYXk=
Sana General Stores Star School Trombay,3.06 KM,,0 Votes,"E Sector, H Q Line, Room No 132, Chita Camp, Trombay, Mumbai - 400088, Star School",https://www.justdial.com/Mumbai/Sana-General-Stores-Star-School-Trombay/022PXX22-XX22-160809144355-X7X1_BZDET?xid=TXVtYmFpIEdlbmVyYWwgU3RvcmVzIFRyb21iYXk=
Md Nooruddin Kutty Janta Hotal Trombay,3.08 KM,,0 Votes,"FU3 Shop No 1, Cheeta Camp, Trombay, Mumbai - 400088, Janta Hotal",https://www.justdial.com/Mumbai/Md-Nooruddin-Kutty-Janta-Hotal-Trombay/022PXX22-XX22-160730115115-X4V1_BZDET?xid=TXVtYmFpIEdlbmVyYWwgU3RvcmVzIFRyb21iYXk=
Samad Kirana Store Cheeta Camp Trombay,3.08 KM,,0 Votes,"D - Sector, Shop No 4, N - Line, Trombay, Mumbai - 400088, Cheeta Camp",https://www.justdial.com/Mumbai/Samad-Kirana-Store-Cheeta-Camp-Trombay/022PXX22-XX22-180717173120-G5X1_BZDET?xid=TXVtYmFpIEdlbmVyYWwgU3RvcmVzIFRyb21iYXk=
S F Kirana Store Cheeta Camp Trombay,3.08 KM,,0 Votes,"B - Sector, Shop No 1, A - 3 Line, Trombay, Mumbai - 400088, Cheeta Camp",https://www.justdial.com/Mumbai/S-F-Kirana-Store-Cheeta-Camp-Trombay/022PXX22-XX22-180719170015-F6H4_BZDET?xid=TXVtYmFpIEdlbmVyYWwgU3RvcmVzIFRyb21iYXk=
Moinuddin General Store Near Star School Chita Camp D Sector Z Line Trombay,3.12 KM,3.5,2 Votes,"Room No 342, Trombay, Mumbai - 400088, Near Star School,Chita Camp,D Sector,Z Line",https://www.justdial.com/Mumbai/Moinuddin-General-Store-Near-Star-School-Chita-Camp-D-Sector-Z-Line-Trombay/022PXX22-XX22-160809134555-P5V9_BZDET?xid=TXVtYmFpIEdlbmVyYWwgU3RvcmVzIFRyb21iYXk=
Usman Kirana General Store Trombay,3.24 KM,,0 Votes,"B Sector, K Line ,Shop No . 1 10/10, Chita Camp, Trombay, Mumbai - 400088",https://www.justdial.com/Mumbai/Usman-Kirana-General-Store-Trombay/022PXX22-XX22-160809110849-I9C1_BZDET?xid=TXVtYmFpIEdlbmVyYWwgU3RvcmVzIFRyb21iYXk=
Shiv General Stores Cheeta Camp Trombay,2.79 KM,,0 Votes,"K - Sector, Room No 12, E - Line, Trombay, Mumbai - 400088, Cheeta Camp",https://www.justdial.com/Mumbai/Shiv-General-Stores-Cheeta-Camp-Trombay/022PXX22-XX22-180717191016-C7I5_BZDET?xid=TXVtYmFpIEdlbmVyYWwgU3RvcmVzIFRyb21iYXk=
Shakti Stores Cheeta Camp Trombay,3.03 KM,,0 Votes,"E - Sector, Shop No 1, F - 1 Line, Trombay, Mumbai - 400088, Cheeta Camp",https://www.justdial.com/Mumbai/Shakti-Stores-Cheeta-Camp-Trombay/022PXX22-XX22-180717170027-T9H9_BZDET?xid=TXVtYmFpIEdlbmVyYWwgU3RvcmVzIFRyb21iYXk=
Sagar Medical General Stores Opposite Usv Ltd Banganga Society Govandi East,3.67 KM,4.5,33 Votes,"Shop No A 5, Indira Apartment, Govandi East, Mumbai - 400088, Opposite Usv Ltd, Banganga Society",https://www.justdial.com/Mumbai/Sagar-Medical-General-Stores-Opposite-Usv-Ltd-Banganga-Society-Govandi-East/022P1221026454F5S6B3_BZDET?xid=TXVtYmFpIEdlbmVyYWwgU3RvcmVzIFRyb21iYXk=
Mahalaxmi Kirana General Store Near Railways Station Mankhurd,,5.0,1 Votes,"Shop No 85, Mahatma Phule Nagar Sainath Chawl, Mankhurd, Mumbai - 400088, Near Railways Station ,",https://www.justdial.com/Mumbai/Mahalaxmi-Kirana-General-Store-Near-Railways-Station-Mankhurd/022PXX22-XX22-161015150545-F3Q8_BZDET?xid=TXVtYmFpIEdlbmVyYWwgU3RvcmVzIFRyb21iYXk=
Shiv Shakti General Stores Mankhurd,3.38 KM,5.0,1 Votes,"Station Road, Mankhurd, Mumbai - 400088",https://www.justdial.com/Mumbai/Shiv-Shakti-General-Stores-Mankhurd/022PXX22-XX22-120313023945-V7I4_BZDET?xid=TXVtYmFpIEdlbmVyYWwgU3RvcmVzIFRyb21iYXk=
K M Adab Husen Stores Cheeta Camp,2.79 KM,5.0,2 Votes,"A1 Line Shop No 13, Sector I, Mankhurd, Cheeta Camp, Mumbai - 400088",https://www.justdial.com/Mumbai/K-M-Adab-Husen-Stores-Cheeta-Camp/022PXX22-XX22-181204042909-K3K2_BZDET?xid=TXVtYmFpIEdlbmVyYWwgU3RvcmVzIFRyb21iYXk=
Shri Sai Prasad Near Mahadev Madical Chembur East,,,0 Votes,"Bilding 7 Shop No 4, Dinakari Road Chambur, Chembur East, Mumbai - 400088, Near Mahadev Madical",https://www.justdial.com/Mumbai/Shri-Sai-Prasad-Near-Mahadev-Madical-Chembur-East/022PXX22-XX22-180518195749-R3R2_BZDET?xid=TXVtYmFpIEdlbmVyYWwgU3RvcmVzIFRyb21iYXk=
Yadav Stores Cheeta Camp,2.84 KM,4.5,4 Votes,"B Line Shop No 11, Sector H, Mankhurd, Cheeta Camp, Mumbai - 400088",https://www.justdial.com/Mumbai/Yadav-Stores-Cheeta-Camp/022PXX22-XX22-181203225207-M4M6_BZDET?xid=TXVtYmFpIEdlbmVyYWwgU3RvcmVzIFRyb21iYXk=
Alhussain Book Depot Near international bar Mankhurd,2.9 KM,,0 Votes,"G- sector, shop no - 3, cheeta camp, Mankhurd, Mumbai - 400088, Near international bar",https://www.justdial.com/Mumbai/Alhussain-Book-Depot-Near-international-bar-Mankhurd/022PXX22-XX22-131212160857-F4Y6_BZDET?xid=TXVtYmFpIEdlbmVyYWwgU3RvcmVzIFRyb21iYXk=
Anusul Kirana Store Cheeta Camp,,,0 Votes,"712, Lane No 4, Cheeta Camp, Mumbai - 400088",https://www.justdial.com/Mumbai/Anusul-Kirana-Store-Cheeta-Camp/022PXX22-XX22-131002192052-R6A8_BZDET?xid=TXVtYmFpIEdlbmVyYWwgU3RvcmVzIFRyb21iYXk=
KGN Azva Bakery And General Store Near Royal Plus Hall Azad Nagar Sai Pada Cheeta Camp,,,0 Votes,"Shop No 01, Cheeta Camp, Mumbai - 400088, Near Royal Plus Hall, Azad Nagar, Sai Pada",https://www.justdial.com/Mumbai/KGN-Azva-Bakery-And-General-Store-Near-Royal-Plus-Hall-Azad-Nagar-Sai-Pada-Cheeta-Camp/022PXX22-XX22-170915070028-E6H4_BZDET?xid=TXVtYmFpIEdlbmVyYWwgU3RvcmVzIFRyb21iYXk=
Vikas Electric Hardware General Stores Near Pop Rickshaw Stand Mankhurd,2.97 KM,5.0,1 Votes,"Shop No 6, Asha Building, Station Road, Mankhurd, Mumbai - 400088, Near Pop Rickshaw Stand",https://www.justdial.com/Mumbai/Vikas-Electric-Hardware-General-Stores-Near-Pop-Rickshaw-Stand-Mankhurd/022PXX22-XX22-160817125320-X9N4_BZDET?xid=TXVtYmFpIEdlbmVyYWwgU3RvcmVzIFRyb21iYXk=
Jyoti general store Near Padua School Mankhurd,2.99 KM,3.0,1 Votes,"Mankhurd Gav Churchroad, Mankhurd, Mumbai - 400088, Near Padua School",https://www.justdial.com/Mumbai/Jyoti-general-store-Near-Padua-School-Mankhurd/022PXX22-XX22-200629095136-Z7Y6_BZDET?xid=TXVtYmFpIEdlbmVyYWwgU3RvcmVzIFRyb21iYXk=
Raj KUMAR GENERAL STORE Deonar,,,0 Votes,"Bldg 67, Grd Floor, Pratap Gad, Deonar Clny, Deonar, Mumbai - 400088",https://www.justdial.com/Mumbai/Raj-KUMAR-GENERAL-STORE-Deonar/022PXX22-XX22-120224092412-T1W5_BZDET?xid=TXVtYmFpIEdlbmVyYWwgU3RvcmVzIFRyb21iYXk=
Shivshakti Kirana General Stores Samta Nagar Maharashtra Nagar 3 Mankhurd,,,0 Votes,"Yashwant Rao Chavan Marg, Mankhurd, Mumbai - 400088, Samta Nagar, Maharashtra Nagar 3",https://www.justdial.com/Mumbai/Shivshakti-Kirana-General-Stores-Samta-Nagar-Maharashtra-Nagar-3-Mankhurd/022PXX22-XX22-180711185009-W6P3_BZDET?xid=TXVtYmFpIEdlbmVyYWwgU3RvcmVzIFRyb21iYXk=
Tawakkal General Store Deonar,3.01 KM,3.8,5 Votes,"Deonar, Mumbai - 400088",https://www.justdial.com/Mumbai/Tawakkal-General-Store-Deonar/022PXX22-XX22-180412175200-I6S1_BZDET?xid=TXVtYmFpIEdlbmVyYWwgU3RvcmVzIFRyb21iYXk=
Bismillah M A C Sector Near Market Cheeta Camp,3.03 KM,,0 Votes,"D1line, Shop No 13, Cheeta Camp, Mumbai - 400088, C Sector, Near Market",https://www.justdial.com/Mumbai/Bismillah-M-A-C-Sector-Near-Market-Cheeta-Camp/022PXX22-XX22-160922115950-P1W5_BZDET?xid=TXVtYmFpIEdlbmVyYWwgU3RvcmVzIFRyb21iYXk=
Barnam Medical General Stores C Sector C Line Near Janta Hotel Cheeta Camp,3.04 KM,4.7,9 Votes,"Shop No 20, Cheeta Camp, Mumbai - 400088, C Sector, C Line , Near Janta Hotel",https://www.justdial.com/Mumbai/Barnam-Medical-General-Stores-C-Sector-C-Line-Near-Janta-Hotel-Cheeta-Camp/022PXX22-XX22-110119204547-R1F8_BZDET?xid=TXVtYmFpIEdlbmVyYWwgU3RvcmVzIFRyb21iYXk=
Alfalah General Stores Near Ideal High School D Sector O Line Cheeta Camp,3.06 KM,,0 Votes,"Shop No 01 & 24, Cheeta Camp, Mumbai - 400088, Near Ideal High School, D Sector, O Line",https://www.justdial.com/Mumbai/Alfalah-General-Stores-Near-Ideal-High-School-D-Sector-O-Line-Cheeta-Camp/022PXX22-XX22-160806155509-L7U8_BZDET?xid=TXVtYmFpIEdlbmVyYWwgU3RvcmVzIFRyb21iYXk=
Famous General Stores E Sector H Q Line Near Star School Cheeta Camp,3.07 KM,,0 Votes,"Shop No 5, Cheeta Camp, Mumbai - 400088, E Sector , H Q Line, Near Star School",https://www.justdial.com/Mumbai/Famous-General-Stores-E-Sector-H-Q-Line-Near-Star-School-Cheeta-Camp/022PXX22-XX22-160809141449-H1R2_BZDET?xid=TXVtYmFpIEdlbmVyYWwgU3RvcmVzIFRyb21iYXk=
Karthik General Store Easten Express Higway Chembur East,3.1 KM,4.2,5 Votes,"Nandanvan, Chembur East, Mumbai - 400088, Easten Express Higway",https://www.justdial.com/Mumbai/Karthik-General-Store-Easten-Express-Higway-Chembur-East/022PXX22-XX22-170627185213-L9X1_BZDET?xid=TXVtYmFpIEdlbmVyYWwgU3RvcmVzIFRyb21iYXk=
Anand General Stores Near Janta Hotel C Sector K Line Cheeta Camp,3.12 KM,,0 Votes,"Shop No 24, Cheeta Camp, Mumbai - 400088, Near Janta Hotel, C Sector , K Line",https://www.justdial.com/Mumbai/Anand-General-Stores-Near-Janta-Hotel-C-Sector-K-Line-Cheeta-Camp/022PXX22-XX22-160805134844-C3Y6_BZDET?xid=TXVtYmFpIEdlbmVyYWwgU3RvcmVzIFRyb21iYXk=
Noori General Store B Sector U line Cheeta Camp,3.14 KM,,0 Votes,"Shop No 09/10, Cheeta Camp, Mumbai - 400088, B Sector, U line",https://www.justdial.com/Mumbai/Noori-General-Store-B-Sector-U-line-Cheeta-Camp/022PXX22-XX22-160808121636-U2C6_BZDET?xid=TXVtYmFpIEdlbmVyYWwgU3RvcmVzIFRyb21iYXk=
Mangalmurti Kirana Stores Near Municipal School Govandi East,3.14 KM,,0 Votes,"Station Road, Govandi East, Mumbai - 400088, Near Municipal School",https://www.justdial.com/Mumbai/Mangalmurti-Kirana-Stores-Near-Municipal-School-Govandi-East/022PXX22-XX22-180707191139-R2J5_BZDET?xid=TXVtYmFpIEdlbmVyYWwgU3RvcmVzIFRyb21iYXk=
Ayesha Store B Sector T1 Line Cheeta Camp,3.15 KM,,0 Votes,"Shop No 1, 10/10, Cheeta Camp, Mumbai - 400088, B Sector ,T1 Line",https://www.justdial.com/Mumbai/Ayesha-Store-B-Sector-T1-Line-Cheeta-Camp/022PXX22-XX22-160808190220-N6P6_BZDET?xid=TXVtYmFpIEdlbmVyYWwgU3RvcmVzIFRyb21iYXk=
Siddhi Vinayak General Store Near Tata Institute Of Social Science Deonar,3.17 KM,4.0,1 Votes,"Shop No 3, Daffodil Apartment, S T Road, Deonar, Mumbai - 400088, Near Tata Institute Of Social Science",https://www.justdial.com/Mumbai/Siddhi-Vinayak-General-Store-Near-Tata-Institute-Of-Social-Science-Deonar/022P1924400_BZDET?xid=TXVtYmFpIEdlbmVyYWwgU3RvcmVzIFRyb21iYXk=
Babusab General Store Near Maharaj Majjid C Sector K Line Cheeta Camp,3.17 KM,,0 Votes,"Shop No 1, Cheeta Camp, Mumbai - 400088, Near Maharaj Majjid, C Sector , K Line",https://www.justdial.com/Mumbai/Babusab-General-Store-Near-Maharaj-Majjid-C-Sector-K-Line-Cheeta-Camp/022PXX22-XX22-160810123657-W1M5_BZDET?xid=TXVtYmFpIEdlbmVyYWwgU3RvcmVzIFRyb21iYXk=
Sai Kirana General Stores Maharashtra Nagar Mankhurd,3.22 KM,,0 Votes,"Chawl No 9, Samta Sahakari Gruhnirman Savsta, Mankhurd, Mumbai - 400088, Maharashtra Nagar",https://www.justdial.com/Mumbai/Sai-Kirana-General-Stores-Maharashtra-Nagar-Mankhurd/022PXX22-XX22-180706152005-I8K9_BZDET?xid=TXVtYmFpIEdlbmVyYWwgU3RvcmVzIFRyb21iYXk=
Kulsum Bakers General Stores Wholesaler Govandi East,3.26 KM,3.5,2 Votes,"Lallubhai Complex , Biulding 22, Lallubhai Compound, Dp Road, Mankhurd, Govandi East, Mumbai - 400088",https://www.justdial.com/Mumbai/Kulsum-Bakers-General-Stores-Wholesaler-Govandi-East/022PXX22-XX22-161118095137-G7S3_BZDET?xid=TXVtYmFpIEdlbmVyYWwgU3RvcmVzIFRyb21iYXk=
Krishna M Priya Kirana Store Govandi East,3.28 KM,3.0,2 Votes,"Aakruthi B 26, Shop No.8, Lallubhai Compound, Mankhurd West, Dp Road, Govandi East, Mumbai - 400088",https://www.justdial.com/Mumbai/Krishna-M-Priya-Kirana-Store-Govandi-East/022PXX22-XX22-180831234522-N5L4_BZDET?xid=TXVtYmFpIEdlbmVyYWwgU3RvcmVzIFRyb21iYXk=
Dhanlaxmi Novelty General Stores Mankhurd,3.28 KM,,0 Votes,"Shop No 2, Samta Nagar, Maharashtra Nagar Road, Mankhurd, Mumbai - 400088",https://www.justdial.com/Mumbai/Dhanlaxmi-Novelty-General-Stores-Mankhurd/022PXX22-XX22-190830174058-K9H6_BZDET?xid=TXVtYmFpIEdlbmVyYWwgU3RvcmVzIFRyb21iYXk=
Sairaj Kirana General Stores Opticians Subhash Chandra Bose Vidyamandir Maharashtra Nagar Mankhurd,3.3 KM,,0 Votes,"Shivprerna Chawl, Mankhurd, Mumbai - 400088, Opticians Subhash Chandra Bose, Vidyamandir, Maharashtra Nagar",https://www.justdial.com/Mumbai/Sairaj-Kirana-General-Stores-Opticians-Subhash-Chandra-Bose-Vidyamandir-Maharashtra-Nagar-Mankhurd/022PXX22-XX22-180712130012-Q1H5_BZDET?xid=TXVtYmFpIEdlbmVyYWwgU3RvcmVzIFRyb21iYXk=
Himalya kirana store Near fly over Mankhurd,3.31 KM,,0 Votes,"Shop no 285, Sion panvel Road, Mankhurd, Mumbai - 400088, Near fly over",https://www.justdial.com/Mumbai/Himalya-kirana-store-Near-fly-over-Mankhurd/022PXX22-XX22-161210144057-I5S7_BZDET?xid=TXVtYmFpIEdlbmVyYWwgU3RvcmVzIFRyb21iYXk=
Parvati General Stationery Stores Opposite Datt Mandir Mankhurd,3.32 KM,,0 Votes,"Railway Overbridge (West) West, Jyotirling Nagar, Mankhurd, Mumbai - 400088, Opposite Datt Mandir",https://www.justdial.com/Mumbai/Parvati-General-Stationery-Stores-Opposite-Datt-Mandir-Mankhurd/022PXX22-XX22-180316121933-W1P5_BZDET?xid=TXVtYmFpIEdlbmVyYWwgU3RvcmVzIFRyb21iYXk=
Chetan Stores Near Krishna Hotel Deonar,3.35 KM,4.0,28 Votes,"Shop No B/12, Hill View Building, Deonar Village, Deonar, Mumbai - 400088, Near Krishna Hotel",https://www.justdial.com/Mumbai/Chetan-Stores-Near-Krishna-Hotel-Deonar/022PXX22-XX22-100219145301-U7B4_BZDET?xid=TXVtYmFpIEdlbmVyYWwgU3RvcmVzIFRyb21iYXk=
Ambika book general store Ambedkar nagar Mankhurd,3.35 KM,,0 Votes,"maharashtra nagar, Mankhurd, Mumbai - 400088, ambedkar nagar",https://www.justdial.com/Mumbai/Ambika-book-general-store-Ambedkar-nagar-Mankhurd/022PXX22-XX22-161112174538-I1M2_BZDET?xid=TXVtYmFpIEdlbmVyYWwgU3RvcmVzIFRyb21iYXk=
Sima General Store Deonar,,,0 Votes,"Deonar, Mumbai - 400088",https://www.justdial.com/Mumbai/Sima-General-Store-Deonar/022P1928861_BZDET?xid=TXVtYmFpIEdlbmVyYWwgU3RvcmVzIFRyb21iYXk=
Lakshdeep General Store Opp Hanuman Mandir Govandi Deonar,,,0 Votes,"Lumbini Baug, Deonar, Mumbai - 400088, Opp Hanuman Mandir Govandi",https://www.justdial.com/Mumbai/Lakshdeep-General-Store-Opp-Hanuman-Mandir-Govandi-Deonar/022P1929024_BZDET?xid=TXVtYmFpIEdlbmVyYWwgU3RvcmVzIFRyb21iYXk=
Amit Kirana General Stores Besides Suryawanshi Enterprises Mankhurd,3.37 KM,5.0,4 Votes,"General Arunkumar Vaidya Chawl, Yashwant Rao Chavan Road, Mankhurd, Mumbai - 400088, Besides Suryawanshi Enterprises",https://www.justdial.com/Mumbai/Amit-Kirana-General-Stores-Besides-Suryawanshi-Enterprises-Mankhurd/022PXX22-XX22-131010171538-X4U9_BZDET?xid=TXVtYmFpIEdlbmVyYWwgU3RvcmVzIFRyb21iYXk=
Swati Kirana General Store Opposite Mhada Building Maharashtra Nagar Mankhurd,3.39 KM,3.3,4 Votes,"109 - C Trimurti Chawl, Maharshta Nagar, Mankhurd, Mumbai - 400088, Opposite Mhada Building, Maharashtra Nagar",https://www.justdial.com/Mumbai/Swati-Kirana-General-Store-Opposite-Mhada-Building-Maharashtra-Nagar-Mankhurd/022PXX22-XX22-180706230045-S8N9_BZDET?xid=TXVtYmFpIEdlbmVyYWwgU3RvcmVzIFRyb21iYXk=
Shree Ganesh Kirana General Store Near Shivaji Maidan Maharashtra Nagar Mankhurd,3.39 KM,,0 Votes,"Navnath Chawl, Mankhurd, Mumbai - 400088, Near Shivaji Maidan, Maharashtra Nagar",https://www.justdial.com/Mumbai/Shree-Ganesh-Kirana-General-Store-Near-Shivaji-Maidan-Maharashtra-Nagar-Mankhurd/022PXX22-XX22-180712123005-T6A4_BZDET?xid=TXVtYmFpIEdlbmVyYWwgU3RvcmVzIFRyb21iYXk=
Shaan Kirana General Stores Near Vanikaran Garden Maharashtra Nagar Mankhurd,3.4 KM,,0 Votes,"Mankhurd, Mumbai - 400088, Near Vanikaran Garden, Maharashtra Nagar",https://www.justdial.com/Mumbai/Shaan-Kirana-General-Stores-Near-Vanikaran-Garden-Maharashtra-Nagar-Mankhurd/022PXX22-XX22-180713154037-E2E5_BZDET?xid=TXVtYmFpIEdlbmVyYWwgU3RvcmVzIFRyb21iYXk=
Aniket Stores Aniket Communication Centre Mankhurd,3.41 KM,3.5,4 Votes,"Ambedkar Nagar 2, Jyotirling Nagar, Mankhurd, Mumbai - 400088",https://www.justdial.com/Mumbai/Aniket-Stores-Aniket-Communication-Centre-Mankhurd/022PXX22-XX22-171130132453-Z2H3_BZDET?xid=TXVtYmFpIEdlbmVyYWwgU3RvcmVzIFRyb21iYXk=
Sadguru General Store Shivaji Madian Maharashtra Nagar Mankhurd,3.42 KM,,0 Votes,"Shop No 1, Mauli Chawl, Mankhurd, Mumbai - 400088, Shivaji Madian, Maharashtra Nagar",https://www.justdial.com/Mumbai/Sadguru-General-Store-Shivaji-Madian-Maharashtra-Nagar-Mankhurd/022PXX22-XX22-191130181108-S3N5_BZDET?xid=TXVtYmFpIEdlbmVyYWwgU3RvcmVzIFRyb21iYXk=
Mahalaxmi Hardware And General Store Maharashtra Nagar mankhurd,3.43 KM,,0 Votes,"Satyam Shivam Sundram Chawl, Maharashtra Nagar-mankhurd, Mumbai - 400088",https://www.justdial.com/Mumbai/Mahalaxmi-Hardware-And-General-Store-Maharashtra-Nagar-mankhurd/022PXX22-XX22-170927175536-A6Y9_BZDET?xid=TXVtYmFpIEdlbmVyYWwgU3RvcmVzIFRyb21iYXk=
Deonar Pharmacy General Stores Opposite Lakme Deonar,3.44 KM,3.9,32 Votes,"Shop No 1m Aastha II, Govandi Station Road, Deonar, Mumbai - 400088, Opposite Lakme",https://www.justdial.com/Mumbai/Deonar-Pharmacy-General-Stores-Opposite-Lakme-Deonar/022P1235145816M8H5N8_BZDET?xid=TXVtYmFpIEdlbmVyYWwgU3RvcmVzIFRyb21iYXk=
Anil General Stores Opp Station Mankhurd,,,0 Votes,"Shop No 556,Mahatma Fhule Nagar, Mankhurd, Mumbai - 400088, Opp Station",https://www.justdial.com/Mumbai/Anil-General-Stores-Opp-Station-Mankhurd/022PXX22-XX22-170317153934-N5N1_BZDET?xid=TXVtYmFpIEdlbmVyYWwgU3RvcmVzIFRyb21iYXk=
Shiv Shakti Grain Stores Near Chembur Nagrik Bank Mankhurd,,,0 Votes,"Shop Number 04-05, Mankhurd, Mumbai - 400088, Near Chembur Nagrik Bank",https://www.justdial.com/Mumbai/Shiv-Shakti-Grain-Stores-Near-Chembur-Nagrik-Bank-Mankhurd/022PXX22-XX22-171002222346-Y2R2_BZDET?xid=TXVtYmFpIEdlbmVyYWwgU3RvcmVzIFRyb21iYXk=
Shree Bhairunath Kirana Stores Maharashtra Nagar Mankhurd,,,0 Votes,"Trimurti Chawl, Mankhurd, Mumbai - 400088, Maharashtra Nagar",https://www.justdial.com/Mumbai/Shree-Bhairunath-Kirana-Stores-Maharashtra-Nagar-Mankhurd/022PXX22-XX22-180706231008-Y4X3_BZDET?xid=TXVtYmFpIEdlbmVyYWwgU3RvcmVzIFRyb21iYXk=
Jay Mata Di General Kirana Store Annasaheb Patil Maidan Maharashtra Nagar Mankhurd,,,0 Votes,"Samta Chawl, Mankhurd, Mumbai - 400088, Annasaheb Patil Maidan, Maharashtra Nagar",https://www.justdial.com/Mumbai/Jay-Mata-Di-General-Kirana-Store-Annasaheb-Patil-Maidan-Maharashtra-Nagar-Mankhurd/022PXX22-XX22-180707135005-R9N3_BZDET?xid=TXVtYmFpIEdlbmVyYWwgU3RvcmVzIFRyb21iYXk=
Shree Ganesh Bakery General Store Dr Babasaheb Ambedkar Nagar Maharashtra Nagar Mankhurd,,,0 Votes,"Samta Chawl, Mankhurd, Mumbai - 400088, Dr Babasaheb Ambedkar Nagar, Maharashtra Nagar",https://www.justdial.com/Mumbai/Shree-Ganesh-Bakery-General-Store-Dr-Babasaheb-Ambedkar-Nagar-Maharashtra-Nagar-Mankhurd/022PXX22-XX22-180707143022-I6L7_BZDET?xid=TXVtYmFpIEdlbmVyYWwgU3RvcmVzIFRyb21iYXk=
Shree Krishna Kirana General Stores Maharashtra Nagar Mankhurd,,,0 Votes,"Shivshakti Chawl, Mankhurd, Mumbai - 400088, Maharashtra Nagar",https://www.justdial.com/Mumbai/Shree-Krishna-Kirana-General-Stores-Maharashtra-Nagar-Mankhurd/022PXX22-XX22-180707180739-G6Q8_BZDET?xid=TXVtYmFpIEdlbmVyYWwgU3RvcmVzIFRyb21iYXk=
Shree Jyotirling Masala General Store Near Samta Nagar Mankhurd,,,0 Votes,"Shop No 1, Maharashtra Nagar Road, Mankhurd, Mumbai - 400088, Near Samta Nagar",https://www.justdial.com/Mumbai/Shree-Jyotirling-Masala-General-Store-Near-Samta-Nagar-Mankhurd/022PXX22-XX22-190222224212-L6F3_BZDET?xid=TXVtYmFpIEdlbmVyYWwgU3RvcmVzIFRyb21iYXk=
Anita General Shop Near Mhada Colony Mankhurd,,,0 Votes,"Shop No 2, Maharashtra Nagar Road, Mankhurd, Mumbai - 400088, Near Mhada Colony",https://www.justdial.com/Mumbai/Anita-General-Shop-Near-Mhada-Colony-Mankhurd/022PXX22-XX22-190830171201-P7E2_BZDET?xid=TXVtYmFpIEdlbmVyYWwgU3RvcmVzIFRyb21iYXk=
Bhawani Kirana General Stores Mankhurd,3.21 KM,,0 Votes,"Shop No 2, Samta Rahivashi Sangh, Maharashtra Nagar Road, Mankhurd, Mumbai - 400088",https://www.justdial.com/Mumbai/Bhawani-Kirana-General-Stores-Mankhurd/022PXX22-XX22-190830182022-M5P2_BZDET?xid=TXVtYmFpIEdlbmVyYWwgU3RvcmVzIFRyb21iYXk=
